CTDID,Region,Year,Mission,Latitude,Longitude,SiteID,ESTDate,UTCDate,EST.Time,UTCTime,Sample_Depth_m,DIC,TA,pH,pCO2,Aragonite_Sat_W,Salinity_Bottle,Conductivity_Sm,Salinity_CTD,Temperature_C,Pressure_db,Density_Sigmat,SiteID.1,Survey_design,Sample_frequency,Date,Zone,Sub_region
calval_mar2012,FLK,2012,CalVal,24.8982666666667,-80.6173833333333,CalVal_N,03/23/12,03/23/12,12:40:00 PM,04:40:00 PM,0,2037.46,2379.61,8.108,345.5,3.88,NA,NA,34.71,24.8,0,NA,CalVal_N,Permanent,Single,2012-03-23,Inshore,UK
calval_mar2012,FLK,2012,CalVal,NA,NA,ADCP_S,03/23/12,03/23/12,01:02:00 PM,05:02:00 PM,0,2015.78,2366.11,8.12,331.4,3.97,NA,NA,34.61,25.05,0,NA,ADCP_S,Permanent,Single,2012-03-23,Inshore,UK
calval_mar2012,FLK,2012,CalVal,24.8955833333333,-80.6166333333333,CalVal_S,03/23/12,03/23/12,01:16:00 PM,05:16:00 PM,0,2024.92,2373.16,8.114,338.6,3.95,NA,NA,34.6,25.2,0,NA,CalVal_S,Permanent,Single,2012-03-23,Inshore,UK
calval_mar2012,FLK,2012,CalVal,24.8966333333333,-80.6153,CalVal_SE,03/23/12,03/23/12,01:32:00 PM,05:32:00 PM,0,2039.81,2373.26,8.089,364.2,3.81,NA,NA,34.52,25.41,0,NA,CalVal_SE,Permanent,Single,2012-03-23,Inshore,UK
calval_mar2012,FLK,2012,CalVal,NA,NA,ADCP_N,03/23/12,03/23/12,01:45:00 PM,05:45:00 PM,0,2026.46,2372.81,8.112,340.5,3.93,NA,NA,34.64,25.11,0,NA,ADCP_N,Permanent,Single,2012-03-23,Inshore,UK
calval_mar2012,FLK,2012,CalVal,NA,NA,ADCP_N,03/23/12,03/23/12,01:57:00 PM,05:57:00 PM,0,2001.39,2365.26,8.141,311.7,4.1,NA,NA,34.67,25,0,NA,ADCP_N,Permanent,Single,2012-03-23,Inshore,UK
calval_apr2012,FLK,2012,CalVal,NA,NA,ADCP_S,04/04/12,04/04/12,08:44:00 AM,12:44:00 PM,0,1990.75,2370.91,8.137,312.4,4.26,NA,NA,35.54,26.11,0,NA,ADCP_S,Permanent,Single,2012-04-04,Inshore,UK
calval_apr2012,FLK,2012,CalVal,24.8955833333333,-80.6166333333333,CalVal_S,04/04/12,04/04/12,08:58:00 AM,12:58:00 PM,0,1976.35,2370.06,8.154,296.2,4.4,NA,NA,35.63,26.2,0,NA,CalVal_S,Permanent,Single,2012-04-04,Inshore,UK
calval_apr2012,FLK,2012,CalVal,24.8966333333333,-80.6153,CalVal_SE,04/04/12,04/04/12,09:09:00 AM,01:09:00 PM,0,1976.2,2363.61,8.146,302,4.32,NA,NA,35.7,26.11,0,NA,CalVal_SE,Permanent,Single,2012-04-04,Inshore,UK
calval_apr2012,FLK,2012,CalVal,NA,NA,ADCP_N,04/04/12,04/04/12,09:21:00 AM,01:21:00 PM,0,1973.45,2361.61,8.145,302.3,4.33,NA,NA,35.77,26.22,0,NA,ADCP_N,Permanent,Single,2012-04-04,Inshore,UK
calval_apr2012,FLK,2012,CalVal,24.8982666666667,-80.6173833333333,CalVal_N,04/04/12,04/04/12,09:34:00 AM,01:34:00 PM,0,1986.82,2360.91,8.125,320.9,4.18,NA,NA,35.73,26.23,0,NA,CalVal_N,Permanent,Single,2012-04-04,Inshore,UK
calval_apr2012,FLK,2012,CalVal,24.9052,-80.6266,Transect 1,04/20/12,04/20/12,11:00:00 AM,03:00:00 PM,0,1795.09,2254.41,8.258,203.6,4.96,NA,NA,36.1,26.42,0,NA,Transect 1,Permanent,Single,2012-04-20,Inshore,UK
calval_apr2012,FLK,2012,CalVal,24.8854666666667,-80.6041,Transect 2,04/20/12,04/20/12,11:20:00 AM,03:20:00 PM,0,2026.09,2376.46,8.103,347.1,3.95,NA,NA,35.35,25.48,0,NA,Transect 2,Permanent,Single,2012-04-20,Mid channel,UK
calval_apr2012,FLK,2012,CalVal,24.8547,-80.5674166666667,Transect 4,04/20/12,04/20/12,12:40:00 PM,04:40:00 PM,0,2027.67,2367.81,8.08,367.7,3.84,NA,NA,35.57,25.83,0,NA,Transect 4,Permanent,Single,2012-04-20,Oceanic,UK
calval_apr2012,FLK,2012,CalVal,24.8547,-80.5674166666667,Transect 4,04/20/12,04/20/12,01:06:00 PM,05:06:00 PM,0,2030.37,2369.11,8.075,373.4,3.83,NA,NA,35.55,26.04,0,NA,Transect 4,Permanent,Single,2012-04-20,Oceanic,UK
calval_apr2012,FLK,2012,CalVal,24.8694,-80.585,Transect 3,04/20/12,04/20/12,01:22:00 PM,05:22:00 PM,0,2033.94,2364.56,8.067,381.8,3.73,NA,NA,35.56,25.77,0,NA,Transect 3,Permanent,Single,2012-04-20,Offshore,UK
calval_may2012,FLK,2012,CalVal,24.8982666666667,-80.6173833333333,CalVal_N,05/04/12,05/04/12,12:00:00 PM,04:00:00 PM,0,2040.61,2336.51,8.027,425.1,3.38,NA,NA,34.89,25.47,0,NA,CalVal_N,Permanent,Single,2012-05-04,Inshore,UK
calval_may2012,FLK,2012,CalVal,24.8981833333333,-80.6160666666667,ADCP_NE,05/04/12,05/04/12,12:10:00 PM,04:10:00 PM,0,2037.66,2331.21,8.026,425.5,3.36,NA,NA,34.78,25.4,0,NA,ADCP_NE,Permanent,Single,2012-05-04,Inshore,UK
calval_may2012,FLK,2012,CalVal,24.8966333333333,-80.6153,CalVal_SE,05/04/12,05/04/12,12:20:00 PM,04:20:00 PM,0,2048.19,2334.81,8.009,446.5,3.28,NA,NA,35,25.55,0,NA,CalVal_SE,Permanent,Single,2012-05-04,Inshore,UK
calval_may2012,FLK,2012,CalVal,24.8955833333333,-80.6166333333333,CalVal_S,05/04/12,05/04/12,12:32:00 PM,04:32:00 PM,0,2045.15,2332.46,8.01,444.9,3.29,NA,NA,34.91,25.65,0,NA,CalVal_S,Permanent,Single,2012-05-04,Inshore,UK
calval_may2012,FLK,2012,CalVal,24.8964666666667,-80.6182,ADCP_S,05/04/12,05/04/12,12:40:00 PM,04:40:00 PM,0,2035.16,2322.51,8.014,439,3.29,NA,NA,34.83,25.59,0,NA,ADCP_S,Permanent,Single,2012-05-04,Inshore,UK
calval_may2012,FLK,2012,CalVal,24.8982666666667,-80.6173833333333,CalVal_N,05/15/12,05/15/12,09:15:00 AM,01:15:00 PM,0,1952.37,2336.01,8.126,316.2,4.35,NA,NA,35,28,0,NA,CalVal_N,Permanent,Single,2012-05-15,Inshore,UK
calval_may2012,FLK,2012,CalVal,24.8981833333333,-80.6160666666667,ADCP_NE,05/15/12,05/15/12,09:28:00 AM,01:28:00 PM,0,1948.6,2333.46,8.103,331.7,4.23,NA,NA,37.2,27.9,0,NA,ADCP_NE,Permanent,Single,2012-05-15,Inshore,UK
calval_may2012,FLK,2012,CalVal,24.8955833333333,-80.6166333333333,CalVal_S,05/15/12,05/15/12,09:40:00 AM,01:40:00 PM,0,1948.41,2325.76,8.093,340.2,4.15,NA,NA,37.2,27.9,0,NA,CalVal_S,Permanent,Single,2012-05-15,Inshore,UK
calval_may2012,FLK,2012,CalVal,24.8955833333333,-80.6166333333333,CalVal_S,05/15/12,05/15/12,09:55:00 AM,01:55:00 PM,0,1949.12,2317.66,8.077,354.1,4.05,NA,NA,37.4,28,0,NA,CalVal_S,Permanent,Single,2012-05-15,Inshore,UK
calval_may2012,FLK,2012,CalVal,24.8966333333333,-80.6153,CalVal_SE,05/15/12,05/15/12,10:05:00 AM,02:05:00 PM,0,1950.24,2331.21,8.094,339.3,4.18,NA,NA,37.5,27.9,0,NA,CalVal_SE,Permanent,Single,2012-05-15,Inshore,UK
calval_may2012,FLK,2012,CalVal,24.8964666666667,-80.6182,ADCP_S,05/15/12,05/15/12,10:15:00 AM,02:15:00 PM,0,1934.16,2307.61,8.091,339.2,4.13,NA,NA,37.4,28,0,NA,ADCP_S,Permanent,Single,2012-05-15,Inshore,UK
calval_may2012,FLK,2012,CalVal,24.8982666666667,-80.6173833333333,CalVal_N,05/15/12,05/15/12,10:35:00 AM,02:35:00 PM,0,1935.43,2315.11,8.097,333.4,4.19,NA,NA,37.5,28,0,NA,CalVal_N,Permanent,Single,2012-05-15,Inshore,UK
calval_may2012,FLK,2012,CalVal,24.8547,-80.5674166666667,Transect 4,05/21/12,05/21/12,10:50:00 AM,02:50:00 PM,0,1948.67,2362.56,8.065,365.2,3.83,NA,NA,37.1,28,0,NA,Transect 4,Permanent,Single,2012-05-21,Oceanic,UK
calval_may2012,FLK,2012,CalVal,24.8694,-80.585,Transect 3,05/21/12,05/21/12,11:05:00 AM,03:05:00 PM,0,1913.25,2360.61,8.014,410,3.43,NA,NA,37.3,28.6,0,NA,Transect 3,Permanent,Single,2012-05-21,Offshore,UK
calval_may2012,FLK,2012,CalVal,24.8854666666667,-80.6041,Transect 2,05/21/12,05/21/12,11:20:00 AM,03:20:00 PM,0,NA,2298.46,NA,NA,NA,NA,NA,37.3,27.2,0,NA,Transect 2,Permanent,Single,2012-05-21,Mid channel,UK
calval_may2012,FLK,2012,CalVal,24.9052,-80.6266,Transect 1,05/21/12,05/21/12,11:45:00 AM,03:45:00 PM,0,NA,2223.76,NA,NA,NA,NA,NA,36.7,27.7,0,NA,Transect 1,Permanent,Single,2012-05-21,Inshore,UK
calval_may2012,FLK,2012,CalVal,24.8982666666667,-80.6173833333333,CalVal_N,05/28/12,05/28/12,12:18:00 PM,04:18:00 PM,0,1863.72,2232.66,8.089,330.8,4.07,NA,NA,36.4,29.1,0,NA,CalVal_N,Permanent,Single,2012-05-28,Inshore,UK
calval_may2012,FLK,2012,CalVal,24.8955833333333,-80.6166333333333,CalVal_S,05/28/12,05/28/12,12:30:00 PM,04:30:00 PM,0,1871.11,2246.16,8.087,334.5,4.11,NA,NA,36.4,29.3,0,NA,CalVal_S,Permanent,Single,2012-05-28,Inshore,UK
calval_may2012,FLK,2012,CalVal,24.8966333333333,-80.6153,CalVal_SE,05/28/12,05/28/12,12:37:00 PM,04:37:00 PM,0,1877.62,2252.51,8.085,336.9,4.11,NA,NA,36.4,29.3,0,NA,CalVal_SE,Permanent,Single,2012-05-28,Inshore,UK
calval_may2012,FLK,2012,CalVal,24.8981833333333,-80.6160666666667,ADCP_NE,05/28/12,05/28/12,12:45:00 PM,04:45:00 PM,0,1864.01,2242.26,8.092,328.5,4.14,NA,NA,36.6,29.2,0,NA,ADCP_NE,Permanent,Single,2012-05-28,Inshore,UK
calval_may2012,FLK,2012,CalVal,NA,NA,ADCP_SW,05/28/12,05/28/12,12:55:00 PM,04:55:00 PM,0,1862.47,2242.21,8.099,321.2,4.18,NA,NA,36.4,29.3,0,NA,ADCP_SW,Permanent,Single,2012-05-28,Inshore,UK
calval_jun2012,FLK,2012,CalVal,NA,NA,ADCP_S,06/12/12,06/12/12,11:05:00 AM,03:05:00 PM,0,1920.34,2280.01,8.063,362.7,4.03,NA,NA,36.9,29.3,0,NA,ADCP_S,Permanent,Single,2012-06-12,Inshore,UK
calval_jun2012,FLK,2012,CalVal,24.8955833333333,-80.6166333333333,CalVal_S,06/12/12,06/12/12,11:20:00 AM,03:20:00 PM,0,1909.64,2287.86,8.075,350.6,4.14,NA,NA,37,29.4,0,NA,CalVal_S,Permanent,Single,2012-06-12,Inshore,UK
calval_jun2012,FLK,2012,CalVal,24.8982666666667,-80.6173833333333,CalVal_N,06/12/12,06/12/12,11:30:00 AM,03:30:00 PM,0,1912.7,2276.86,8.044,382,3.91,NA,NA,37,29.4,0,NA,CalVal_N,Permanent,Single,2012-06-12,Inshore,UK
calval_jun2012,FLK,2012,CalVal,24.8966333333333,-80.6153,CalVal_SE,06/12/12,06/12/12,11:45:00 AM,03:45:00 PM,0,1914.06,2288.46,8.069,356.7,4.1,NA,NA,37,29.4,0,NA,CalVal_SE,Permanent,Single,2012-06-12,Inshore,UK
calval_jun2012,FLK,2012,CalVal,NA,NA,ADCP_NE,06/12/12,06/12/12,11:55:00 AM,03:55:00 PM,0,1916.96,2289.31,8.065,361.3,4.08,NA,NA,37.1,29.4,0,NA,ADCP_NE,Permanent,Single,2012-06-12,Inshore,UK
calval_jun2012,FLK,2012,CalVal,24.8547,-80.5674166666667,Transect 4,06/22/12,06/22/12,12:20:00 PM,04:20:00 PM,0,1976.63,2363.86,8.039,405,3.89,NA,NA,37.1,28.2,0,NA,Transect 4,Permanent,Single,2012-06-22,Oceanic,UK
calval_jun2012,FLK,2012,CalVal,24.8694,-80.585,Transect 3,06/22/12,06/22/12,12:40:00 PM,04:40:00 PM,0,2012.27,2360.71,8.028,417.5,3.81,NA,NA,37.2,28.2,0,NA,Transect 3,Permanent,Single,2012-06-22,Offshore,UK
calval_jun2012,FLK,2012,CalVal,24.8854666666667,-80.6041,Transect 2,06/22/12,06/22/12,12:55:00 PM,04:55:00 PM,0,2015.96,2366.26,8.03,415.6,3.81,NA,NA,37.3,27.9,0,NA,Transect 2,Permanent,Single,2012-06-22,Mid channel,UK
calval_jun2012,FLK,2012,CalVal,24.9052,-80.6266,Transect 1,06/22/12,06/22/12,01:32:00 PM,05:32:00 PM,0,2021.44,2342.81,8.067,369.2,3.99,NA,NA,37.5,27.7,0,NA,Transect 1,Permanent,Single,2012-06-22,Inshore,UK
calval_jul2012,FLK,2012,CalVal,NA,NA,ADCP_SW,07/07/12,07/07/12,03:15:00 PM,07:15:00 PM,0,1961.07,2324.71,8.032,402.8,4.02,NA,NA,37.2,30.2,0,NA,ADCP_SW,Permanent,Single,2012-07-07,Inshore,UK
calval_jul2012,FLK,2012,CalVal,24.8955833333333,-80.6166333333333,CalVal_S,07/07/12,07/07/12,03:30:00 PM,07:30:00 PM,0,1961.31,2331.11,8.034,401.1,4.07,NA,NA,37.3,30.4,0,NA,CalVal_S,Permanent,Single,2012-07-07,Inshore,UK
calval_jul2012,FLK,2012,CalVal,24.8966333333333,-80.6153,CalVal_SE,07/07/12,07/07/12,03:40:00 PM,07:40:00 PM,0,1965.63,2323.86,8.016,421.7,3.94,NA,NA,37.3,30.4,0,NA,CalVal_SE,Permanent,Single,2012-07-07,Inshore,UK
calval_jul2012,FLK,2012,CalVal,24.8981833333333,-80.6160666666667,ADCP_NE,07/07/12,07/07/12,03:50:00 PM,07:50:00 PM,0,1961.35,2322.86,8.035,398.1,4.07,NA,NA,37.2,30.4,0,NA,ADCP_NE,Permanent,Single,2012-07-07,Inshore,UK
calval_jul2012,FLK,2012,CalVal,24.8982666666667,-80.6173833333333,CalVal_N,07/07/12,07/07/12,04:00:00 PM,08:00:00 PM,0,1968.92,2324.56,8.034,399.2,4.07,NA,NA,37.3,30.4,0,NA,CalVal_N,Permanent,Single,2012-07-07,Inshore,UK
calval_jul2012,FLK,2012,CalVal,24.8982666666667,-80.6173833333333,CalVal_N,07/07/12,07/07/12,04:05:00 PM,08:05:00 PM,0,1967.15,2328.36,8.039,394.4,4.11,NA,NA,37.3,30.4,0,NA,CalVal_N,Permanent,Single,2012-07-07,Inshore,UK
calval_jul2012,FLK,2012,CalVal,24.8982666666667,-80.6173833333333,CalVal_N,07/23/12,07/23/12,12:44:00 PM,04:44:00 PM,0,1952.14,2327.86,8.062,370.9,4.18,NA,NA,36.9,29.8,0,NA,CalVal_N,Permanent,Single,2012-07-23,Inshore,UK
calval_jul2012,FLK,2012,CalVal,24.8981833333333,-80.6160666666667,ADCP_NE,07/23/12,07/23/12,12:55:00 PM,04:55:00 PM,0,1956.22,2323.26,8.065,367.7,4.17,NA,NA,36.8,29.7,0,NA,ADCP_NE,Permanent,Single,2012-07-23,Inshore,UK
calval_jul2012,FLK,2012,CalVal,24.8981833333333,-80.6160666666667,ADCP_NE,07/23/12,07/23/12,01:05:00 PM,05:05:00 PM,0,1959,2329.06,8.055,380.4,4.12,NA,NA,36.6,29.8,0,NA,ADCP_NE,Permanent,Single,2012-07-23,Inshore,UK
calval_jul2012,FLK,2012,CalVal,24.8966333333333,-80.6153,CalVal_SE,07/23/12,07/23/12,01:15:00 PM,05:15:00 PM,0,1957.34,2341.61,8.056,379.1,4.15,NA,NA,37.1,29.7,0,NA,CalVal_SE,Permanent,Single,2012-07-23,Inshore,UK
calval_jul2012,FLK,2012,CalVal,24.8955833333333,-80.6166333333333,CalVal_S,07/23/12,07/23/12,01:25:00 PM,05:25:00 PM,0,1950.98,2332.36,8.052,382.8,4.11,NA,NA,37,29.8,0,NA,CalVal_S,Permanent,Single,2012-07-23,Inshore,UK
calval_jul2012,FLK,2012,CalVal,NA,NA,ADCP_SW,07/23/12,07/23/12,01:35:00 PM,05:35:00 PM,0,1964.29,2325.11,8.054,379,4.12,NA,NA,37,29.8,0,NA,ADCP_SW,Permanent,Single,2012-07-23,Inshore,UK
calval_aug2012,FLK,2012,CalVal,24.8547,-80.5674166666667,Transect 4,08/01/12,08/01/12,09:45:00 AM,01:45:00 PM,0,1966.4,2366.71,8.009,440.4,3.86,NA,NA,37,29.6,0,NA,Transect 4,Permanent,Single,2012-08-01,Oceanic,UK
calval_aug2012,FLK,2012,CalVal,24.8694,-80.585,Transect 3,08/01/12,08/01/12,10:00:00 AM,02:00:00 PM,0,2019.72,2340.46,8,447.4,3.81,NA,NA,36.7,30.1,0,NA,Transect 3,Permanent,Single,2012-08-01,Offshore,UK
calval_aug2012,FLK,2012,CalVal,24.8854666666667,-80.6041,Transect 2,08/01/12,08/01/12,10:15:00 AM,02:15:00 PM,0,1872.65,2338.21,8.04,395,4.18,NA,NA,37.2,30.8,0,NA,Transect 2,Permanent,Single,2012-08-01,Mid channel,UK
calval_aug2012,FLK,2012,CalVal,24.8854666666667,-80.6041,Transect 2,08/01/12,08/01/12,10:25:00 AM,02:25:00 PM,0,1999.7,2350.21,8.052,382.2,4.33,NA,NA,37.3,31.1,0,NA,Transect 2,Permanent,Single,2012-08-01,Mid channel,UK
calval_aug2012,FLK,2012,CalVal,24.9052,-80.6266,Transect 1,08/01/12,08/01/12,10:50:00 AM,02:50:00 PM,0,1959.02,2205.41,7.974,446.8,3.64,NA,NA,37.4,31.9,0,NA,Transect 1,Permanent,Single,2012-08-01,Inshore,UK
calval_aug2012,FLK,2012,CalVal,24.8982666666667,-80.6173833333333,CalVal_N,08/14/12,08/14/12,01:10:00 PM,05:10:00 PM,0,1886.87,2251.06,8.048,371.7,4.06,NA,NA,36.8,30.8,0,NA,CalVal_N,Permanent,Single,2012-08-14,Inshore,UK
calval_aug2012,FLK,2012,CalVal,24.8982666666667,-80.6173833333333,CalVal_N,08/14/12,08/14/12,01:20:00 PM,05:20:00 PM,0,1882.53,2250.26,8.051,368,4.09,NA,NA,36.9,30.9,0,NA,CalVal_N,Permanent,Single,2012-08-14,Inshore,UK
calval_aug2012,FLK,2012,CalVal,NA,NA,ADCP_NE,08/14/12,08/14/12,01:30:00 PM,05:30:00 PM,0,1870.03,2255.66,8.079,340,4.29,NA,NA,36.7,30.9,0,NA,ADCP_NE,Permanent,Single,2012-08-14,Inshore,UK
calval_aug2012,FLK,2012,CalVal,24.8966333333333,-80.6153,CalVal_SE,08/14/12,08/14/12,01:37:00 PM,05:37:00 PM,0,1898.45,2267.46,8.05,372.1,4.12,NA,NA,36.9,30.9,0,NA,CalVal_SE,Permanent,Single,2012-08-14,Inshore,UK
calval_aug2012,FLK,2012,CalVal,24.8955833333333,-80.6166333333333,CalVal_S,08/14/12,08/14/12,01:50:00 PM,05:50:00 PM,0,1899.48,2271.31,8.057,366,4.16,NA,NA,36.6,30.9,0,NA,CalVal_S,Permanent,Single,2012-08-14,Inshore,UK
calval_aug2012,FLK,2012,CalVal,NA,NA,ADCP_S,08/14/12,08/14/12,02:00:00 PM,06:00:00 PM,0,1877.33,2249.26,8.057,360.9,4.13,NA,NA,36.9,30.9,0,NA,ADCP_S,Permanent,Single,2012-08-14,Inshore,UK
calval_aug2012,FLK,2012,CalVal,24.8982666666667,-80.6173833333333,CalVal_N,08/22/12,08/22/12,02:39:00 PM,06:39:00 PM,0,1890.59,2279.41,8.076,348.1,4.39,NA,NA,36.2,31.6,0,NA,CalVal_N,Permanent,Single,2012-08-22,Inshore,UK
calval_aug2012,FLK,2012,CalVal,NA,NA,ADCP_NE,08/22/12,08/22/12,02:50:00 PM,06:50:00 PM,0,1886.14,2274.06,8.073,349.5,4.36,NA,NA,36.4,31.6,0,NA,ADCP_NE,Permanent,Single,2012-08-22,Inshore,UK
calval_aug2012,FLK,2012,CalVal,NA,NA,ADCP_NE,08/22/12,08/22/12,02:59:00 PM,06:59:00 PM,0,1881.52,2254.91,8.053,367,4.2,NA,NA,36.4,31.7,0,NA,ADCP_NE,Permanent,Single,2012-08-22,Inshore,UK
calval_aug2012,FLK,2012,CalVal,24.8966333333333,-80.6153,CalVal_SE,08/22/12,08/22/12,03:09:00 PM,07:09:00 PM,0,1883.77,2253.61,8.048,372.3,4.16,NA,NA,36.4,31.7,0,NA,CalVal_SE,Permanent,Single,2012-08-22,Inshore,UK
calval_aug2012,FLK,2012,CalVal,24.8955833333333,-80.6166333333333,CalVal_S,08/22/12,08/22/12,03:19:00 PM,07:19:00 PM,0,1977.47,2291.16,7.954,497.8,3.61,NA,NA,36.4,31.7,0,NA,CalVal_S,Permanent,Single,2012-08-22,Inshore,UK
calval_aug2012,FLK,2012,CalVal,NA,NA,ADCP_S,08/22/12,08/22/12,03:28:00 PM,07:28:00 PM,0,1886.75,2272.51,8.068,353.6,4.34,NA,NA,36.4,31.7,0,NA,ADCP_S,Permanent,Single,2012-08-22,Inshore,UK
calval_sep2012,FLK,2012,CalVal,NA,NA,ADCP_S,09/06/12,09/06/12,02:00:00 PM,06:00:00 PM,0,2051.14,2371.11,7.972,493.3,3.71,NA,NA,36.2,30.5,0,NA,ADCP_S,Permanent,Single,2012-09-06,Inshore,UK
calval_sep2012,FLK,2012,CalVal,NA,NA,ADCP_N,09/06/12,09/06/12,02:22:00 PM,06:22:00 PM,0,2046.97,2394.56,8.006,450.9,4.01,NA,NA,36.4,30.7,0,NA,ADCP_N,Permanent,Single,2012-09-06,Inshore,UK
calval_sep2012,FLK,2012,CalVal,24.8982666666667,-80.6173833333333,CalVal_N,09/06/12,09/06/12,02:36:00 PM,06:36:00 PM,0,2028.23,2388.36,7.992,467.1,3.92,NA,NA,36.4,30.8,0,NA,CalVal_N,Permanent,Single,2012-09-06,Inshore,UK
calval_sep2012,FLK,2012,CalVal,24.8966333333333,-80.6153,CalVal_SE,09/06/12,09/06/12,02:52:00 PM,06:52:00 PM,0,2049.12,2394.01,8.031,418.6,4.19,NA,NA,36.6,30.7,0,NA,CalVal_SE,Permanent,Single,2012-09-06,Inshore,UK
calval_sep2012,FLK,2012,CalVal,24.8955833333333,-80.6166333333333,CalVal_S,09/06/12,09/06/12,03:03:00 PM,07:03:00 PM,0,2032.1,2399.06,8.031,418.9,4.21,NA,NA,36.5,30.8,0,NA,CalVal_S,Permanent,Single,2012-09-06,Inshore,UK
calval_sep2012,FLK,2012,CalVal,24.8982666666667,-80.6173833333333,CalVal_N,09/22/12,09/22/12,04:10:00 PM,08:10:00 PM,0,2059.65,2372.54,7.971,494.7,3.57,NA,NA,36.6,29.2,0,NA,CalVal_N,Permanent,Single,2012-09-22,Inshore,UK
calval_sep2012,FLK,2012,CalVal,24.8981833333333,-80.6160666666667,ADCP_NE,09/22/12,09/22/12,04:18:00 PM,08:18:00 PM,0,2060.96,2373.31,7.971,494,3.58,NA,NA,36.6,29.3,0,NA,ADCP_NE,Permanent,Single,2012-09-22,Inshore,UK
calval_sep2012,FLK,2012,CalVal,24.8966333333333,-80.6153,CalVal_SE,09/22/12,09/22/12,04:25:00 PM,08:25:00 PM,0,2066.89,2390.3,7.988,475.1,3.71,NA,NA,36.5,29.3,0,NA,CalVal_SE,Permanent,Single,2012-09-22,Inshore,UK
calval_sep2012,FLK,2012,CalVal,24.8955833333333,-80.6166333333333,CalVal_S,09/22/12,09/22/12,04:32:00 PM,08:32:00 PM,0,2061.12,2381.41,7.984,479,3.67,NA,NA,36.6,29.3,0,NA,CalVal_S,Permanent,Single,2012-09-22,Inshore,UK
calval_sep2012,FLK,2012,CalVal,24.8964666666667,-80.6182,ADCP_S,09/22/12,09/22/12,04:40:00 PM,08:40:00 PM,0,2061.67,2382.39,7.987,474.5,3.7,NA,NA,36.6,29.3,0,NA,ADCP_S,Permanent,Single,2012-09-22,Inshore,UK
calval_oct2012,FLK,2012,CalVal,24.8547,-80.5674166666667,Transect 4,10/04/12,10/04/12,11:10:00 AM,03:10:00 PM,0,2123.97,2363.54,8.045,400.4,3.96,NA,NA,36.2,28.7,0,NA,Transect 4,Permanent,Single,2012-10-04,Oceanic,UK
calval_oct2012,FLK,2012,CalVal,24.8694,-80.585,Transect 3,10/04/12,10/04/12,11:30:00 AM,03:30:00 PM,0,2075.53,2368.23,8.016,435.9,3.79,NA,NA,36.3,28.8,0,NA,Transect 3,Permanent,Single,2012-10-04,Offshore,UK
calval_oct2012,FLK,2012,CalVal,24.8854666666667,-80.6041,Transect 2,10/04/12,10/04/12,11:45:00 AM,03:45:00 PM,0,2035.5,2382.12,7.967,503.6,3.53,NA,NA,36.5,29,0,NA,Transect 2,Permanent,Single,2012-10-04,Mid channel,UK
calval_oct2012,FLK,2012,CalVal,24.9052,-80.6266,Transect 1,10/04/12,10/04/12,12:00:00 PM,04:00:00 PM,0,2014.2,2383.39,7.886,632.9,3.08,NA,NA,36,29.4,0,NA,Transect 1,Permanent,Single,2012-10-04,Inshore,UK
calval_oct2012,FLK,2012,CalVal,24.8981833333333,-80.6160666666667,ADCP_NE,10/04/12,10/04/12,12:35:00 PM,04:35:00 PM,0,2113.66,2388.46,7.905,598.6,3.21,NA,NA,36.6,29.4,0,NA,ADCP_NE,Permanent,Single,2012-10-04,Inshore,UK
calval_oct2012,FLK,2012,CalVal,24.8982666666667,-80.6173833333333,CalVal_N,10/04/12,10/04/12,12:45:00 PM,04:45:00 PM,0,2116.04,2388.96,7.902,605.1,3.2,NA,NA,36.5,29.5,0,NA,CalVal_N,Permanent,Single,2012-10-04,Inshore,UK
calval_oct2012,FLK,2012,CalVal,NA,NA,ADCP_S,10/04/12,10/04/12,12:55:00 PM,04:55:00 PM,0,2119,2386.17,7.891,622.3,3.14,NA,NA,36.6,29.5,0,NA,ADCP_S,Permanent,Single,2012-10-04,Inshore,UK
calval_oct2012,FLK,2012,CalVal,24.8966333333333,-80.6153,CalVal_SE,10/04/12,10/04/12,01:05:00 PM,05:05:00 PM,0,2111.88,2387.7,7.906,596.8,3.22,NA,NA,36.7,29.4,0,NA,CalVal_SE,Permanent,Single,2012-10-04,Inshore,UK
calval_oct2012,FLK,2012,CalVal,24.8955833333333,-80.6166333333333,CalVal_S,10/04/12,10/04/12,01:15:00 PM,05:15:00 PM,0,2115.36,2389.18,7.904,601.8,3.2,NA,NA,36.6,29.4,0,NA,CalVal_S,Permanent,Single,2012-10-04,Inshore,UK
calval_oct2012,FLK,2012,CalVal,NA,NA,ADCP_S,10/31/12,10/31/12,10:42:00 AM,02:42:00 PM,0,2189.64,2475.87,8.007,475.6,3.15,NA,NA,35.9,22.3,0,NA,ADCP_S,Permanent,Single,2012-10-31,Inshore,UK
calval_oct2012,FLK,2012,CalVal,24.8966333333333,-80.6153,CalVal_SE,10/31/12,10/31/12,11:00:00 AM,03:00:00 PM,0,2200.14,2461.28,8.012,466.5,3.17,NA,NA,36,22.4,0,NA,CalVal_SE,Permanent,Single,2012-10-31,Inshore,UK
calval_oct2012,FLK,2012,CalVal,24.8955833333333,-80.6166333333333,CalVal_S,10/31/12,10/31/12,11:07:00 AM,03:07:00 PM,0,2182.59,2452.28,7.983,502.7,3,NA,NA,36,22.4,0,NA,CalVal_S,Permanent,Single,2012-10-31,Inshore,UK
calval_oct2012,FLK,2012,CalVal,NA,NA,ADCP_N,10/31/12,10/31/12,11:19:00 AM,03:19:00 PM,0,2190.54,2458.12,7.99,493.2,3.06,NA,NA,36.2,22.5,0,NA,ADCP_N,Permanent,Single,2012-10-31,Inshore,UK
calval_oct2012,FLK,2012,CalVal,24.8982666666667,-80.6173833333333,CalVal_N,10/31/12,10/31/12,11:27:00 AM,03:27:00 PM,0,2188.76,2457.43,7.995,488,3.07,NA,NA,36,22.4,0,NA,CalVal_N,Permanent,Single,2012-10-31,Inshore,UK
calval_nov2012,FLK,2012,CalVal,NA,NA,ADCP_NE,11/19/12,11/19/12,11:10:00 AM,04:10:00 PM,0,2075.34,2402.52,8.063,389.7,3.62,NA,NA,37,24.1,0,NA,ADCP_NE,Permanent,Single,2012-11-19,Inshore,UK
calval_nov2012,FLK,2012,CalVal,24.8982666666667,-80.6173833333333,CalVal_N,11/19/12,11/19/12,11:21:00 AM,04:21:00 PM,0,2071.9,2401,8.066,385.8,3.64,NA,NA,37,24.1,0,NA,CalVal_N,Permanent,Single,2012-11-19,Inshore,UK
calval_nov2012,FLK,2012,CalVal,24.8964666666667,-80.6182,ADCP_S,11/19/12,11/19/12,11:37:00 AM,04:37:00 PM,0,2067.11,2402.68,8.074,376.8,3.71,NA,NA,37,24.2,0,NA,ADCP_S,Permanent,Single,2012-11-19,Inshore,UK
calval_nov2012,FLK,2012,CalVal,24.8955833333333,-80.6166333333333,CalVal_S,11/19/12,11/19/12,11:50:00 AM,04:50:00 PM,0,2074.98,2409.56,8.073,379.2,3.7,NA,NA,37,24.1,0,NA,CalVal_S,Permanent,Single,2012-11-19,Inshore,UK
calval_nov2012,FLK,2012,CalVal,24.8966333333333,-80.6153,CalVal_SE,11/19/12,11/19/12,12:05:00 PM,05:05:00 PM,0,2081.51,2409.59,8.063,390.5,3.63,NA,NA,37,24.1,0,NA,CalVal_SE,Permanent,Single,2012-11-19,Inshore,UK
calval_dec2012,FLK,2012,CalVal,24.8982666666667,-80.6173833333333,CalVal_N,12/03/12,12/03/12,01:00:00 PM,06:00:00 PM,0,2299.35,2548.83,7.954,565.7,2.92,NA,NA,36,22,0,NA,CalVal_N,Permanent,Single,2012-12-03,Inshore,UK
calval_dec2012,FLK,2012,CalVal,24.8981833333333,-80.6160666666667,ADCP_NE,12/03/12,12/03/12,01:12:00 PM,06:12:00 PM,0,2289.95,2543.52,7.962,552.3,2.96,NA,NA,36,22,0,NA,ADCP_NE,Permanent,Single,2012-12-03,Inshore,UK
calval_dec2012,FLK,2012,CalVal,24.8966333333333,-80.6153,CalVal_SE,12/03/12,12/03/12,01:20:00 PM,06:20:00 PM,0,2288.14,2543.67,7.984,521,3.08,NA,NA,36.1,22,0,NA,CalVal_SE,Permanent,Single,2012-12-03,Inshore,UK
calval_dec2012,FLK,2012,CalVal,24.8955833333333,-80.6166333333333,CalVal_S,12/03/12,12/03/12,01:32:00 PM,06:32:00 PM,0,2290.73,2539.57,7.953,565,2.9,NA,NA,36.1,22,0,NA,CalVal_S,Permanent,Single,2012-12-03,Inshore,UK
calval_dec2012,FLK,2012,CalVal,24.8964666666667,-80.6182,ADCP_S,12/03/12,12/03/12,01:45:00 PM,06:45:00 PM,0,2295.1,2543.1,7.952,567.4,2.9,NA,NA,36,22,0,NA,ADCP_S,Permanent,Single,2012-12-03,Inshore,UK
calval_dec2012,FLK,2012,CalVal,24.8964666666667,-80.6182,ADCP_S,12/03/12,12/03/12,01:55:00 PM,06:55:00 PM,0,2305.64,2560.56,7.963,555.8,2.98,NA,NA,36,22,0,NA,ADCP_S,Permanent,Single,2012-12-03,Inshore,UK
calval_dec2012,FLK,2012,CalVal,24.8547,-80.5674166666667,Transect 4,12/17/12,12/17/12,12:20:00 PM,05:20:00 PM,0,2022.51,2362.5,8.059,385.5,3.78,NA,NA,36.8,26.3,0,NA,Transect 4,Permanent,Single,2012-12-17,Oceanic,UK
calval_dec2012,FLK,2012,CalVal,24.8547,-80.5674166666667,Transect 4,12/17/12,12/17/12,12:38:00 PM,05:38:00 PM,0,2023.15,2367.73,8.065,379,3.82,NA,NA,36.9,26.2,0,NA,Transect 4,Permanent,Single,2012-12-17,Oceanic,UK
calval_dec2012,FLK,2012,CalVal,24.8694,-80.585,Transect 3,12/17/12,12/17/12,12:50:00 PM,05:50:00 PM,0,2015.41,2369.53,8.057,387.6,3.82,NA,NA,36.9,26.6,0,NA,Transect 3,Permanent,Single,2012-12-17,Offshore,UK
calval_dec2012,FLK,2012,CalVal,24.8854666666667,-80.6041,Transect 2,12/17/12,12/17/12,01:07:00 PM,06:07:00 PM,0,2023.64,2369.84,8.057,388.6,3.72,NA,NA,37,25.7,0,NA,Transect 2,Permanent,Single,2012-12-17,Mid channel,UK
calval_dec2012,FLK,2012,CalVal,24.9052,-80.6266,Transect 1,12/17/12,12/17/12,01:31:00 PM,06:31:00 PM,0,2105.64,2428.28,8.039,421,3.62,NA,NA,36.8,25.1,0,NA,Transect 1,Permanent,Single,2012-12-17,Inshore,UK
calval_jan2013,FLK,2013,CalVal,24.8966333333333,-80.6153,CalVal_SE,01/08/13,01/08/13,09:50:00 AM,02:50:00 PM,0,2082.21,2401.58,8.062,390.6,3.66,NA,NA,36.6,24.6,0,NA,CalVal_SE,Permanent,Single,2013-01-08,Inshore,UK
calval_jan2013,FLK,2013,CalVal,24.8955833333333,-80.6166333333333,CalVal_S,01/08/13,01/08/13,10:02:00 AM,03:02:00 PM,0,2088.38,2396.63,8.044,410.2,3.54,NA,NA,36.7,24.6,0,NA,CalVal_S,Permanent,Single,2013-01-08,Inshore,UK
calval_jan2013,FLK,2013,CalVal,24.8981833333333,-80.6160666666667,ADCP_NE,01/08/13,01/08/13,10:19:00 AM,03:19:00 PM,0,2090.36,2402.85,8.061,393.9,3.66,NA,NA,36.6,24.7,0,NA,ADCP_NE,Permanent,Single,2013-01-08,Inshore,UK
calval_jan2013,FLK,2013,CalVal,24.8982666666667,-80.6173833333333,CalVal_N,01/08/13,01/08/13,10:19:00 AM,03:19:00 PM,0,2081.48,2409.36,8.064,389.1,3.69,NA,NA,36.6,24.6,0,NA,CalVal_N,Permanent,Single,2013-01-08,Inshore,UK
calval_jan2013,FLK,2013,CalVal,24.8964666666667,-80.6182,ADCP_S,01/08/13,01/08/13,10:32:00 AM,03:32:00 PM,0,2076.04,2395.1,8.063,388.9,3.66,NA,NA,36.6,24.6,0,NA,ADCP_S,Permanent,Single,2013-01-08,Inshore,UK
calval_jan2013,FLK,2013,CalVal,24.8964666666667,-80.6182,ADCP_S,01/08/13,01/08/13,10:42:00 AM,03:42:00 PM,0,2082.82,2395.21,8.051,402,3.58,NA,NA,36.7,24.6,0,NA,ADCP_S,Permanent,Single,2013-01-08,Inshore,UK
calval_jan2013,FLK,2013,CalVal,24.8964666666667,-80.6182,ADCP_S,01/24/13,01/24/13,12:14:00 PM,05:14:00 PM,0,2056,2383.12,8.115,335.9,3.71,NA,NA,36.4,22.4,0,NA,ADCP_S,Permanent,Single,2013-01-24,Inshore,UK
calval_jan2013,FLK,2013,CalVal,24.8955833333333,-80.6166333333333,CalVal_S,01/24/13,01/24/13,12:25:00 PM,05:25:00 PM,0,2067.64,2385.15,8.121,329.6,3.77,NA,NA,36.5,22.5,0,NA,CalVal_S,Permanent,Single,2013-01-24,Inshore,UK
calval_jan2013,FLK,2013,CalVal,24.8955833333333,-80.6166333333333,CalVal_S,01/24/13,01/24/13,12:36:00 PM,05:36:00 PM,0,2045.24,2386.29,8.115,336.3,3.72,NA,NA,36.5,22.5,0,NA,CalVal_S,Permanent,Single,2013-01-24,Inshore,UK
calval_jan2013,FLK,2013,CalVal,24.8966333333333,-80.6153,CalVal_SE,01/24/13,01/24/13,12:46:00 PM,05:46:00 PM,0,2045.5,2384.02,8.114,336.7,3.72,NA,NA,36.5,22.5,0,NA,CalVal_SE,Permanent,Single,2013-01-24,Inshore,UK
calval_jan2013,FLK,2013,CalVal,24.8982666666667,-80.6173833333333,CalVal_N,01/24/13,01/24/13,01:00:00 PM,06:00:00 PM,0,2041.42,2393.05,8.126,326.9,3.79,NA,NA,36.5,22.4,0,NA,CalVal_N,Permanent,Single,2013-01-24,Inshore,UK
calval_jan2013,FLK,2013,CalVal,24.8981833333333,-80.6160666666667,ADCP_NE,01/24/13,01/24/13,01:12:00 PM,06:12:00 PM,0,2046.79,2394.46,8.108,344,3.69,NA,NA,36.5,22.5,0,NA,ADCP_NE,Permanent,Single,2013-01-24,Inshore,UK
calval_feb2013,FLK,2013,CalVal,24.8547,-80.5674166666667,Transect 4,02/04/13,02/04/13,01:54:00 PM,06:54:00 PM,0,2050.04,2373.01,8.07,378.3,3.65,NA,NA,36.4,24.5,0,NA,Transect 4,Permanent,Single,2013-02-04,Oceanic,UK
calval_feb2013,FLK,2013,CalVal,24.8694,-80.585,Transect 3,02/04/13,02/04/13,02:10:00 PM,07:10:00 PM,0,2054.15,2373.4,8.08,368.3,3.7,NA,NA,36.3,24.4,0,NA,Transect 3,Permanent,Single,2013-02-04,Offshore,UK
calval_feb2013,FLK,2013,CalVal,24.8854666666667,-80.6041,Transect 2,02/04/13,02/04/13,02:23:00 PM,07:23:00 PM,0,2051.83,2375.59,8.091,357.2,3.67,NA,NA,36.5,23.5,0,NA,Transect 2,Permanent,Single,2013-02-04,Mid channel,UK
calval_feb2013,FLK,2013,CalVal,24.9052,-80.6266,Transect 1,02/04/13,02/04/13,02:55:00 PM,07:55:00 PM,0,2043.1832,2392.96,8.141,312.7,3.8,NA,NA,36.8,21.5,0,NA,Transect 1,Permanent,Single,2013-02-04,Inshore,UK
calval_feb2013,FLK,2013,CalVal,24.8982666666667,-80.6173833333333,CalVal_N,02/21/13,02/21/13,12:30:00 PM,05:30:00 PM,0,2053.23,2376.99,8.121,329.6,3.73,NA,NA,36.4,22.4,0,NA,CalVal_N,Permanent,Single,2013-02-21,Inshore,UK
calval_feb2013,FLK,2013,CalVal,NA,NA,ADCP_NE,02/21/13,02/21/13,12:40:00 PM,05:40:00 PM,0,2036.38,2377.91,8.121,329.3,3.75,NA,NA,36.4,22.5,0,NA,ADCP_NE,Permanent,Single,2013-02-21,Inshore,UK
calval_feb2013,FLK,2013,CalVal,24.8966333333333,-80.6153,CalVal_SE,02/21/13,02/21/13,12:50:00 PM,05:50:00 PM,0,2036.02,2382.64,8.112,338.3,3.72,NA,NA,36.4,22.7,0,NA,CalVal_SE,Permanent,Single,2013-02-21,Inshore,UK
calval_feb2013,FLK,2013,CalVal,24.8955833333333,-80.6166333333333,CalVal_S,02/21/13,02/21/13,01:01:00 PM,06:01:00 PM,0,2037.4,2376.74,8.116,334.1,3.72,NA,NA,36.4,22.6,0,NA,CalVal_S,Permanent,Single,2013-02-21,Inshore,UK
calval_feb2013,FLK,2013,CalVal,NA,NA,ADCP_S,02/21/13,02/21/13,01:14:00 PM,06:14:00 PM,0,2029.97,2371.06,8.12,329.3,3.73,NA,NA,36.5,22.5,0,NA,ADCP_S,Permanent,Single,2013-02-21,Inshore,UK
calval_march2013,FLK,2013,CalVal,24.8964666666667,-80.6182,ADCP_S,03/06/13,03/06/13,11:32:00 AM,07:14:00 PM,0,2030.36,2387.45,8.101,359.5,3.54,NA,NA,33.6,22.6,0,NA,ADCP_S,Permanent,Single,2013-03-06,Inshore,UK
calval_march2013,FLK,2013,CalVal,24.8982666666667,-80.6173833333333,CalVal_N,03/06/13,03/06/13,11:46:00 AM,08:14:00 PM,0,2033.14,2393.81,8.099,362.7,3.54,NA,NA,33.6,22.6,0,NA,CalVal_N,Permanent,Single,2013-03-06,Inshore,UK
calval_march2013,FLK,2013,CalVal,24.8981833333333,-80.6160666666667,ADCP_NE,03/06/13,03/06/13,11:57:00 AM,09:14:00 PM,0,2022.01,2393.81,8.108,353,3.6,NA,NA,33.6,22.6,0,NA,ADCP_NE,Permanent,Single,2013-03-06,Inshore,UK
calval_march2013,FLK,2013,CalVal,24.8966333333333,-80.6153,CalVal_SE,03/06/13,03/06/13,12:10:00 PM,10:14:00 PM,0,2021.28,2385.9,8.103,356.9,3.55,NA,NA,33.6,22.6,0,NA,CalVal_SE,Permanent,Single,2013-03-06,Inshore,UK
calval_march2013,FLK,2013,CalVal,24.8955833333333,-80.6166333333333,CalVal_S,03/06/13,03/06/13,12:22:00 PM,11:14:00 PM,0,2020.25,2387.84,8.091,369.3,3.48,NA,NA,33.6,22.6,0,NA,CalVal_S,Permanent,Single,2013-03-06,Inshore,UK
calval_march2013,FLK,2013,CalVal,24.8964666666667,-80.6182,ADCP_S,03/06/13,03/06/13,12:45:00 PM,12:14:00 AM,0,2018.04,2384.75,8.108,351.4,3.58,NA,NA,33.6,22.6,0,NA,ADCP_S,Permanent,Single,2013-03-06,Inshore,UK
calval_march2013,FLK,2013,CalVal,24.8547,-80.5674166666667,Transect 4,03/20/13,03/20/13,10:18:00 AM,02:18:00 PM,0,2043.47,2375.94,8.091,357.1,3.67,NA,NA,36.4,23.5,0,NA,Transect 4,Permanent,Single,2013-03-20,Oceanic,UK
calval_march2013,FLK,2013,CalVal,24.8694,-80.585,Transect 3,03/20/13,03/20/13,10:30:00 AM,02:30:00 PM,0,2045.33,2376.28,8.091,358.2,3.66,NA,NA,36.4,23.4,0,NA,Transect 3,Permanent,Single,2013-03-20,Offshore,UK
calval_march2013,FLK,2013,CalVal,24.8854666666667,-80.6041,Transect 2,03/20/13,03/20/13,10:42:00 AM,02:42:00 PM,0,2033.92,2370.82,8.101,347,3.71,NA,NA,36.4,23.4,0,NA,Transect 2,Permanent,Single,2013-03-20,Mid channel,UK
calval_march2013,FLK,2013,CalVal,24.9052,-80.6266,Transect 1,03/20/13,03/20/13,11:15:00 AM,03:15:00 PM,0,2032.52,2372.1,8.109,339.1,3.72,NA,NA,36.7,22.9,0,NA,Transect 1,Permanent,Single,2013-03-20,Inshore,UK
calval_may2013,FLK,2013,CalVal,NA,NA,H2O_1,05/27/13,05/27/13,11:00:00 AM,03:00:00 PM,0,1915.46,2234.16,8.066,357.3,3.7,NA,NA,36.21,27.22,0,NA,H2O_1,Permanent,Single,2013-05-27,Inshore,UK
calval_jun2013,FLK,2013,CalVal,NA,NA,H2O_1,06/15/13,06/15/13,11:15:00 AM,03:15:00 PM,0,1929.34,2248.32,8.049,377,3.74,NA,NA,36.02,28.4,0,NA,H2O_1,Permanent,Single,2013-06-15,Inshore,UK
calval_jun2013,FLK,2013,CalVal,NA,NA,H2O_1,06/30/13,06/30/13,01:15:00 PM,05:15:00 PM,0,1995.36,2244.01,8.11,312.9,4.23,NA,NA,36.04,29.1,0,NA,H2O_1,Permanent,Single,2013-06-30,Inshore,UK
calval_jun2013,FLK,2013,CalVal,NA,NA,H2O_2,06/30/13,06/30/13,01:30:00 PM,05:30:00 PM,0,1969.12,2350.67,8.118,321.9,4.47,NA,NA,36.07,28.9,0,NA,H2O_2,Permanent,Single,2013-06-30,Inshore,UK
calval_jun2013,FLK,2013,CalVal,NA,NA,H2O_3,06/30/13,06/30/13,01:45:00 PM,05:45:00 PM,0,1878.59,2353.79,8.085,355.1,4.23,NA,NA,36.06,28.8,0,NA,H2O_3,Permanent,Single,2013-06-30,Inshore,UK
calval_jun2013,FLK,2013,CalVal,NA,NA,H2O_4,06/30/13,06/30/13,02:00:00 PM,06:00:00 PM,0,1956.47,2319.66,8.098,336,4.25,NA,NA,36.13,28.7,0,NA,H2O_4,Permanent,Single,2013-06-30,Inshore,UK
calval_jul2013,FLK,2013,CalVal,NA,NA,H2O_1,07/13/13,07/13/13,12:50:00 PM,04:50:00 PM,0,1950.63,2317,8.081,352,4.35,NA,NA,35.8,30.53,0,NA,H2O_1,Permanent,Single,2013-07-13,Inshore,UK
calval_jul2013,FLK,2013,CalVal,NA,NA,H2O_2,07/13/13,07/13/13,01:00:00 PM,05:00:00 PM,0,2024.62,2363.67,8.038,405.7,4.13,NA,NA,36.48,30.34,0,NA,H2O_2,Permanent,Single,2013-07-13,Inshore,UK
calval_jul2013,FLK,2013,CalVal,NA,NA,H2O_3,07/13/13,07/13/13,01:10:00 PM,05:10:00 PM,0,2017.38,2367.99,8.04,404.2,4.09,NA,NA,36.39,29.87,0,NA,H2O_3,Permanent,Single,2013-07-13,Inshore,UK
calval_jul2013,FLK,2013,CalVal,NA,NA,H2O_4,07/13/13,07/13/13,01:20:00 PM,05:20:00 PM,0,2020.56,2370.53,8.046,397.4,4.16,NA,NA,36.5,30.04,0,NA,H2O_4,Permanent,Single,2013-07-13,Inshore,UK
calval_jul2013,FLK,2013,CalVal,NA,NA,H2O_1,07/27/13,07/27/13,11:00:00 AM,03:00:00 PM,0,1921.33,2269.05,8.05,374.7,4.1,NA,NA,36.3,30.88,0,NA,H2O_1,Permanent,Single,2013-07-27,Inshore,UK
calval_aug2013,FLK,2013,CalVal,NA,NA,H2O_1,08/10/13,08/10/13,01:47:00 PM,05:47:00 PM,0,2011.48,2304.43,7.93,559.5,3.36,NA,NA,36.8,30.5,0,NA,H2O_1,Permanent,Single,2013-08-10,Inshore,UK
calval_aug2013,FLK,2013,CalVal,NA,NA,H2O_1,08/23/13,08/23/13,04:18:00 PM,08:18:00 PM,0,2014.25,2295.92,7.937,548.8,3.36,NA,NA,36.4,30.3,0,NA,H2O_1,Permanent,Single,2013-08-23,Inshore,UK
calval_aug2013,FLK,2013,CalVal,NA,NA,H2O_2,08/23/13,08/23/13,04:40:00 PM,08:40:00 PM,0,2004.33,2333.39,7.982,487.6,3.71,NA,NA,37.1,30.2,0,NA,H2O_2,Permanent,Single,2013-08-23,Inshore,UK
calval_aug2013,FLK,2013,CalVal,NA,NA,H2O_3,08/23/13,08/23/13,04:53:00 PM,08:53:00 PM,0,2006.33,2334.45,7.955,526.3,3.51,NA,NA,37.4,29.9,0,NA,H2O_3,Permanent,Single,2013-08-23,Inshore,UK
calval_aug2013,FLK,2013,CalVal,NA,NA,H2O_4,08/23/13,08/23/13,05:07:00 PM,09:07:00 PM,0,2024.83,2361.83,8.012,451.7,3.9,NA,NA,37.5,29.7,0,NA,H2O_4,Permanent,Single,2013-08-23,Inshore,UK
calval_aug2013,FLK,2013,CalVal,NA,NA,H2O_4,08/23/13,08/23/13,05:07:00 PM,09:07:00 PM,0,2009.86,2356.17,8.004,460.8,3.84,NA,NA,37.5,29.7,0,NA,H2O_4,Permanent,Single,2013-08-23,Inshore,UK
calval_sep2013,FLK,2013,CalVal,NA,NA,H2O_1,09/10/13,09/10/13,01:45:00 PM,05:45:00 PM,0,1917.18,2185.83,7.903,571.9,3.05,NA,NA,36.8,30.7,0,NA,H2O_1,Permanent,Single,2013-09-10,Inshore,UK
calval_sep2013,FLK,2013,CalVal,NA,NA,H2O_1,09/10/13,09/10/13,01:45:00 PM,05:45:00 PM,0,1912.79,2174.81,7.884,599,2.93,NA,NA,36.8,30.7,0,NA,H2O_1,Permanent,Single,2013-09-10,Inshore,UK
calval_oct2013,FLK,2013,CalVal,NA,NA,H2O_1,10/03/13,10/03/13,04:30:00 PM,08:30:00 PM,0,2046.37,2329.19,7.93,567.9,3.27,NA,NA,36.4,29.4,0,NA,H2O_1,Permanent,Single,2013-10-03,Inshore,UK
calval_oct2014,FLK,2013,CalVal,NA,NA,H2O_1,10/03/13,10/03/13,04:30:00 PM,08:30:00 PM,0,2041.99,2325.9,7.925,575.3,3.23,NA,NA,36.4,29.4,0,NA,H2O_1,Permanent,Single,2013-10-03,Inshore,UK
calval_oct2015,FLK,2013,CalVal,NA,NA,H2O_1,10/21/13,10/21/13,02:25:00 PM,06:25:00 PM,0,2022.52,2317.91,7.875,658.3,2.91,NA,NA,36.4,29.1,0,NA,H2O_1,Permanent,Single,2013-10-21,Inshore,UK
calval_oct2016,FLK,2013,CalVal,NA,NA,H2O_2,10/21/13,10/21/13,02:45:00 PM,06:45:00 PM,0,2069.38,2350.43,7.999,472.2,3.68,NA,NA,36.3,29,0,NA,H2O_2,Permanent,Single,2013-10-21,Inshore,UK
calval_oct2017,FLK,2013,CalVal,NA,NA,H2O_4,10/21/13,10/21/13,03:05:00 PM,07:05:00 PM,0,2028.4,2362.09,8.037,429.4,3.91,NA,NA,35.3,29,0,NA,H2O_4,Permanent,Single,2013-10-21,Inshore,UK
calval_nov2013,FLK,2013,CalVal,24.8966333333333,-80.6153,CalVal_N,11/11/13,11/11/13,04:25:00 PM,09:25:00 PM,0,2207.63,2414.8,7.831,774.5,2.52,NA,NA,35.6,26.4,0,NA,CalVal_N,Permanent,Single,2013-11-11,Inshore,UK
calval_nov2013,FLK,2013,CalVal,24.8981833333333,-80.6160666666667,ADCP_NE,11/11/13,11/11/13,04:31:00 PM,09:31:00 PM,0,2222.08,2427.54,7.826,789,2.51,NA,NA,35.6,26.4,0,NA,ADCP_NE,Permanent,Single,2013-11-11,Inshore,UK
calval_nov2013,FLK,2013,CalVal,24.8966333333333,-80.6153,CalVal_SE,11/11/13,11/11/13,04:35:00 PM,09:35:00 PM,0,2204.51,2410.92,7.83,775.5,2.52,NA,NA,35.6,26.4,0,NA,CalVal_SE,Permanent,Single,2013-11-11,Inshore,UK
calval_nov2013,FLK,2013,CalVal,24.8966333333333,-80.6153,CalVal_S,11/11/13,11/11/13,04:39:00 PM,09:39:00 PM,0,2199.04,2404.06,7.828,777.3,2.5,NA,NA,35.6,26.4,0,NA,CalVal_S,Permanent,Single,2013-11-11,Inshore,UK
calval_dec2013,FLK,2013,CalVal,24.8966333333333,-80.6153,CalVal_N,12/03/13,12/03/13,04:23:00 PM,09:23:00 PM,0,2230.98,2469.49,7.901,654.4,2.84,NA,NA,35.7,25.2,0,NA,CalVal_N,Permanent,Single,2013-12-03,Inshore,UK
calval_dec2013,FLK,2013,CalVal,24.8981833333333,-80.6160666666667,ADCP_NE,12/03/13,12/03/13,04:28:00 PM,09:28:00 PM,0,2222.06,2461.66,7.904,647,2.84,NA,NA,35.7,25.2,0,NA,ADCP_NE,Permanent,Single,2013-12-03,Inshore,UK
calval_dec2013,FLK,2013,CalVal,24.8966333333333,-80.6153,CalVal_SE,12/03/13,12/03/13,04:34:00 PM,09:34:00 PM,0,2203.86,2445.55,7.91,632.3,2.86,NA,NA,35.7,25.2,0,NA,CalVal_SE,Permanent,Single,2013-12-03,Inshore,UK
calval_dec2013,FLK,2013,CalVal,24.8955833333333,-80.6166333333333,CalVal_S,12/03/13,12/03/13,04:40:00 PM,09:40:00 PM,0,2185.71,2450.13,7.95,567,3.09,NA,NA,35.7,25.2,0,NA,CalVal_S,Permanent,Single,2013-12-03,Inshore,UK
calval_dec2013,FLK,2013,CalVal,24.8964666666667,-80.6182,ADCP_S,12/03/13,12/03/13,04:47:00 PM,09:47:00 PM,0,2220.25,2477.92,7.935,598.9,3.03,NA,NA,35.7,25.2,0,NA,ADCP_S,Permanent,Single,2013-12-03,Inshore,UK
calval_dec2013,FLK,2013,CalVal,24.8982666666667,-80.6173833333333,CalVal_N,12/16/13,12/16/13,01:27:00 PM,06:27:00 PM,0,2187.22,2454.32,7.95,570.8,3.15,NA,NA,35.2,25.9,0,NA,CalVal_N,Permanent,Single,2013-12-16,Inshore,UK
calval_dec2013,FLK,2013,CalVal,24.8981833333333,-80.6160666666667,ADCP_NE,12/16/13,12/16/13,01:34:00 PM,06:34:00 PM,0,2223.66,2468.79,7.909,643.1,2.93,NA,NA,35.2,25.9,0,NA,ADCP_NE,Permanent,Single,2013-12-16,Inshore,UK
calval_dec2013,FLK,2013,CalVal,24.8966333333333,-80.6153,CalVal_SE,12/16/13,12/16/13,01:40:00 PM,06:40:00 PM,0,2208.56,2464.76,7.93,606.9,3.04,NA,NA,35.2,25.9,0,NA,CalVal_SE,Permanent,Single,2013-12-16,Inshore,UK
calval_dec2013,FLK,2013,CalVal,24.8955833333333,-80.6166333333333,CalVal_S,12/16/13,12/16/13,01:45:00 PM,06:45:00 PM,0,2234.47,2481.9,7.911,642.2,2.96,NA,NA,35.2,25.9,0,NA,CalVal_S,Permanent,Single,2013-12-16,Inshore,UK
calval_dec2013,FLK,2013,CalVal,24.8964666666667,-80.6182,ADCP_S,12/16/13,12/16/13,01:51:00 PM,06:51:00 PM,0,2244.8,2481.53,7.892,677.4,2.86,NA,NA,35.2,25.9,0,NA,ADCP_S,Permanent,Single,2013-12-16,Inshore,UK
calval_dec2013,FLK,2013,CalVal,24.9052,-80.6266,Transect 1,12/16/13,12/16/13,02:00:00 PM,07:00:00 PM,0,2271.36,2502.18,7.878,708.8,2.81,NA,NA,35.2,25.9,0,NA,Transect 1,Permanent,Single,2013-12-16,Inshore,UK
calval_dec2013,FLK,2013,CalVal,24.8854666666667,-80.6041,Transect 2,12/16/13,12/16/13,02:18:00 PM,07:18:00 PM,0,2229.25,2455.59,7.871,706.1,2.72,NA,NA,35.7,25.8,0,NA,Transect 2,Permanent,Single,2013-12-16,Mid channel,UK
calval_jan2014,FLK,2014,CalVal,24.8982666666667,-80.6173833333333,CalVal_N,01/10/14,01/10/14,10:50:00 AM,03:50:00 PM,0,2151.76,2430.41,8.017,465.9,3.18,NA,NA,35.9,22.6,0,NA,CalVal_N,Permanent,Single,2014-01-10,Inshore,UK
calval_jan2014,FLK,2014,CalVal,24.8981833333333,-80.6160666666667,ADCP_NE,01/10/14,01/10/14,11:04:00 AM,04:04:00 PM,0,2149.93,2412.17,8.009,472.5,3.12,NA,NA,36,22.7,0,NA,ADCP_NE,Permanent,Single,2014-01-10,Inshore,UK
calval_jan2014,FLK,2014,CalVal,24.8966333333333,-80.6153,CalVal_SE,01/10/14,01/10/14,11:11:00 AM,04:11:00 PM,0,2136.28,2412.67,8.016,463.4,3.17,NA,NA,36,22.7,0,NA,CalVal_SE,Permanent,Single,2014-01-10,Inshore,UK
calval_jan2014,FLK,2014,CalVal,24.8955833333333,-80.6166333333333,CalVal_S,01/10/14,01/10/14,11:15:00 AM,04:15:00 PM,0,2132.67,2426.71,8.02,461,3.2,NA,NA,36,22.6,0,NA,CalVal_S,Permanent,Single,2014-01-10,Inshore,UK
calval_jan2014,FLK,2014,CalVal,24.8964666666667,-80.6182,ADCP_S,01/10/14,01/10/14,11:21:00 AM,04:21:00 PM,0,2144.09,2438.77,8.027,454,3.25,NA,NA,36,22.5,0,NA,ADCP_S,Permanent,Single,2014-01-10,Inshore,UK
calval_jan2014,FLK,2014,CalVal,24.8982666666667,-80.6173833333333,CalVal_N,01/31/14,01/31/14,03:05:00 PM,08:05:00 PM,0,2033.27,2367.27,8.045,416.6,3.64,NA,NA,36.7,25.8,0,NA,CalVal_N,Permanent,Single,2014-01-31,Inshore,UK
calval_jan2014,FLK,2014,CalVal,24.8981833333333,-80.6160666666667,ADCP_NE,01/31/14,01/31/14,03:15:00 PM,08:15:00 PM,0,2041.27,2370.24,8.046,415.9,3.63,NA,NA,36.7,25.6,0,NA,ADCP_NE,Permanent,Single,2014-01-31,Inshore,UK
calval_jan2014,FLK,2014,CalVal,24.8966333333333,-80.6153,CalVal_SE,01/31/14,01/31/14,03:20:00 PM,08:20:00 PM,0,2030.72,2368.53,8.068,390.4,3.75,NA,NA,36.6,25.5,0,NA,CalVal_SE,Permanent,Single,2014-01-31,Inshore,UK
calval_jan2014,FLK,2014,CalVal,24.8955833333333,-80.6166333333333,CalVal_S,01/31/14,01/31/14,03:25:00 PM,08:25:00 PM,0,2045.12,2381.99,8.084,375.5,3.87,NA,NA,36.6,25.5,0,NA,CalVal_S,Permanent,Single,2014-01-31,Inshore,UK
calval_jan2014,FLK,2014,CalVal,24.8964666666667,-80.6182,ADCP_S,01/31/14,01/31/14,03:30:00 PM,08:30:00 PM,0,2031.28,2371.39,8.073,385.5,3.79,NA,NA,36.6,25.5,0,NA,ADCP_S,Permanent,Single,2014-01-31,Inshore,UK
calval_jan2014,FLK,2014,CalVal,24.9052,-80.6266,Transect 1,01/31/14,01/31/14,03:36:00 PM,08:36:00 PM,0,2027.52,2368.04,8.064,394.3,3.8,NA,NA,36.6,26.1,0,NA,Transect 1,Permanent,Single,2014-01-31,Inshore,UK
calval_jan2014,FLK,2014,CalVal,24.8854666666667,-80.6041,Transect 2,01/31/14,01/31/14,03:48:00 PM,08:48:00 PM,0,2029.71,2369.2,8.073,384.6,3.76,NA,NA,36.7,25.3,0,NA,Transect 2,Permanent,Single,2014-01-31,Mid channel,UK
calval_jan2014,FLK,2014,CalVal,24.8694,-80.585,Transect 3,01/31/14,01/31/14,04:00:00 PM,09:00:00 PM,0,2027.69,2369.3,8.076,381,3.79,NA,NA,36.7,25.3,0,NA,Transect 3,Permanent,Single,2014-01-31,Offshore,UK
calval_jan2014,FLK,2014,CalVal,24.8547,-80.5674166666667,Transect 4,01/31/14,01/31/14,04:12:00 PM,09:12:00 PM,0,2025.05,2368.62,8.076,381.1,3.82,NA,NA,36.6,25.6,0,NA,Transect 4,Permanent,Single,2014-01-31,Oceanic,UK
calval_feb2014,FLK,2014,CalVal,24.8982666666667,-80.6173833333333,CalVal_N,02/10/14,02/10/14,11:01:00 AM,04:01:00 PM,0,2037.25,2374.8,8.073,388.1,3.79,NA,NA,35.9,25.7,0,NA,CalVal_N,Permanent,Single,2014-02-10,Inshore,UK
calval_feb2014,FLK,2014,CalVal,24.8981833333333,-80.6160666666667,ADCP_NE,02/10/14,02/10/14,11:07:00 AM,04:07:00 PM,0,2029.85,2368.12,8.074,386.2,3.8,NA,NA,35.9,25.8,0,NA,ADCP_NE,Permanent,Single,2014-02-10,Inshore,UK
calval_feb2014,FLK,2014,CalVal,24.8966333333333,-80.6153,CalVal_SE,02/10/14,02/10/14,11:14:00 AM,04:14:00 PM,0,2031.05,2371.87,8.08,380.5,3.83,NA,NA,35.8,25.7,0,NA,CalVal_SE,Permanent,Single,2014-02-10,Inshore,UK
calval_feb2014,FLK,2014,CalVal,24.8955833333333,-80.6166333333333,CalVal_S,02/10/14,02/10/14,11:19:00 AM,04:19:00 PM,0,2030.77,2372.31,8.08,380.4,3.83,NA,NA,35.9,25.7,0,NA,CalVal_S,Permanent,Single,2014-02-10,Inshore,UK
calval_feb2014,FLK,2014,CalVal,24.8964666666667,-80.6182,ADCP_S,02/10/14,02/10/14,11:25:00 AM,04:25:00 PM,0,2038.56,2374.39,8.069,392.7,3.78,NA,NA,35.9,25.8,0,NA,ADCP_S,Permanent,Single,2014-02-10,Inshore,UK
calval_feb2014,FLK,2014,CalVal,24.8547,-80.5674166666667,Transect 4,02/24/14,02/24/14,09:35:00 AM,02:35:00 PM,0,2031.77,2376.32,8.077,383.5,3.86,NA,NA,36.1,26,0,NA,Transect 4,Permanent,Single,2014-02-24,Oceanic,UK
calval_feb2014,FLK,2014,CalVal,24.8694,-80.585,Transect 3,02/24/14,02/24/14,09:47:00 AM,02:47:00 PM,0,2043.44,2372.79,8.049,413.8,3.71,NA,NA,36.2,26.2,0,NA,Transect 3,Permanent,Single,2014-02-24,Offshore,UK
calval_feb2014,FLK,2014,CalVal,24.8854666666667,-80.6041,Transect 2,02/24/14,02/24/14,09:57:00 AM,02:57:00 PM,0,2034.65,2379.77,8.076,384.7,3.87,NA,NA,36.2,26,0,NA,Transect 2,Permanent,Single,2014-02-24,Mid channel,UK
calval_feb2014,FLK,2014,CalVal,24.9052,-80.6266,Transect 1,02/24/14,02/24/14,10:01:00 AM,03:01:00 PM,0,2046.63,2357.45,8.015,453.1,3.51,NA,NA,36.3,26.6,0,NA,Transect 1,Permanent,Single,2014-02-24,Inshore,UK
calval_feb2014,FLK,2014,CalVal,24.8964666666667,-80.6182,ADCP_S,02/24/14,02/24/14,10:12:00 AM,03:12:00 PM,0,2038.25,2382.67,8.076,385.9,3.87,NA,NA,36.1,26,0,NA,ADCP_S,Permanent,Single,2014-02-24,Inshore,UK
calval_feb2014,FLK,2014,CalVal,24.8955833333333,-80.6166333333333,CalVal_S,02/24/14,02/24/14,10:15:00 AM,03:15:00 PM,0,2031.67,2377.02,8.084,375.4,3.86,NA,NA,36.2,25.5,0,NA,CalVal_S,Permanent,Single,2014-02-24,Inshore,UK
calval_feb2014,FLK,2014,CalVal,24.8966333333333,-80.6153,CalVal_SE,02/24/14,02/24/14,10:20:00 AM,03:20:00 PM,0,2030.44,2377.89,8.074,386.5,3.9,NA,NA,36.2,26.4,0,NA,CalVal_SE,Permanent,Single,2014-02-24,Inshore,UK
calval_feb2014,FLK,2014,CalVal,24.8981833333333,-80.6160666666667,ADCP_NE,02/24/14,02/24/14,10:24:00 AM,03:24:00 PM,0,2031.32,2383.28,8.08,381.3,3.96,NA,NA,36.1,26.5,0,NA,ADCP_NE,Permanent,Single,2014-02-24,Inshore,UK
calval_feb2014,FLK,2014,CalVal,24.8982666666667,-80.6173833333333,CalVal_N,02/24/14,02/24/14,10:28:00 AM,03:28:00 PM,0,2035.93,2380.84,8.072,389.2,3.88,NA,NA,36.1,26.3,0,NA,CalVal_N,Permanent,Single,2014-02-24,Inshore,UK
calval_march2014,FLK,2014,CalVal,24.8982666666667,-80.6173833333333,CalVal_N,03/11/14,03/11/14,01:04:00 PM,05:04:00 PM,0,1998.04,2377.74,8.142,316.8,4.18,NA,NA,36.4,24.9,0,NA,CalVal_N,Permanent,Single,2014-03-11,Inshore,UK
calval_march2014,FLK,2014,CalVal,24.8981833333333,-80.6160666666667,ADCP_NE,03/11/14,03/11/14,01:10:00 PM,05:10:00 PM,0,1996.29,2377.29,8.14,318.4,4.2,NA,NA,36.5,25.1,0,NA,ADCP_NE,Permanent,Single,2014-03-11,Inshore,UK
calval_march2014,FLK,2014,CalVal,24.8966333333333,-80.6153,CalVal_SE,03/11/14,03/11/14,01:17:00 PM,05:17:00 PM,0,2010.75,2388.8,8.137,323.3,4.17,NA,NA,36.5,24.9,0,NA,CalVal_SE,Permanent,Single,2014-03-11,Inshore,UK
calval_march2014,FLK,2014,CalVal,24.8955833333333,-80.6166333333333,CalVal_S,03/11/14,03/11/14,01:22:00 PM,05:22:00 PM,0,2002.69,2379.77,8.135,323.2,4.16,NA,NA,36.5,25,0,NA,CalVal_S,Permanent,Single,2014-03-11,Inshore,UK
calval_march2014,FLK,2014,CalVal,24.8964666666667,-80.6182,ADCP_S,03/11/14,03/11/14,01:27:00 PM,05:27:00 PM,0,1994.7,2380.5,8.145,313.7,4.24,NA,NA,36.6,25.1,0,NA,ADCP_S,Permanent,Single,2014-03-11,Inshore,UK
calval_may2015,FLK,2014,CalVal,NA,NA,ADCP_S,05/23/14,05/23/14,11:19:00 AM,03:19:00 PM,0,1975.13,2366.38,8.291,316.6,4.31,NA,NA,37.6,26.8,0,NA,ADCP_S,Permanent,Single,2014-05-23,Inshore,UK
calval_may2015,FLK,2014,CalVal,NA,NA,CalVal_S,05/23/14,05/23/14,11:23:00 AM,03:23:00 PM,0,1979.59,2370.44,8.245,316.1,4.3,NA,NA,37.5,26.6,0,NA,CalVal_S,Permanent,Single,2014-05-23,Inshore,UK
calval_may2015,FLK,2014,CalVal,NA,NA,CalVal_SE,05/23/14,05/23/14,11:27:00 AM,03:27:00 PM,0,1978.33,2371.68,8.272,315.1,4.33,NA,NA,37.6,26.7,0,NA,CalVal_SE,Permanent,Single,2014-05-23,Inshore,UK
calval_may2015,FLK,2014,CalVal,24.8981833333333,-80.6160666666667,ADCP_NE,05/23/14,05/23/14,11:33:00 AM,03:33:00 PM,0,1976.9,2369.51,8.244,320.3,4.33,NA,NA,37.6,27.1,0,NA,ADCP_NE,Permanent,Single,2014-05-23,Inshore,UK
calval_may2015,FLK,2014,CalVal,24.9052,-80.6266,Transect 1,05/23/14,05/23/14,11:58:00 AM,03:58:00 PM,0,1885.73,2298.95,8.299,277.5,4.47,NA,NA,38.1,27.2,0,NA,Transect 1,Permanent,Single,2014-05-23,Inshore,UK
calval_may2015,FLK,2014,CalVal,24.8854666666667,-80.6041,Transect 2,05/23/14,05/23/14,12:06:00 PM,04:06:00 PM,0,1990.62,2381.51,8.259,323.7,4.33,NA,NA,37.5,27,0,NA,Transect 2,Permanent,Single,2014-05-23,Mid channel,UK
calval_may2015,FLK,2014,CalVal,24.8694,-80.585,Transect 3,05/23/14,05/23/14,12:13:00 PM,04:13:00 PM,0,2033.54,2386.03,8.198,385.1,3.96,NA,NA,37.2,27.3,0,NA,Transect 3,Permanent,Single,2014-05-23,Offshore,UK
calval_may2015,FLK,2014,CalVal,24.8547,-80.56742,Transect 4,05/23/14,05/23/14,12:21:00 PM,04:21:00 PM,0,2035.18,2383.21,8.188,397,3.92,NA,NA,37.1,27.6,0,NA,Transect 4,Permanent,Single,2014-05-23,Oceanic,UK
calval_jun2014,FLK,2014,CalVal,24.8982666666667,-80.6173833333333,CalVal_N,06/12/14,06/12/14,02:37:00 PM,06:37:00 PM,0,1923.18,2301.58,8.268,374.2,4.19,37.7,NA,NA,30.7,0,NA,CalVal_N,Permanent,Single,2014-06-12,Inshore,UK
calval_jun2014,FLK,2014,CalVal,24.8981833333333,-80.6160666666667,ADCP_NE,06/12/14,06/12/14,02:43:00 PM,06:43:00 PM,0,1933.87,2306.38,8.266,383.1,4.13,37.6,NA,NA,30.6,0,NA,ADCP_NE,Permanent,Single,2014-06-12,Inshore,UK
calval_jun2014,FLK,2014,CalVal,24.8966333333333,-80.6153,CalVal_SE,06/12/14,06/12/14,02:50:00 PM,06:50:00 PM,0,1931.17,2313.94,8.265,367.7,4.24,37.6,NA,NA,30.5,0,NA,CalVal_SE,Permanent,Single,2014-06-12,Inshore,UK
calval_jun2014,FLK,2014,CalVal,24.8955833333333,-80.6166333333333,CalVal_S,06/12/14,06/12/14,02:56:00 PM,06:56:00 PM,0,1939.64,2314.48,8.25,381.8,4.15,37.7,NA,NA,30.5,0,NA,CalVal_S,Permanent,Single,2014-06-12,Inshore,UK
calval_jun2014,FLK,2014,CalVal,24.8964666666667,-80.6182,ADCP_S,06/12/14,06/12/14,03:01:00 PM,07:01:00 PM,0,1933.52,2295.69,8.221,400.5,4.01,37.8,NA,NA,30.7,0,NA,ADCP_S,Permanent,Single,2014-06-12,Inshore,UK
calval_jun2014,FLK,2014,CalVal,24.9052,-80.6266,Transect 1,06/12/14,06/12/14,03:08:00 PM,07:08:00 PM,0,1825.42,2223.65,8.294,327.3,4.31,38.1,NA,NA,31.2,0,NA,Transect 1,Permanent,Single,2014-06-12,Inshore,UK
calval_jun2014,FLK,2014,CalVal,24.8854666666667,-80.6041,Transect 2,06/12/14,06/12/14,03:18:00 PM,07:18:00 PM,0,1960.62,2375.94,8.297,334.3,4.62,37.4,NA,NA,30.2,0,NA,Transect 2,Permanent,Single,2014-06-12,Mid channel,UK
calval_jun2014,FLK,2014,CalVal,24.8694,-80.585,Transect 3,06/12/14,06/12/14,03:30:00 PM,07:30:00 PM,0,2026.86,2388.62,8.225,398.8,4.06,37.1,NA,NA,28.8,0,NA,Transect 3,Permanent,Single,2014-06-12,Offshore,UK
calval_jun2014,FLK,2014,CalVal,24.8547,-80.5674166666667,Transect 4,06/12/14,06/12/14,03:41:00 PM,07:41:00 PM,0,2018.58,2356.9,8.185,421.4,3.79,37.1,NA,NA,28.3,0,NA,Transect 4,Permanent,Single,2014-06-12,Oceanic,UK
calval_jun2014,FLK,2014,CalVal,24.8982666666667,-80.6173833333333,CalVal_N,06/28/14,06/28/14,01:50:00 PM,05:50:00 PM,0,1981.03,2334.68,8.257,425.6,4.02,36.7,NA,NA,31.1,0,NA,CalVal_N,Permanent,Single,2014-06-28,Inshore,UK
calval_jun2014,FLK,2014,CalVal,24.8981833333333,-80.6160666666667,ADCP_NE,06/28/14,06/28/14,02:06:00 PM,06:06:00 PM,0,1972.93,2339.85,8.292,402.4,4.17,36.6,NA,NA,31.1,0,NA,ADCP_NE,Permanent,Single,2014-06-28,Inshore,UK
calval_jun2014,FLK,2014,CalVal,24.8966333333333,-80.6153,CalVal_SE,06/28/14,06/28/14,02:12:00 PM,06:12:00 PM,0,1974.59,2341.93,8.29,402.4,4.18,36.6,NA,NA,31.1,0,NA,CalVal_SE,Permanent,Single,2014-06-28,Inshore,UK
calval_jun2014,FLK,2014,CalVal,24.8955833333333,-80.6166333333333,CalVal_S,06/28/14,06/28/14,02:25:00 PM,06:25:00 PM,0,1974.97,2336.54,8.265,407.4,4.13,36.3,NA,NA,31.1,0,NA,CalVal_S,Permanent,Single,2014-06-28,Inshore,UK
calval_jun2014,FLK,2014,CalVal,24.8964666666667,-80.6182,ADCP_S,06/28/14,06/28/14,02:29:00 PM,06:29:00 PM,0,1971.65,2330.31,8.277,417.8,4.08,36.7,NA,NA,31.3,0,NA,ADCP_S,Permanent,Single,2014-06-28,Inshore,UK
calval_jul2014,FLK,2014,CalVal,24.8547,-80.5674166666667,Transect 4,07/09/14,07/09/14,01:40:00 PM,05:40:00 PM,0,2042.97,2392.47,8.014,440.9,4.02,36.6,NA,NA,30.4,0,NA,Transect 4,Permanent,Single,2014-07-09,Oceanic,UK
calval_jul2014,FLK,2014,CalVal,24.8694,-80.585,Transect 3,07/09/14,07/09/14,01:47:00 PM,05:47:00 PM,0,2041.91,2379.88,8.002,454.1,3.89,36.7,NA,NA,30.2,0,NA,Transect 3,Permanent,Single,2014-07-09,Offshore,UK
calval_jul2014,FLK,2014,CalVal,24.8854666666667,-80.6041,Transect 2,07/09/14,07/09/14,01:56:00 PM,05:56:00 PM,0,1973.7,2362.05,8.059,377.7,4.37,37.2,NA,NA,30.9,0,NA,Transect 2,Permanent,Single,2014-07-09,Mid channel,UK
calval_jul2014,FLK,2014,CalVal,24.9052,-80.6266,Transect 1,07/09/14,07/09/14,02:05:00 PM,06:05:00 PM,0,1898.65,2302.12,8.071,350.8,4.47,37.7,NA,NA,31.8,0,NA,Transect 1,Permanent,Single,2014-07-09,Inshore,UK
calval_jul2014,FLK,2014,CalVal,24.8982666666667,-80.6173833333333,CalVal_N,07/09/14,07/09/14,02:19:00 PM,06:19:00 PM,0,1927.13,2330.08,8.075,352.5,4.49,37.5,NA,NA,31.3,0,NA,CalVal_N,Permanent,Single,2014-07-09,Inshore,UK
calval_jul2014,FLK,2014,CalVal,24.8981833333333,-80.6160666666667,ADCP_NE,07/09/14,07/09/14,02:24:00 PM,06:24:00 PM,0,1928.02,2328.34,8.072,356.3,4.47,37.4,NA,NA,31.4,0,NA,ADCP_NE,Permanent,Single,2014-07-09,Inshore,UK
calval_jul2014,FLK,2014,CalVal,24.8966333333333,-80.6153,CalVal_SE,07/09/14,07/09/14,02:29:00 PM,06:29:00 PM,0,1932.96,2329.94,8.067,361.5,4.42,37.5,NA,NA,31.3,0,NA,CalVal_SE,Permanent,Single,2014-07-09,Inshore,UK
calval_jul2014,FLK,2014,CalVal,24.8955833333333,-80.6166333333333,CalVal_S,07/09/14,07/09/14,02:34:00 PM,06:34:00 PM,0,1946.14,2336.61,8.058,372.6,4.36,37.5,NA,NA,31.2,0,NA,CalVal_S,Permanent,Single,2014-07-09,Inshore,UK
calval_jul2014,FLK,2014,CalVal,24.8964666666667,-80.6182,ADCP_S,07/09/14,07/09/14,02:39:00 PM,06:39:00 PM,0,1940.91,2328.33,8.053,376,4.32,37.5,NA,NA,31.3,0,NA,ADCP_S,Permanent,Single,2014-07-09,Inshore,UK
calval_jul2014,FLK,2014,CalVal,24.8982666666667,-80.6173833333333,CalVal_N,07/31/14,07/31/14,02:25:00 PM,06:25:00 PM,0,1865.75,2248.8,8.032,381.2,4.21,38.2,NA,NA,32.7,0,NA,CalVal_N,Permanent,Single,2014-07-31,Inshore,UK
calval_jul2014,FLK,2014,CalVal,24.8981833333333,-80.6160666666667,ADCP_NE,07/31/14,07/31/14,02:29:00 PM,06:29:00 PM,0,1870.46,2249.83,8.029,385.3,4.18,38.1,NA,NA,32.6,0,NA,ADCP_NE,Permanent,Single,2014-07-31,Inshore,UK
calval_jul2014,FLK,2014,CalVal,24.8966333333333,-80.6153,CalVal_SE,07/31/14,07/31/14,02:35:00 PM,06:35:00 PM,0,1869.97,2249.68,8.027,387.2,4.18,38.2,NA,NA,32.7,0,NA,CalVal_SE,Permanent,Single,2014-07-31,Inshore,UK
calval_jul2014,FLK,2014,CalVal,24.8955833333333,-80.6166333333333,CalVal_S,07/31/14,07/31/14,02:40:00 PM,06:40:00 PM,0,1866.83,2242.05,8.021,392.4,4.14,38.1,NA,NA,32.8,0,NA,CalVal_S,Permanent,Single,2014-07-31,Inshore,UK
calval_jul2014,FLK,2014,CalVal,24.8964666666667,-80.6182,ADCP_S,07/31/14,07/31/14,02:45:00 PM,06:45:00 PM,0,1860.29,2243.97,8.034,378.4,4.22,38.2,NA,NA,32.7,0,NA,ADCP_S,Permanent,Single,2014-07-31,Inshore,UK
calval_aug2014,FLK,2014,CalVal,24.8982666666667,-80.6173833333333,CalVal_N,08/14/14,08/14/14,11:10:00 AM,03:10:00 PM,0,1927.68,2308.93,8.066,364.7,4.34,35.7,NA,NA,31.4,0,NA,CalVal_N,Permanent,Single,2014-08-14,Inshore,UK
calval_aug2014,FLK,2014,CalVal,24.8981833333333,-80.6160666666667,ADCP_NE,08/14/14,08/14/14,11:14:00 AM,03:14:00 PM,0,1919.65,2311.83,8.078,351.7,4.45,35.9,NA,NA,31.5,0,NA,ADCP_NE,Permanent,Single,2014-08-14,Inshore,UK
calval_aug2014,FLK,2014,CalVal,24.8966333333333,-80.6153,CalVal_SE,08/14/14,08/14/14,11:18:00 AM,03:18:00 PM,0,1917.37,2309.02,8.081,348.6,4.46,35.8,NA,NA,31.5,0,NA,CalVal_SE,Permanent,Single,2014-08-14,Inshore,UK
calval_aug2014,FLK,2014,CalVal,24.8955833333333,-80.6166333333333,CalVal_S,08/14/14,08/14/14,11:22:00 AM,03:22:00 PM,0,1916.34,2313.73,8.085,344.5,4.52,35.7,NA,NA,31.6,0,NA,CalVal_S,Permanent,Single,2014-08-14,Inshore,UK
calval_aug2014,FLK,2014,CalVal,24.8964666666667,-80.6182,ADCP_S,08/14/14,08/14/14,11:26:00 AM,03:26:00 PM,0,1911.32,2311.53,8.088,341,4.55,35.7,NA,NA,31.7,0,NA,ADCP_S,Permanent,Single,2014-08-14,Inshore,UK
calval_aug2014,FLK,2014,CalVal,24.9052,-80.6266,Transect 1,08/14/14,08/14/14,11:30:00 AM,03:30:00 PM,0,1931.37,2293.03,8.023,407.2,4.1,36.5,NA,NA,31.9,0,NA,Transect 1,Permanent,Single,2014-08-14,Inshore,UK
calval_aug2014,FLK,2014,CalVal,24.8854666666667,-80.6041,Transect 2,08/14/14,08/14/14,11:35:00 AM,03:35:00 PM,0,1931.46,2317.95,8.069,362.4,4.41,35.7,NA,NA,31.6,0,NA,Transect 2,Permanent,Single,2014-08-14,Mid channel,UK
calval_aug2014,FLK,2014,CalVal,24.8694,-80.585,Transect 3,08/14/14,08/14/14,11:41:00 AM,03:41:00 PM,0,1883.53,2245.8,8.058,365.3,4.14,34.9,NA,NA,31.4,0,NA,Transect 3,Permanent,Single,2014-08-14,Offshore,UK
calval_aug2014,FLK,2014,CalVal,24.8547,-80.5674166666667,Transect 4,08/14/14,08/14/14,11:50:00 AM,03:50:00 PM,0,1892.7,2254.06,8.064,363.3,4.17,34.4,NA,NA,31.4,0,NA,Transect 4,Permanent,Single,2014-08-14,Oceanic,UK
calval_aug2014,FLK,2014,CalVal,24.8982666666667,-80.6173833333333,CalVal_N,08/28/14,08/28/14,05:17:00 PM,09:17:00 PM,0,1936.42,2333.05,8.121,322.2,4.67,33.2,NA,NA,31.1,0,NA,CalVal_N,Permanent,Single,2014-08-28,Inshore,UK
calval_aug2014,FLK,2014,CalVal,24.8981833333333,-80.6160666666667,ADCP_NE,08/28/14,08/28/14,05:22:00 PM,09:22:00 PM,0,1960.35,2332.8,8.087,357.2,4.41,33.2,NA,NA,31.1,0,NA,ADCP_NE,Permanent,Single,2014-08-28,Inshore,UK
calval_aug2014,FLK,2014,CalVal,24.8966333333333,-80.6153,CalVal_SE,08/28/14,08/28/14,05:29:00 PM,09:29:00 PM,0,1960.57,2336.11,8.095,350,4.44,33,NA,NA,30.9,0,NA,CalVal_SE,Permanent,Single,2014-08-28,Inshore,UK
calval_aug2014,FLK,2014,CalVal,24.8955833333333,-80.6166333333333,CalVal_S,08/28/14,08/28/14,05:34:00 PM,09:34:00 PM,0,1967.31,2334.71,8.082,363.7,4.36,33.1,NA,NA,31,0,NA,CalVal_S,Permanent,Single,2014-08-28,Inshore,UK
calval_aug2014,FLK,2014,CalVal,24.8964666666667,-80.6182,ADCP_S,08/28/14,08/28/14,05:39:00 PM,09:39:00 PM,0,1947.37,2337.51,8.114,330.8,4.6,33.1,NA,NA,31,0,NA,ADCP_S,Permanent,Single,2014-08-28,Inshore,UK
calval_sep2015,FLK,2014,CalVal,24.8982666666667,-80.6173833333333,CalVal_N,09/05/14,09/05/14,03:33:00 PM,07:33:00 PM,0,2023.03,2384.32,8.054,398.9,4.26,33.8,NA,NA,30.8,0,NA,CalVal_N,Permanent,Single,2014-09-05,Inshore,UK
calval_sep2015,FLK,2014,CalVal,24.8981833333333,-80.6160666666667,ADCP_NE,09/05/14,09/05/14,03:39:00 PM,07:39:00 PM,0,2010.75,2377.27,8.064,386.2,4.31,33.8,NA,NA,30.7,0,NA,ADCP_NE,Permanent,Single,2014-09-05,Inshore,UK
calval_sep2015,FLK,2014,CalVal,24.8966333333333,-80.6153,CalVal_SE,09/05/14,09/05/14,03:45:00 PM,07:45:00 PM,0,2011.98,2378.19,8.062,388.4,4.31,33.9,NA,NA,30.8,0,NA,CalVal_SE,Permanent,Single,2014-09-05,Inshore,UK
calval_sep2015,FLK,2014,CalVal,24.8955833333333,-80.6166333333333,CalVal_S,09/05/14,09/05/14,03:50:00 PM,07:50:00 PM,0,2013,2376.88,8.06,390.2,4.28,33.9,NA,NA,30.7,0,NA,CalVal_S,Permanent,Single,2014-09-05,Inshore,UK
calval_sep2015,FLK,2014,CalVal,24.8964666666667,-80.6182,ADCP_S,09/05/14,09/05/14,03:54:00 PM,07:54:00 PM,0,2025.62,2380.71,8.045,408.5,4.19,33.8,NA,NA,30.8,0,NA,ADCP_S,Permanent,Single,2014-09-05,Inshore,UK
calval_sep2022,FLK,2014,CalVal,24.8547,-80.5674166666667,Transect 4,09/24/14,09/24/14,02:07:00 PM,06:07:00 PM,0,2044.34,2357.73,8.273,366.222,3.609,33.448,NA,33.4,29.1,0,NA,Transect 4,Permanent,Single,2014-09-24,Oceanic,UK
calval_sep2021,FLK,2014,CalVal,24.8694,-80.585,Transect 3,09/24/14,09/24/14,02:16:00 PM,06:16:00 PM,0,2045.31,2356.11,8.241,367.632,3.592,33.19,NA,33.2,29.1,0,NA,Transect 3,Permanent,Single,2014-09-24,Offshore,UK
calval_sep2020,FLK,2014,CalVal,24.8854666666667,-80.6041,Transect 2,09/24/14,09/24/14,02:25:00 PM,06:25:00 PM,0,2049.15,2346.15,8.242,393.812,3.447,33.189,NA,33.2,29.1,0,NA,Transect 2,Permanent,Single,2014-09-24,Mid channel,UK
calval_sep2016,FLK,2014,CalVal,24.8982666666667,-80.6173833333333,CalVal_N,09/24/14,09/24/14,02:40:00 PM,06:40:00 PM,0,2048.53,2345.79,8.218,387.781,3.438,33.271,NA,33.2,29.1,0,NA,CalVal_N,Permanent,Single,2014-09-24,Inshore,UK
calval_sep2014,FLK,2014,CalVal,24.8981833333333,-80.6160666666667,ADCP_NE,09/24/14,09/24/14,02:46:00 PM,06:46:00 PM,0,2046.53,2342.69,8.191,387.456,3.446,32.843,NA,33.2,29.1,0,NA,ADCP_NE,Permanent,Single,2014-09-24,Inshore,UK
calval_sep2018,FLK,2014,CalVal,24.8966333333333,-80.6153,CalVal_SE,09/24/14,09/24/14,02:51:00 PM,06:51:00 PM,0,1999.79,2341.66,8.182,322.357,3.923,33.242,NA,33.2,29.1,0,NA,CalVal_SE,Permanent,Single,2014-09-24,Inshore,UK
calval_sep2017,FLK,2014,CalVal,24.8955833333333,-80.6166333333333,CalVal_S,09/24/14,09/24/14,03:00:00 PM,07:00:00 PM,0,2018.39,2343.51,8.185,341.173,3.747,33.025,NA,33.3,29.1,0,NA,CalVal_S,Permanent,Single,2014-09-24,Inshore,UK
calval_sep2015,FLK,2014,CalVal,24.8964666666667,-80.6182,ADCP_S,09/24/14,09/24/14,03:04:00 PM,07:04:00 PM,0,2027.11,2340.97,8.191,361.169,3.616,33.271,NA,33.3,29.1,0,NA,ADCP_S,Permanent,Single,2014-09-24,Inshore,UK
calval_sep2019,FLK,2014,CalVal,24.9052,-80.6266,Transect 1,09/24/14,09/24/14,03:09:00 PM,07:09:00 PM,0,2008.77,2311.43,8.224,374.076,3.493,33.137,NA,33.1,29.1,0,NA,Transect 1,Permanent,Single,2014-09-24,Inshore,UK
calval_oct2015,FLK,2014,CalVal,24.8964666666667,-80.6182,ADCP_S,10/22/14,10/22/14,01:56:00 PM,05:56:00 PM,0,2063.89,2369.24,8.224,409.769,3.492,34.823,NA,34.3,26.8,0,NA,ADCP_S,Permanent,Single,2014-10-22,Inshore,UK
calval_oct2017,FLK,2014,CalVal,24.8955833333333,-80.6166333333333,CalVal_S,10/22/14,10/22/14,02:03:00 PM,06:03:00 PM,0,2095.41,2367.16,8.23,477.85,3.146,34.746,NA,34.3,26.7,0,NA,CalVal_S,Permanent,Single,2014-10-22,Inshore,UK
calval_oct2018,FLK,2014,CalVal,24.8966333333333,-80.6153,CalVal_SE,10/22/14,10/22/14,02:08:00 PM,06:08:00 PM,0,2066.64,2373.92,8.217,411.284,3.517,34.847,NA,34.2,26.9,0,NA,CalVal_SE,Permanent,Single,2014-10-22,Inshore,UK
calval_oct2014,FLK,2014,CalVal,24.8981833333333,-80.6160666666667,ADCP_NE,10/22/14,10/22/14,02:15:00 PM,06:15:00 PM,0,2059.02,2373.72,8.212,386.247,3.579,34.843,NA,34.2,26.9,0,NA,ADCP_NE,Permanent,Single,2014-10-22,Inshore,UK
calval_oct2016,FLK,2014,CalVal,24.8982666666667,-80.6173833333333,CalVal_N,10/22/14,10/22/14,02:19:00 PM,06:19:00 PM,0,2066.15,2369.78,8.221,409.455,3.472,34.77,NA,34.2,26.9,0,NA,CalVal_N,Permanent,Single,2014-10-22,Inshore,UK
calval_oct2021,FLK,2014,CalVal,24.8982666666667,-80.6173833333333,CalVal_N,10/29/14,10/29/14,11:58:00 AM,03:58:00 PM,0,2088.48,2363.86,8.188,469.194,3.201,34.377,NA,33.6,25.9,0,NA,CalVal_N,Permanent,Single,2014-10-29,Inshore,UK
calval_oct2019,FLK,2014,CalVal,24.8981833333333,-80.6160666666667,ADCP_NE,10/29/14,10/29/14,12:03:00 PM,04:03:00 PM,0,2106.5,2360.02,8.19,516.493,2.973,34.308,NA,33.6,25.8,0,NA,ADCP_NE,Permanent,Single,2014-10-29,Inshore,UK
calval_oct2023,FLK,2014,CalVal,24.8966333333333,-80.6153,CalVal_SE,10/29/14,10/29/14,12:09:00 PM,04:09:00 PM,0,2110.72,2361.27,8.177,517.699,2.934,34.387,NA,33.7,25.8,0,NA,CalVal_SE,Permanent,Single,2014-10-29,Inshore,UK
calval_oct2022,FLK,2014,CalVal,24.8955833333333,-80.6166333333333,CalVal_S,10/29/14,10/29/14,12:13:00 PM,04:13:00 PM,0,2084.28,2367.53,8.187,454.68,3.287,34.369,NA,33.7,25.7,0,NA,CalVal_S,Permanent,Single,2014-10-29,Inshore,UK
calval_oct2020,FLK,2014,CalVal,24.8964666666667,-80.6182,ADCP_S,10/29/14,10/29/14,12:18:00 PM,04:18:00 PM,0,2076.63,2353.71,8.157,461.174,3.213,34.363,NA,33.6,25.7,0,NA,ADCP_S,Permanent,Single,2014-10-29,Inshore,UK
calval_oct2024,FLK,2014,CalVal,24.9052,-80.6266,Transect 1,10/29/14,10/29/14,12:24:00 PM,04:24:00 PM,0,2040.93,2307,8.157,461.106,3.087,33.943,NA,33.3,25.7,0,NA,Transect 1,Permanent,Single,2014-10-29,Inshore,UK
calval_oct2025,FLK,2014,CalVal,24.8854666666667,-80.6041,Transect 2,10/29/14,10/29/14,12:34:00 PM,04:34:00 PM,0,2104.5,2380.61,8.177,477.881,3.207,34.681,NA,34,25.7,0,NA,Transect 2,Permanent,Single,2014-10-29,Mid channel,UK
calval_oct2026,FLK,2014,CalVal,24.8694,-80.585,Transect 3,10/29/14,10/29/14,12:45:00 PM,04:45:00 PM,0,2045.61,2367.27,8.252,385.354,3.65,35.129,NA,34.3,27.2,0,NA,Transect 3,Permanent,Single,2014-10-29,Offshore,UK
calval_oct2027,FLK,2014,CalVal,24.8547,-80.5674166666667,Transect 4,10/29/14,10/29/14,12:54:00 PM,04:54:00 PM,0,2025.85,2366.78,8.258,351.249,3.866,34.812,NA,34.3,27.4,0,NA,Transect 4,Permanent,Single,2014-10-29,Oceanic,UK
calval_Nov2014,FLK,2014,CalVal,24.8964666666667,-80.6182,ADCP_S,11/07/14,11/07/14,01:27:00 PM,06:27:00 PM,0,2135.85,2413.6,8.179,482.665,3.225,34.928,NA,34.5,24,0,NA,ADCP_S,Permanent,Single,2014-11-07,Inshore,UK
calval_Nov2014,FLK,2014,CalVal,24.8955833333333,-80.6166333333333,CalVal_S,11/07/14,11/07/14,01:34:00 PM,06:34:00 PM,0,2136.14,2410.41,8.182,478.874,3.173,34.996,NA,34.6,23.7,0,NA,CalVal_S,Permanent,Single,2014-11-07,Inshore,UK
calval_Nov2014,FLK,2014,CalVal,24.8966333333333,-80.6153,CalVal_SE,11/07/14,11/07/14,01:41:00 PM,06:41:00 PM,0,2149.78,2406.29,8.188,523.148,2.991,35.009,NA,34.6,23.9,0,NA,CalVal_SE,Permanent,Single,2014-11-07,Inshore,UK
calval_Nov2014,FLK,2014,CalVal,24.8981833333333,-80.6160666666667,ADCP_NE,11/07/14,11/07/14,01:46:00 PM,06:46:00 PM,0,2169.33,2417.02,8.161,546.549,2.913,34.809,NA,34.5,23.9,0,NA,ADCP_NE,Permanent,Single,2014-11-07,Inshore,UK
calval_Nov2014,FLK,2014,CalVal,24.8982666666667,-80.6173833333333,CalVal_N,11/07/14,11/07/14,01:51:00 PM,06:51:00 PM,0,2130.51,2417.85,8.158,456.063,3.323,34.839,NA,34.5,24.1,0,NA,CalVal_N,Permanent,Single,2014-11-07,Inshore,UK
calval_Nov2014,FLK,2014,CalVal,24.9052,-80.6266,Transect 1,11/07/14,11/07/14,01:57:00 PM,06:57:00 PM,0,2114.29,2412.79,8.205,429.729,3.439,34.743,NA,34.4,24,0,NA,Transect 1,Permanent,Single,2014-11-07,Inshore,UK
calval_Nov2014,FLK,2014,CalVal,24.8854666666667,-80.6041,Transect 2,11/07/14,11/07/14,02:13:00 PM,07:13:00 PM,0,2053.87,2395.65,8.221,363.918,3.851,35.607,NA,35.1,24.8,0,NA,Transect 2,Permanent,Single,2014-11-07,Mid channel,UK
calval_Nov2014,FLK,2014,CalVal,24.8694,-80.585,Transect 3,11/07/14,11/07/14,02:20:00 PM,07:20:00 PM,0,2037.4,2385.84,8.231,345.191,3.902,35.67,NA,35.2,25.9,0,NA,Transect 3,Permanent,Single,2014-11-07,Offshore,UK
calval_Nov2014,FLK,2014,CalVal,24.8547,-80.5674166666667,Transect 4,11/07/14,11/07/14,02:30:00 PM,07:30:00 PM,0,2040.06,2382.21,8.236,357.593,3.825,35.915,NA,35.4,26.4,0,NA,Transect 4,Permanent,Single,2014-11-07,Oceanic,UK
calval_Nov2014,FLK,2014,CalVal,24.8982666666667,-80.6173833333333,CalVal_N,11/25/14,11/25/14,09:53:00 AM,02:53:00 PM,0,2268.46,2495.71,8.025,659.69,2.751,34.976,NA,34.7,25.1,0,NA,CalVal_N,Permanent,Single,2014-11-25,Inshore,UK
calval_Nov2014,FLK,2014,CalVal,24.8981833333333,-80.6160666666667,ADCP_NE,11/25/14,11/25/14,09:58:00 AM,02:58:00 PM,0,2244.53,2484.73,8.06,616.016,2.876,35.041,NA,34.7,25,0,NA,ADCP_NE,Permanent,Single,2014-11-25,Inshore,UK
calval_Nov2014,FLK,2014,CalVal,24.8966333333333,-80.6153,CalVal_SE,11/25/14,11/25/14,10:04:00 AM,03:04:00 PM,0,2195.78,2463.38,8.088,530.297,3.133,35.273,NA,34.9,25.2,0,NA,CalVal_SE,Permanent,Single,2014-11-25,Inshore,UK
calval_Nov2014,FLK,2014,CalVal,24.8955833333333,-80.6166333333333,CalVal_S,11/25/14,11/25/14,10:12:00 AM,03:12:00 PM,0,2214.8,2474.52,8.081,556.848,3.064,35.187,NA,34.8,25.1,0,NA,CalVal_S,Permanent,Single,2014-11-25,Inshore,UK
calval_Nov2014,FLK,2014,CalVal,24.8964666666667,-80.6182,ADCP_S,11/25/14,11/25/14,10:16:00 AM,03:16:00 PM,0,2253.91,2485.29,8.042,639.548,2.783,35.049,NA,34.7,24.9,0,NA,ADCP_S,Permanent,Single,2014-11-25,Inshore,UK
calval_Dec2014,FLK,2014,CalVal,24.8982666666667,-80.6173833333333,CalVal_N,12/11/14,12/11/14,10:53:00 AM,03:53:00 PM,0,2073.8,2401.46,8.185,400.025,3.692,36.14,NA,35.2,21.5,0,NA,CalVal_N,Permanent,Single,2014-12-11,Inshore,UK
calval_Dec2014,FLK,2014,CalVal,24.8981833333333,-80.6160666666667,ADCP_NE,12/11/14,12/11/14,11:00:00 AM,04:00:00 PM,0,2078.54,2406.96,8.178,398.015,3.696,36.199,NA,35.2,21.8,0,NA,ADCP_NE,Permanent,Single,2014-12-11,Inshore,UK
calval_Dec2014,FLK,2014,CalVal,24.8966333333333,-80.6153,CalVal_SE,12/11/14,12/11/14,11:05:00 AM,04:05:00 PM,0,2067.77,2399.55,8.189,389.733,3.724,36.223,NA,35.2,21.9,0,NA,CalVal_SE,Permanent,Single,2014-12-11,Inshore,UK
calval_Dec2014,FLK,2014,CalVal,24.8955833333333,-80.6166333333333,CalVal_S,12/11/14,12/11/14,11:10:00 AM,04:10:00 PM,0,2088.6,2396.23,8.176,433.252,3.479,36.165,NA,35.2,21.9,0,NA,CalVal_S,Permanent,Single,2014-12-11,Inshore,UK
calval_Dec2014,FLK,2014,CalVal,24.8964666666667,-80.6182,ADCP_S,12/11/14,12/11/14,11:14:00 AM,04:14:00 PM,0,2058.43,2397.23,8.184,364.976,3.787,36.066,NA,35.1,21.6,0,NA,ADCP_S,Permanent,Single,2014-12-11,Inshore,UK
calval_Dec2014,FLK,2014,CalVal,24.9052,-80.6266,Transect 1,12/11/14,12/11/14,11:20:00 AM,04:20:00 PM,0,2202.89,2521.97,8.128,440.152,3.67,35.796,NA,35,20.2,0,NA,Transect 1,Permanent,Single,2014-12-11,Inshore,UK
calval_Dec2014,FLK,2014,CalVal,24.8854666666667,-80.6041,Transect 2,12/11/14,12/11/14,11:28:00 AM,04:28:00 PM,0,2056.76,2404.15,8.191,355.516,3.868,36.285,NA,35,22.2,0,NA,Transect 2,Permanent,Single,2014-12-11,Mid channel,UK
calval_Dec2014,FLK,2014,CalVal,24.8694,-80.585,Transect 3,12/11/14,12/11/14,11:36:00 AM,04:36:00 PM,0,2056.52,2389.75,8.185,379.805,3.724,36.273,NA,35,24.2,0,NA,Transect 3,Permanent,Single,2014-12-11,Offshore,UK
calval_Dec2014,FLK,2014,CalVal,24.8547,-80.5674166666667,Transect 4,12/11/14,12/11/14,11:42:00 AM,04:42:00 PM,0,2047.17,2382.85,8.189,372.757,3.748,36.214,NA,35.1,24.2,0,NA,Transect 4,Permanent,Single,2014-12-11,Oceanic,UK
CalVal_Jan2015_1,FLK,2015,CalVal,24.8977,-80.61817,MapCO2_Buoy,01/06/15,01/06/15,10:20:00 AM,03:20:00 PM,0,2098.94,2401.75,8.007,456.986,3.433,36.413,NA,NA,25.7,0,NA,MapCO2_Buoy,Permanent,Single,2015-01-06,Inshore,UK
CalVal_Jan2015_2,FLK,2015,CalVal,24.8977,-80.61817,MapCO2_Buoy,01/06/15,01/06/15,10:20:00 AM,03:20:00 PM,0,2104.3,2400.23,7.995,471.537,3.361,36.433,NA,NA,25.7,0,NA,MapCO2_Buoy,Permanent,Single,2015-01-06,Inshore,UK
CalVal_Jan2015_3,FLK,2015,CalVal,24.8982666666667,-80.6173833333333,CalVal_N,01/06/15,01/06/15,11:11:00 AM,04:11:00 PM,0,2112.08,2401.29,7.987,483.325,3.29,36.435,NA,NA,25.5,0,NA,CalVal_N,Permanent,Single,2015-01-06,Inshore,UK
CalVal_Jan2015_4,FLK,2015,CalVal,24.8981833333333,-80.6160666666667,ADCP_NE,01/06/15,01/06/15,11:16:00 AM,04:16:00 PM,0,2118.33,2402.85,7.98,492.714,3.242,36.419,NA,NA,25.4,0,NA,ADCP_NE,Permanent,Single,2015-01-06,Inshore,UK
CalVal_Jan2015_5,FLK,2015,CalVal,24.8966333333333,-80.6153,CalVal_SE,01/06/15,01/06/15,11:21:00 AM,04:21:00 PM,0,2111.88,2401.59,7.989,480.163,3.294,36.414,NA,NA,25.4,0,NA,CalVal_SE,Permanent,Single,2015-01-06,Inshore,UK
CalVal_Jan2015_6,FLK,2015,CalVal,24.8955833333333,-80.6166333333333,CalVal_S,01/06/15,01/06/15,11:26:00 AM,04:26:00 PM,0,2106.97,2402.73,7.999,467.07,3.356,36.412,NA,NA,25.4,0,NA,CalVal_S,Permanent,Single,2015-01-06,Inshore,UK
CalVal_Jan2015_7,FLK,2015,CalVal,24.8964666666667,-80.6182,ADCP_S,01/06/15,01/06/15,12:32:00 PM,05:32:00 PM,0,2103.63,2399.73,7.999,467.073,3.359,36.417,NA,NA,25.5,0,NA,ADCP_S,Permanent,Single,2015-01-06,Inshore,UK
CalVal_Jan2015_8,FLK,2015,CalVal,24.8977,-80.61817,MapCO2_Buoy,01/10/15,01/10/15,03:20:00 PM,08:20:00 PM,0,2107.49,2412.28,8.041,418.528,3.406,36.562,NA,NA,23.4,0,NA,MapCO2_Buoy,Permanent,Single,2015-01-10,Inshore,UK
CalVal_Jan2015_9,FLK,2015,CalVal,24.8977,-80.61817,MapCO2_Buoy,01/10/15,01/10/15,03:20:00 PM,08:20:00 PM,0,2110.89,2415.71,8.04,419.68,3.408,36.562,NA,NA,23.4,0,NA,MapCO2_Buoy,Permanent,Single,2015-01-10,Inshore,UK
CalVal_Jan2015_10,FLK,2015,CalVal,24.8982666666667,-80.6173833333333,CalVal_N,01/10/15,01/10/15,03:28:00 PM,08:28:00 PM,0,2108.86,2414.82,8.047,412.12,3.413,36.559,NA,NA,23.1,0,NA,CalVal_N,Permanent,Single,2015-01-10,Inshore,UK
CalVal_Jan2015_11,FLK,2015,CalVal,24.8981833333333,-80.6160666666667,ADCP_NE,01/10/15,01/10/15,03:32:00 PM,08:32:00 PM,0,2106.13,2411.14,8.044,414.173,3.404,36.545,NA,NA,23.2,0,NA,ADCP_NE,Permanent,Single,2015-01-10,Inshore,UK
CalVal_Jan2015_12,FLK,2015,CalVal,24.8966333333333,-80.6153,CalVal_SE,01/10/15,01/10/15,03:37:00 PM,08:37:00 PM,0,2127.04,2418,8.021,443.56,3.264,36.584,NA,NA,23.1,0,NA,CalVal_SE,Permanent,Single,2015-01-10,Inshore,UK
CalVal_Jan2015_13,FLK,2015,CalVal,24.8955833333333,-80.6166333333333,CalVal_S,01/10/15,01/10/15,03:44:00 PM,08:44:00 PM,0,2103.63,2414.81,8.054,403.89,3.468,36.556,NA,NA,23.2,0,NA,CalVal_S,Permanent,Single,2015-01-10,Inshore,UK
CalVal_Jan2015_14,FLK,2015,CalVal,24.8964666666667,-80.6182,ADCP_S,01/10/15,01/10/15,03:48:00 PM,08:48:00 PM,0,2098.84,2407.34,8.051,406.281,3.437,36.55,NA,NA,23.2,0,NA,ADCP_S,Permanent,Single,2015-01-10,Inshore,UK
CalVal_Jan2015_15,FLK,2015,CalVal,24.8547,-80.56742,Transect 4,01/22/15,01/22/15,11:43:00 AM,04:43:00 PM,0,2042.25,2372.91,8.064,384.194,3.698,36.229,NA,NA,25.3,0,NA,Transect 4,Permanent,Single,2015-01-22,Oceanic,UK
CalVal_Jan2015_16,FLK,2015,CalVal,24.8694,-80.585,Transect 3,01/22/15,01/22/15,11:51:00 AM,04:51:00 PM,0,2051.29,2374.38,8.057,392.609,3.61,36.299,NA,NA,24.9,0,NA,Transect 3,Permanent,Single,2015-01-22,Offshore,UK
CalVal_Jan2015_17,FLK,2015,CalVal,24.8854666666667,-80.6041,Transect 2,01/22/15,01/22/15,12:03:00 PM,05:03:00 PM,0,2065.81,2396.71,8.08,371.48,3.672,36.471,NA,NA,23.8,0,NA,Transect 2,Permanent,Single,2015-01-22,Mid channel,UK
CalVal_Jan2015_18,FLK,2015,CalVal,24.9052,-80.6266,Transect 1,01/22/15,01/22/15,12:17:00 PM,05:17:00 PM,0,2086.3,2403.64,8.06,395.11,3.531,36.548,NA,NA,23.6,0,NA,Transect 1,Permanent,Single,2015-01-22,Inshore,UK
CalVal_Jan2015_19,FLK,2015,CalVal,24.8964666666667,-80.6182,ADCP_S,01/22/15,01/22/15,12:25:00 PM,05:25:00 PM,0,2072.88,2405.29,8.086,367.334,3.686,36.474,NA,NA,23.5,0,NA,ADCP_S,Permanent,Single,2015-01-22,Inshore,UK
CalVal_Jan2015_20,FLK,2015,CalVal,24.8955833333333,-80.6166333333333,CalVal_S,01/22/15,01/22/15,12:29:00 PM,05:29:00 PM,0,2068.74,2400.67,8.087,365.195,3.676,36.478,NA,NA,23.4,0,NA,CalVal_S,Permanent,Single,2015-01-22,Inshore,UK
CalVal_Jan2015_21,FLK,2015,CalVal,24.8966333333333,-80.6153,CalVal_SE,01/22/15,01/22/15,12:33:00 PM,05:33:00 PM,0,2068.61,2400.38,8.087,365.416,3.674,36.484,NA,NA,23.4,0,NA,CalVal_SE,Permanent,Single,2015-01-22,Inshore,UK
CalVal_Jan2015_22,FLK,2015,CalVal,24.8981833333333,-80.6160666666667,ADCP_NE,01/22/15,01/22/15,12:36:00 PM,05:36:00 PM,0,2074.52,2404.22,8.083,370.241,3.655,36.498,NA,NA,23.4,0,NA,ADCP_NE,Permanent,Single,2015-01-22,Inshore,UK
CalVal_Jan2015_23,FLK,2015,CalVal,24.8982666666667,-80.6173833333333,CalVal_N,01/22/15,01/22/15,12:39:00 PM,05:39:00 PM,0,2070.04,2394.73,8.077,375.406,3.599,36.478,NA,NA,23.4,0,NA,CalVal_N,Permanent,Single,2015-01-22,Inshore,UK
CalVal_Jan2015_24,FLK,2015,CalVal,24.8977,-80.61817,MapCO2_Buoy,01/22/15,01/22/15,01:17:00 PM,06:17:00 PM,0,2080.57,2397.5,8.059,394.869,3.528,36.502,NA,NA,23.7,0,NA,MapCO2_Buoy,Permanent,Single,2015-01-22,Inshore,UK
CalVal_Jan2015_25,FLK,2015,CalVal,24.8977,-80.61817,MapCO2_Buoy,01/22/15,01/22/15,01:17:00 PM,06:17:00 PM,0,2076.44,2394.9,8.062,391.167,3.542,36.495,NA,NA,23.7,0,NA,MapCO2_Buoy,Permanent,Single,2015-01-22,Inshore,UK
CalVal_Feb2015_1,FLK,2015,CalVal,24.8977,-80.61817,MapCO2_Buoy,02/03/15,02/03/15,09:38:00 AM,02:38:00 PM,0,2084.36,2397.66,8.082,370.999,3.45,36.558,NA,NA,21.7,0,NA,MapCO2_Buoy,Permanent,Single,2015-02-03,Inshore,UK
CalVal_Feb2015_2,FLK,2015,CalVal,24.8977,-80.61817,MapCO2_Buoy,02/03/15,02/03/15,09:38:00 AM,02:38:00 PM,0,2088.5,2398.6,8.077,376.512,3.42,36.524,NA,NA,21.7,0,NA,MapCO2_Buoy,Permanent,Single,2015-02-03,Inshore,UK
CalVal_Feb2015_3,FLK,2015,CalVal,24.8982666666667,-80.6173833333333,CalVal_N,02/03/15,02/03/15,09:46:00 AM,02:46:00 PM,0,2085.29,2396.71,8.078,375.056,3.434,36.518,NA,NA,21.8,0,NA,CalVal_N,Permanent,Single,2015-02-03,Inshore,UK
CalVal_Feb2015_4,FLK,2015,CalVal,24.8981833333333,-80.6160666666667,ADCP_NE,02/03/15,02/03/15,09:50:00 AM,02:50:00 PM,0,2091.11,2400.93,8.075,379.196,3.421,36.516,NA,NA,21.8,0,NA,ADCP_NE,Permanent,Single,2015-02-03,Inshore,UK
CalVal_Feb2015_5,FLK,2015,CalVal,24.8966333333333,-80.6153,CalVal_SE,02/03/15,02/03/15,09:54:00 AM,02:54:00 PM,0,2086.18,2396.52,8.079,374.934,3.423,36.474,NA,NA,21.7,0,NA,CalVal_SE,Permanent,Single,2015-02-03,Inshore,UK
CalVal_Feb2015_6,FLK,2015,CalVal,24.8955833333333,-80.6166333333333,CalVal_S,02/03/15,02/03/15,09:57:00 AM,02:57:00 PM,0,2089.07,2396.23,8.074,380.305,3.391,36.464,NA,NA,21.7,0,NA,CalVal_S,Permanent,Single,2015-02-03,Inshore,UK
CalVal_Feb2015_7,FLK,2015,CalVal,24.8964666666667,-80.6182,ADCP_S,02/03/15,02/03/15,10:01:00 AM,03:01:00 PM,0,2088.29,2398.99,8.078,375.719,3.425,36.539,NA,NA,21.7,0,NA,ADCP_S,Permanent,Single,2015-02-03,Inshore,UK
CalVal_Feb2015_8,FLK,2015,CalVal,24.8547,-80.56742,Transect 4,02/24/15,02/24/15,09:45:00 AM,02:45:00 PM,0,2053.45,2382.52,8.079,370.85,3.649,36.413,NA,NA,23.9,0,NA,Transect 4,Permanent,Single,2015-02-24,Oceanic,UK
CalVal_Feb2015_9,FLK,2015,CalVal,24.8694,-80.585,Transect 3,02/24/15,02/24/15,09:53:00 AM,02:53:00 PM,0,2056.68,2384.85,8.083,366.968,3.634,36.391,NA,NA,23.5,0,NA,Transect 3,Permanent,Single,2015-02-24,Offshore,UK
CalVal_Feb2015_10,FLK,2015,CalVal,24.8854666666667,-80.6041,Transect 2,02/24/15,02/24/15,10:00:00 AM,03:00:00 PM,0,2069.08,2402.19,8.096,357.251,3.684,36.405,NA,NA,23,0,NA,Transect 2,Permanent,Single,2015-02-24,Mid channel,UK
CalVal_Feb2015_11,FLK,2015,CalVal,24.9052,-80.6266,Transect 1,02/24/15,02/24/15,10:10:00 AM,03:10:00 PM,0,2101.87,2441.33,8.095,363.084,3.763,36.646,NA,NA,23.1,0,NA,Transect 1,Permanent,Single,2015-02-24,Inshore,UK
CalVal_Feb2015_12,FLK,2015,CalVal,24.8977,-80.61817,MapCO2_Buoy,02/24/15,02/24/15,10:14:00 AM,03:14:00 PM,0,2071.86,2400.22,8.09,362.864,3.633,36.402,NA,NA,22.9,0,NA,MapCO2_Buoy,Permanent,Single,2015-02-24,Inshore,UK
CalVal_Feb2015_13,FLK,2015,CalVal,24.8977,-80.61817,MapCO2_Buoy,02/24/15,02/24/15,10:14:00 AM,03:14:00 PM,0,2075.33,2402.65,8.087,365.98,3.621,36.468,NA,NA,22.9,0,NA,MapCO2_Buoy,Permanent,Single,2015-02-24,Inshore,UK
CalVal_Feb2015_14,FLK,2015,CalVal,24.8982666666667,-80.6173833333333,CalVal_N,02/24/15,02/24/15,10:20:00 AM,03:20:00 PM,0,2066.03,2405.44,8.106,347.53,3.744,36.476,NA,NA,22.9,0,NA,CalVal_N,Permanent,Single,2015-02-24,Inshore,UK
CalVal_Feb2015_15,FLK,2015,CalVal,24.8981833333333,-80.6160666666667,ADCP_NE,02/24/15,02/24/15,10:23:00 AM,03:23:00 PM,0,2073.47,2408.47,8.098,355.562,3.701,36.491,NA,NA,22.9,0,NA,ADCP_NE,Permanent,Single,2015-02-24,Inshore,UK
CalVal_Feb2015_16,FLK,2015,CalVal,24.8966333333333,-80.6153,CalVal_SE,02/24/15,02/24/15,10:27:00 AM,03:27:00 PM,0,2070.09,2407.8,8.105,349.304,3.727,36.455,NA,NA,22.8,0,NA,CalVal_SE,Permanent,Single,2015-02-24,Inshore,UK
CalVal_Feb2015_17,FLK,2015,CalVal,24.8955833333333,-80.6166333333333,CalVal_S,02/24/15,02/24/15,10:30:00 AM,03:30:00 PM,0,2071.85,2405.52,8.098,355.164,3.684,36.474,NA,NA,22.8,0,NA,CalVal_S,Permanent,Single,2015-02-24,Inshore,UK
CalVal_Feb2015_18,FLK,2015,CalVal,24.8964666666667,-80.6182,ADCP_S,02/24/15,02/24/15,10:34:00 AM,03:34:00 PM,0,2070.08,2406.28,8.102,351.269,3.711,36.463,NA,NA,22.8,0,NA,ADCP_S,Permanent,Single,2015-02-24,Inshore,UK
CalVal_Mar2015_1,FLK,2015,CalVal,24.8547,-80.56742,Transect 4,03/22/15,03/22/15,10:44:00 AM,02:44:00 PM,0,1932.54,2322.57,8.139,298.704,4.235,37.182,NA,NA,26.1,0,NA,Transect 4,Permanent,Single,2015-03-22,Oceanic,UK
CalVal_Mar2015_2,FLK,2015,CalVal,24.8694,-80.585,Transect 3,03/22/15,03/22/15,10:52:00 AM,02:52:00 PM,0,1924.26,2328.15,8.164,278.144,4.372,37.138,NA,NA,25.7,0,NA,Transect 3,Permanent,Single,2015-03-22,Offshore,UK
CalVal_Mar2015_3,FLK,2015,CalVal,24.8854666666667,-80.6041,Transect 2,03/22/15,03/22/15,10:58:00 AM,02:58:00 PM,0,1928.5,2329.64,8.15,290.087,4.371,37.021,NA,NA,26.5,0,NA,Transect 2,Permanent,Single,2015-03-22,Mid channel,UK
CalVal_Mar2015_4,FLK,2015,CalVal,24.9052,-80.6266,Transect 1,03/22/15,03/22/15,11:05:00 AM,03:05:00 PM,0,1925.45,2332.09,8.14,297.15,4.465,36.922,NA,NA,27.7,0,NA,Transect 1,Permanent,Single,2015-03-22,Inshore,UK
CalVal_Mar2015_5,FLK,2015,CalVal,24.8982666666667,-80.6173833333333,CalVal_N,03/22/15,03/22/15,11:10:00 AM,03:10:00 PM,0,1992.09,2360.74,8.084,356.078,4.097,36.849,NA,NA,27.5,0,NA,CalVal_N,Permanent,Single,2015-03-22,Inshore,UK
CalVal_Mar2015_6,FLK,2015,CalVal,24.8981833333333,-80.6160666666667,ADCP_NE,03/22/15,03/22/15,11:13:00 AM,03:13:00 PM,0,1998.84,2375.79,8.097,346.006,4.195,36.745,NA,NA,27.4,0,NA,ADCP_NE,Permanent,Single,2015-03-22,Inshore,UK
CalVal_Mar2015_7,FLK,2015,CalVal,24.8977,-80.61817,MapCO2_Buoy,03/22/15,03/22/15,11:15:00 AM,03:15:00 PM,0,1988.62,2362.78,8.094,346.699,4.153,36.822,NA,NA,27.4,0,NA,MapCO2_Buoy,Permanent,Single,2015-03-22,Inshore,UK
CalVal_Mar2015_8,FLK,2015,CalVal,24.8977,-80.61817,MapCO2_Buoy,03/22/15,03/22/15,11:15:00 AM,03:15:00 PM,0,1993.41,2358.13,8.08,359.824,4.053,36.839,NA,NA,27.4,0,NA,MapCO2_Buoy,Permanent,Single,2015-03-22,Inshore,UK
CalVal_Mar2015_9,FLK,2015,CalVal,24.8964666666667,-80.6182,ADCP_S,03/22/15,03/22/15,11:20:00 AM,03:20:00 PM,0,1995.36,2364.48,8.087,354.521,4.105,36.78,NA,NA,27.4,0,NA,ADCP_S,Permanent,Single,2015-03-22,Inshore,UK
CalVal_Mar2015_10,FLK,2015,CalVal,24.8955833333333,-80.6166333333333,CalVal_S,03/22/15,03/22/15,11:24:00 AM,03:24:00 PM,0,1997.82,2382.64,8.109,335.213,4.279,36.731,NA,NA,27.3,0,NA,CalVal_S,Permanent,Single,2015-03-22,Inshore,UK
CalVal_Mar2015_11,FLK,2015,CalVal,24.8966333333333,-80.6153,CalVal_SE,03/22/15,03/22/15,11:27:00 AM,03:27:00 PM,0,2005.21,2389.75,8.109,336.26,4.281,36.702,NA,NA,27.2,0,NA,CalVal_SE,Permanent,Single,2015-03-22,Inshore,UK
CalVal_Mar2015_12,FLK,2015,CalVal,24.8982666666667,-80.6173833333333,CalVal_N,03/29/15,03/29/15,01:30:00 PM,05:30:00 PM,0,2049.03,2385.67,8.072,377.304,3.753,36.438,NA,NA,25.1,0,NA,CalVal_N,Permanent,Single,2015-03-29,Inshore,UK
CalVal_Mar2015_13,FLK,2015,CalVal,24.8964666666667,-80.6182,ADCP_S,03/29/15,03/29/15,01:35:00 PM,05:35:00 PM,0,1936.46,2332.56,8.159,284.129,4.288,37.125,NA,NA,25.3,0,NA,ADCP_S,Permanent,Single,2015-03-29,Inshore,UK
CalVal_Mar2015_14,FLK,2015,CalVal,24.8955833333333,-80.6166333333333,CalVal_S,03/29/15,03/29/15,01:40:00 PM,05:40:00 PM,0,1934.59,2328.61,8.158,284.633,4.26,37.149,NA,NA,25.2,0,NA,CalVal_S,Permanent,Single,2015-03-29,Inshore,UK
CalVal_Mar2015_15,FLK,2015,CalVal,24.8966333333333,-80.6153,CalVal_SE,03/29/15,03/29/15,01:45:00 PM,05:45:00 PM,0,1924.72,2334.09,8.18,267.345,4.424,37.065,NA,NA,25.2,0,NA,CalVal_SE,Permanent,Single,2015-03-29,Inshore,UK
CalVal_Mar2015_16,FLK,2015,CalVal,24.8981833333333,-80.6160666666667,ADCP_NE,03/29/15,03/29/15,01:50:00 PM,05:50:00 PM,0,2051.03,2381.7,8.063,386.285,3.689,36.442,NA,NA,25.1,0,NA,ADCP_NE,Permanent,Single,2015-03-29,Inshore,UK
CalVal_Mar2015_17,FLK,2015,CalVal,24.8977,-80.61817,MapCO2_Buoy,03/29/15,03/29/15,02:05:00 PM,06:05:00 PM,0,1980.69,2339.66,8.112,327.948,3.908,37.082,NA,NA,24.7,0,NA,MapCO2_Buoy,Permanent,Single,2015-03-29,Inshore,UK
CalVal_Mar2015_18,FLK,2015,CalVal,24.8977,-80.61817,MapCO2_Buoy,03/29/15,03/29/15,02:05:00 PM,06:05:00 PM,0,2035.36,2393.44,8.109,340.921,3.962,36.54,NA,NA,24.7,0,NA,MapCO2_Buoy,Permanent,Single,2015-03-29,Inshore,UK
CalVal_May2015_4,FLK,2015,CalVal,24.8547,-80.56742,Transect 4,05/14/15,05/14/15,11:31:00 AM,03:31:00 PM,0,2049.19,2369.87,8.016,437.359,3.634,36.376,NA,NA,27.4,0,NA,Transect 4,Permanent,Single,2015-05-14,Oceanic,UK
CalVal_May2015_5,FLK,2015,CalVal,24.8694,-80.585,Transect 3,05/14/15,05/14/15,11:56:00 AM,03:56:00 PM,0,2057.75,2370.61,8.001,456.809,3.56,36.342,NA,NA,27.6,0,NA,Transect 3,Permanent,Single,2015-05-14,Offshore,UK
CalVal_May2015_6,FLK,2015,CalVal,24.8854666666667,-80.6041,Transect 2,05/14/15,05/14/15,12:17:00 PM,04:17:00 PM,0,2018.47,2370.9,8.053,392.158,3.967,36.565,NA,NA,28.1,0,NA,Transect 2,Permanent,Single,2015-05-14,Mid channel,UK
CalVal_May2015_7,FLK,2015,CalVal,24.8964666666667,-80.6182,ADCP_S,05/14/15,05/14/15,12:32:00 PM,04:32:00 PM,0,2021.27,2366.55,8.044,401.612,3.898,36.417,NA,NA,28.1,0,NA,ADCP_S,Permanent,Single,2015-05-14,Inshore,UK
CalVal_May2015_8,FLK,2015,CalVal,24.8955833333333,-80.6166333333333,CalVal_S,05/14/15,05/14/15,12:43:00 PM,04:43:00 PM,0,2014.19,2374.58,8.069,375.3,4.055,36.396,NA,NA,27.9,0,NA,CalVal_S,Permanent,Single,2015-05-14,Inshore,UK
CalVal_May2015_9,FLK,2015,CalVal,24.8966333333333,-80.6153,CalVal_SE,05/14/15,05/14/15,12:55:00 PM,04:55:00 PM,0,2021.01,2377.91,8.063,382.841,4.019,36.455,NA,NA,27.9,0,NA,CalVal_SE,Permanent,Single,2015-05-14,Inshore,UK
CalVal_May2015_1,FLK,2015,CalVal,24.8981833333333,-80.6160666666667,ADCP_NE,05/14/15,05/14/15,01:00:00 PM,05:00:00 PM,0,2026.71,2375.77,8.048,399.293,3.948,36.367,NA,NA,28.2,0,NA,ADCP_NE,Permanent,Single,2015-05-14,Inshore,UK
CalVal_May2015_2,FLK,2015,CalVal,24.8982666666667,-80.6173833333333,CalVal_N,05/14/15,05/14/15,01:16:00 PM,05:16:00 PM,0,2019.43,2374.21,8.057,389.026,4.005,36.391,NA,NA,28.2,0,NA,CalVal_N,Permanent,Single,2015-05-14,Inshore,UK
CalVal_May2015_3,FLK,2015,CalVal,24.8977,-80.61817,MapCO2_Buoy,05/14/15,05/14/15,01:26:00 PM,05:26:00 PM,0,2010.61,2366.59,8.06,384.125,4.013,36.374,NA,NA,28.2,0,NA,MapCO2_Buoy,Permanent,Single,2015-05-14,Inshore,UK
CalVal_May2015_10,FLK,2015,CalVal,24.8977,-80.61817,MapCO2_Buoy,05/14/15,05/14/15,01:30:00 PM,05:30:00 PM,0,2010.82,2361.61,8.053,391.121,3.957,36.362,NA,NA,28.2,0,NA,MapCO2_Buoy,Permanent,Single,2015-05-14,Inshore,UK
CalVal_May2015_11,FLK,2015,CalVal,24.9052,-80.6266,Transect 1,05/14/15,05/14/15,01:46:00 PM,05:46:00 PM,0,1906.7,2319.8,8.14,295.696,4.57,36.598,NA,NA,28.8,0,NA,Transect 1,Permanent,Single,2015-05-14,Inshore,UK
CalVal_May2015_12,FLK,2015,CalVal,24.8982666666667,-80.6173833333333,CalVal_N,05/29/15,05/29/15,10:55:00 AM,02:55:00 PM,0,1873.43,2259.11,8.121,303.82,4.178,37.212,NA,NA,27.6,0,NA,CalVal_N,Permanent,Single,2015-05-29,Inshore,UK
CalVal_May2015_13,FLK,2015,CalVal,24.8981833333333,-80.6160666666667,ADCP_NE,05/29/15,05/29/15,11:09:00 AM,03:09:00 PM,0,1878.82,2266.7,8.123,302.946,4.207,37.183,NA,NA,27.6,0,NA,ADCP_NE,Permanent,Single,2015-05-29,Inshore,UK
CalVal_May2015_14,FLK,2015,CalVal,24.8977,-80.61817,MapCO2_Buoy,05/29/15,05/29/15,11:18:00 AM,03:18:00 PM,0,1866.84,2258.68,8.128,296.897,4.241,37.229,NA,NA,27.7,0,NA,MapCO2_Buoy,Permanent,Single,2015-05-29,Inshore,UK
CalVal_May2015_15,FLK,2015,CalVal,24.8977,-80.61817,MapCO2_Buoy,05/29/15,05/29/15,11:23:00 AM,03:23:00 PM,0,1864.94,2266.66,8.141,286.663,4.346,37.225,NA,NA,27.7,0,NA,MapCO2_Buoy,Permanent,Single,2015-05-29,Inshore,UK
CalVal_May2015_16,FLK,2015,CalVal,24.8966333333333,-80.6153,CalVal_SE,05/29/15,05/29/15,11:35:00 AM,03:35:00 PM,0,1878.15,2273.11,8.132,296.392,4.289,37.134,NA,NA,27.7,0,NA,CalVal_SE,Permanent,Single,2015-05-29,Inshore,UK
CalVal_May2015_17,FLK,2015,CalVal,24.8955833333333,-80.6166333333333,CalVal_S,05/29/15,05/29/15,11:47:00 AM,03:47:00 PM,0,1874.29,2279.91,8.146,285.03,4.401,37.142,NA,NA,27.7,0,NA,CalVal_S,Permanent,Single,2015-05-29,Inshore,UK
CalVal_May2015_18,FLK,2015,CalVal,24.8964666666667,-80.6182,ADCP_S,05/29/15,05/29/15,11:56:00 AM,03:56:00 PM,0,1859.35,2256.37,8.137,289.36,4.292,37.201,NA,NA,27.7,0,NA,ADCP_S,Permanent,Single,2015-05-29,Inshore,UK
CalVal_Jun2015_1,FLK,2015,CalVal,24.8982666666667,-80.6173833333333,CalVal_N,06/11/15,06/11/15,01:23:00 PM,05:23:00 PM,0,1983.65,2356.34,8.065,373.266,4.184,36.774,NA,NA,29.3,0,NA,CalVal_N,Permanent,Single,2015-06-11,Inshore,UK
CalVal_Jun2015_2,FLK,2015,CalVal,24.8981833333333,-80.6160666666667,ADCP_NE,06/11/15,06/11/15,01:33:00 PM,05:33:00 PM,0,1988.01,2364.19,8.074,366.543,4.248,36.381,NA,NA,29.3,0,NA,ADCP_NE,Permanent,Single,2015-06-11,Inshore,UK
CalVal_Jun2015_3,FLK,2015,CalVal,24.8966333333333,-80.6153,CalVal_SE,06/11/15,06/11/15,01:43:00 PM,05:43:00 PM,0,1987.06,2371.71,8.085,356,4.341,36.386,NA,NA,29.3,0,NA,CalVal_SE,Permanent,Single,2015-06-11,Inshore,UK
CalVal_Jun2015_4,FLK,2015,CalVal,24.8955833333333,-80.6166333333333,CalVal_S,06/11/15,06/11/15,01:50:00 PM,05:50:00 PM,0,1985.96,2376.2,8.092,349.333,4.401,36.413,NA,NA,29.3,0,NA,CalVal_S,Permanent,Single,2015-06-11,Inshore,UK
CalVal_Jun2015_5,FLK,2015,CalVal,24.8964666666667,-80.6182,ADCP_S,06/11/15,06/11/15,02:00:00 PM,06:00:00 PM,0,1982.88,2361.42,8.076,363.491,4.272,36.399,NA,NA,29.4,0,NA,ADCP_S,Permanent,Single,2015-06-11,Inshore,UK
CalVal_Jun2015_6,FLK,2015,CalVal,24.8977,-80.61817,MapCO2_Buoy,06/11/15,06/11/15,02:17:00 PM,06:17:00 PM,0,1986.23,2365.43,8.078,362.151,4.28,36.373,NA,NA,29.3,0,NA,MapCO2_Buoy,Permanent,Single,2015-06-11,Inshore,UK
CalVal_Jun2015_7,FLK,2015,CalVal,24.8977,-80.61817,MapCO2_Buoy,06/11/15,06/11/15,02:17:00 PM,06:17:00 PM,0,1987.7,2365.01,8.076,364.945,4.261,36.371,NA,NA,29.3,0,NA,MapCO2_Buoy,Permanent,Single,2015-06-11,Inshore,UK
CalVal_Jun2015_8,FLK,2015,CalVal,24.8547,-80.56742,Transect 4,06/24/15,06/24/15,10:29:00 AM,02:29:00 PM,0,2036.35,2380.31,8.028,422.725,3.93,36.18,NA,NA,29.1,0,NA,Transect 4,Permanent,Single,2015-06-24,Oceanic,UK
CalVal_Jun2015_9,FLK,2015,CalVal,24.8694,-80.585,Transect 3,06/24/15,06/24/15,10:32:00 AM,02:32:00 PM,0,2040.54,2376.1,8.01,444.545,3.848,36.224,NA,NA,29.5,0,NA,Transect 3,Permanent,Single,2015-06-24,Offshore,UK
CalVal_Jun2015_10,FLK,2015,CalVal,24.8854666666667,-80.6041,Transect 2,06/24/15,06/24/15,10:40:00 AM,02:40:00 PM,0,2030.1,2397.13,8.037,412.203,4.206,36.404,NA,NA,30.5,0,NA,Transect 2,Permanent,Single,2015-06-24,Mid channel,UK
CalVal_Jun2015_11,FLK,2015,CalVal,24.8982666666667,-80.6173833333333,CalVal_N,06/24/15,06/24/15,10:47:00 AM,02:47:00 PM,0,1996.74,2370.6,8.041,401.041,4.246,36.816,NA,NA,30.9,0,NA,CalVal_N,Permanent,Single,2015-06-24,Inshore,UK
CalVal_Jun2015_12,FLK,2015,CalVal,24.8981833333333,-80.6160666666667,ADCP_NE,06/24/15,06/24/15,10:50:00 AM,02:50:00 PM,0,2001.89,2370.34,8.035,408.18,4.19,36.756,NA,NA,30.8,0,NA,ADCP_NE,Permanent,Single,2015-06-24,Inshore,UK
CalVal_Jun2015_13,FLK,2015,CalVal,24.8966333333333,-80.6153,CalVal_SE,06/24/15,06/24/15,10:54:00 AM,02:54:00 PM,0,2010.65,2380.62,8.038,407.336,4.213,36.715,NA,NA,30.7,0,NA,CalVal_SE,Permanent,Single,2015-06-24,Inshore,UK
CalVal_Jun2015_14,FLK,2015,CalVal,24.8955833333333,-80.6166333333333,CalVal_S,06/24/15,06/24/15,10:59:00 AM,02:59:00 PM,0,2001.4,2376.09,8.04,402.832,4.263,36.78,NA,NA,31,0,NA,CalVal_S,Permanent,Single,2015-06-24,Inshore,UK
CalVal_Jun2015_15,FLK,2015,CalVal,24.8964666666667,-80.6182,ADCP_S,06/24/15,06/24/15,11:02:00 AM,03:02:00 PM,0,2000.85,2371.33,8.038,405.238,4.21,36.781,NA,NA,30.8,0,NA,ADCP_S,Permanent,Single,2015-06-24,Inshore,UK
CalVal_Jun2015_16,FLK,2015,CalVal,24.8977,-80.61817,MapCO2_Buoy,06/24/15,06/24/15,11:17:00 AM,03:17:00 PM,0,1995.12,2371.71,8.043,398.064,4.279,36.793,NA,NA,31,0,NA,MapCO2_Buoy,Permanent,Single,2015-06-24,Inshore,UK
CalVal_Jun2015_17,FLK,2015,CalVal,24.8977,-80.61817,MapCO2_Buoy,06/24/15,06/24/15,11:23:00 AM,03:23:00 PM,0,1994.93,2378.72,8.053,388.647,4.358,36.803,NA,NA,31,0,NA,MapCO2_Buoy,Permanent,Single,2015-06-24,Inshore,UK
CalVal_Jun2015_18,FLK,2015,CalVal,24.9052,-80.6266,Transect 1,06/24/15,06/24/15,12:32:00 PM,04:32:00 PM,0,1957.43,2337.11,8.061,372.287,4.253,37.024,NA,NA,30.3,0,NA,Transect 1,Permanent,Single,2015-06-24,Inshore,UK
CalVal_Jul2015_1,FLK,2015,CalVal,24.8977,-80.61817,MapCO2_Buoy,07/28/15,07/28/15,11:17:00 AM,03:17:00 PM,0,1996.6,2328.63,7.981,465.691,3.748,37.4,NA,NA,30.6,0,NA,MapCO2_Buoy,Permanent,Single,2015-07-28,Inshore,UK
CalVal_Jul2015_2,FLK,2015,CalVal,24.8977,-80.61817,MapCO2_Buoy,07/28/15,07/28/15,11:23:00 AM,03:23:00 PM,0,1995.4,2327.79,7.982,464.598,3.751,37.402,NA,NA,30.6,0,NA,MapCO2_Buoy,Permanent,Single,2015-07-28,Inshore,UK
CalVal_Jul2015_4,FLK,2015,CalVal,24.8981833333333,-80.6160666666667,ADCP_NE,07/28/15,07/28/15,12:00:00 PM,04:00:00 PM,0,1987.29,2323.21,7.986,457.969,3.782,37.472,NA,NA,30.7,0,NA,ADCP_NE,Permanent,Single,2015-07-28,Inshore,UK
CalVal_Jul2015_7,FLK,2015,CalVal,24.8964666666667,-80.6182,ADCP_S,07/28/15,07/28/15,12:00:00 PM,04:00:00 PM,0,1994.82,2332.94,7.989,456.647,3.832,37.149,NA,NA,30.87,0,NA,ADCP_S,Permanent,Single,2015-07-28,Inshore,UK
CalVal_Jul2015_3,FLK,2015,CalVal,24.8982666666667,-80.6173833333333,CalVal_N,07/28/15,07/28/15,12:00:00 PM,04:00:00 PM,0,1986.78,2327.13,7.992,451.615,3.835,37.413,NA,NA,30.8,0,NA,CalVal_N,Permanent,Single,2015-07-28,Inshore,UK
CalVal_Jul2015_6,FLK,2015,CalVal,24.8955833333333,-80.6166333333333,CalVal_S,07/28/15,07/28/15,12:00:00 PM,04:00:00 PM,0,1996.69,2341.68,8,444.695,3.909,37.107,NA,NA,30.8,0,NA,CalVal_S,Permanent,Single,2015-07-28,Inshore,UK
CalVal_Jul2015_5,FLK,2015,CalVal,24.8966333333333,-80.6153,CalVal_SE,07/28/15,07/28/15,12:00:00 PM,04:00:00 PM,0,1992.12,2338.41,8,443.477,3.907,37.336,NA,NA,30.8,0,NA,CalVal_SE,Permanent,Single,2015-07-28,Inshore,UK
CalVal_Aug2015_1,FLK,2015,CalVal,24.8977,-80.61817,MapCO2_Buoy,08/06/15,08/06/15,11:15:00 AM,03:15:00 PM,0,2019.51,2352.94,7.996,458.478,3.879,35.604,NA,NA,31,0,NA,MapCO2_Buoy,Permanent,Single,2015-08-06,Inshore,UK
CalVal_Aug2015_2,FLK,2015,CalVal,24.8977,-80.61817,MapCO2_Buoy,08/06/15,08/06/15,11:20:00 AM,03:20:00 PM,0,2018.07,2349.36,7.994,460.166,3.86,35.498,NA,NA,31,0,NA,MapCO2_Buoy,Permanent,Single,2015-08-06,Inshore,UK
CalVal_Aug2015_3,FLK,2015,CalVal,24.8982666666667,-80.6173833333333,CalVal_N,08/06/15,08/06/15,11:56:00 AM,03:56:00 PM,0,2018.44,2347.67,7.992,463.187,3.839,35.449,NA,NA,31,0,NA,CalVal_N,Permanent,Single,2015-08-06,Inshore,UK
CalVal_Aug2015_4,FLK,2015,CalVal,24.8981833333333,-80.6160666666667,ADCP_NE,08/06/15,08/06/15,12:06:00 PM,04:06:00 PM,0,2017.6,2347.53,7.994,461.251,3.848,35.414,NA,NA,31,0,NA,ADCP_NE,Permanent,Single,2015-08-06,Inshore,UK
CalVal_Aug2015_5,FLK,2015,CalVal,24.8966333333333,-80.6153,CalVal_SE,08/06/15,08/06/15,12:16:00 PM,04:16:00 PM,0,2008.13,2352.15,8.017,432.169,4.001,35.336,NA,NA,30.9,0,NA,CalVal_SE,Permanent,Single,2015-08-06,Inshore,UK
CalVal_Aug2015_6,FLK,2015,CalVal,24.8955833333333,-80.6166333333333,CalVal_S,08/06/15,08/06/15,12:36:00 PM,04:36:00 PM,0,2002.92,2345.4,8.015,433.011,3.978,35.382,NA,NA,30.9,0,NA,CalVal_S,Permanent,Single,2015-08-06,Inshore,UK
CalVal_Aug2015_7,FLK,2015,CalVal,24.8964666666667,-80.6182,ADCP_S,08/06/15,08/06/15,12:48:00 PM,04:48:00 PM,0,2007.51,2348.57,8.01,440.354,3.971,35.376,NA,NA,31.1,0,NA,ADCP_S,Permanent,Single,2015-08-06,Inshore,UK
CalVal_Aug2015_8,FLK,2015,CalVal,24.9052,-80.6266,Transect 1,08/21/15,08/21/15,10:14:00 AM,02:14:00 PM,0,2038.56,2329.19,7.928,551.012,3.433,35.414,NA,NA,31.3,0,NA,Transect 1,Permanent,Single,2015-08-21,Inshore,UK
CalVal_Aug2015_9,FLK,2015,CalVal,24.8977,-80.61817,MapCO2_Buoy,08/21/15,08/21/15,11:17:00 AM,03:17:00 PM,0,2048.75,2349.15,7.948,527.25,3.555,35.12,NA,NA,31.1,0,NA,MapCO2_Buoy,Permanent,Single,2015-08-21,Inshore,UK
CalVal_Aug2015_10,FLK,2015,CalVal,24.8977,-80.61817,MapCO2_Buoy,08/21/15,08/21/15,11:20:00 AM,03:20:00 PM,0,2046.42,2347.93,7.95,523.612,3.567,35.092,NA,NA,31.1,0,NA,MapCO2_Buoy,Permanent,Single,2015-08-21,Inshore,UK
CalVal_Aug2015_11,FLK,2015,CalVal,24.8982666666667,-80.6173833333333,CalVal_N,08/21/15,08/21/15,11:31:00 AM,03:31:00 PM,0,2046.51,2359.34,7.966,502.433,3.692,35.13,NA,NA,31.11,0,NA,CalVal_N,Permanent,Single,2015-08-21,Inshore,UK
CalVal_Aug2015_12,FLK,2015,CalVal,24.8981833333333,-80.6160666666667,ADCP_NE,08/21/15,08/21/15,11:41:00 AM,03:41:00 PM,0,2045.74,2352.82,7.959,512.26,3.629,35.084,NA,NA,31.1,0,NA,ADCP_NE,Permanent,Single,2015-08-21,Inshore,UK
CalVal_Aug2015_13,FLK,2015,CalVal,24.8966333333333,-80.6153,CalVal_SE,08/21/15,08/21/15,11:47:00 AM,03:47:00 PM,0,2037.83,2358.07,7.978,486.232,3.774,35.089,NA,NA,31.2,0,NA,CalVal_SE,Permanent,Single,2015-08-21,Inshore,UK
CalVal_Aug2015_14,FLK,2015,CalVal,24.8955833333333,-80.6166333333333,CalVal_S,08/21/15,08/21/15,11:52:00 AM,03:52:00 PM,0,2034.64,2355.45,7.978,484.783,3.784,35.014,NA,NA,31.3,0,NA,CalVal_S,Permanent,Single,2015-08-21,Inshore,UK
CalVal_Aug2015_15,FLK,2015,CalVal,24.8964666666667,-80.6182,ADCP_S,08/21/15,08/21/15,11:58:00 AM,03:58:00 PM,0,2035.73,2347.08,7.965,501.621,3.673,35.088,NA,NA,31.2,0,NA,ADCP_S,Permanent,Single,2015-08-21,Inshore,UK
CalVal_Aug2015_16,FLK,2015,CalVal,24.8854666666667,-80.6041,Transect 2,08/21/15,08/21/15,12:13:00 PM,04:13:00 PM,0,2017.43,2357.34,8.016,437.401,4.003,34.62,NA,NA,31.1,0,NA,Transect 2,Permanent,Single,2015-08-21,Mid channel,UK
CalVal_Aug2015_17,FLK,2015,CalVal,24.8694,-80.585,Transect 3,08/21/15,08/21/15,12:29:00 PM,04:29:00 PM,0,1997.37,2350.42,8.059,388.714,4.136,34.135,NA,NA,30.07,0,NA,Transect 3,Permanent,Single,2015-08-21,Offshore,UK
CalVal_Aug2015_18,FLK,2015,CalVal,24.8547,-80.56742,Transect 4,08/21/15,08/21/15,12:47:00 PM,04:47:00 PM,0,2003.95,2358.76,8.051,398.822,4.186,34.031,NA,NA,30.8,0,NA,Transect 4,Permanent,Single,2015-08-21,Oceanic,UK
CalVal_Sep2015_1,FLK,2015,CalVal,24.8977,-80.61817,MapCO2_Buoy,09/04/15,09/04/15,02:44:00 PM,06:44:00 PM,0,2057.73,2371.99,7.964,510.546,3.761,34.548,NA,NA,31.8,0,NA,MapCO2_Buoy,Permanent,Single,2015-09-04,Inshore,UK
CalVal_Sep2015_2,FLK,2015,CalVal,24.8977,-80.61817,MapCO2_Buoy,09/04/15,09/04/15,02:57:00 PM,06:57:00 PM,0,2056.83,2366.47,7.958,518.672,3.709,34.523,NA,NA,31.8,0,NA,MapCO2_Buoy,Permanent,Single,2015-09-04,Inshore,UK
CalVal_Sep2015_3,FLK,2015,CalVal,24.8982666666667,-80.6173833333333,CalVal_N,09/04/15,09/04/15,03:10:00 PM,07:10:00 PM,0,2057.88,2365.12,7.948,532.564,3.691,34.569,NA,NA,32.2,0,NA,CalVal_N,Permanent,Single,2015-09-04,Inshore,UK
CalVal_Sep2015_4,FLK,2015,CalVal,24.8981833333333,-80.6160666666667,ADCP_NE,09/04/15,09/04/15,03:27:00 PM,07:27:00 PM,0,2056.44,2362.18,7.946,534.92,3.673,34.57,NA,NA,32.2,0,NA,ADCP_NE,Permanent,Single,2015-09-04,Inshore,UK
CalVal_Sep2015_5,FLK,2015,CalVal,24.8966333333333,-80.6153,CalVal_SE,09/04/15,09/04/15,03:39:00 PM,07:39:00 PM,0,2011.83,2377.81,8.037,414.676,4.339,34.486,NA,NA,32.3,0,NA,CalVal_SE,Permanent,Single,2015-09-04,Inshore,UK
CalVal_Sep2015_6,FLK,2015,CalVal,24.8955833333333,-80.6166333333333,CalVal_S,09/04/15,09/04/15,04:02:00 PM,08:02:00 PM,0,2011.03,2370.99,8.029,422.247,4.261,34.561,NA,NA,32.2,0,NA,CalVal_S,Permanent,Single,2015-09-04,Inshore,UK
CalVal_Sep2015_7,FLK,2015,CalVal,24.8964666666667,-80.6182,ADCP_S,09/04/15,09/04/15,04:09:00 PM,08:09:00 PM,0,2033.73,2364.22,7.985,478.764,3.938,34.591,NA,NA,32.2,0,NA,ADCP_S,Permanent,Single,2015-09-04,Inshore,UK
CalVal_Sep2015_16,FLK,2015,CalVal,24.8547,-80.56742,Transect 4,09/22/15,09/22/15,12:25:00 PM,04:25:00 PM,0,2017.97,2343.28,8.005,450.793,3.832,34.471,NA,NA,30.6,0,NA,Transect 4,Permanent,Single,2015-09-22,Oceanic,UK
CalVal_Sep2015_17,FLK,2015,CalVal,24.8694,-80.585,Transect 3,09/22/15,09/22/15,12:38:00 PM,04:38:00 PM,0,1997.35,2358.17,8.054,392.661,4.217,34.61,NA,NA,30.7,0,NA,Transect 3,Permanent,Single,2015-09-22,Offshore,UK
CalVal_Sep2015_18,FLK,2015,CalVal,24.8854666666667,-80.6041,Transect 2,09/22/15,09/22/15,12:49:00 PM,04:49:00 PM,0,2011.34,2339.51,8.011,442.907,3.872,34.28,NA,NA,30.7,0,NA,Transect 2,Permanent,Single,2015-09-22,Mid channel,UK
CalVal_Sep2015_8,FLK,2015,CalVal,24.8964666666667,-80.6182,ADCP_S,09/22/15,09/22/15,01:02:00 PM,05:02:00 PM,0,2016.69,2314.4,7.973,489.573,3.538,33.982,NA,NA,30.4,0,NA,ADCP_S,Permanent,Single,2015-09-22,Inshore,UK
CalVal_Sep2015_9,FLK,2015,CalVal,24.8955833333333,-80.6166333333333,CalVal_S,09/22/15,09/22/15,01:09:00 PM,05:09:00 PM,0,2021.37,2308.96,7.956,511.853,3.426,34.008,NA,NA,30.4,0,NA,CalVal_S,Permanent,Single,2015-09-22,Inshore,UK
CalVal_Sep2015_10,FLK,2015,CalVal,24.8966333333333,-80.6153,CalVal_SE,09/22/15,09/22/15,01:13:00 PM,05:13:00 PM,0,2020.33,2316.82,7.967,497.769,3.53,34.017,NA,NA,30.6,0,NA,CalVal_SE,Permanent,Single,2015-09-22,Inshore,UK
CalVal_Sep2015_11,FLK,2015,CalVal,24.8981833333333,-80.6160666666667,ADCP_NE,09/22/15,09/22/15,01:21:00 PM,05:21:00 PM,0,2016.1,2302.24,7.953,514.29,3.41,33.999,NA,NA,30.5,0,NA,ADCP_NE,Permanent,Single,2015-09-22,Inshore,UK
CalVal_Sep2015_12,FLK,2015,CalVal,24.8982666666667,-80.6173833333333,CalVal_N,09/22/15,09/22/15,01:27:00 PM,05:27:00 PM,0,2013.26,2298.32,7.949,519.117,3.401,33.995,NA,NA,30.7,0,NA,CalVal_N,Permanent,Single,2015-09-22,Inshore,UK
CalVal_Sep2015_13,FLK,2015,CalVal,24.9052,-80.6266,Transect 1,09/22/15,09/22/15,01:37:00 PM,05:37:00 PM,0,1963.07,2253.1,7.955,499.86,3.442,33.987,NA,NA,31.4,0,NA,Transect 1,Permanent,Single,2015-09-22,Inshore,UK
CalVal_Sep2015_14,FLK,2015,CalVal,24.8977,-80.61817,MapCO2_Buoy,09/22/15,09/22/15,02:17:00 PM,06:17:00 PM,0,2003.42,2281.73,7.941,526.972,3.317,34.01,NA,NA,30.6,0,NA,MapCO2_Buoy,Permanent,Single,2015-09-22,Inshore,UK
CalVal_Sep2015_15,FLK,2015,CalVal,24.8977,-80.61817,MapCO2_Buoy,09/22/15,09/22/15,02:20:00 PM,06:20:00 PM,0,2021.66,2288.29,7.92,561.478,3.198,34,NA,NA,30.6,0,NA,MapCO2_Buoy,Permanent,Single,2015-09-22,Inshore,UK
CalVal_Oct2015_5,FLK,2015,CalVal,24.8982666666667,-80.6173833333333,CalVal_N,10/07/15,10/07/15,12:20:00 PM,04:20:00 PM,0,1953.14,2276.08,8.023,410.171,3.625,36.205,NA,NA,28.3,0,NA,CalVal_N,Permanent,Single,2015-10-07,Inshore,UK
CalVal_Oct2015_6,FLK,2015,CalVal,24.8981833333333,-80.6160666666667,ADCP_NE,10/07/15,10/07/15,12:35:00 PM,04:35:00 PM,0,1950.08,2285.85,8.042,390.35,3.761,36.227,NA,NA,28.3,0,NA,ADCP_NE,Permanent,Single,2015-10-07,Inshore,UK
CalVal_Oct2015_7,FLK,2015,CalVal,24.8966333333333,-80.6153,CalVal_SE,10/07/15,10/07/15,12:52:00 PM,04:52:00 PM,0,1949.46,2274.39,8.028,404.95,3.648,36.129,NA,NA,28.3,0,NA,CalVal_SE,Permanent,Single,2015-10-07,Inshore,UK
CalVal_Oct2015_1,FLK,2015,CalVal,24.8955833333333,-80.6166333333333,CalVal_S,10/07/15,10/07/15,01:07:00 PM,05:07:00 PM,0,1949.48,2281.4,8.038,394.675,3.733,35.983,NA,NA,28.4,0,NA,CalVal_S,Permanent,Single,2015-10-07,Inshore,UK
CalVal_Oct2015_2,FLK,2015,CalVal,24.8964666666667,-80.6182,ADCP_S,10/07/15,10/07/15,01:17:00 PM,05:17:00 PM,0,1946.45,2277.17,8.037,395.341,3.708,36.136,NA,NA,28.3,0,NA,ADCP_S,Permanent,Single,2015-10-07,Inshore,UK
