"CTDID","Region","Year","Mission","Location","Latitude","Longitude","ESTDate","UTCDate","EST.Time","UTCTime","Sample_Depth_m","DIC","TA","pH","pCO2","Aragonite_Sat_W","Salinity_Bottle","Conductivity_Sm","Salinity_CTD","Temperature_C","Pressure_db","Density_Sigmat","SiteID","Survey_design","Sample_frequency","Date","Season","Precipitation","Month","BestSalinity","TA_0","DIC_0","nTA","nDIC"
"calval_mar2012","FLK",2012,"CalVal","FLK",24.89826667,-80.61738333,"03/23/12","03/23/12","12:40:00 PM","04:40:00 PM",0,2037.46,2379.61,8.108,345.5,3.88,NA,NA,34.71,24.8,0,NA,"CalVal_N","Permanent","Single",2012-03-23,"Spring","Dry","March",34.71,2761.01831444374,3227.6940676083,2376.4233560591,2027.5156646613
"calval_mar2012","FLK",2012,"CalVal","FLK",NA,NA,"03/23/12","03/23/12","01:02:00 PM","05:02:00 PM",0,2015.78,2366.11,8.12,331.4,3.97,NA,NA,34.61,25.05,0,NA,"ADCP_S","Permanent","Single",2012-03-23,"Spring","Dry","March",34.61,2761.01831444374,3227.6940676083,2361.6600074362,2002.12364384955
"calval_mar2012","FLK",2012,"CalVal","FLK",24.89558333,-80.61663333,"03/23/12","03/23/12","01:16:00 PM","05:16:00 PM",0,2024.92,2373.16,8.114,338.6,3.95,NA,NA,34.6,25.2,0,NA,"CalVal_S","Permanent","Single",2012-03-23,"Spring","Dry","March",34.6,2761.01831444374,3227.6940676083,2368.67608885036,2011.0150974843
"calval_mar2012","FLK",2012,"CalVal","FLK",24.89663333,-80.6153,"03/23/12","03/23/12","01:32:00 PM","05:32:00 PM",0,2039.81,2373.26,8.089,364.2,3.81,NA,NA,34.52,25.41,0,NA,"CalVal_SE","Permanent","Single",2012-03-23,"Spring","Dry","March",34.52,2761.01831444374,3227.6940676083,2367.86822737738,2023.29249268679
"calval_mar2012","FLK",2012,"CalVal","FLK",NA,NA,"03/23/12","03/23/12","01:45:00 PM","05:45:00 PM",0,2026.46,2372.81,8.112,340.5,3.93,NA,NA,34.64,25.11,0,NA,"ADCP_N","Permanent","Single",2012-03-23,"Spring","Dry","March",34.64,2761.01831444374,3227.6940676083,2368.77550250578,2013.97604317728
"calval_mar2012","FLK",2012,"CalVal","FLK",NA,NA,"03/23/12","03/23/12","01:57:00 PM","05:57:00 PM",0,2001.39,2365.26,8.141,311.7,4.1,NA,NA,34.67,25,0,NA,"ADCP_N","Permanent","Single",2012-03-23,"Spring","Dry","March",34.67,2761.01831444374,3227.6940676083,2361.49304748294,1989.71765092845
"calval_apr2012","FLK",2012,"CalVal","FLK",NA,NA,"04/04/12","04/04/12","08:44:00 AM","12:44:00 PM",0,1990.75,2370.91,8.137,312.4,4.26,NA,NA,35.54,26.11,0,NA,"ADCP_S","Permanent","Single",2012-04-04,"Spring","Dry","April",35.54,2761.01831444374,3227.6940676083,2376.83736324703,2009.54431053766
"calval_apr2012","FLK",2012,"CalVal","FLK",24.89558333,-80.61663333,"04/04/12","04/04/12","08:58:00 AM","12:58:00 PM",0,1976.35,2370.06,8.154,296.2,4.4,NA,NA,35.63,26.2,0,NA,"CalVal_S","Permanent","Single",2012-04-04,"Spring","Dry","April",35.63,2761.01831444374,3227.6940676083,2376.97281891944,1998.47592653924
"calval_apr2012","FLK",2012,"CalVal","FLK",24.89663333,-80.6153,"04/04/12","04/04/12","09:09:00 AM","01:09:00 PM",0,1976.2,2363.61,8.146,302,4.32,NA,NA,35.7,26.11,0,NA,"CalVal_SE","Permanent","Single",2012-04-04,"Spring","Dry","April",35.7,2761.01831444374,3227.6940676083,2371.40231989105,2000.73909936487
"calval_apr2012","FLK",2012,"CalVal","FLK",NA,NA,"04/04/12","04/04/12","09:21:00 AM","01:21:00 PM",0,1973.45,2361.61,8.145,302.3,4.33,NA,NA,35.77,26.22,0,NA,"ADCP_N","Permanent","Single",2012-04-04,"Spring","Dry","April",35.77,2761.01831444374,3227.6940676083,2370.2078306436,2000.44938306006
"calval_apr2012","FLK",2012,"CalVal","FLK",24.89826667,-80.61738333,"04/04/12","04/04/12","09:34:00 AM","01:34:00 PM",0,1986.82,2360.91,8.125,320.9,4.18,NA,NA,35.73,26.23,0,NA,"CalVal_N","Permanent","Single",2012-04-04,"Spring","Dry","April",35.73,2761.01831444374,3227.6940676083,2369.0846171157,2012.17231092511
"calval_apr2012","FLK",2012,"CalVal","FLK",24.9052,-80.6266,"04/20/12","04/20/12","11:00:00 AM","03:00:00 PM",0,1795.09,2254.41,8.258,203.6,4.96,NA,NA,36.1,26.42,0,NA,"Transect 1","Permanent","Single",2012-04-20,"Spring","Dry","April",36.1,2761.01831444374,3227.6940676083,2269.84681844565,1838.74275552269
"calval_apr2012","FLK",2012,"CalVal","FLK",24.88546667,-80.6041,"04/20/12","04/20/12","11:20:00 AM","03:20:00 PM",0,2026.09,2376.46,8.103,347.1,3.95,NA,NA,35.35,25.48,0,NA,"Transect 2","Permanent","Single",2012-04-20,"Spring","Dry","April",35.35,2761.01831444374,3227.6940676083,2380.2675080638,2037.98706997632
"calval_apr2012","FLK",2012,"CalVal","FLK",24.8547,-80.56741667,"04/20/12","04/20/12","12:40:00 PM","04:40:00 PM",0,2027.67,2367.81,8.08,367.7,3.84,NA,NA,35.57,25.83,0,NA,"Transect 4","Permanent","Single",2012-04-20,"Spring","Dry","April",35.57,2761.01831444374,3227.6940676083,2374.1110609849,2046.90007361644
"calval_apr2012","FLK",2012,"CalVal","FLK",24.8547,-80.56741667,"04/20/12","04/20/12","01:06:00 PM","05:06:00 PM",0,2030.37,2369.11,8.075,373.4,3.83,NA,NA,35.55,26.04,0,NA,"Transect 4","Permanent","Single",2012-04-20,"Spring","Dry","April",35.55,2761.01831444374,3227.6940676083,2375.17327912642,2048.89400104598
"calval_apr2012","FLK",2012,"CalVal","FLK",24.8694,-80.585,"04/20/12","04/20/12","01:22:00 PM","05:22:00 PM",0,2033.94,2364.56,8.067,381.8,3.73,NA,NA,35.56,25.77,0,NA,"Transect 3","Permanent","Single",2012-04-20,"Spring","Dry","April",35.56,2761.01831444374,3227.6940676083,2370.80343802274,2052.73927665525
"calval_may2012","FLK",2012,"CalVal","FLK",24.89826667,-80.61738333,"05/04/12","05/04/12","12:00:00 PM","04:00:00 PM",0,2040.61,2336.51,8.027,425.1,3.38,NA,NA,34.89,25.47,0,NA,"CalVal_N","Permanent","Single",2012-05-04,"Spring","Wet","May",34.89,2761.01831444374,3227.6940676083,2335.17162468934,2036.8674019078
"calval_may2012","FLK",2012,"CalVal","FLK",24.89818333,-80.61606667,"05/04/12","05/04/12","12:10:00 PM","04:10:00 PM",0,2037.66,2331.21,8.026,425.5,3.36,NA,NA,34.78,25.4,0,NA,"ADCP_NE","Permanent","Single",2012-05-04,"Spring","Wet","May",34.78,2761.01831444374,3227.6940676083,2328.49125850553,2030.13246995762
"calval_may2012","FLK",2012,"CalVal","FLK",24.89663333,-80.6153,"05/04/12","05/04/12","12:20:00 PM","04:20:00 PM",0,2048.19,2334.81,8.009,446.5,3.28,NA,NA,35,25.55,0,NA,"CalVal_SE","Permanent","Single",2012-05-04,"Spring","Wet","May",35,2761.01831444374,3227.6940676083,2334.81,2048.19
"calval_may2012","FLK",2012,"CalVal","FLK",24.89558333,-80.61663333,"05/04/12","05/04/12","12:32:00 PM","04:32:00 PM",0,2045.15,2332.46,8.01,444.9,3.29,NA,NA,34.91,25.65,0,NA,"CalVal_S","Permanent","Single",2012-05-04,"Spring","Wet","May",34.91,2761.01831444374,3227.6940676083,2331.35515186766,2042.10133296807
"calval_may2012","FLK",2012,"CalVal","FLK",24.89646667,-80.6182,"05/04/12","05/04/12","12:40:00 PM","04:40:00 PM",0,2035.16,2322.51,8.014,439,3.29,NA,NA,34.83,25.59,0,NA,"ADCP_S","Permanent","Single",2012-05-04,"Spring","Wet","May",34.83,2761.01831444374,3227.6940676083,2320.36970676269,2029.33942028443
"calval_may2012","FLK",2012,"CalVal","FLK",24.89826667,-80.61738333,"05/15/12","05/15/12","09:15:00 AM","01:15:00 PM",0,1952.37,2336.01,8.126,316.2,4.35,NA,NA,35,28,0,NA,"CalVal_N","Permanent","Single",2012-05-15,"Spring","Wet","May",35,2761.01831444374,3227.6940676083,2336.01,1952.37
"calval_may2012","FLK",2012,"CalVal","FLK",24.89818333,-80.61606667,"05/15/12","05/15/12","09:28:00 AM","01:28:00 PM",0,1948.6,2333.46,8.103,331.7,4.23,NA,NA,37.2,27.9,0,NA,"ADCP_NE","Permanent","Single",2012-05-15,"Spring","Wet","May",37.2,2761.01831444374,3227.6940676083,2358.74570676818,2024.24534808436
"calval_may2012","FLK",2012,"CalVal","FLK",24.89558333,-80.61663333,"05/15/12","05/15/12","09:40:00 AM","01:40:00 PM",0,1948.41,2325.76,8.093,340.2,4.15,NA,NA,37.2,27.9,0,NA,"CalVal_S","Permanent","Single",2012-05-15,"Spring","Wet","May",37.2,2761.01831444374,3227.6940676083,2351.50108311226,2024.0665846435
"calval_may2012","FLK",2012,"CalVal","FLK",24.89558333,-80.61663333,"05/15/12","05/15/12","09:55:00 AM","01:55:00 PM",0,1949.12,2317.66,8.077,354.1,4.05,NA,NA,37.4,28,0,NA,"CalVal_S","Permanent","Single",2012-05-15,"Spring","Wet","May",37.4,2761.01831444374,3227.6940676083,2346.11080092687,2031.16753375027
"calval_may2012","FLK",2012,"CalVal","FLK",24.89663333,-80.6153,"05/15/12","05/15/12","10:05:00 AM","02:05:00 PM",0,1950.24,2331.21,8.094,339.3,4.18,NA,NA,37.5,27.9,0,NA,"CalVal_SE","Permanent","Single",2012-05-15,"Spring","Wet","May",37.5,2761.01831444374,3227.6940676083,2359.86388762958,2035.40360450722
"calval_may2012","FLK",2012,"CalVal","FLK",24.89646667,-80.6182,"05/15/12","05/15/12","10:15:00 AM","02:15:00 PM",0,1934.16,2307.61,8.091,339.2,4.13,NA,NA,37.4,28,0,NA,"ADCP_S","Permanent","Single",2012-05-15,"Spring","Wet","May",37.4,2761.01831444374,3227.6940676083,2336.70572071297,2017.16753375027
"calval_may2012","FLK",2012,"CalVal","FLK",24.89826667,-80.61738333,"05/15/12","05/15/12","10:35:00 AM","02:35:00 PM",0,1935.43,2315.11,8.097,333.4,4.19,NA,NA,37.5,28,0,NA,"CalVal_N","Permanent","Single",2012-05-15,"Spring","Wet","May",37.5,2761.01831444374,3227.6940676083,2344.83722096292,2021.58093784055
"calval_may2012","FLK",2012,"CalVal","FLK",24.8547,-80.56741667,"05/21/12","05/21/12","10:50:00 AM","02:50:00 PM",0,1948.67,2362.56,8.065,365.2,3.83,NA,NA,37.1,28,0,NA,"Transect 4","Permanent","Single",2012-05-21,"Spring","Wet","May",37.1,2761.01831444374,3227.6940676083,2385.1142442138,2021.06758873255
"calval_may2012","FLK",2012,"CalVal","FLK",24.8694,-80.585,"05/21/12","05/21/12","11:05:00 AM","03:05:00 PM",0,1913.25,2360.61,8.014,410,3.43,NA,NA,37.3,28.6,0,NA,"Transect 3","Permanent","Single",2012-05-21,"Spring","Wet","May",37.3,2761.01831444374,3227.6940676083,2385.3000569228,1994.30151087129
"calval_may2012","FLK",2012,"CalVal","FLK",24.88546667,-80.6041,"05/21/12","05/21/12","11:20:00 AM","03:20:00 PM",0,NA,2298.46,NA,NA,NA,NA,NA,37.3,27.2,0,NA,"Transect 2","Permanent","Single",2012-05-21,"Spring","Wet","May",37.3,2761.01831444374,3227.6940676083,2326.98236255283,NA
"calval_may2012","FLK",2012,"CalVal","FLK",24.9052,-80.6266,"05/21/12","05/21/12","11:45:00 AM","03:45:00 PM",0,NA,2223.76,NA,NA,NA,NA,NA,36.7,27.7,0,NA,"Transect 1","Permanent","Single",2012-05-21,"Spring","Wet","May",36.7,2761.01831444374,3227.6940676083,2248.64662491974,NA
"calval_may2012","FLK",2012,"CalVal","FLK",24.89826667,-80.61738333,"05/28/12","05/28/12","12:18:00 PM","04:18:00 PM",0,1863.72,2232.66,8.089,330.8,4.07,NA,NA,36.4,29.1,0,NA,"CalVal_N","Permanent","Single",2012-05-28,"Spring","Wet","May",36.4,2761.01831444374,3227.6940676083,2252.98147363245,1916.18054106186
"calval_may2012","FLK",2012,"CalVal","FLK",24.89558333,-80.61663333,"05/28/12","05/28/12","12:30:00 PM","04:30:00 PM",0,1871.11,2246.16,8.087,334.5,4.11,NA,NA,36.4,29.3,0,NA,"CalVal_S","Permanent","Single",2012-05-28,"Spring","Wet","May",36.4,2761.01831444374,3227.6940676083,2265.96224286322,1923.28631029263
"calval_may2012","FLK",2012,"CalVal","FLK",24.89663333,-80.6153,"05/28/12","05/28/12","12:37:00 PM","04:37:00 PM",0,1877.62,2252.51,8.085,336.9,4.11,NA,NA,36.4,29.3,0,NA,"CalVal_SE","Permanent","Single",2012-05-28,"Spring","Wet","May",36.4,2761.01831444374,3227.6940676083,2272.06801209399,1929.54592567724
"calval_may2012","FLK",2012,"CalVal","FLK",24.89818333,-80.61606667,"05/28/12","05/28/12","12:45:00 PM","04:45:00 PM",0,1864.01,2242.26,8.092,328.5,4.14,NA,NA,36.6,29.2,0,NA,"ADCP_NE","Permanent","Single",2012-05-28,"Spring","Wet","May",36.6,2761.01831444374,3227.6940676083,2264.93795910137,1923.62460404845
"calval_may2012","FLK",2012,"CalVal","FLK",NA,NA,"05/28/12","05/28/12","12:55:00 PM","04:55:00 PM",0,1862.47,2242.21,8.099,321.2,4.18,NA,NA,36.4,29.3,0,NA,"ADCP_SW","Permanent","Single",2012-05-28,"Spring","Wet","May",36.4,2761.01831444374,3227.6940676083,2262.16416594014,1914.97861798493
"calval_jun2012","FLK",2012,"CalVal","FLK",NA,NA,"06/12/12","06/12/12","11:05:00 AM","03:05:00 PM",0,1920.34,2280.01,8.063,362.7,4.03,NA,NA,36.9,29.3,0,NA,"ADCP_S","Permanent","Single",2012-06-12,"Summer","Wet","June",36.9,2761.01831444374,3227.6940676083,2304.77736578437,1987.65633410449
"calval_jun2012","FLK",2012,"CalVal","FLK",24.89558333,-80.61663333,"06/12/12","06/12/12","11:20:00 AM","03:20:00 PM",0,1909.64,2287.86,8.075,350.6,4.14,NA,NA,37,29.4,0,NA,"CalVal_S","Permanent","Single",2012-06-12,"Summer","Wet","June",37,2761.01831444374,3227.6940676083,2313.43612510507,1980.88616581667
"calval_jun2012","FLK",2012,"CalVal","FLK",24.89826667,-80.61738333,"06/12/12","06/12/12","11:30:00 AM","03:30:00 PM",0,1912.7,2276.86,8.044,382,3.91,NA,NA,37,29.4,0,NA,"CalVal_N","Permanent","Single",2012-06-12,"Summer","Wet","June",37,2761.01831444374,3227.6940676083,2303.03071969966,1983.78076041126
"calval_jun2012","FLK",2012,"CalVal","FLK",24.89663333,-80.6153,"06/12/12","06/12/12","11:45:00 AM","03:45:00 PM",0,1914.06,2288.46,8.069,356.7,4.1,NA,NA,37,29.4,0,NA,"CalVal_SE","Permanent","Single",2012-06-12,"Summer","Wet","June",37,2761.01831444374,3227.6940676083,2314.00369267263,1985.06724689775
"calval_jun2012","FLK",2012,"CalVal","FLK",NA,NA,"06/12/12","06/12/12","11:55:00 AM","03:55:00 PM",0,1916.96,2289.31,8.065,361.3,4.08,NA,NA,37.1,29.4,0,NA,"ADCP_NE","Permanent","Single",2012-06-12,"Summer","Wet","June",37.1,2761.01831444374,3227.6940676083,2316.01047062889,1991.15249439292
"calval_jun2012","FLK",2012,"CalVal","FLK",24.8547,-80.56741667,"06/22/12","06/22/12","12:20:00 PM","04:20:00 PM",0,1976.63,2363.86,8.039,405,3.89,NA,NA,37.1,28.2,0,NA,"Transect 4","Permanent","Single",2012-06-22,"Summer","Wet","June",37.1,2761.01831444374,3227.6940676083,2386.34065930814,2047.44494722311
"calval_jun2012","FLK",2012,"CalVal","FLK",24.8694,-80.585,"06/22/12","06/22/12","12:40:00 PM","04:40:00 PM",0,2012.27,2360.71,8.028,417.5,3.81,NA,NA,37.2,28.2,0,NA,"Transect 3","Permanent","Single",2012-06-22,"Summer","Wet","June",37.2,2761.01831444374,3227.6940676083,2384.38414762839,2084.14991797684
"calval_jun2012","FLK",2012,"CalVal","FLK",24.88546667,-80.6041,"06/22/12","06/22/12","12:55:00 PM","04:55:00 PM",0,2015.96,2366.26,8.03,415.6,3.81,NA,NA,37.3,27.9,0,NA,"Transect 2","Permanent","Single",2012-06-22,"Summer","Wet","June",37.3,2761.01831444374,3227.6940676083,2390.60166550189,2090.67818647451
"calval_jun2012","FLK",2012,"CalVal","FLK",24.9052,-80.6266,"06/22/12","06/22/12","01:32:00 PM","05:32:00 PM",0,2021.44,2342.81,8.067,369.2,3.99,NA,NA,37.5,27.7,0,NA,"Transect 1","Permanent","Single",2012-06-22,"Summer","Wet","June",37.5,2761.01831444374,3227.6940676083,2370.69055429625,2101.85693784055
"calval_jul2012","FLK",2012,"CalVal","FLK",NA,NA,"07/07/12","07/07/12","03:15:00 PM","07:15:00 PM",0,1961.07,2324.71,8.032,402.8,4.02,NA,NA,37.2,30.2,0,NA,"ADCP_SW","Permanent","Single",2012-07-07,"Summer","Wet","July",37.2,2761.01831444374,3227.6940676083,2350.51317988646,2035.97787496608
"calval_jul2012","FLK",2012,"CalVal","FLK",24.89558333,-80.61663333,"07/07/12","07/07/12","03:30:00 PM","07:30:00 PM",0,1961.31,2331.11,8.034,401.1,4.07,NA,NA,37.3,30.4,0,NA,"CalVal_S","Permanent","Single",2012-07-07,"Summer","Wet","July",37.3,2761.01831444374,3227.6940676083,2357.61909177535,2039.3980256166
"calval_jul2012","FLK",2012,"CalVal","FLK",24.89663333,-80.6153,"07/07/12","07/07/12","03:40:00 PM","07:40:00 PM",0,1965.63,2323.86,8.016,421.7,3.94,NA,NA,37.3,30.4,0,NA,"CalVal_SE","Permanent","Single",2012-07-07,"Summer","Wet","July",37.3,2761.01831444374,3227.6940676083,2350.81614271369,2043.45164491955
"calval_jul2012","FLK",2012,"CalVal","FLK",24.89818333,-80.61606667,"07/07/12","07/07/12","03:50:00 PM","07:50:00 PM",0,1961.35,2322.86,8.035,398.1,4.07,NA,NA,37.2,30.4,0,NA,"ADCP_NE","Permanent","Single",2012-07-07,"Summer","Wet","July",37.2,2761.01831444374,3227.6940676083,2348.77258848861,2036.2413158263
"calval_jul2012","FLK",2012,"CalVal","FLK",24.89826667,-80.61738333,"07/07/12","07/07/12","04:00:00 PM","08:00:00 PM",0,1968.92,2324.56,8.034,399.2,4.07,NA,NA,37.3,30.4,0,NA,"CalVal_N","Permanent","Single",2012-07-07,"Summer","Wet","July",37.3,2761.01831444374,3227.6940676083,2351.47297917482,2046.53877628684
"calval_jul2012","FLK",2012,"CalVal","FLK",24.89826667,-80.61738333,"07/07/12","07/07/12","04:05:00 PM","08:05:00 PM",0,1967.15,2328.36,8.039,394.4,4.11,NA,NA,37.3,30.4,0,NA,"CalVal_N","Permanent","Single",2012-07-07,"Summer","Wet","July",37.3,2761.01831444374,3227.6940676083,2355.03866282093,2044.87791837799
"calval_jul2012","FLK",2012,"CalVal","FLK",24.89826667,-80.61738333,"07/23/12","07/23/12","12:44:00 PM","04:44:00 PM",0,1952.14,2327.86,8.062,370.9,4.18,NA,NA,36.9,29.8,0,NA,"CalVal_N","Permanent","Single",2012-07-23,"Summer","Wet","July",36.9,2761.01831444374,3227.6940676083,2350.16354464615,2017.81893573051
"calval_jul2012","FLK",2012,"CalVal","FLK",24.89818333,-80.61606667,"07/23/12","07/23/12","12:55:00 PM","04:55:00 PM",0,1956.22,2323.26,8.065,367.7,4.17,NA,NA,36.8,29.7,0,NA,"ADCP_NE","Permanent","Single",2012-07-23,"Summer","Wet","July",36.8,2761.01831444374,3227.6940676083,2344.67209146736,2018.41166635041
"calval_jul2012","FLK",2012,"CalVal","FLK",24.89818333,-80.61606667,"07/23/12","07/23/12","01:05:00 PM","05:05:00 PM",0,1959,2329.06,8.055,380.4,4.12,NA,NA,36.6,29.8,0,NA,"ADCP_NE","Permanent","Single",2012-07-23,"Summer","Wet","July",36.6,2761.01831444374,3227.6940676083,2347.94342358224,2014.46203574244
"calval_jul2012","FLK",2012,"CalVal","FLK",24.89663333,-80.6153,"07/23/12","07/23/12","01:15:00 PM","05:15:00 PM",0,1957.34,2341.61,8.056,379.1,4.15,NA,NA,37.1,29.7,0,NA,"CalVal_SE","Permanent","Single",2012-07-23,"Summer","Wet","July",37.1,2761.01831444374,3227.6940676083,2365.3500932704,2029.24683401556
"calval_jul2012","FLK",2012,"CalVal","FLK",24.89558333,-80.61663333,"07/23/12","07/23/12","01:25:00 PM","05:25:00 PM",0,1950.98,2332.36,8.052,382.8,4.11,NA,NA,37,29.8,0,NA,"CalVal_S","Permanent","Single",2012-07-23,"Summer","Wet","July",37,2761.01831444374,3227.6940676083,2355.53071969966,2019.99157122207
"calval_jul2012","FLK",2012,"CalVal","FLK",NA,NA,"07/23/12","07/23/12","01:35:00 PM","05:35:00 PM",0,1964.29,2325.11,8.054,379,4.12,NA,NA,37,29.8,0,NA,"ADCP_SW","Permanent","Single",2012-07-23,"Summer","Wet","July",37,2761.01831444374,3227.6940676083,2348.67261159155,2032.58211176261
"calval_aug2012","FLK",2012,"CalVal","FLK",24.8547,-80.56741667,"08/01/12","08/01/12","09:45:00 AM","01:45:00 PM",0,1966.4,2366.71,8.009,440.4,3.86,NA,NA,37,29.6,0,NA,"Transect 4","Permanent","Single",2012-08-01,"Summer","Wet","August",37,2761.01831444374,3227.6940676083,2388.0239629429,2034.57805770856
"calval_aug2012","FLK",2012,"CalVal","FLK",24.8694,-80.585,"08/01/12","08/01/12","10:00:00 AM","02:00:00 PM",0,2019.72,2340.46,8,447.4,3.81,NA,NA,36.7,30.1,0,NA,"Transect 3","Permanent","Single",2012-08-01,"Summer","Wet","August",36.7,2761.01831444374,3227.6940676083,2359.94090284889,2075.6752020418
"calval_aug2012","FLK",2012,"CalVal","FLK",24.88546667,-80.6041,"08/01/12","08/01/12","10:15:00 AM","02:15:00 PM",0,1872.65,2338.21,8.04,395,4.18,NA,NA,37.2,30.8,0,NA,"Transect 2","Permanent","Single",2012-08-01,"Summer","Wet","August",37.2,2761.01831444374,3227.6940676083,2363.21479278968,1952.78701475103
"calval_aug2012","FLK",2012,"CalVal","FLK",24.88546667,-80.6041,"08/01/12","08/01/12","10:25:00 AM","02:25:00 PM",0,1999.7,2350.21,8.052,382.2,4.33,NA,NA,37.3,31.1,0,NA,"Transect 2","Permanent","Single",2012-08-01,"Summer","Wet","August",37.3,2761.01831444374,3227.6940676083,2375.54134378608,2075.42081382035
"calval_aug2012","FLK",2012,"CalVal","FLK",24.9052,-80.6266,"08/01/12","08/01/12","10:50:00 AM","02:50:00 PM",0,1959.02,2205.41,7.974,446.8,3.64,NA,NA,37.4,31.9,0,NA,"Transect 1","Permanent","Single",2012-08-01,"Summer","Wet","August",37.4,2761.01831444374,3227.6940676083,2241.06400948302,2040.43223963262
"calval_aug2012","FLK",2012,"CalVal","FLK",24.89826667,-80.61738333,"08/14/12","08/14/12","01:10:00 PM","05:10:00 PM",0,1886.87,2251.06,8.048,371.7,4.06,NA,NA,36.8,30.8,0,NA,"CalVal_N","Permanent","Single",2012-08-14,"Summer","Wet","August",36.8,2761.01831444374,3227.6940676083,2276.00361320649,1952.45378591562
"calval_aug2012","FLK",2012,"CalVal","FLK",24.89826667,-80.61738333,"08/14/12","08/14/12","01:20:00 PM","05:20:00 PM",0,1882.53,2250.26,8.051,368,4.09,NA,NA,36.9,30.9,0,NA,"CalVal_N","Permanent","Single",2012-08-14,"Summer","Wet","August",36.9,2761.01831444374,3227.6940676083,2276.55920860279,1951.79319047306
"calval_aug2012","FLK",2012,"CalVal","FLK",NA,NA,"08/14/12","08/14/12","01:30:00 PM","05:30:00 PM",0,1870.03,2255.66,8.079,340,4.29,NA,NA,36.7,30.9,0,NA,"ADCP_NE","Permanent","Single",2012-08-14,"Summer","Wet","August",36.7,2761.01831444374,3227.6940676083,2279.06896824399,1932.91907125161
"calval_aug2012","FLK",2012,"CalVal","FLK",24.89663333,-80.6153,"08/14/12","08/14/12","01:37:00 PM","05:37:00 PM",0,1898.45,2267.46,8.05,372.1,4.12,NA,NA,36.9,30.9,0,NA,"CalVal_SE","Permanent","Single",2012-08-14,"Summer","Wet","August",36.9,2761.01831444374,3227.6940676083,2292.87357174643,1966.89346147577
"calval_aug2012","FLK",2012,"CalVal","FLK",24.89558333,-80.61663333,"08/14/12","08/14/12","01:50:00 PM","05:50:00 PM",0,1899.48,2271.31,8.057,366,4.16,NA,NA,36.6,30.9,0,NA,"CalVal_S","Permanent","Single",2012-08-14,"Summer","Wet","August",36.6,2761.01831444374,3227.6940676083,2292.71801374617,1957.54400295555
"calval_aug2012","FLK",2012,"CalVal","FLK",NA,NA,"08/14/12","08/14/12","02:00:00 PM","06:00:00 PM",0,1877.33,2249.26,8.057,360.9,4.13,NA,NA,36.9,30.9,0,NA,"ADCP_S","Permanent","Single",2012-08-14,"Summer","Wet","August",36.9,2761.01831444374,3227.6940676083,2275.6106991177,1946.86094115056
"calval_aug2012","FLK",2012,"CalVal","FLK",24.89826667,-80.61738333,"08/22/12","08/22/12","02:39:00 PM","06:39:00 PM",0,1890.59,2279.41,8.076,348.1,4.39,NA,NA,36.2,31.6,0,NA,"CalVal_N","Permanent","Single",2012-08-22,"Summer","Wet","August",36.2,2761.01831444374,3227.6940676083,2295.3749165009,1934.91389174392
"calval_aug2012","FLK",2012,"CalVal","FLK",NA,NA,"08/22/12","08/22/12","02:50:00 PM","06:50:00 PM",0,1886.14,2274.06,8.073,349.5,4.36,NA,NA,36.4,31.6,0,NA,"ADCP_NE","Permanent","Single",2012-08-22,"Summer","Wet","August",36.4,2761.01831444374,3227.6940676083,2292.78916594014,1937.73823336955
"calval_aug2012","FLK",2012,"CalVal","FLK",NA,NA,"08/22/12","08/22/12","02:59:00 PM","06:59:00 PM",0,1881.52,2254.91,8.053,367,4.2,NA,NA,36.4,31.7,0,NA,"ADCP_NE","Permanent","Single",2012-08-22,"Summer","Wet","August",36.4,2761.01831444374,3227.6940676083,2274.37570440168,1933.29592567724
"calval_aug2012","FLK",2012,"CalVal","FLK",24.89663333,-80.6153,"08/22/12","08/22/12","03:09:00 PM","07:09:00 PM",0,1883.77,2253.61,8.048,372.3,4.16,NA,NA,36.4,31.7,0,NA,"CalVal_SE","Permanent","Single",2012-08-22,"Summer","Wet","August",36.4,2761.01831444374,3227.6940676083,2273.12570440168,1935.4593872157
"calval_aug2012","FLK",2012,"CalVal","FLK",24.89558333,-80.61663333,"08/22/12","08/22/12","03:19:00 PM","07:19:00 PM",0,1977.47,2291.16,7.954,497.8,3.61,NA,NA,36.4,31.7,0,NA,"CalVal_S","Permanent","Single",2012-08-22,"Summer","Wet","August",36.4,2761.01831444374,3227.6940676083,2309.23147363245,2025.55554106186
"calval_aug2012","FLK",2012,"CalVal","FLK",NA,NA,"08/22/12","08/22/12","03:28:00 PM","07:28:00 PM",0,1886.75,2272.51,8.068,353.6,4.34,NA,NA,36.4,31.7,0,NA,"ADCP_S","Permanent","Single",2012-08-22,"Summer","Wet","August",36.4,2761.01831444374,3227.6940676083,2291.29878132476,1938.32477183109
"calval_sep2012","FLK",2012,"CalVal","FLK",NA,NA,"09/06/12","09/06/12","02:00:00 PM","06:00:00 PM",0,2051.14,2371.11,7.972,493.3,3.71,NA,NA,36.2,30.5,0,NA,"ADCP_S","Permanent","Single",2012-09-06,"Fall","Wet","September",36.2,2761.01831444374,3227.6940676083,2384.03513749537,2090.14179229641
"calval_sep2012","FLK",2012,"CalVal","FLK",NA,NA,"09/06/12","09/06/12","02:22:00 PM","06:22:00 PM",0,2046.97,2394.56,8.006,450.9,4.01,NA,NA,36.4,30.7,0,NA,"ADCP_N","Permanent","Single",2012-09-06,"Fall","Wet","September",36.4,2761.01831444374,3227.6940676083,2408.65455055553,2092.38246413878
"calval_sep2012","FLK",2012,"CalVal","FLK",24.89826667,-80.61738333,"09/06/12","09/06/12","02:36:00 PM","06:36:00 PM",0,2028.23,2388.36,7.992,467.1,3.92,NA,NA,36.4,30.8,0,NA,"CalVal_N","Permanent","Single",2012-09-06,"Fall","Wet","September",36.4,2761.01831444374,3227.6940676083,2402.69301209399,2074.36323336955
"calval_sep2012","FLK",2012,"CalVal","FLK",24.89663333,-80.6153,"09/06/12","09/06/12","02:52:00 PM","06:52:00 PM",0,2049.12,2394.01,8.031,418.6,4.19,NA,NA,36.6,30.7,0,NA,"CalVal_SE","Permanent","Single",2012-09-06,"Fall","Wet","September",36.6,2761.01831444374,3227.6940676083,2410.05407931995,2100.64236361129
"calval_sep2012","FLK",2012,"CalVal","FLK",24.89558333,-80.61663333,"09/06/12","09/06/12","03:03:00 PM","07:03:00 PM",0,2032.1,2399.06,8.031,418.9,4.21,NA,NA,36.5,30.8,0,NA,"CalVal_S","Permanent","Single",2012-09-06,"Fall","Wet","September",36.5,2761.01831444374,3227.6940676083,2413.93499922372,2081.23400277842
"calval_sep2012","FLK",2012,"CalVal","FLK",24.89826667,-80.61738333,"09/22/12","09/22/12","04:10:00 PM","08:10:00 PM",0,2059.65,2372.54,7.971,494.7,3.57,NA,NA,36.6,29.2,0,NA,"CalVal_N","Permanent","Single",2012-09-22,"Fall","Wet","September",36.6,2761.01831444374,3227.6940676083,2389.52265855492,2110.71203574244
"calval_sep2012","FLK",2012,"CalVal","FLK",24.89818333,-80.61606667,"09/22/12","09/22/12","04:18:00 PM","08:18:00 PM",0,2060.96,2373.31,7.971,494,3.58,NA,NA,36.6,29.3,0,NA,"ADCP_NE","Permanent","Single",2012-09-22,"Fall","Wet","September",36.6,2761.01831444374,3227.6940676083,2390.25899735273,2111.96476798288
"calval_sep2012","FLK",2012,"CalVal","FLK",24.89663333,-80.6153,"09/22/12","09/22/12","04:25:00 PM","08:25:00 PM",0,2066.89,2390.3,7.988,475.1,3.71,NA,NA,36.5,29.3,0,NA,"CalVal_SE","Permanent","Single",2012-09-22,"Fall","Wet","September",36.5,2761.01831444374,3227.6940676083,2405.53499922372,2114.59427675103
"calval_sep2012","FLK",2012,"CalVal","FLK",24.89558333,-80.61663333,"09/22/12","09/22/12","04:32:00 PM","08:32:00 PM",0,2061.12,2381.41,7.984,479,3.67,NA,NA,36.6,29.3,0,NA,"CalVal_S","Permanent","Single",2012-09-22,"Fall","Wet","September",36.6,2761.01831444374,3227.6940676083,2398.00489899208,2112.11777344736
"calval_sep2012","FLK",2012,"CalVal","FLK",24.89646667,-80.6182,"09/22/12","09/22/12","04:40:00 PM","08:40:00 PM",0,2061.67,2382.39,7.987,474.5,3.7,NA,NA,36.6,29.3,0,NA,"ADCP_S","Permanent","Single",2012-09-22,"Fall","Wet","September",36.6,2761.01831444374,3227.6940676083,2398.94205746202,2112.64372973151
"calval_oct2012","FLK",2012,"CalVal","FLK",24.8547,-80.56741667,"10/04/12","10/04/12","11:10:00 AM","03:10:00 PM",0,2123.97,2363.54,8.045,400.4,3.96,NA,NA,36.2,28.7,0,NA,"Transect 4","Permanent","Single",2012-10-04,"Fall","Wet","October",36.2,2761.01831444374,3227.6940676083,2376.71607672189,2160.55753815276
"calval_oct2012","FLK",2012,"CalVal","FLK",24.8694,-80.585,"10/04/12","10/04/12","11:30:00 AM","03:30:00 PM",0,2075.53,2368.23,8.016,435.9,3.79,NA,NA,36.3,28.8,0,NA,"Transect 3","Permanent","Single",2012-10-04,"Fall","Wet","October",36.3,2761.01831444374,3227.6940676083,2382.29679913986,2116.79207404658
"calval_oct2012","FLK",2012,"CalVal","FLK",24.88546667,-80.6041,"10/04/12","10/04/12","11:45:00 AM","03:45:00 PM",0,2035.5,2382.12,7.967,503.6,3.53,NA,NA,36.5,29,0,NA,"Transect 2","Permanent","Single",2012-10-04,"Fall","Wet","October",36.5,2761.01831444374,3227.6940676083,2397.69116360728,2084.49427675103
"calval_oct2012","FLK",2012,"CalVal","FLK",24.9052,-80.6266,"10/04/12","10/04/12","12:00:00 PM","04:00:00 PM",0,2014.2,2383.39,7.886,632.9,3.08,NA,NA,36,29.4,0,NA,"Transect 1","Permanent","Single",2012-10-04,"Fall","Wet","October",36,2761.01831444374,3227.6940676083,2393.87967540121,2047.90816854468
"calval_oct2012","FLK",2012,"CalVal","FLK",24.89818333,-80.61606667,"10/04/12","10/04/12","12:35:00 PM","04:35:00 PM",0,2113.66,2388.46,7.905,598.6,3.21,NA,NA,36.6,29.4,0,NA,"ADCP_NE","Permanent","Single",2012-10-04,"Fall","Wet","October",36.6,2761.01831444374,3227.6940676083,2404.74670227076,2162.36094284626
"calval_oct2012","FLK",2012,"CalVal","FLK",24.89826667,-80.61738333,"10/04/12","10/04/12","12:45:00 PM","04:45:00 PM",0,2116.04,2388.96,7.902,605.1,3.2,NA,NA,36.5,29.5,0,NA,"CalVal_N","Permanent","Single",2012-10-04,"Fall","Wet","October",36.5,2761.01831444374,3227.6940676083,2404.25006771687,2161.72441373733
"calval_oct2012","FLK",2012,"CalVal","FLK",NA,NA,"10/04/12","10/04/12","12:55:00 PM","04:55:00 PM",0,2119,2386.17,7.891,622.3,3.14,NA,NA,36.6,29.5,0,NA,"ADCP_S","Permanent","Single",2012-10-04,"Fall","Wet","October",36.6,2761.01831444374,3227.6940676083,2402.55681156038,2167.46750022331
"calval_oct2012","FLK",2012,"CalVal","FLK",24.89663333,-80.6153,"10/04/12","10/04/12","01:05:00 PM","05:05:00 PM",0,2111.88,2387.7,7.906,596.8,3.22,NA,NA,36.7,29.4,0,NA,"CalVal_SE","Permanent","Single",2012-10-04,"Fall","Wet","October",36.7,2761.01831444374,3227.6940676083,2404.99267396606,2163.56621021619
"calval_oct2012","FLK",2012,"CalVal","FLK",24.89558333,-80.61663333,"10/04/12","10/04/12","01:15:00 PM","05:15:00 PM",0,2115.36,2389.18,7.904,601.8,3.2,NA,NA,36.6,29.4,0,NA,"CalVal_S","Permanent","Single",2012-10-04,"Fall","Wet","October",36.6,2761.01831444374,3227.6940676083,2405.43522686093,2163.98662590637
"calval_oct2012","FLK",2012,"CalVal","FLK",NA,NA,"10/31/12","10/31/12","10:42:00 AM","02:42:00 PM",0,2189.64,2475.87,8.007,475.6,3.15,NA,NA,35.9,22.3,0,NA,"ADCP_S","Permanent","Single",2012-10-31,"Fall","Wet","October",35.9,2761.01831444374,3227.6940676083,2483.01856498605,2215.66363957792
"calval_oct2012","FLK",2012,"CalVal","FLK",24.89663333,-80.6153,"10/31/12","10/31/12","11:00:00 AM","03:00:00 PM",0,2200.14,2461.28,8.012,466.5,3.17,NA,NA,36,22.4,0,NA,"CalVal_SE","Permanent","Single",2012-10-31,"Fall","Wet","October",36,2761.01831444374,3227.6940676083,2469.6060642901,2228.68316854468
"calval_oct2012","FLK",2012,"CalVal","FLK",24.89558333,-80.61663333,"10/31/12","10/31/12","11:07:00 AM","03:07:00 PM",0,2182.59,2452.28,7.983,502.7,3,NA,NA,36,22.4,0,NA,"CalVal_S","Permanent","Single",2012-10-31,"Fall","Wet","October",36,2761.01831444374,3227.6940676083,2460.8560642901,2211.62066854468
"calval_oct2012","FLK",2012,"CalVal","FLK",NA,NA,"10/31/12","10/31/12","11:19:00 AM","03:19:00 PM",0,2190.54,2458.12,7.99,493.2,3.06,NA,NA,36.2,22.5,0,NA,"ADCP_N","Permanent","Single",2012-10-31,"Fall","Wet","October",36.2,2761.01831444374,3227.6940676083,2468.16082810311,2224.92079782127
"calval_oct2012","FLK",2012,"CalVal","FLK",24.89826667,-80.61738333,"10/31/12","10/31/12","11:27:00 AM","03:27:00 PM",0,2188.76,2457.43,7.995,488,3.07,NA,NA,36,22.4,0,NA,"CalVal_N","Permanent","Single",2012-10-31,"Fall","Wet","October",36,2761.01831444374,3227.6940676083,2465.86300873455,2217.61927965579
"calval_nov2012","FLK",2012,"CalVal","FLK",NA,NA,"11/19/12","11/19/12","11:10:00 AM","04:10:00 PM",0,2075.34,2402.52,8.063,389.7,3.62,NA,NA,37,24.1,0,NA,"ADCP_NE","Permanent","Single",2012-11-19,"Fall","Dry","November",37,2761.01831444374,3227.6940676083,2421.89828726723,2137.62940905991
"calval_nov2012","FLK",2012,"CalVal","FLK",24.89826667,-80.61738333,"11/19/12","11/19/12","11:21:00 AM","04:21:00 PM",0,2071.9,2401,8.066,385.8,3.64,NA,NA,37,24.1,0,NA,"CalVal_N","Permanent","Single",2012-11-19,"Fall","Dry","November",37,2761.01831444374,3227.6940676083,2420.46044942939,2134.37535500585
"calval_nov2012","FLK",2012,"CalVal","FLK",24.89646667,-80.6182,"11/19/12","11/19/12","11:37:00 AM","04:37:00 PM",0,2067.11,2402.68,8.074,376.8,3.71,NA,NA,37,24.2,0,NA,"ADCP_S","Permanent","Single",2012-11-19,"Fall","Dry","November",37,2761.01831444374,3227.6940676083,2422.04963861858,2129.84427392477
"calval_nov2012","FLK",2012,"CalVal","FLK",24.89558333,-80.61663333,"11/19/12","11/19/12","11:50:00 AM","04:50:00 PM",0,2074.98,2409.56,8.073,379.2,3.7,NA,NA,37,24.1,0,NA,"CalVal_S","Permanent","Single",2012-11-19,"Fall","Dry","November",37,2761.01831444374,3227.6940676083,2428.55774672669,2137.28886851937
"calval_nov2012","FLK",2012,"CalVal","FLK",24.89663333,-80.6153,"11/19/12","11/19/12","12:05:00 PM","05:05:00 PM",0,2081.51,2409.59,8.063,390.5,3.63,NA,NA,37,24.1,0,NA,"CalVal_SE","Permanent","Single",2012-11-19,"Fall","Dry","November",37,2761.01831444374,3227.6940676083,2428.58612510507,2143.4658955464
"calval_dec2012","FLK",2012,"CalVal","FLK",24.89826667,-80.61738333,"12/03/12","12/03/12","01:00:00 PM","06:00:00 PM",0,2299.35,2548.83,7.954,565.7,2.92,NA,NA,36,22,0,NA,"CalVal_N","Permanent","Single",2012-12-03,"Winter","Dry","December",36,2761.01831444374,3227.6940676083,2554.72411984566,2325.13733521134
"calval_dec2012","FLK",2012,"CalVal","FLK",24.89818333,-80.61606667,"12/03/12","12/03/12","01:12:00 PM","06:12:00 PM",0,2289.95,2543.52,7.962,552.3,2.96,NA,NA,36,22,0,NA,"ADCP_NE","Permanent","Single",2012-12-03,"Winter","Dry","December",36,2761.01831444374,3227.6940676083,2549.56161984566,2315.99844632245
"calval_dec2012","FLK",2012,"CalVal","FLK",24.89663333,-80.6153,"12/03/12","12/03/12","01:20:00 PM","06:20:00 PM",0,2288.14,2543.67,7.984,521,3.08,NA,NA,36.1,22,0,NA,"CalVal_SE","Permanent","Single",2012-12-03,"Winter","Dry","December",36.1,2761.01831444374,3227.6940676083,2550.29280182516,2316.76907131216
"calval_dec2012","FLK",2012,"CalVal","FLK",24.89558333,-80.61663333,"12/03/12","12/03/12","01:32:00 PM","06:32:00 PM",0,2290.73,2539.57,7.953,565,2.9,NA,NA,36.1,22,0,NA,"CalVal_S","Permanent","Single",2012-12-03,"Winter","Dry","December",36.1,2761.01831444374,3227.6940676083,2546.31773257308,2319.28015164457
"calval_dec2012","FLK",2012,"CalVal","FLK",24.89646667,-80.6182,"12/03/12","12/03/12","01:45:00 PM","06:45:00 PM",0,2295.1,2543.1,7.952,567.4,2.9,NA,NA,36,22,0,NA,"ADCP_S","Permanent","Single",2012-12-03,"Winter","Dry","December",36,2761.01831444374,3227.6940676083,2549.15328651233,2321.0053907669
"calval_dec2012","FLK",2012,"CalVal","FLK",24.89646667,-80.6182,"12/03/12","12/03/12","01:55:00 PM","06:55:00 PM",0,2305.64,2560.56,7.963,555.8,2.98,NA,NA,36,22,0,NA,"ADCP_S","Permanent","Single",2012-12-03,"Winter","Dry","December",36,2761.01831444374,3227.6940676083,2566.12828651233,2331.25261298912
"calval_dec2012","FLK",2012,"CalVal","FLK",24.8547,-80.56741667,"12/17/12","12/17/12","12:20:00 PM","05:20:00 PM",0,2022.51,2362.5,8.059,385.5,3.78,NA,NA,36.8,26.3,0,NA,"Transect 4","Permanent","Single",2012-12-17,"Winter","Dry","December",36.8,2761.01831444374,3227.6940676083,2381.99274364127,2081.45922069823
"calval_dec2012","FLK",2012,"CalVal","FLK",24.8547,-80.56741667,"12/17/12","12/17/12","12:38:00 PM","05:38:00 PM",0,2023.15,2367.73,8.065,379,3.82,NA,NA,36.9,26.2,0,NA,"Transect 4","Permanent","Single",2012-12-17,"Winter","Dry","December",36.9,2761.01831444374,3227.6940676083,2387.98061781689,2085.17259426709
"calval_dec2012","FLK",2012,"CalVal","FLK",24.8694,-80.585,"12/17/12","12/17/12","12:50:00 PM","05:50:00 PM",0,2015.41,2369.53,8.057,387.6,3.82,NA,NA,36.9,26.6,0,NA,"Transect 3","Permanent","Single",2012-12-17,"Winter","Dry","December",36.9,2761.01831444374,3227.6940676083,2389.68793489006,2077.83113085246
"calval_dec2012","FLK",2012,"CalVal","FLK",24.88546667,-80.6041,"12/17/12","12/17/12","01:07:00 PM","06:07:00 PM",0,2023.64,2369.84,8.057,388.6,3.72,NA,NA,37,25.7,0,NA,"Transect 2","Permanent","Single",2012-12-17,"Winter","Dry","December",37,2761.01831444374,3227.6940676083,2390.98477375372,2088.7240036545
"calval_dec2012","FLK",2012,"CalVal","FLK",24.9052,-80.6266,"12/17/12","12/17/12","01:31:00 PM","06:31:00 PM",0,2105.64,2428.28,8.039,421,3.62,NA,NA,36.8,25.1,0,NA,"Transect 1","Permanent","Single",2012-12-17,"Winter","Dry","December",36.8,2761.01831444374,3227.6940676083,2444.55524364127,2160.52307939388
"calval_jan2013","FLK",2013,"CalVal","FLK",24.89663333,-80.6153,"01/08/13","01/08/13","09:50:00 AM","02:50:00 PM",0,2082.21,2401.58,8.062,390.6,3.66,NA,NA,36.6,24.6,0,NA,"CalVal_SE","Permanent","Single",2013-01-08,"Winter","Dry","January",36.6,2761.01831444374,3227.6940676083,2417.2931503582,2132.28580623424
"calval_jan2013","FLK",2013,"CalVal","FLK",24.89558333,-80.61663333,"01/08/13","01/08/13","10:02:00 AM","03:02:00 PM",0,2088.38,2396.63,8.044,410.2,3.54,NA,NA,36.7,24.6,0,NA,"CalVal_S","Permanent","Single",2013-01-08,"Winter","Dry","January",36.7,2761.01831444374,3227.6940676083,2413.5090227399,2141.1547660745
"calval_jan2013","FLK",2013,"CalVal","FLK",24.89818333,-80.61606667,"01/08/13","01/08/13","10:19:00 AM","03:19:00 PM",0,2090.36,2402.85,8.061,393.9,3.66,NA,NA,36.6,24.7,0,NA,"ADCP_NE","Permanent","Single",2013-01-08,"Winter","Dry","January",36.6,2761.01831444374,3227.6940676083,2418.50763123251,2140.07952208124
"calval_jan2013","FLK",2013,"CalVal","FLK",24.89826667,-80.61738333,"01/08/13","01/08/13","10:19:00 AM","03:19:00 PM",0,2081.48,2409.36,8.064,389.1,3.69,NA,NA,36.6,24.6,0,NA,"CalVal_N","Permanent","Single",2013-01-08,"Winter","Dry","January",36.6,2761.01831444374,3227.6940676083,2424.73304106858,2131.58771880255
"calval_jan2013","FLK",2013,"CalVal","FLK",24.89646667,-80.6182,"01/08/13","01/08/13","10:32:00 AM","03:32:00 PM",0,2076.04,2395.1,8.063,388.9,3.66,NA,NA,36.6,24.6,0,NA,"ADCP_S","Permanent","Single",2013-01-08,"Winter","Dry","January",36.6,2761.01831444374,3227.6940676083,2411.09642904672,2126.3855330102
"calval_jan2013","FLK",2013,"CalVal","FLK",24.89646667,-80.6182,"01/08/13","01/08/13","10:42:00 AM","03:42:00 PM",0,2082.82,2395.21,8.051,402,3.58,NA,NA,36.7,24.6,0,NA,"ADCP_S","Permanent","Single",2013-01-08,"Winter","Dry","January",36.7,2761.01831444374,3227.6940676083,2412.15479930666,2135.85231375842
"calval_jan2013","FLK",2013,"CalVal","FLK",24.89646667,-80.6182,"01/24/13","01/24/13","12:14:00 PM","05:14:00 PM",0,2056,2383.12,8.115,335.9,3.71,NA,NA,36.4,22.4,0,NA,"ADCP_S","Permanent","Single",2013-01-24,"Winter","Dry","January",36.4,2761.01831444374,3227.6940676083,2397.65455055553,2101.06515644647
"calval_jan2013","FLK",2013,"CalVal","FLK",24.89558333,-80.61663333,"01/24/13","01/24/13","12:25:00 PM","05:25:00 PM",0,2067.64,2385.15,8.121,329.6,3.77,NA,NA,36.5,22.5,0,NA,"CalVal_S","Permanent","Single",2013-01-24,"Winter","Dry","January",36.5,2761.01831444374,3227.6940676083,2400.59664305933,2115.31345483322
"calval_jan2013","FLK",2013,"CalVal","FLK",24.89558333,-80.61663333,"01/24/13","01/24/13","12:36:00 PM","05:36:00 PM",0,2045.24,2386.29,8.115,336.3,3.72,NA,NA,36.5,22.5,0,NA,"CalVal_S","Permanent","Single",2013-01-24,"Winter","Dry","January",36.5,2761.01831444374,3227.6940676083,2401.68979374426,2093.83400277842
"calval_jan2013","FLK",2013,"CalVal","FLK",24.89663333,-80.6153,"01/24/13","01/24/13","12:46:00 PM","05:46:00 PM",0,2045.5,2384.02,8.114,336.7,3.72,NA,NA,36.5,22.5,0,NA,"CalVal_SE","Permanent","Single",2013-01-24,"Winter","Dry","January",36.5,2761.01831444374,3227.6940676083,2399.5130814155,2094.08331784692
"calval_jan2013","FLK",2013,"CalVal","FLK",24.89826667,-80.61738333,"01/24/13","01/24/13","01:00:00 PM","06:00:00 PM",0,2041.42,2393.05,8.126,326.9,3.79,NA,NA,36.5,22.4,0,NA,"CalVal_N","Permanent","Single",2013-01-24,"Winter","Dry","January",36.5,2761.01831444374,3227.6940676083,2408.17198552509,2090.17098907979
"calval_jan2013","FLK",2013,"CalVal","FLK",24.89818333,-80.61606667,"01/24/13","01/24/13","01:12:00 PM","06:12:00 PM",0,2046.79,2394.46,8.108,344,3.69,NA,NA,36.5,22.5,0,NA,"ADCP_NE","Permanent","Single",2013-01-24,"Winter","Dry","January",36.5,2761.01831444374,3227.6940676083,2409.52404031961,2095.32030414829
"calval_feb2014","FLK",2013,"CalVal","FLK",24.8547,-80.56741667,"02/04/13","02/04/13","01:54:00 PM","06:54:00 PM",0,2050.04,2373.01,8.07,378.3,3.65,NA,NA,36.4,24.5,0,NA,"Transect 4","Permanent","Single",2013-02-04,"Winter","Dry","February",36.4,2761.01831444374,3227.6940676083,2387.93339670937,2095.3343872157
"calval_feb2014","FLK",2013,"CalVal","FLK",24.8694,-80.585,"02/04/13","02/04/13","02:10:00 PM","07:10:00 PM",0,2054.15,2373.4,8.08,368.3,3.7,NA,NA,36.3,24.4,0,NA,"Transect 3","Permanent","Single",2013-02-04,"Winter","Dry","February",36.3,2761.01831444374,3227.6940676083,2387.28164762471,2096.17774897771
"calval_feb2014","FLK",2013,"CalVal","FLK",24.88546667,-80.6041,"02/04/13","02/04/13","02:23:00 PM","07:23:00 PM",0,2051.83,2375.59,8.091,357.2,3.67,NA,NA,36.5,23.5,0,NA,"Transect 2","Permanent","Single",2013-02-04,"Winter","Dry","February",36.5,2761.01831444374,3227.6940676083,2391.42951977166,2100.15318086062
"calval_feb2014","FLK",2013,"CalVal","FLK",24.9052,-80.6266,"02/04/13","02/04/13","02:55:00 PM","07:55:00 PM",0,NA,2392.96,8.141,312.7,3.8,NA,NA,36.8,21.5,0,NA,"Transect 1","Permanent","Single",2013-02-04,"Winter","Dry","February",36.8,2761.01831444374,3227.6940676083,2410.96285233692,NA
"calval_feb2014","FLK",2013,"CalVal","FLK",24.89826667,-80.61738333,"02/21/13","02/21/13","12:30:00 PM","05:30:00 PM",0,2053.23,2376.99,8.121,329.6,3.73,NA,NA,36.4,22.4,0,NA,"CalVal_N","Permanent","Single",2013-02-21,"Winter","Dry","February",36.4,2761.01831444374,3227.6940676083,2391.7603197863,2098.40169490801
"calval_feb2014","FLK",2013,"CalVal","FLK",NA,NA,"02/21/13","02/21/13","12:40:00 PM","05:40:00 PM",0,2036.38,2377.91,8.121,329.3,3.75,NA,NA,36.4,22.5,0,NA,"ADCP_NE","Permanent","Single",2013-02-21,"Winter","Dry","February",36.4,2761.01831444374,3227.6940676083,2392.64493517091,2082.19977183109
"calval_feb2014","FLK",2013,"CalVal","FLK",24.89663333,-80.6153,"02/21/13","02/21/13","12:50:00 PM","05:50:00 PM",0,2036.02,2382.64,8.112,338.3,3.72,NA,NA,36.4,22.7,0,NA,"CalVal_SE","Permanent","Single",2013-02-21,"Winter","Dry","February",36.4,2761.01831444374,3227.6940676083,2397.19301209399,2081.85361798493
"calval_feb2014","FLK",2013,"CalVal","FLK",24.89558333,-80.61663333,"02/21/13","02/21/13","01:01:00 PM","06:01:00 PM",0,2037.4,2376.74,8.116,334.1,3.72,NA,NA,36.4,22.6,0,NA,"CalVal_S","Permanent","Single",2013-02-21,"Winter","Dry","February",36.4,2761.01831444374,3227.6940676083,2391.51993517091,2083.18054106186
"calval_feb2014","FLK",2013,"CalVal","FLK",NA,NA,"02/21/13","02/21/13","01:14:00 PM","06:14:00 PM",0,2029.97,2371.06,8.12,329.3,3.73,NA,NA,36.5,22.5,0,NA,"ADCP_S","Permanent","Single",2013-02-21,"Winter","Dry","February",36.5,2761.01831444374,3227.6940676083,2387.08568415522,2079.191537025
"calval_march2013","FLK",2013,"CalVal","FLK",24.89646667,-80.6182,"03/06/13","03/06/13","11:32:00 AM","#REF!",0,2030.36,2387.45,8.101,359.5,3.54,NA,NA,33.6,22.6,0,NA,"ADCP_S","Permanent","Single",2013-03-06,"Spring","Dry","March",33.6,2761.01831444374,3227.6940676083,2371.88465356484,1980.47108051632
"calval_march2013","FLK",2013,"CalVal","FLK",24.89826667,-80.61738333,"03/06/13","03/06/13","11:46:00 AM","#REF!",0,2033.14,2393.81,8.099,362.7,3.54,NA,NA,33.6,22.6,0,NA,"CalVal_N","Permanent","Single",2013-03-06,"Spring","Dry","March",33.6,2761.01831444374,3227.6940676083,2378.50965356484,1983.36691384965
"calval_march2013","FLK",2013,"CalVal","FLK",24.89818333,-80.61606667,"03/06/13","03/06/13","11:57:00 AM","#REF!",0,2022.01,2393.81,8.108,353,3.6,NA,NA,33.6,22.6,0,NA,"ADCP_NE","Permanent","Single",2013-03-06,"Spring","Dry","March",33.6,2761.01831444374,3227.6940676083,2378.50965356484,1971.77316384965
"calval_march2013","FLK",2013,"CalVal","FLK",24.89663333,-80.6153,"03/06/13","03/06/13","12:10:00 PM","#REF!",0,2021.28,2385.9,8.103,356.9,3.55,NA,NA,33.6,22.6,0,NA,"CalVal_SE","Permanent","Single",2013-03-06,"Spring","Dry","March",33.6,2761.01831444374,3227.6940676083,2370.27007023151,1971.01274718299
"calval_march2013","FLK",2013,"CalVal","FLK",24.89558333,-80.61663333,"03/06/13","03/06/13","12:22:00 PM","#REF!",0,2020.25,2387.84,8.091,369.3,3.48,NA,NA,33.6,22.6,0,NA,"CalVal_S","Permanent","Single",2013-03-06,"Spring","Dry","March",33.6,2761.01831444374,3227.6940676083,2372.29090356484,1969.93983051632
"calval_march2013","FLK",2013,"CalVal","FLK",24.89646667,-80.6182,"03/06/13","03/06/13","12:45:00 PM","#REF!",0,2018.04,2384.75,8.108,351.4,3.58,NA,NA,33.6,22.6,0,NA,"ADCP_S","Permanent","Single",2013-03-06,"Spring","Dry","March",33.6,2761.01831444374,3227.6940676083,2369.07215356484,1967.63774718299
"calval_march2013","FLK",2013,"CalVal","FLK",24.8547,-80.56741667,"03/20/13","03/20/13","10:18:00 AM","02:18:00 PM",0,2043.47,2375.94,8.091,357.1,3.67,NA,NA,36.4,23.5,0,NA,"Transect 4","Permanent","Single",2013-03-20,"Spring","Dry","March",36.4,2761.01831444374,3227.6940676083,2390.75070440168,2089.0170795234
"calval_march2013","FLK",2013,"CalVal","FLK",24.8694,-80.585,"03/20/13","03/20/13","10:30:00 AM","02:30:00 PM",0,2045.33,2376.28,8.091,358.2,3.66,NA,NA,36.4,23.4,0,NA,"Transect 3","Permanent","Single",2013-03-20,"Spring","Dry","March",36.4,2761.01831444374,3227.6940676083,2391.07762747861,2090.80554106186
"calval_march2013","FLK",2013,"CalVal","FLK",24.88546667,-80.6041,"03/20/13","03/20/13","10:42:00 AM","02:42:00 PM",0,2033.92,2370.82,8.101,347,3.71,NA,NA,36.4,23.4,0,NA,"Transect 2","Permanent","Single",2013-03-20,"Spring","Dry","March",36.4,2761.01831444374,3227.6940676083,2385.82762747861,2079.8343872157
"calval_march2013","FLK",2013,"CalVal","FLK",24.9052,-80.6266,"03/20/13","03/20/13","11:15:00 AM","03:15:00 PM",0,2032.52,2372.1,8.109,339.1,3.72,NA,NA,36.7,22.9,0,NA,"Transect 1","Permanent","Single",2013-03-20,"Spring","Dry","March",36.7,2761.01831444374,3227.6940676083,2390.11528976987,2087.88228651047
"calval_may2013","FLK",2013,"CalVal","FLK",NA,NA,"05/27/13","05/27/13","11:00:00 AM","03:00:00 PM",0,1915.46,2234.16,8.066,357.3,3.7,NA,NA,36.21,27.22,0,NA,"H2O_1","Permanent","Single",2013-05-27,"Spring","Wet","May",36.21,2761.01831444374,3227.6940676083,2251.76559404797,1959.3098542338
"calval_jun2013","FLK",2013,"CalVal","FLK",NA,NA,"06/15/13","06/15/13","11:15:00 AM","03:15:00 PM",0,1929.34,2248.32,8.049,377,3.74,NA,NA,36.02,28.4,0,NA,"H2O_1","Permanent","Single",2013-06-15,"Summer","Wet","June",36.02,2761.01831444374,3227.6940676083,2262.83838647231,1966.10627287508
"calval_jun2013","FLK",2013,"CalVal","FLK",NA,NA,"06/30/13","06/30/13","01:15:00 PM","05:15:00 PM",0,1995.36,2244.01,8.11,312.9,4.23,NA,NA,36.04,29.1,0,NA,"H2O_1","Permanent","Single",2013-06-30,"Summer","Wet","June",36.04,2761.01831444374,3227.6940676083,2258.92921884077,2030.92124945374
"calval_jun2013","FLK",2013,"CalVal","FLK",NA,NA,"06/30/13","06/30/13","01:30:00 PM","05:30:00 PM",0,1969.12,2350.67,8.118,321.9,4.47,NA,NA,36.07,28.9,0,NA,"H2O_2","Permanent","Single",2013-06-30,"Summer","Wet","June",36.07,2761.01831444374,3227.6940676083,2362.84279446783,2006.45502224399
"calval_jun2013","FLK",2013,"CalVal","FLK",NA,NA,"06/30/13","06/30/13","01:45:00 PM","05:45:00 PM",0,1878.59,2353.79,8.085,355.1,4.23,NA,NA,36.06,28.8,0,NA,"H2O_3","Permanent","Single",2013-06-30,"Summer","Wet","June",36.06,2761.01831444374,3227.6940676083,2365.76066038021,1918.24752389531
"calval_jun2013","FLK",2013,"CalVal","FLK",NA,NA,"06/30/13","06/30/13","02:00:00 PM","06:00:00 PM",0,1956.47,2319.66,8.098,336,4.25,NA,NA,36.13,28.7,0,NA,"H2O_4","Permanent","Single",2013-06-30,"Summer","Wet","June",36.13,2761.01831444374,3227.6940676083,2333.46389967676,1996.22873779124
"NCRMP_USVI_2013","USVI",2013,"NCRMP","STT",18.3695,-64.99558,"07/08/13","07/08/13","10:26:00 AM","02:26:00 PM",0,2020.19,2361.33,8.08,373.3,4,NA,NA,33.3,28,0,NA,"96","Random","Single",2013-07-08,"Summer","Wet","July",33.3,1883.86431617678,1712.86990652258,2385.70512499998,2035.87901378113
"NCRMP_USVI_2013","USVI",2013,"NCRMP","STT",18.37735,-64.98218,"07/08/13","07/08/13","11:53:00 AM","03:53:00 PM",0,2023.38,2363.98,8.077,376.6,4,NA,NA,33.3,28.1,0,NA,"58","Random","Single",2013-07-08,"Summer","Wet","July",33.3,1883.86431617678,1712.86990652258,2388.49041028527,2039.23186663398
"NCRMP_USVI_2013","USVI",2013,"NCRMP","STT",18.36485,-64.00758,"07/08/13","07/08/13","01:25:00 PM","05:25:00 PM",0,2014.76,2353.2,8.078,375.1,3.99,NA,NA,33,28.2,0,NA,"36","Random","Single",2013-07-08,"Summer","Wet","July",33,1883.86431617678,1712.86990652258,2381.64458689838,2033.05636930166
"NCRMP_USVI_2013","USVI",2013,"NCRMP","STT",18.31122,-64.96133,"07/08/13","07/08/13","03:16:00 PM","07:16:00 PM",0,1993.42,2340.75,8.091,359.9,4.1,NA,NA,32.8,28.6,0,NA,"4","Random","Single",2013-07-08,"Summer","Wet","July",32.8,1883.86431617678,1712.86990652258,2371.39477147595,2012.23738431861
"NCRMP_USVI_2013","USVI",2013,"NCRMP","STT",18.36131582,-64.78380011,"07/09/13","07/09/13","11:21:00 AM","03:21:00 PM",0,2019.64,2355.73,8.05,399.2,3.87,NA,NA,35,28.1,0,NA,"North of Hawk's Nest Bay","Random","Single",2013-07-09,"Summer","Wet","July",35,1883.86431617678,1712.86990652258,2355.73,2019.64
"NCRMP_USVI_2013","USVI",2013,"NCRMP","STT",18.3893,-64.97398,"07/09/13","07/09/13","11:35:00 AM","03:35:00 PM",0,2025.57,2369.72,8.086,369.1,4.05,NA,NA,33.1,28,0,NA,"42","Random","Single",2013-07-09,"Summer","Wet","July",33.1,1883.86431617678,1712.86990652258,2397.60899695662,2043.51955219357
"NCRMP_USVI_2013","USVI",2013,"NCRMP","STT",18.36136397,-64.77479279,"07/09/13","07/09/13","11:58:00 AM","03:58:00 PM",0,2003.92,2349.25,8.061,384.7,3.96,NA,NA,35.1,28.3,0,NA,"Johnson's Reef","Random","Single",2013-07-09,"Summer","Wet","July",35.1,1883.86431617678,1712.86990652258,2347.9241148609,2003.09079745448
"NCRMP_USVI_2013","USVI",2013,"NCRMP","STT",18.34957309,-64.78160748,"07/09/13","07/09/13","01:11:00 PM","05:11:00 PM",0,2020.93,2353.05,8.035,414.1,3.8,NA,NA,35.5,28.3,0,NA,"Hawk's Nest Bay","Random","Single",2013-07-09,"Summer","Wet","July",35.5,1883.86431617678,1712.86990652258,2346.44175093207,2016.59112544398
"NCRMP_USVI_2013","USVI",2013,"NCRMP","STT",18.35788987,-64.82868902,"07/10/13","07/10/13","11:20:00 AM","03:20:00 PM",0,2006.56,2344.08,8.046,399.2,3.85,NA,NA,35.5,28.2,0,NA,"Grass Cay","Random","Single",2013-07-10,"Summer","Wet","July",35.5,1883.86431617678,1712.86990652258,2337.59808896024,2002.42351981018
"NCRMP_USVI_2013","USVI",2013,"NCRMP","STT",18.36407455,-64.78153863,"07/10/13","07/10/13","11:55:00 AM","03:55:00 PM",0,1941.12,2352,8.16,288,4.65,NA,NA,35,28.2,0,NA,"Johnson's Reef","Random","Single",2013-07-10,"Summer","Wet","July",35,1883.86431617678,1712.86990652258,2352,1941.12
"NCRMP_USVI_2013","USVI",2013,"NCRMP","STT",18.35873615,-64.80250796,"07/10/13","07/10/13","01:25:00 PM","05:25:00 PM",0,2014.36,2344.5,8.035,411.9,3.78,NA,NA,35.4,28.2,0,NA,"Lavango Cay","Random","Single",2013-07-10,"Summer","Wet","July",35.4,1883.86431617678,1712.86990652258,2339.29507701895,2010.95333227709
"NCRMP_USVI_2013","USVI",2013,"NCRMP","STT",18.2577,-65.10282,"07/11/13","07/11/13","09:19:00 AM","01:19:00 PM",0,2019.4,2355.99,8.072,380.7,3.95,NA,NA,33.3,28.1,0,NA,"207","Random","Single",2013-07-11,"Summer","Wet","July",33.3,1883.86431617678,1712.86990652258,2380.09251238737,2035.0486834508
"NCRMP_USVI_2013","USVI",2013,"NCRMP","STT",18.32293487,-64.68571203,"07/11/13","07/11/13","11:12:00 AM","03:12:00 PM",0,2007.41,2341.69,8.036,409.6,3.81,NA,NA,35.7,28.4,0,NA,"Coral Bay","Random","Single",2013-07-11,"Summer","Wet","July",35.7,1883.86431617678,1712.86990652258,2332.71302580739,2001.63470404946
"NCRMP_USVI_2013","USVI",2013,"NCRMP","STT",18.36054,-65.03216,"07/11/13","07/11/13","12:53:00 PM","04:53:00 PM",0,2011.22,2361.05,8.082,370,4.11,NA,NA,33.4,28.7,0,NA,"20","Random","Single",2013-07-11,"Summer","Wet","July",33.4,1883.86431617678,1712.86990652258,2383.90919443465,2025.51222004682
"NCRMP_USVI_2013","USVI",2013,"NCRMP","STT",18.33869259,-64.6938121,"07/11/13","07/11/13","01:31:00 PM","05:31:00 PM",0,2000.49,2329.38,8.026,420,3.77,NA,NA,35.4,28.9,0,NA,"Turner Point","Random","Single",2013-07-11,"Summer","Wet","July",35.4,1883.86431617678,1712.86990652258,2324.34592447657,1997.24005544093
"NCRMP_USVI_2013","USVI",2013,"NCRMP","STT",18.3165477,-64.72600588,"07/11/13","07/11/13","02:45:00 PM","06:45:00 PM",0,1998.09,2328.23,8.026,419.3,3.8,NA,NA,35.3,29.1,0,NA,"Little Lameshur Bay","Random","Single",2013-07-11,"Summer","Wet","July",35.3,1883.86431617678,1712.86990652258,2324.45352110065,1995.66603319991
"NCRMP_USVI_2013","USVI",2013,"NCRMP","STT",18.26136,-65.09861,"07/12/13","07/12/13","08:55:00 AM","12:55:00 PM",0,2008.29,2345.42,8.068,381.7,3.93,NA,NA,33.7,28.2,0,NA,"209","Random","Single",2013-07-12,"Summer","Wet","July",33.7,1883.86431617678,1712.86990652258,2363.2248186638,2019.68602734483
"NCRMP_USVI_2013","USVI",2013,"NCRMP","STT",18.32723136,-64.6532093,"07/12/13","07/12/13","09:38:00 AM","01:38:00 PM",0,2010.29,2334.69,8.025,421.9,3.71,NA,NA,35.5,28.3,0,NA,"Flanagan Island","Random","Single",2013-07-12,"Summer","Wet","July",35.5,1883.86431617678,1712.86990652258,2328.34034248136,2006.10098459891
"NCRMP_USVI_2013","USVI",2013,"NCRMP","STT",18.28415,-65.12016,"07/12/13","07/12/13","10:42:00 AM","02:42:00 PM",0,2021.95,2347.24,8.047,407.3,3.84,NA,NA,33.3,28.7,0,NA,"211","Random","Single",2013-07-12,"Summer","Wet","July",33.3,1883.86431617678,1712.86990652258,2370.89581569067,2037.72886363098
"NCRMP_USVI_2013","USVI",2013,"NCRMP","STT",18.33729523,-64.66167809,"07/12/13","07/12/13","11:05:00 AM","03:05:00 PM",0,2005.81,2335.02,8.031,415,3.77,NA,NA,35.4,28.5,0,NA,"Privateer Point","Random","Single",2013-07-12,"Summer","Wet","July",35.4,1883.86431617678,1712.86990652258,2329.92219566301,2002.49994244658
"NCRMP_USVI_2013","USVI",2013,"NCRMP","STT",18.31724,-64.93944,"07/12/13","07/12/13","12:53:00 PM","04:53:00 PM",0,2004.91,2338.73,8.056,393.3,3.92,NA,NA,33.6,28.8,0,NA,"52","Random","Single",2013-07-12,"Summer","Wet","July",33.6,1883.86431617678,1712.86990652258,2357.68273682597,2017.07833722823
"NCRMP_USVI_2013","USVI",2013,"NCRMP","STT",18.34284535,-64.66035923,"07/12/13","07/12/13","01:37:00 PM","05:37:00 PM",0,1997.26,2333.39,8.035,410,3.86,NA,NA,35.3,29.1,0,NA,"Near East End Point","Random","Single",2013-07-12,"Summer","Wet","July",35.3,1883.86431617678,1712.86990652258,2329.56966840943,1994.84308702427
"NCRMP_USVI_2013","USVI",2013,"NCRMP","STT",18.27585,-64.96782,"07/13/13","07/13/13","09:45:00 AM","01:45:00 PM",0,2011.37,2348.35,8.066,385,3.95,NA,NA,33.6,28.4,0,NA,"216","Random","Single",2013-07-13,"Summer","Wet","July",33.6,1883.86431617678,1712.86990652258,2367.7035701593,2023.80750389489
"NCRMP_USVI_2013","USVI",2013,"NCRMP","STT",NA,NA,"07/13/13","07/13/13","10:10:00 AM","02:10:00 PM",0,2005.88,2339.03,8.038,407.5,3.81,NA,NA,35.4,28.4,0,NA,"Mid-shelf Reef VICR","Random","Single",2013-07-13,"Summer","Wet","July",35.4,1883.86431617678,1712.86990652258,2333.88688492855,2002.56915148613
"NCRMP_USVI_2013","USVI",2013,"NCRMP","STT",NA,NA,"07/13/13","07/13/13","11:10:00 AM","03:10:00 PM",0,2004.49,2337.95,8.036,409.2,3.81,NA,NA,35.5,28.5,0,NA,"Mid-shelf Reef VICR","Random","Single",2013-07-13,"Summer","Wet","July",35.5,1883.86431617678,1712.86990652258,2331.55442698841,2000.38267473975
"NCRMP_USVI_2013","USVI",2013,"NCRMP","STT",NA,NA,"07/13/13","07/13/13","12:10:00 PM","04:10:00 PM",0,2004.28,2338.56,8.038,407.4,3.81,NA,NA,35.6,28.4,0,NA,"Mid-shelf Reef VICR","Random","Single",2013-07-13,"Summer","Wet","July",35.6,1883.86431617678,1712.86990652258,2330.89658959848,1999.36859393016
"calval_jul2013","FLK",2013,"CalVal","FLK",NA,NA,"07/13/13","07/13/13","12:50:00 PM","04:50:00 PM",0,1950.63,2317,8.081,352,4.35,NA,NA,35.8,30.53,0,NA,"H2O_1","Permanent","Single",2013-07-13,"Summer","Wet","July",35.8,2761.01831444374,3227.6940676083,2326.92219697081,1979.16774452756
"calval_jul2013","FLK",2013,"CalVal","FLK",NA,NA,"07/13/13","07/13/13","01:00:00 PM","05:00:00 PM",0,2024.62,2363.67,8.038,405.7,4.13,NA,NA,36.48,30.34,0,NA,"H2O_2","Permanent","Single",2013-07-13,"Summer","Wet","July",36.48,2761.01831444374,3227.6940676083,2379.79049082721,2073.42892598849
"NCRMP_USVI_2013","USVI",2013,"NCRMP","STT",NA,NA,"07/13/13","07/13/13","01:01:00 PM","05:01:00 PM",0,2000.95,2334.55,8.037,407.1,3.8,NA,NA,35.6,28.6,0,NA,"Mid-shelf Reef VICR","Random","Single",2013-07-13,"Summer","Wet","July",35.6,1883.86431617678,1712.86990652258,2326.95417386815,1996.09471752566
"calval_jul2013","FLK",2013,"CalVal","FLK",NA,NA,"07/13/13","07/13/13","01:10:00 PM","05:10:00 PM",0,2017.38,2367.99,8.04,404.2,4.09,NA,NA,36.39,29.87,0,NA,"H2O_3","Permanent","Single",2013-07-13,"Summer","Wet","July",36.39,2761.01831444374,3227.6940676083,2383.00262316781,2063.61073794931
"calval_jul2013","FLK",2013,"CalVal","FLK",NA,NA,"07/13/13","07/13/13","01:20:00 PM","05:20:00 PM",0,2020.56,2370.53,8.046,397.4,4.16,NA,NA,36.5,30.04,0,NA,"H2O_4","Permanent","Single",2013-07-13,"Summer","Wet","July",36.5,2761.01831444374,3227.6940676083,2386.57746497714,2070.16824935377
"NCRMP_USVI_2013","USVI",2013,"NCRMP","STJ",18.35160422,-64.64850194,"07/15/13","07/15/13","09:56:00 AM","01:56:00 PM",0,2011.44,2343.99,8.04,407.7,3.83,NA,NA,35,28.5,0,NA,"Site 345","Random","Single",2013-07-15,"Summer","Wet","July",35,1883.86431617678,1712.86990652258,2343.99,2011.44
"NCRMP_USVI_2013","USVI",2013,"NCRMP","STJ",18.26385,-64.90385,"07/15/13","07/15/13","10:10:00 AM","02:10:00 PM",0,2001.48,2345.18,8.074,374.4,4.01,NA,NA,33.8,28.4,0,NA,"388","Random","Single",2013-07-15,"Summer","Wet","July",33.8,1883.86431617678,1712.86990652258,2361.55807161503,2011.72651219446
"NCRMP_USVI_2013","USVI",2013,"NCRMP","STJ",18.36459731,-64.65988586,"07/15/13","07/15/13","10:59:00 AM","02:59:00 PM",0,2010.98,2343.91,8.033,413.5,3.81,NA,NA,35.6,28.5,0,NA,"Site 198","Random","Single",2013-07-15,"Summer","Wet","July",35.6,1883.86431617678,1712.86990652258,2336.15642105916,2005.95567258184
"NCRMP_USVI_2013","USVI",2013,"NCRMP","STJ",18.35047837,-64.67806903,"07/15/13","07/15/13","11:50:00 AM","03:50:00 PM",0,2009.06,2334.24,8.019,428,3.72,NA,NA,35.6,28.7,0,NA,"Site 157","Random","Single",2013-07-15,"Summer","Wet","July",35.6,1883.86431617678,1712.86990652258,2326.64939858725,2004.0680321324
"NCRMP_USVI_2013","USVI",2013,"NCRMP","STJ",18.34329,-65.0821,"07/15/13","07/15/13","12:15:00 PM","04:15:00 PM",0,2015.13,2357.01,8.074,377.6,3.99,NA,NA,33.7,28.2,0,NA,"272","Random","Single",2013-07-15,"Summer","Wet","July",33.7,1883.86431617678,1712.86990652258,2375.26191065193,2026.78988491159
"NCRMP_USVI_2013","USVI",2013,"NCRMP","STJ",18.3021,-64.87211,"07/15/13","07/15/13","01:10:00 PM","05:10:00 PM",0,1995.81,2333.25,8.058,389.1,3.93,NA,NA,34,28.8,0,NA,"253","Random","Single",2013-07-15,"Summer","Wet","July",34,1883.86431617678,1712.86990652258,2346.4672259948,2004.13176745522
"NCRMP_USVI_2013","USVI",2013,"NCRMP","STJ",18.38058,-65.05842,"07/15/13","07/15/13","01:50:00 PM","05:50:00 PM",0,2015.42,2352.73,8.063,388.5,3.95,NA,NA,33.7,28.5,0,NA,"298","Random","Single",2013-07-15,"Summer","Wet","July",33.7,1883.86431617678,1712.86990652258,2370.81680679437,2027.09107185521
"NCRMP_USVI_2013","USVI",2013,"NCRMP","STJ",18.350461,-64.67080219,"07/15/13","07/15/13","01:53:00 PM","05:53:00 PM",0,1956.6,2314.02,8.073,362.6,4.04,NA,NA,35.7,28.6,0,NA,"No Name Bay","Random","Single",2013-07-15,"Summer","Wet","July",35.7,1883.86431617678,1712.86990652258,2305.585574827,1951.82097855927
"NCRMP_USVI_2013","USVI",2013,"NCRMP","STJ",18.36459,-65.03363,"07/15/13","07/15/13","02:32:00 PM","06:32:00 PM",0,2022.57,2364.18,8.067,384.6,3.98,NA,NA,34.1,28.2,0,NA,"296","Random","Single",2013-07-15,"Summer","Wet","July",34.1,1883.86431617678,1712.86990652258,2376.85695353199,2030.7439027604
"NCRMP_USVI_2013","USVI",2013,"NCRMP","STJ",18.31946,-64.94324,"07/15/13","07/15/13","03:15:00 PM","07:15:00 PM",0,1987.42,2326.59,8.049,396.4,3.95,NA,NA,34.2,29.5,0,NA,"269","Random","Single",2013-07-15,"Summer","Wet","July",34.2,1883.86431617678,1712.86990652258,2336.94615634674,1993.84222440883
"NCRMP_USVI_2013","USVI",2013,"NCRMP","STJ",18.31971584,-64.78806528,"07/15/13","07/15/13","03:15:00 PM","07:15:00 PM",0,1948.03,2313.63,8.072,362.2,4.15,NA,NA,35.7,29.5,0,NA,"Site 322","Random","Single",2013-07-15,"Summer","Wet","July",35.7,1883.86431617678,1712.86990652258,2305.20322188582,1943.41901777495
"NCRMP_USVI_2013","USVI",2013,"NCRMP","STT",18.36397,-65.00713,"07/15/13","07/15/13","03:57:00 PM","07:57:00 PM",0,2017.85,2357.29,8.064,386.5,3.96,NA,NA,34,28.3,0,NA,"23","Random","Single",2013-07-15,"Summer","Wet","July",34,1883.86431617678,1712.86990652258,2371.21428481833,2026.82000274934
"NCRMP_USVI_2013","USVI",2013,"NCRMP","STJ",18.36680691,-64.68601462,"07/16/13","07/16/13","09:28:00 AM","01:28:00 PM",0,2009.43,2348.54,8.043,402.7,3.88,NA,NA,35.5,28.5,0,NA,"Mennebeck Bay (190)","Random","Single",2013-07-16,"Summer","Wet","July",35.5,1883.86431617678,1712.86990652258,2341.99527205883,2005.25309727497
"NCRMP_USVI_2013","USVI",2013,"NCRMP","STJ",18.36011672,-64.68546707,"07/16/13","07/16/13","09:55:00 AM","01:55:00 PM",0,2007.17,2344.4,8.04,405.7,3.85,NA,NA,35.6,28.5,0,NA,"Mennebeck Bay (363)","Random","Single",2013-07-16,"Summer","Wet","July",35.6,1883.86431617678,1712.86990652258,2336.63816263219,2002.20988606499
"NCRMP_USVI_2013","USVI",2013,"NCRMP","STJ",18.35270194,-64.6789894,"07/16/13","07/16/13","10:25:00 AM","02:25:00 PM",0,2013.2,2346.92,8.033,414.2,3.81,NA,NA,35.7,28.5,0,NA,"Mennebeck Bay (163)","Random","Single",2013-07-16,"Summer","Wet","July",35.7,1883.86431617678,1712.86990652258,2337.84047678778,2007.3111746377
"NCRMP_USVI_2013","USVI",2013,"NCRMP","STJ",18.37118675,-64.68524336,"07/16/13","07/16/13","11:25:00 AM","03:25:00 PM",0,2010.72,2341.69,8.03,416.9,3.79,NA,NA,35.5,28.6,0,NA,"North of Mennebeck Bay (191)","Random","Single",2013-07-16,"Summer","Wet","July",35.5,1883.86431617678,1712.86990652258,2335.24175093207,2006.52492826088
"NCRMP_USVI_2013","USVI",2013,"NCRMP","STJ",18.38369,-64.89003,"07/17/13","07/17/13","08:45:00 AM","12:45:00 PM",0,2012.11,2355.05,8.077,374.1,4.01,NA,NA,33.6,28.2,0,NA,"86","Random","Single",2013-07-17,"Summer","Wet","July",33.6,1883.86431617678,1712.86990652258,2374.68273682597,2024.57833722823
"NCRMP_USVI_2013","USVI",2013,"NCRMP","STJ",18.34422081,-64.81923564,"07/17/13","07/17/13","09:09:00 AM","01:09:00 PM",0,2008.7,2339.59,8.029,416.8,3.78,NA,NA,35.7,28.5,0,NA,"WNW of Cruz Bay","Random","Single",2013-07-17,"Summer","Wet","July",35.7,1883.86431617678,1712.86990652258,2330.65420227798,2002.89940993182
"NCRMP_USVI_2013","USVI",2013,"NCRMP","STJ",18.36686003,-64.80993496,"07/17/13","07/17/13","10:33:00 AM","02:33:00 PM",0,2017.84,2351.57,8.032,414.9,3.8,NA,NA,35.9,28.3,0,NA,"West of Congo Cay","Random","Single",2013-07-17,"Summer","Wet","July",35.9,1883.86431617678,1712.86990652258,2339.84478787073,2010.19451019137
"NCRMP_USVI_2013","USVI",2013,"NCRMP","STJ",18.38995,-64.89577,"07/17/13","07/17/13","10:40:00 AM","02:40:00 PM",0,2022.39,2355.2,8.058,394.3,3.9,NA,NA,33.7,28.3,0,NA,"299","Random","Single",2013-07-17,"Summer","Wet","July",33.7,1883.86431617678,1712.86990652258,2373.38208869348,2034.32994425877
"NCRMP_USVI_2013","USVI",2013,"NCRMP","STJ",18.36170966,-64.79091957,"07/17/13","07/17/13","11:39:00 AM","03:39:00 PM",0,2010.88,2343.6,8.03,416.5,3.8,NA,NA,35.7,28.6,0,NA,"West of Johnson's Reef","Random","Single",2013-07-17,"Summer","Wet","July",35.7,1883.86431617678,1712.86990652258,2334.585574827,2005.03666483378
"NCRMP_USVI_2013","USVI",2013,"NCRMP","STJ",18.3678295,-64.77418707,"07/17/13","07/17/13","11:48:00 AM","03:48:00 PM",0,2017.03,2350.56,8.032,415.4,3.8,NA,NA,35.8,28.4,0,NA,"North of Johnson's Reef","Random","Single",2013-07-17,"Summer","Wet","July",35.8,1883.86431617678,1712.86990652258,2340.13104617155,2010.23312640274
"NCRMP_USVI_2013","USVI",2013,"NCRMP","STJ",18.37481097,-64.74222684,"07/17/13","07/17/13","12:15:00 PM","04:15:00 PM",0,2008.02,2341.92,8.031,414.7,3.81,NA,NA,35.8,28.6,0,NA,"The Narrows","Random","Single",2013-07-17,"Summer","Wet","July",35.8,1883.86431617678,1712.86990652258,2331.68411879725,2001.42446718486
"NCRMP_USVI_2013","USVI",2013,"NCRMP","STJ",18.3653738,-64.73186541,"07/17/13","07/17/13","01:29:00 PM","05:29:00 PM",0,2013.45,2341.77,8.022,425.3,3.75,NA,NA,35.8,28.6,0,NA,"Mary's Creek","Random","Single",2013-07-17,"Summer","Wet","July",35.8,1883.86431617678,1712.86990652258,2331.53747075255,2006.73312640274
"NCRMP_USVI_2013","USVI",2013,"NCRMP","STJ",18.36546468,-64.75740522,"07/17/13","07/17/13","03:12:00 PM","07:12:00 PM",0,2018.19,2350.47,8.029,418.8,3.79,NA,NA,35.9,28.4,0,NA,"Whistling Key","Random","Single",2013-07-17,"Summer","Wet","July",35.9,1883.86431617678,1712.86990652258,2338.7723644724,2010.53573581811
"NCRMP_USVI_2013","USVI",2013,"NCRMP","STJ",18.36912362,-64.75253122,"07/18/13","07/18/13","09:23:00 AM","01:23:00 PM",0,2023.34,2347.04,8.015,434.7,3.68,NA,NA,36.1,28.3,0,NA,"Fungi Passage","Random","Single",2013-07-18,"Summer","Wet","July",36.1,1883.86431617678,1712.86990652258,2332.92661351231,2013.87969244252
"NCRMP_USVI_2013","USVI",2013,"NCRMP","STJ",18.37387823,-64.73950164,"07/18/13","07/18/13","09:34:00 AM","01:34:00 PM",0,2004.27,2338.87,8.034,410.1,3.8,NA,NA,35.9,28.4,0,NA,"The Narrows","Random","Single",2013-07-18,"Summer","Wet","July",35.9,1883.86431617678,1712.86990652258,2327.46317227184,1996.96470517745
"NCRMP_USVI_2013","USVI",2013,"NCRMP","STJ",18.34395,-64.75971,"07/18/13","07/18/13","09:43:00 AM","01:43:00 PM",0,2007.73,2341.1,8.056,393.5,3.89,NA,NA,33.9,28.5,0,NA,"354","Random","Single",2013-07-18,"Summer","Wet","July",33.9,1883.86431617678,1712.86990652258,2355.93655611226,2017.29773164676
"NCRMP_USVI_2013","USVI",2013,"NCRMP","STJ",18.36784317,-64.71360835,"07/18/13","07/18/13","11:00:00 AM","03:00:00 PM",0,2009.96,2333.76,8.019,427.2,3.69,NA,NA,35.9,28.3,0,NA,"Thread Needle Point","Random","Single",2013-07-18,"Summer","Wet","July",35.9,1883.86431617678,1712.86990652258,2322.48127812142,2002.51205893789
"NCRMP_USVI_2013","USVI",2013,"NCRMP","STJ",18.35074,-64.79411,"07/18/13","07/18/13","11:03:00 AM","03:03:00 PM",0,2000.2,2344.65,8.073,375.4,4.01,NA,NA,33.9,28.5,0,NA,"346","Random","Single",2013-07-18,"Summer","Wet","July",33.9,1883.86431617678,1712.86990652258,2359.60174785267,2009.52339536357
"NCRMP_USVI_2013","USVI",2013,"NCRMP","STJ",18.36410061,-64.72979938,"07/18/13","07/18/13","11:41:00 AM","03:41:00 PM",0,2015.11,2336.74,8.015,432.6,3.67,NA,NA,35.9,28.3,0,NA,"Annaberg Point","Random","Single",2013-07-18,"Summer","Wet","July",35.9,1883.86431617678,1712.86990652258,2325.38657060053,2007.53295030279
"NCRMP_USVI_2013","USVI",2013,"NCRMP","STJ",18.33944,-64.79399,"07/18/13","07/18/13","11:56:00 AM","03:56:00 PM",0,2004.05,2338.76,8.057,390.8,3.89,NA,NA,34.1,28.4,0,NA,"332","Random","Single",2013-07-18,"Summer","Wet","July",34.1,1883.86431617678,1712.86990652258,2350.76604444108,2011.73510510644
"NCRMP_USVI_2013","USVI",2013,"NCRMP","STJ",18.36433102,-64.7441371,"07/18/13","07/18/13","12:33:00 PM","04:33:00 PM",0,2030.04,2367.89,8.036,412.8,3.83,NA,NA,36.3,28,0,NA,"Francis Bay (333)","Random","Single",2013-07-18,"Summer","Wet","July",36.3,1883.86431617678,1712.86990652258,2350.55574686033,2018.68129141816
"NCRMP_USVI_2013","USVI",2013,"NCRMP","STJ",18.35669141,-64.76428031,"07/18/13","07/18/13","12:45:00 PM","04:45:00 PM",0,2011.31,2340.57,8.027,418.7,3.74,NA,NA,36,28.2,0,NA,"Peter Bay (326)","Random","Single",2013-07-18,"Summer","Wet","July",36,1883.86431617678,1712.86990652258,2327.88373100491,2003.0199974034
"NCRMP_USVI_2013","USVI",2013,"NCRMP","STJ",18.32003,-64.84062,"07/18/13","07/18/13","01:56:00 PM","05:56:00 PM",0,1990.82,2329.88,8.068,377.5,3.93,NA,NA,34,28.3,0,NA,"33","Random","Single",2013-07-18,"Summer","Wet","July",34,1883.86431617678,1712.86990652258,2342.99810834774,1998.99500274934
"NCRMP_USVI_2013","USVI",2013,"NCRMP","STJ",18.33292406,-64.69020811,"07/19/13","07/19/13","10:17:00 AM","02:17:00 PM",0,1999.39,2337.05,8.037,406.4,3.85,NA,NA,35.7,28.7,0,NA,"Turner Point (341)","Random","Single",2013-07-19,"Summer","Wet","July",35.7,1883.86431617678,1712.86990652258,2328.16400619954,1993.77195895142
"NCRMP_USVI_2013","USVI",2013,"NCRMP","STJ",18.35076346,-64.6928038,"07/19/13","07/19/13","11:20:00 AM","03:20:00 PM",0,1994.29,2336.22,8.044,399.4,3.91,NA,NA,35.5,28.9,0,NA,"Hurricane Hole (313)","Random","Single",2013-07-19,"Summer","Wet","July",35.5,1883.86431617678,1712.86990652258,2329.84879318559,1990.32633671159
"NCRMP_USVI_2013","USVI",2013,"NCRMP","STJ",18.3009417,-64.69912016,"07/19/13","07/19/13","11:51:00 AM","03:51:00 PM",0,1998.79,2347.89,8.055,388.4,3.97,NA,NA,35.7,28.6,0,NA,"NCRMP Site 353","Random","Single",2013-07-19,"Summer","Wet","July",35.7,1883.86431617678,1712.86990652258,2338.79145717994,1993.18372365731
"NCRMP_USVI_2013","USVI",2013,"NCRMP","STJ",18.3011728,-64.70864765,"07/19/13","07/19/13","11:58:00 AM","03:58:00 PM",0,1998.51,2342.24,8.048,395.3,3.91,NA,NA,35.8,28.5,0,NA,"NCRMP Site 352","Random","Single",2013-07-19,"Summer","Wet","July",35.8,1883.86431617678,1712.86990652258,2331.99696795926,1992.12698115134
"NCRMP_USVI_2013","USVI",2013,"NCRMP","STJ",18.30818537,-64.72255547,"07/19/13","07/19/13","12:03:00 PM","04:03:00 PM",0,1987.17,2337.88,8.06,381.1,3.99,NA,NA,35.6,28.6,0,NA,"Tektite (338)","Random","Single",2013-07-19,"Summer","Wet","July",35.6,1883.86431617678,1712.86990652258,2330.22805027264,1982.54696471667
"NCRMP_USVI_2013","USVI",2013,"NCRMP","STJ",18.31858144,-64.7437727,"07/19/13","07/19/13","12:10:00 PM","04:10:00 PM",0,2003.11,2339.17,8.039,405.9,3.84,NA,NA,35.6,28.5,0,NA,"Reef Bay (324)","Random","Single",2013-07-19,"Summer","Wet","July",35.6,1883.86431617678,1712.86990652258,2331.49630869961,1998.21831303128
"NCRMP_USVI_2013","USVI",2013,"NCRMP","STJ",18.31441579,-64.7595568,"07/19/13","07/19/13","12:16:00 PM","04:16:00 PM",0,1998.25,2347.76,8.056,387.2,3.97,NA,NA,35.8,28.5,0,NA,"Cocoloba Cay (339)","Random","Single",2013-07-19,"Summer","Wet","July",35.8,1883.86431617678,1712.86990652258,2337.39361600395,1991.87279120721
"NCRMP_USVI_2013","USVI",2013,"NCRMP","STJ",18.32465072,-64.7974624,"07/19/13","07/19/13","12:25:00 PM","04:25:00 PM",0,2011.06,2346.39,8.036,410.5,3.84,NA,NA,35.5,28.6,0,NA,"Turner Bay (336)","Random","Single",2013-07-19,"Summer","Wet","July",35.5,1883.86431617678,1712.86990652258,2339.87555374897,2006.86013952849
"calval_jul2013","FLK",2013,"CalVal","FLK",NA,NA,"07/27/13","07/27/13","11:00:00 AM","03:00:00 PM",0,1921.33,2269.05,8.05,374.7,4.1,NA,NA,36.3,30.88,0,NA,"H2O_1","Permanent","Single",2013-07-27,"Summer","Wet","July",36.3,2761.01831444374,3227.6940676083,2286.6686999663,1968.11438809616
"calval_aug2013","FLK",2013,"CalVal","FLK",NA,NA,"08/10/13","08/10/13","01:47:00 PM","05:47:00 PM",0,2011.48,2304.43,7.93,559.5,3.36,NA,NA,36.8,30.5,0,NA,"H2O_1","Permanent","Single",2013-08-10,"Summer","Wet","August",36.8,2761.01831444374,3227.6940676083,2326.76312407605,2070.9687315678
"calval_aug2013","FLK",2013,"CalVal","FLK",NA,NA,"08/23/13","08/23/13","04:18:00 PM","08:18:00 PM",0,2014.25,2295.92,7.937,548.8,3.36,NA,NA,36.4,30.3,0,NA,"H2O_1","Permanent","Single",2013-08-23,"Summer","Wet","August",36.4,2761.01831444374,3227.6940676083,2313.80839670937,2060.92092567724
"calval_aug2013","FLK",2013,"CalVal","FLK",NA,NA,"08/23/13","08/23/13","04:40:00 PM","08:40:00 PM",0,2004.33,2333.39,7.982,487.6,3.71,NA,NA,37.1,30.2,0,NA,"H2O_2","Permanent","Single",2013-08-23,"Summer","Wet","August",37.1,2761.01831444374,3227.6940676083,2357.59537628927,2073.57702269481
"calval_aug2013","FLK",2013,"CalVal","FLK",NA,NA,"08/23/13","08/23/13","04:53:00 PM","08:53:00 PM",0,2006.33,2334.45,7.955,526.3,3.51,NA,NA,37.4,29.9,0,NA,"H2O_3","Permanent","Single",2013-08-23,"Summer","Wet","August",37.4,2761.01831444374,3227.6940676083,2361.82336777179,2084.70630380374
"calval_aug2013","FLK",2013,"CalVal","FLK",NA,NA,"08/23/13","08/23/13","05:07:00 PM","09:07:00 PM",0,2024.83,2361.83,8.012,451.7,3.9,NA,NA,37.5,29.7,0,NA,"H2O_4","Permanent","Single",2013-08-23,"Summer","Wet","August",37.5,2761.01831444374,3227.6940676083,2388.44255429625,2105.02093784055
"calval_aug2013","FLK",2013,"CalVal","FLK",NA,NA,"08/23/13","08/23/13","05:07:00 PM","09:07:00 PM",0,2009.86,2356.17,8.004,460.8,3.84,NA,NA,37.5,29.7,0,NA,"H2O_4","Permanent","Single",2013-08-23,"Summer","Wet","August",37.5,2761.01831444374,3227.6940676083,2383.15988762958,2091.04893784055
"NCRMP_FGB_2013","FGB",2013,"NCRMP","FGB",27.92243,-93.6008,"09/02/13","09/02/13","07:30:00 AM","11:30:00 AM",20,2043.91,2403.32,8.023,427.3,4.03,NA,NA,37.8,29.5,0,NA,"EH74","Random","Single",2013-09-02,"Fall","Wet","September",37.8,1991.81301332128,2307.54092346866,2372.83800098676,2063.43821655323
"NCRMP_FGB_2013","FGB",2013,"NCRMP","FGB",27.91926,-93.60281,"09/02/13","09/02/13","08:25:00 AM","12:25:00 PM",20,2042.36,2406.97,8.032,418.6,4.14,NA,NA,37,30,0,NA,"EH28","Random","Single",2013-09-02,"Fall","Wet","September",37,1991.81301332128,2307.54092346866,2384.52908180115,2056.69410397128
"NCRMP_FGB_2013","FGB",2013,"NCRMP","FGB",27.91069,-93.60277,"09/02/13","09/02/13","09:28:00 AM","01:28:00 PM",20,2048.77,2408.41,8.021,432.2,4.08,NA,NA,37.2,30.1,0,NA,"EH65","Random","Single",2013-09-02,"Fall","Wet","September",37.2,1991.81301332128,2307.54092346866,2383.77254379857,2064.07365676428
"NCRMP_FGB_2013","FGB",2013,"NCRMP","FGB",27.91116,-93.59769,"09/02/13","09/02/13","01:30:00 PM","05:30:00 PM",20,2045.48,2410.41,8.025,427.6,4.16,NA,NA,37,30.5,0,NA,"EH58","Random","Single",2013-09-02,"Fall","Wet","September",37,1991.81301332128,2307.54092346866,2387.7831358552,2059.64545532263
"NCRMP_FGB_2013","FGB",2013,"NCRMP","FGB",27.90527,-93.60274,"09/03/13","09/03/13","07:25:00 AM","11:25:00 AM",20,2047.8,2411.48,8.026,425.9,4.1,NA,NA,37.5,29.9,0,NA,"EL44","Random","Single",2013-09-03,"Fall","Wet","September",37.5,1991.81301332128,2307.54092346866,2383.50220088809,2065.11606156458
"NCRMP_FGB_2013","FGB",2013,"NCRMP","FGB",27.90528,-93.60071,"09/03/13","09/03/13","08:45:00 AM","12:45:00 PM",20,2048.93,2410.24,8.02,433.7,4.11,NA,NA,37.1,30.4,0,NA,"EH15","Random","Single",2013-09-03,"Fall","Wet","September",37.1,1991.81301332128,2307.54092346866,2386.55545358422,2063.5683541586
"NCRMP_FGB_2013","FGB",2013,"NCRMP","FGB",27.90709,-93.6002,"09/03/13","09/03/13","02:10:00 PM","06:10:00 PM",20,2048.4,2400.67,8.011,443.7,4.01,NA,NA,37.1,30.2,0,NA,"EH19","Random","Single",2013-09-03,"Fall","Wet","September",37.1,1991.81301332128,2307.54092346866,2377.52715169743,2063.0683541586
"NCRMP_FGB_2013","FGB",2013,"NCRMP","FGB",27.90936,-93.59819,"09/03/13","09/03/13","05:30:00 PM","09:30:00 PM",20,2048.5,2409.11,8.003,454,4.14,NA,NA,37,31.6,0,NA,"EH64","Random","Single",2013-09-03,"Fall","Wet","September",37,1991.81301332128,2307.54092346866,2386.55340612547,2062.50221207939
"NCRMP_FGB_2013","FGB",2013,"NCRMP","FGB",27.90393,-93.59917,"09/04/13","09/04/13","07:47:00 AM","11:47:00 AM",20,2051.7,2411.7,8.02,433.3,4.08,NA,NA,37.4,30,0,NA,"EL10","Random","Single",2013-09-04,"Fall","Wet","September",37.4,1991.81301332128,2307.54092346866,2384.75538053399,2068.11759936697
"NCRMP_FGB_2013","FGB",2013,"NCRMP","FGB",27.90575,-93.59664,"09/04/13","09/04/13","08:29:00 AM","12:29:00 PM",20,2048.6,2409.64,8.02,432.8,4.1,NA,NA,37.3,30.2,0,NA,"EL59","Random","Single",2013-09-04,"Fall","Wet","September",37.3,1991.81301332128,2307.54092346866,2383.87586945413,2064.56686659458
"NCRMP_FGB_2013","FGB",2013,"NCRMP","FGB",27.90935,-93.60022,"09/04/13","09/04/13","10:42:00 AM","02:42:00 PM",20,2046.3,2405.3,8.019,433.3,4.07,NA,NA,37.3,30.1,0,NA,"EH89","Random","Single",2013-09-04,"Fall","Wet","September",37.3,1991.81301332128,2307.54092346866,2379.80348339515,2062.40868965088
"NCRMP_FGB_2013","FGB",2013,"NCRMP","FGB",27.87481,-93.81996,"09/04/13","09/04/13","02:00:00 PM","06:00:00 PM",20,2044.1,2405.64,8.02,430.9,4.08,NA,NA,37.5,30.1,0,NA,"WH26","Random","Single",2013-09-04,"Fall","Wet","September",37.5,1991.81301332128,2307.54092346866,2378.05153422142,2061.66272823124
"NCRMP_FGB_2013","FGB",2013,"NCRMP","FGB",27.87299,-93.82299,"09/05/13","09/05/13","07:30:00 AM","11:30:00 AM",20,2051.5,2405.44,8.013,440.1,4,NA,NA,37.5,29.8,0,NA,"WL11","Random","Single",2013-09-05,"Fall","Wet","September",37.5,1991.81301332128,2307.54092346866,2377.86486755475,2068.56939489791
"NCRMP_FGB_2013","FGB",2013,"NCRMP","FGB",27.87346,-93.81995,"09/05/13","09/05/13","09:30:00 AM","01:30:00 PM",20,2048.1,2404.26,8.013,439.9,4.02,NA,NA,37.6,30,0,NA,"WH12","Random","Single",2013-09-05,"Fall","Wet","September",37.6,1991.81301332128,2307.54092346866,2375.73972964456,2066.04006385688
"NCRMP_FGB_2013","FGB",2013,"NCRMP","FGB",27.87527,-93.81844,"09/05/13","09/05/13","12:42:00 PM","04:42:00 PM",20,2043.5,2405.33,8.022,428.6,4.08,NA,NA,37.5,30,0,NA,"WH22","Random","Single",2013-09-05,"Fall","Wet","September",37.5,1991.81301332128,2307.54092346866,2377.76220088809,2061.10272823124
"NCRMP_FGB_2013","FGB",2013,"NCRMP","FGB",27.87393,-93.81741,"09/05/13","09/05/13","02:20:00 PM","06:20:00 PM",20,2058.6,2402.98,7.995,462.6,3.9,NA,NA,37.6,30,0,NA,"WH57","Random","Single",2013-09-05,"Fall","Wet","September",37.6,1991.81301332128,2307.54092346866,2374.54824028285,2075.81400002709
"NCRMP_FGB_2013","FGB",2013,"NCRMP","FGB",27.87619,-93.8159,"09/05/13","09/05/13","03:30:00 PM","07:30:00 PM",20,2048.5,2406.91,8.018,434.5,4.06,NA,NA,37.4,30,0,NA,"WH49","Random","Single",2013-09-05,"Fall","Wet","September",37.4,1991.81301332128,2307.54092346866,2380.27276021313,2065.12294696056
"NCRMP_FGB_2013","FGB",2013,"NCRMP","FGB",27.87575,-93.81438,"09/05/13","09/05/13","05:15:00 PM","09:15:00 PM",20,2088.9,2403.66,7.948,528.8,3.59,NA,NA,37.8,29.9,0,NA,"WH13","Random","Single",2013-09-05,"Fall","Wet","September",37.8,1991.81301332128,2307.54092346866,2373.15281580158,2105.09562396064
"NCRMP_FGB_2013","FGB",2013,"NCRMP","FGB",27.87259,-93.81435,"09/06/13","09/06/13","07:45:00 AM","11:45:00 AM",20,2045.5,2404.05,8.019,432,4.02,NA,NA,37.9,29.6,0,NA,"WL29","Random","Single",2013-09-06,"Fall","Wet","September",37.9,1991.81301332128,2307.54092346866,2372.5068004916,2065.5506247509
"NCRMP_FGB_2013","FGB",2013,"NCRMP","FGB",27.87441,-93.81183,"09/06/13","09/06/13","09:30:00 AM","01:30:00 PM",20,2044.8,2402,8.015,437.1,4.03,NA,NA,37.6,30,0,NA,"WL31","Random","Single",2013-09-06,"Fall","Wet","September",37.6,1991.81301332128,2307.54092346866,2373.6360062403,2062.96825534624
"NCRMP_FGB_2013","FGB",2013,"NCRMP","FGB",27.8735,-93.81284,"09/06/13","09/06/13","10:50:00 AM","02:50:00 PM",20,2043.4,2403.17,8.02,431.6,4.06,NA,NA,37.5,30,0,NA,"WH27","Random","Single",2013-09-06,"Fall","Wet","September",37.5,1991.81301332128,2307.54092346866,2375.74620088809,2061.00939489791
"NCRMP_FGB_2013","FGB",2013,"NCRMP","FGB",27.8744,-93.81437,"09/06/13","09/06/13","10:54:00 AM","02:54:00 PM",20,2048.1,2403.51,8.011,441.7,4,NA,NA,37.8,29.9,0,NA,"WH56","Random","Single",2013-09-06,"Fall","Wet","September",37.8,1991.81301332128,2307.54092346866,2373.01392691269,2067.31784618286
"calval_sep2013","FLK",2013,"CalVal","FLK",NA,NA,"09/10/13","09/10/13","01:45:00 PM","05:45:00 PM",0,1917.18,2185.83,7.903,571.9,3.05,NA,NA,36.8,30.7,0,NA,"H2O_1","Permanent","Single",2013-09-10,"Fall","Wet","September",36.8,2761.01831444374,3227.6940676083,2213.96421103257,1981.2812315678
"calval_sep2013","FLK",2013,"CalVal","FLK",NA,NA,"09/10/13","09/10/13","01:45:00 PM","05:45:00 PM",0,1912.79,2174.81,7.884,599,2.93,NA,NA,36.8,30.7,0,NA,"H2O_1","Permanent","Single",2013-09-10,"Fall","Wet","September",36.8,2761.01831444374,3227.6940676083,2203.4832327717,1977.10595982867
"calval_oct2013","FLK",2013,"CalVal","FLK",NA,NA,"10/03/13","10/03/13","04:30:00 PM","08:30:00 PM",0,2046.37,2329.19,7.93,567.9,3.27,NA,NA,36.4,29.4,0,NA,"H2O_1","Permanent","Single",2013-10-03,"Fall","Wet","October",36.4,2761.01831444374,3227.6940676083,2345.79878132476,2091.80554106186
"calval_oct2014","FLK",2013,"CalVal","FLK",NA,NA,"10/03/13","10/03/13","04:30:00 PM","08:30:00 PM",0,2041.99,2325.9,7.925,575.3,3.23,NA,NA,36.4,29.4,0,NA,"H2O_1","Permanent","Single",2013-10-03,"Fall","Wet","October",36.4,2761.01831444374,3227.6940676083,2342.6353197863,2087.59400260032
"calval_oct2015","FLK",2013,"CalVal","FLK",NA,NA,"10/21/13","10/21/13","02:25:00 PM","06:25:00 PM",0,2022.52,2317.91,7.875,658.3,2.91,NA,NA,36.4,29.1,0,NA,"H2O_1","Permanent","Single",2013-10-21,"Fall","Wet","October",36.4,2761.01831444374,3227.6940676083,2334.95262747861,2068.87284875417
"calval_oct2016","FLK",2013,"CalVal","FLK",NA,NA,"10/21/13","10/21/13","02:45:00 PM","06:45:00 PM",0,2069.38,2350.43,7.999,472.2,3.68,NA,NA,36.3,29,0,NA,"H2O_2","Permanent","Single",2013-10-21,"Fall","Wet","October",36.3,2761.01831444374,3227.6940676083,2365.1342647046,2110.86232198046
"calval_oct2017","FLK",2013,"CalVal","FLK",NA,NA,"10/21/13","10/21/13","03:05:00 PM","07:05:00 PM",0,2028.4,2362.09,8.037,429.4,3.91,NA,NA,35.3,29,0,NA,"H2O_4","Permanent","Single",2013-10-21,"Fall","Wet","October",35.3,2761.01831444374,3227.6940676083,2365.4803256185,2038.59230085786
"calval_nov2013","FLK",2013,"CalVal","FLK",24.89663333,-80.6153,"11/11/13","11/11/13","04:25:00 PM","09:25:00 PM",0,2207.63,2414.8,7.831,774.5,2.52,NA,NA,35.6,26.4,0,NA,"CalVal_N","Permanent","Single",2013-11-11,"Fall","Dry","November",35.6,2761.01831444374,3227.6940676083,2420.63514013107,2224.82209102711
"calval_nov2013","FLK",2013,"CalVal","FLK",24.89818333,-80.61606667,"11/11/13","11/11/13","04:31:00 PM","09:31:00 PM",0,2222.08,2427.54,7.826,789,2.51,NA,NA,35.6,26.4,0,NA,"ADCP_NE","Permanent","Single",2013-11-11,"Fall","Dry","November",35.6,2761.01831444374,3227.6940676083,2433.16042102995,2239.02855170126
"calval_nov2013","FLK",2013,"CalVal","FLK",24.89663333,-80.6153,"11/11/13","11/11/13","04:35:00 PM","09:35:00 PM",0,2204.51,2410.92,7.83,775.5,2.52,NA,NA,35.6,26.4,0,NA,"CalVal_SE","Permanent","Single",2013-11-11,"Fall","Dry","November",35.6,2761.01831444374,3227.6940676083,2416.8205333895,2221.75467529677
"calval_nov2013","FLK",2013,"CalVal","FLK",24.89663333,-80.6153,"11/11/13","11/11/13","04:39:00 PM","09:39:00 PM",0,2199.04,2404.06,7.828,777.3,2.5,NA,NA,35.6,26.4,0,NA,"CalVal_S","Permanent","Single",2013-11-11,"Fall","Dry","November",35.6,2761.01831444374,3227.6940676083,2410.07615136703,2216.376866308
"calval_dec2013","FLK",2013,"CalVal","FLK",24.89663333,-80.6153,"12/03/13","12/03/13","04:23:00 PM","09:23:00 PM",0,2230.98,2469.49,7.901,654.4,2.84,NA,NA,35.7,25.2,0,NA,"CalVal_N","Permanent","Single",2013-12-03,"Winter","Dry","December",35.7,2761.01831444374,3227.6940676083,2475.20624145968,2250.52341309036
"calval_dec2013","FLK",2013,"CalVal","FLK",24.89818333,-80.61606667,"12/03/13","12/03/13","04:28:00 PM","09:28:00 PM",0,2222.06,2461.66,7.904,647,2.84,NA,NA,35.7,25.2,0,NA,"ADCP_NE","Permanent","Single",2013-12-03,"Winter","Dry","December",35.7,2761.01831444374,3227.6940676083,2467.52977087145,2241.77831505114
"calval_dec2013","FLK",2013,"CalVal","FLK",24.89663333,-80.6153,"12/03/13","12/03/13","04:34:00 PM","09:34:00 PM",0,2203.86,2445.55,7.91,632.3,2.86,NA,NA,35.7,25.2,0,NA,"CalVal_SE","Permanent","Single",2013-12-03,"Winter","Dry","December",35.7,2761.01831444374,3227.6940676083,2451.73565322439,2223.93517779624
"calval_dec2013","FLK",2013,"CalVal","FLK",24.89558333,-80.61663333,"12/03/13","12/03/13","04:40:00 PM","09:40:00 PM",0,2185.71,2450.13,7.95,567,3.09,NA,NA,35.7,25.2,0,NA,"CalVal_S","Permanent","Single",2013-12-03,"Winter","Dry","December",35.7,2761.01831444374,3227.6940676083,2456.22584930282,2206.14106014918
"calval_dec2013","FLK",2013,"CalVal","FLK",24.89646667,-80.6182,"12/03/13","12/03/13","04:47:00 PM","09:47:00 PM",0,2220.25,2477.92,7.935,598.9,3.03,NA,NA,35.7,25.2,0,NA,"ADCP_S","Permanent","Single",2013-12-03,"Winter","Dry","December",35.7,2761.01831444374,3227.6940676083,2483.47094734203,2240.00380524722
"calval_dec2013","FLK",2013,"CalVal","FLK",24.89826667,-80.61738333,"12/16/13","12/16/13","01:27:00 PM","06:27:00 PM",0,2187.22,2454.32,7.95,570.8,3.15,NA,NA,35.2,25.9,0,NA,"CalVal_N","Permanent","Single",2013-12-16,"Winter","Dry","December",35.2,2761.01831444374,3227.6940676083,2456.06260405934,2193.13178447505
"calval_dec2013","FLK",2013,"CalVal","FLK",24.89818333,-80.61606667,"12/16/13","12/16/13","01:34:00 PM","06:34:00 PM",0,2223.66,2468.79,7.909,643.1,2.93,NA,NA,35.2,25.9,0,NA,"ADCP_NE","Permanent","Single",2013-12-16,"Winter","Dry","December",35.2,2761.01831444374,3227.6940676083,2470.45038815025,2229.3647390205
"calval_dec2013","FLK",2013,"CalVal","FLK",24.89663333,-80.6153,"12/16/13","12/16/13","01:40:00 PM","06:40:00 PM",0,2208.56,2464.76,7.93,606.9,3.04,NA,NA,35.2,25.9,0,NA,"CalVal_SE","Permanent","Single",2013-12-16,"Winter","Dry","December",35.2,2761.01831444374,3227.6940676083,2466.44328587752,2214.35053447505
"calval_dec2013","FLK",2013,"CalVal","FLK",24.89558333,-80.61663333,"12/16/13","12/16/13","01:45:00 PM","06:45:00 PM",0,2234.47,2481.9,7.911,642.2,2.96,NA,NA,35.2,25.9,0,NA,"CalVal_S","Permanent","Single",2013-12-16,"Winter","Dry","December",35.2,2761.01831444374,3227.6940676083,2483.48589951388,2240.11331856596
"calval_dec2013","FLK",2013,"CalVal","FLK",24.89646667,-80.6182,"12/16/13","12/16/13","01:51:00 PM","06:51:00 PM",0,2244.8,2481.53,7.892,677.4,2.86,NA,NA,35.2,25.9,0,NA,"ADCP_S","Permanent","Single",2013-12-16,"Winter","Dry","December",35.2,2761.01831444374,3227.6940676083,2483.11800178661,2250.38462538414
"calval_dec2013","FLK",2013,"CalVal","FLK",24.9052,-80.6266,"12/16/13","12/16/13","02:00:00 PM","07:00:00 PM",0,2271.36,2502.18,7.878,708.8,2.81,NA,NA,35.2,25.9,0,NA,"Transect 1","Permanent","Single",2013-12-16,"Winter","Dry","December",35.2,2761.01831444374,3227.6940676083,2503.65067224116,2276.79371629323
"calval_dec2013","FLK",2013,"CalVal","FLK",24.88546667,-80.6041,"12/16/13","12/16/13","02:18:00 PM","07:18:00 PM",0,2229.25,2455.59,7.871,706.1,2.72,NA,NA,35.7,25.8,0,NA,"Transect 2","Permanent","Single",2013-12-16,"Winter","Dry","December",35.7,2761.01831444374,3227.6940676083,2461.57879047929,2248.82733465899
"calval_jan2014","FLK",2014,"CalVal","FLK",24.89826667,-80.61738333,"01/10/14","01/10/14","10:50:00 AM","03:50:00 PM",0,2151.76,2430.41,8.017,465.9,3.18,NA,NA,35.9,22.6,0,NA,"CalVal_N","Permanent","Single",2014-01-10,"Winter","Dry","January",35.9,2761.01831444374,3227.6940676083,2438.69823072422,2178.73327746093
"calval_jan2014","FLK",2014,"CalVal","FLK",24.89818333,-80.61606667,"01/10/14","01/10/14","11:04:00 AM","04:04:00 PM",0,2149.93,2412.17,8.009,472.5,3.12,NA,NA,36,22.7,0,NA,"ADCP_NE","Permanent","Single",2014-01-10,"Winter","Dry","January",36,2761.01831444374,3227.6940676083,2421.86023095677,2179.8678907669
"calval_jan2014","FLK",2014,"CalVal","FLK",24.89663333,-80.6153,"01/10/14","01/10/14","11:11:00 AM","04:11:00 PM",0,2136.28,2412.67,8.016,463.4,3.17,NA,NA,36,22.7,0,NA,"CalVal_SE","Permanent","Single",2014-01-10,"Winter","Dry","January",36,2761.01831444374,3227.6940676083,2422.34634206788,2166.59705743356
"calval_jan2014","FLK",2014,"CalVal","FLK",24.89558333,-80.61663333,"01/10/14","01/10/14","11:15:00 AM","04:15:00 PM",0,2132.67,2426.71,8.02,461,3.2,NA,NA,36,22.6,0,NA,"CalVal_S","Permanent","Single",2014-01-10,"Winter","Dry","January",36,2761.01831444374,3227.6940676083,2435.99634206788,2163.08733521134
"calval_jan2014","FLK",2014,"CalVal","FLK",24.89646667,-80.6182,"01/10/14","01/10/14","11:21:00 AM","04:21:00 PM",0,2144.09,2438.77,8.027,454,3.25,NA,NA,36,22.5,0,NA,"ADCP_S","Permanent","Single",2014-01-10,"Winter","Dry","January",36,2761.01831444374,3227.6940676083,2447.72134206788,2174.19011298912
"calval_jan2014","FLK",2014,"CalVal","FLK",24.89826667,-80.61738333,"01/31/14","01/31/14","03:05:00 PM","08:05:00 PM",0,2033.27,2367.27,8.045,416.6,3.64,NA,NA,36.7,25.8,0,NA,"CalVal_N","Permanent","Single",2014-01-31,"Winter","Dry","January",36.7,2761.01831444374,3227.6940676083,2385.5090227399,2088.59754536605
"calval_jan2014","FLK",2014,"CalVal","FLK",24.89818333,-80.61606667,"01/31/14","01/31/14","03:15:00 PM","08:15:00 PM",0,2041.27,2370.24,8.046,415.9,3.63,NA,NA,36.7,25.6,0,NA,"ADCP_NE","Permanent","Single",2014-01-31,"Winter","Dry","January",36.7,2761.01831444374,3227.6940676083,2388.34144780802,2096.22697315897
"calval_jan2014","FLK",2014,"CalVal","FLK",24.89663333,-80.6153,"01/31/14","01/31/14","03:20:00 PM","08:20:00 PM",0,2030.72,2368.53,8.068,390.4,3.75,NA,NA,36.6,25.5,0,NA,"CalVal_SE","Permanent","Single",2014-01-31,"Winter","Dry","January",36.6,2761.01831444374,3227.6940676083,2385.68795910137,2083.04673519599
"calval_jan2014","FLK",2014,"CalVal","FLK",24.89558333,-80.61663333,"01/31/14","01/31/14","03:25:00 PM","08:25:00 PM",0,2045.12,2381.99,8.084,375.5,3.87,NA,NA,36.6,25.5,0,NA,"CalVal_S","Permanent","Single",2014-01-31,"Winter","Dry","January",36.6,2761.01831444374,3227.6940676083,2398.55954380082,2096.81722699927
"calval_jan2014","FLK",2014,"CalVal","FLK",24.89646667,-80.6182,"01/31/14","01/31/14","03:30:00 PM","08:30:00 PM",0,2031.28,2371.39,8.073,385.5,3.79,NA,NA,36.6,25.5,0,NA,"ADCP_S","Permanent","Single",2014-01-31,"Winter","Dry","January",36.6,2761.01831444374,3227.6940676083,2388.42293177896,2083.58225432167
"calval_jan2014","FLK",2014,"CalVal","FLK",24.9052,-80.6266,"01/31/14","01/31/14","03:36:00 PM","08:36:00 PM",0,2027.52,2368.04,8.064,394.3,3.8,NA,NA,36.6,26.1,0,NA,"Transect 1","Permanent","Single",2014-01-31,"Winter","Dry","January",36.6,2761.01831444374,3227.6940676083,2385.21937986639,2079.98662590637
"calval_jan2014","FLK",2014,"CalVal","FLK",24.88546667,-80.6041,"01/31/14","01/31/14","03:48:00 PM","08:48:00 PM",0,2029.71,2369.2,8.073,384.6,3.76,NA,NA,36.7,25.3,0,NA,"Transect 2","Permanent","Single",2014-01-31,"Winter","Dry","January",36.7,2761.01831444374,3227.6940676083,2387.34962219494,2085.2024499982
"calval_jan2014","FLK",2014,"CalVal","FLK",24.8694,-80.585,"01/31/14","01/31/14","04:00:00 PM","09:00:00 PM",0,2027.69,2369.3,8.076,381,3.79,NA,NA,36.7,25.3,0,NA,"Transect 3","Permanent","Single",2014-01-31,"Winter","Dry","January",36.7,2761.01831444374,3227.6940676083,2387.44499004235,2083.27601948049
"calval_jan2014","FLK",2014,"CalVal","FLK",24.8547,-80.56741667,"01/31/14","01/31/14","04:12:00 PM","09:12:00 PM",0,2025.05,2368.62,8.076,381.1,3.82,NA,NA,36.6,25.6,0,NA,"Transect 4","Permanent","Single",2014-01-31,"Winter","Dry","January",36.6,2761.01831444374,3227.6940676083,2385.77402467514,2077.62460404845
"calval_feb2014","FLK",2014,"CalVal","FLK",24.89826667,-80.61738333,"02/10/14","02/10/14","11:01:00 AM","04:01:00 PM",0,2037.25,2374.8,8.073,388.1,3.79,NA,NA,35.9,25.7,0,NA,"CalVal_N","Permanent","Single",2014-02-10,"Winter","Dry","February",35.9,2761.01831444374,3227.6940676083,2384.48235328689,2067.09400169492
"calval_feb2014","FLK",2014,"CalVal","FLK",24.89818333,-80.61606667,"02/10/14","02/10/14","11:07:00 AM","04:07:00 PM",0,2029.85,2368.12,8.074,386.2,3.8,NA,NA,35.9,25.8,0,NA,"ADCP_NE","Permanent","Single",2014-02-10,"Winter","Dry","February",35.9,2761.01831444374,3227.6940676083,2377.96981846795,2059.87951701525
"calval_feb2014","FLK",2014,"CalVal","FLK",24.89663333,-80.6153,"02/10/14","02/10/14","11:14:00 AM","04:14:00 PM",0,2031.05,2371.87,8.08,380.5,3.83,NA,NA,35.8,25.7,0,NA,"CalVal_SE","Permanent","Single",2014-02-10,"Winter","Dry","February",35.8,2761.01831444374,3227.6940676083,2380.56605171941,2057.79064955549
"calval_feb2014","FLK",2014,"CalVal","FLK",24.89558333,-80.61663333,"02/10/14","02/10/14","11:19:00 AM","04:19:00 PM",0,2030.77,2372.31,8.08,380.4,3.83,NA,NA,35.9,25.7,0,NA,"CalVal_S","Permanent","Single",2014-02-10,"Winter","Dry","February",35.9,2761.01831444374,3227.6940676083,2382.05477668522,2060.7764529484
"calval_feb2014","FLK",2014,"CalVal","FLK",24.89646667,-80.6182,"02/10/14","02/10/14","11:25:00 AM","04:25:00 PM",0,2038.56,2374.39,8.069,392.7,3.78,NA,NA,35.9,25.8,0,NA,"ADCP_S","Permanent","Single",2014-02-10,"Winter","Dry","February",35.9,2761.01831444374,3227.6940676083,2384.08263183842,2068.37116046929
"calval_feb2014","FLK",2014,"CalVal","FLK",24.8547,-80.56741667,"02/24/14","02/24/14","09:35:00 AM","02:35:00 PM",0,2031.77,2376.32,8.077,383.5,3.86,NA,NA,36.1,26,0,NA,"Transect 4","Permanent","Single",2014-02-24,"Winter","Dry","February",36.1,2761.01831444374,3227.6940676083,2388.04210930438,2068.21089956701
"calval_feb2014","FLK",2014,"CalVal","FLK",24.8694,-80.585,"02/24/14","02/24/14","09:47:00 AM","02:47:00 PM",0,2043.44,2372.79,8.049,413.8,3.71,NA,NA,36.2,26.2,0,NA,"Transect 3","Permanent","Single",2014-02-24,"Winter","Dry","February",36.2,2761.01831444374,3227.6940676083,2385.65944688764,2082.69704091519
"calval_feb2014","FLK",2014,"CalVal","FLK",24.88546667,-80.6041,"02/24/14","02/24/14","09:57:00 AM","02:57:00 PM",0,2034.65,2379.77,8.076,384.7,3.87,NA,NA,36.2,26,0,NA,"Transect 2","Permanent","Single",2014-02-24,"Winter","Dry","February",36.2,2761.01831444374,3227.6940676083,2392.40806567217,2074.19842213066
"calval_feb2014","FLK",2014,"CalVal","FLK",24.9052,-80.6266,"02/24/14","02/24/14","10:01:00 AM","03:01:00 PM",0,2046.63,2357.45,8.015,453.1,3.51,NA,NA,36.3,26.6,0,NA,"Transect 1","Permanent","Single",2014-02-24,"Winter","Dry","February",36.3,2761.01831444374,3227.6940676083,2371.90285974592,2088.92706027247
"calval_feb2014","FLK",2014,"CalVal","FLK",24.89646667,-80.6182,"02/24/14","02/24/14","10:12:00 AM","03:12:00 PM",0,2038.25,2382.67,8.076,385.9,3.87,NA,NA,36.1,26,0,NA,"ADCP_S","Permanent","Single",2014-02-24,"Winter","Dry","February",36.1,2761.01831444374,3227.6940676083,2394.19861899967,2074.49344804347
"calval_feb2014","FLK",2014,"CalVal","FLK",24.89558333,-80.61663333,"02/24/14","02/24/14","10:15:00 AM","03:15:00 PM",0,2031.67,2377.02,8.084,375.4,3.86,NA,NA,36.2,25.5,0,NA,"CalVal_S","Permanent","Single",2014-02-24,"Winter","Dry","February",36.2,2761.01831444374,3227.6940676083,2389.74922589316,2071.31720666105
"calval_feb2014","FLK",2014,"CalVal","FLK",24.89663333,-80.6153,"02/24/14","02/24/14","10:20:00 AM","03:20:00 PM",0,2030.44,2377.89,8.074,386.5,3.9,NA,NA,36.2,26.4,0,NA,"CalVal_SE","Permanent","Single",2014-02-24,"Winter","Dry","February",36.2,2761.01831444374,3227.6940676083,2390.59038611416,2070.12798014171
"calval_feb2014","FLK",2014,"CalVal","FLK",24.89818333,-80.61606667,"02/24/14","02/24/14","10:24:00 AM","03:24:00 PM",0,2031.32,2383.28,8.08,381.3,3.96,NA,NA,36.1,26.5,0,NA,"ADCP_NE","Permanent","Single",2014-02-24,"Winter","Dry","February",36.1,2761.01831444374,3227.6940676083,2394.79003174205,2067.77461147837
"calval_feb2014","FLK",2014,"CalVal","FLK",24.89826667,-80.61738333,"02/24/14","02/24/14","10:28:00 AM","03:28:00 PM",0,2035.93,2380.84,8.072,389.2,3.88,NA,NA,36.1,26.3,0,NA,"CalVal_N","Permanent","Single",2014-02-24,"Winter","Dry","February",36.1,2761.01831444374,3227.6940676083,2392.42438077252,2072.24414056424
"calval_march2014","FLK",2014,"CalVal","FLK",24.89826667,-80.61738333,"03/11/14","03/11/14","01:04:00 PM","05:04:00 PM",0,1998.04,2377.74,8.142,316.8,4.18,NA,NA,36.4,24.9,0,NA,"CalVal_N","Permanent","Single",2014-03-11,"Spring","Dry","March",36.4,2761.01831444374,3227.6940676083,2392.48147363245,2045.3343872157
"calval_march2014","FLK",2014,"CalVal","FLK",24.89818333,-80.61606667,"03/11/14","03/11/14","01:10:00 PM","05:10:00 PM",0,1996.29,2377.29,8.14,318.4,4.2,NA,NA,36.5,25.1,0,NA,"ADCP_NE","Permanent","Single",2014-03-11,"Spring","Dry","March",36.5,2761.01831444374,3227.6940676083,2393.05965675796,2046.89564661404
"calval_march2014","FLK",2014,"CalVal","FLK",24.89663333,-80.6153,"03/11/14","03/11/14","01:17:00 PM","05:17:00 PM",0,2010.75,2388.8,8.137,323.3,4.17,NA,NA,36.5,24.9,0,NA,"CalVal_SE","Permanent","Single",2014-03-11,"Spring","Dry","March",36.5,2761.01831444374,3227.6940676083,2404.09664305933,2060.7614000387
"calval_march2014","FLK",2014,"CalVal","FLK",24.89558333,-80.61663333,"03/11/14","03/11/14","01:22:00 PM","05:22:00 PM",0,2002.69,2379.77,8.135,323.2,4.16,NA,NA,36.5,25,0,NA,"CalVal_S","Permanent","Single",2014-03-11,"Spring","Dry","March",36.5,2761.01831444374,3227.6940676083,2395.43773894974,2053.03263291541
"calval_march2014","FLK",2014,"CalVal","FLK",24.89646667,-80.6182,"03/11/14","03/11/14","01:27:00 PM","05:27:00 PM",0,1994.7,2380.5,8.145,313.7,4.24,NA,NA,36.6,25.1,0,NA,"ADCP_S","Permanent","Single",2014-03-11,"Spring","Dry","March",36.6,2761.01831444374,3227.6940676083,2397.13468041284,2048.60138000473
"calval_may2015","FLK",2014,"CalVal","FLK",NA,NA,"05/23/14","05/23/14","11:19:00 AM","03:19:00 PM",0,1975.13,2366.38,8.291,316.6,4.31,NA,NA,37.6,26.8,0,NA,"ADCP_S","Permanent","Single",2014-05-23,"Spring","Wet","May",37.6,2761.01831444374,3227.6940676083,2393.66881961579,2061.74347276015
"calval_may2015","FLK",2014,"CalVal","FLK",NA,NA,"05/23/14","05/23/14","11:23:00 AM","03:23:00 PM",0,1979.59,2370.44,8.245,316.1,4.3,NA,NA,37.5,26.6,0,NA,"CalVal_S","Permanent","Single",2014-05-23,"Spring","Wet","May",37.5,2761.01831444374,3227.6940676083,2396.47855429625,2062.79693784055
"calval_may2015","FLK",2014,"CalVal","FLK",NA,NA,"05/23/14","05/23/14","11:27:00 AM","03:27:00 PM",0,1978.33,2371.68,8.272,315.1,4.33,NA,NA,37.6,26.7,0,NA,"CalVal_SE","Permanent","Single",2014-05-23,"Spring","Wet","May",37.6,2761.01831444374,3227.6940676083,2398.60233025409,2064.7221961644
"calval_may2015","FLK",2014,"CalVal","FLK",24.89818333,-80.61606667,"05/23/14","05/23/14","11:33:00 AM","03:33:00 PM",0,1976.9,2369.51,8.244,320.3,4.33,NA,NA,37.6,27.1,0,NA,"ADCP_NE","Permanent","Single",2014-05-23,"Spring","Wet","May",37.6,2761.01831444374,3227.6940676083,2396.58238344558,2063.39107914313
"calval_may2015","FLK",2014,"CalVal","FLK",NA,NA,"05/23/14","05/23/14","11:38:00 AM","03:38:00 PM",0,1970.8,2368.12,8.251,315.7,4.38,NA,NA,37.4,27.3,0,NA,"SVN","Permanent","Single",2014-05-23,"Spring","Wet","May",37.4,2761.01831444374,3227.6940676083,2393.33272606056,2051.45630380374
"calval_may2015","FLK",2014,"CalVal","FLK",24.9052,-80.6266,"05/23/14","05/23/14","11:58:00 AM","03:58:00 PM",0,1885.73,2298.95,8.299,277.5,4.47,NA,NA,38.1,27.2,0,NA,"Transect 1","Permanent","Single",2014-05-23,"Spring","Wet","May",38.1,2761.01831444374,3227.6940676083,2336.54610957416,1994.91867741695
"calval_may2015","FLK",2014,"CalVal","FLK",24.88546667,-80.6041,"05/23/14","05/23/14","12:06:00 PM","04:06:00 PM",0,1990.62,2381.51,8.259,323.7,4.33,NA,NA,37.5,27,0,NA,"Transect 2","Permanent","Single",2014-05-23,"Spring","Wet","May",37.5,2761.01831444374,3227.6940676083,2406.81055429625,2073.09160450722
"calval_may2015","FLK",2014,"CalVal","FLK",24.8694,-80.585,"05/23/14","05/23/14","12:13:00 PM","04:13:00 PM",0,2033.54,2386.03,8.198,385.1,3.96,NA,NA,37.2,27.3,0,NA,"Transect 3","Permanent","Single",2014-05-23,"Spring","Wet","May",37.2,2761.01831444374,3227.6940676083,2408.20672827355,2104.16201475103
"calval_may2015","FLK",2014,"CalVal","FLK",24.8547,-80.56742,"05/23/14","05/23/14","12:21:00 PM","04:21:00 PM",0,2035.18,2383.21,8.188,397,3.92,NA,NA,37.1,27.6,0,NA,"Transect 4","Permanent","Single",2014-05-23,"Spring","Wet","May",37.1,2761.01831444374,3227.6940676083,2404.59537628927,2102.68079627972
"NCRMP_PR_2014","PR",2014,"NCRMP","PR",17.93847006,-67.037363,"05/27/14","05/27/14","12:30:00 PM","04:30:00 PM",0,1995.81,2332.39,8.068,379.1,3.92,33.8,NA,NA,28.2,0,NA,"155","Random","Single",2014-05-27,"Spring","Wet","May",33.8,2001.00823353875,1714.66352479484,2344.1550331288,2005.79153166409
"NCRMP_PR_2014","PR",2014,"NCRMP","PR",17.8991891,-67.03921103,"05/28/14","05/28/14","08:35:00 AM","12:35:00 PM",0,2019.04,2357.67,8.077,374.9,3.95,33.6,NA,NA,27.7,0,NA,"119","Random","Single",2014-05-28,"Spring","Wet","May",33.6,2001.00823353875,1714.66352479484,2372.53090693589,2031.72235313355
"NCRMP_PR_2014","PR",2014,"NCRMP","PR",17.9139212,-67.06688874,"05/28/14","05/28/14","10:08:00 AM","02:08:00 PM",0,2016.48,2362.45,8.085,366.2,4.02,33.8,NA,NA,27.7,0,NA,"132","Random","Single",2014-05-28,"Spring","Wet","May",33.8,2001.00823353875,1714.66352479484,2375.28225206371,2027.19537781793
"NCRMP_PR_2014","PR",2014,"NCRMP","PR",17.92172096,-67.12531845,"05/28/14","05/28/14","12:39:00 PM","04:39:00 PM",0,1980.63,2335.32,8.097,348.9,4.11,33.8,NA,NA,28.1,0,NA,"144","Random","Single",2014-05-28,"Spring","Wet","May",33.8,2001.00823353875,1714.66352479484,2347.18905679744,1990.07259675285
"NCRMP_PR_2014","PR",2014,"NCRMP","PR",17.86704787,-67.12400565,"05/29/14","05/29/14","09:40:00 AM","01:40:00 PM",0,2009.78,2362.32,8.105,348.9,4.13,33.1,NA,NA,27.7,0,NA,"108","Random","Single",2014-05-29,"Spring","Wet","May",33.1,2001.00823353875,1714.66352479484,2383.05995034068,2026.72022063111
"NCRMP_PR_2014","PR",2014,"NCRMP","PR",17.901754,-67.06985161,"05/29/14","05/29/14","10:25:00 AM","02:25:00 PM",0,2022.59,2358.18,8.074,378.8,3.92,33.6,NA,NA,27.6,0,NA,"121","Random","Single",2014-05-29,"Spring","Wet","May",33.6,2001.00823353875,1714.66352479484,2373.06215693589,2035.42026980022
"NCRMP_PR_2014","PR",2014,"NCRMP","PR",17.90678205,-66.94334689,"05/30/14","05/30/14","09:00:00 AM","01:00:00 PM",0,2020.58,2358.98,8.087,367.7,3.99,32.8,NA,NA,27.7,0,NA,"127","Random","Single",2014-05-30,"Spring","Wet","May",32.8,2001.00823353875,1714.66352479484,2382.99030140899,2041.09878797108
