"CTDID","Region","Year","Mission","Location","Latitude","Longitude","SiteID","ESTDate","UTCDate","EST.Time","UTCTime","Sample_Depth_m","DIC","TA","pH","pCO2","Aragonite_Sat_W","Salinity_Bottle","Conductivity_Sm","Salinity_CTD","Temperature_C","Pressure_db","Density_Sigmat","Survey_design","Sample_frequency","File_Origin","Notes","Bottle.No.","Temp..o.C..input","pCO2.25","pH.25","Omega.25","Locale","Date","Season","Precipitation","Month","BestSalinity","TA_0","DIC_0","nTA","nDIC","MY","ID","dec.lon","dec.lat","Zone","Sub_region","Reference"
"WS10067_1","FLK",2010,"WaltonSmith","Biscayne",25.6463,-80.1243,"1","3/8/2010","3/8/2010","7:38:00 AM","12:38 PM",0,2072.52,2424.23,8.162,300.5,3.83,36.37,NA,36.494,20.34,"",NA,"Permanent","Single","Lauren’s_DB","","",NA,NA,NA,NA,"",2010-03-08,"Spring","Dry","March",36.37,2677.02550967879,3091.35743555061,2433.75240440638,2110.89798423713,"2010-03","1 _ 2010-03-08",-80.12666667,25.645,"Inshore","Biscayne",1
"WS10067_10","FLK",2010,"WaltonSmith","MK",24.7629,-80.725,"9","3/8/2010","3/8/2010","3:58:00 PM","8:58 PM",0,2078.91,2390.38,8.099,353.6,3.41,36.45,NA,36.499,20.54,"",NA,"Permanent","Single","Lauren’s_DB","","",NA,NA,NA,NA,"",2010-03-08,"Spring","Dry","March",36.45,2677.02550967879,3091.35743555061,2401.78290779243,2119.18568673658,"2010-03","9 _ 2010-03-08",-80.72333333,24.76333333,"Offshore","MK",6
"WS10067_11","FLK",2010,"WaltonSmith","MK",24.7183,-80.6877,"9.5","3/8/2010","3/8/2010","4:48:00 PM","9:48 PM",0,2067.29,2408.08,8.134,322.7,3.73,36.38,NA,36.507,21.24,"",NA,"Permanent","Single","Lauren’s_DB","","",NA,NA,NA,NA,"",2010-03-08,"Spring","Dry","March",36.38,2677.02550967879,3091.35743555061,2418.28189124125,2106.13587853381,"2010-03","9.5 _ 2010-03-08",-80.69,24.71666667,"Oceanic","MK",6
"WS10067_12","FLK",2010,"WaltonSmith","MK",24.7126,-80.8341,"12","3/8/2010","3/8/2010","5:55:00 PM","10:55 PM",0,2073.49,2413.73,8.148,311.3,3.71,36.29,NA,36.48,20.24,"",NA,"Permanent","Single","Lauren’s_DB","","",NA,NA,NA,NA,"",2010-03-08,"Spring","Dry","March",36.29,2677.02550967879,3091.35743555061,2423.0893609117,2109.67211606118,"2010-03","12 _ 2010-03-08",-80.83166667,24.71333333,"Offshore","MK",7
"WS10067_13","FLK",2010,"WaltonSmith","MK",24.753,-80.8467,"11","3/8/2010","3/8/2010","6:14:00 PM","11:14 PM",0,2072,2408.63,8.147,312,3.66,36.39,NA,36.511,19.94,"",NA,"Permanent","Single","Lauren’s_DB","","",NA,NA,NA,NA,"",2010-03-08,"Spring","Dry","March",36.39,2677.02550967879,3091.35743555061,2418.88198566786,2110.93670886,"2010-03","11 _ 2010-03-08",-80.84666667,24.75333333,"Mid channel","MK",7
"WS10067_14","FLK",2010,"WaltonSmith","MK",24.7865,-80.8613,"10","3/8/2010","3/8/2010","6:48:00 PM","11:48 PM",0,2334.34,2724.33,8.227,287.1,4.42,34.98,NA,35.047,17.9,"",NA,"Permanent","Single","Lauren’s_DB","","",NA,NA,NA,NA,"",2010-03-08,"Spring","Dry","March",34.98,2677.02550967879,3091.35743555061,2724.35704659252,2333.90717127756,"2010-03","10 _ 2010-03-08",-80.86,24.78833333,"Inshore","MK",7
"WS10067_16","FLK",2010,"WaltonSmith","LK",24.6352,-81.1859,"17","3/9/2010","3/9/2010","1:05:00 AM","6:05",0,2310.76,2678.78,8.199,304.8,4.16,35.23,NA,35.523,17.91,"",NA,"Permanent","Single","Lauren’s_DB","","",NA,NA,NA,NA,"",2010-03-09,"Spring","Dry","March",35.23,2677.02550967879,3091.35743555061,2678.76854576288,2315.85615129653,"2010-03","17 _ 2010-03-09",-81.19333333,24.635,"Mid channel","LK",9
"WS10067_17","FLK",2010,"WaltonSmith","LK",24.5974,-81.1865,"18","3/9/2010","3/9/2010","12:38:00 AM","5:38",0,2339.89,2722.78,8.196,311.9,4.37,35.03,NA,36.193,19.19,"",NA,"Permanent","Single","Lauren’s_DB","","",NA,NA,NA,NA,"",2010-03-09,"Spring","Dry","March",35.03,2677.02550967879,3091.35743555061,2722.74081545219,2340.53356331906,"2010-03","18 _ 2010-03-09",-81.18333333,24.59833333,"Offshore","LK",9
"WS10067_2","FLK",2010,"WaltonSmith","Biscayne",25.6456,-80.0825,"3","3/8/2010","3/8/2010","8:05:00 AM","13:05",0,2068.17,2418.43,8.139,318.2,3.83,36.55,NA,36.515,21.58,"",NA,"Permanent","Single","Lauren’s_DB","","",NA,NA,NA,NA,"",2010-03-08,"Spring","Dry","March",36.55,2677.02550967879,3091.35743555061,2429.39643064301,2111.56098563895,"2010-03","3 _ 2010-03-08",-80.08333333,25.645,"Offshore","Biscayne",1
"WS10067_22","FLK",2010,"WaltonSmith","LK",24.396,-81.8227,"22.5","3/9/2010","3/9/2010","7:48:00 AM","12:48",0,2084.41,2420.98,8.107,349.1,3.71,36.52,NA,36.558,22.33,"",NA,"Permanent","Single","Lauren’s_DB","","",NA,NA,NA,NA,"",2010-03-09,"Spring","Dry","March",36.52,2677.02550967879,3091.35743555061,2431.63687773033,2126.32018899334,"2010-03","22.5 _ 2010-03-09",-81.82833333,24.39666667,"Oceanic","LK",11
"WS10067_23","FLK",2010,"WaltonSmith","LK",24.4862,-81.8279,"23","3/9/2010","3/9/2010","8:56:00 AM","13:56",0,2120.94,2430.33,8.12,340.8,3.38,36.45,NA,36.507,18.58,"",NA,"Permanent","Single","Lauren’s_DB","","",NA,NA,NA,NA,"",2010-03-09,"Spring","Dry","March",36.45,2677.02550967879,3091.35743555061,2440.14367596802,2159.54371142794,"2010-03","23 _ 2010-03-09",-81.82833333,24.48666667,"Mid channel","LK",11
"WS10067_24","FLK",2010,"WaltonSmith","LK",24.5357,-81.8295,"24","3/9/2010","3/9/2010","9:30:00 AM","14:30",0,2178.44,2459.03,8.08,386.4,3.11,36.21,NA,36.361,17.92,"",NA,"Permanent","Single","Lauren’s_DB","","",NA,NA,NA,NA,"",2010-03-09,"Spring","Dry","March",36.21,2677.02550967879,3091.35743555061,2466.3145779263,2208.94621643237,"2010-03","24 _ 2010-03-09",-81.82833333,24.53666667,"Inshore","LK",11
"WS10067_3","FLK",2010,"WaltonSmith","UK",25.1068,-80.3812,"4","3/8/2010","3/8/2010","12:17:00 PM","17:17",0,2187.09,2558.48,8.216,275.5,4.1,35.73,NA,36.662,17.9,"",NA,"Permanent","Single","Lauren’s_DB","","",NA,NA,NA,NA,"",2010-03-08,"Spring","Dry","March",35.73,2677.02550967879,3091.35743555061,2560.90200453584,2205.56509733983,"2010-03","4 _ 2010-03-08",-80.38,25.10833333,"Inshore","UK",3
"WS10067_4","FLK",2010,"WaltonSmith","UK",25.0933,-80.3545,"5","3/8/2010","3/8/2010","12:42:00 PM","17:42",0,2112.23,2446.23,8.148,315.8,3.62,36.85,NA,36.682,18.86,"",NA,"Permanent","Single","Lauren’s_DB","","",NA,NA,NA,NA,"",2010-03-08,"Spring","Dry","March",36.85,2677.02550967879,3091.35743555061,2457.81674878984,2161.38565144555,"2010-03","5 _ 2010-03-08",-80.355,25.09333333,"Inshore","UK",3
"WS10067_5","FLK",2010,"WaltonSmith","UK",25.079,-80.333,"5.5","3/8/2010","3/8/2010","12:45:00 PM","17:45",0,2080.85,2428.08,8.147,313.7,3.8,36.45,NA,36.553,20.77,"",NA,"Permanent","Single","Lauren’s_DB","","",NA,NA,NA,NA,"",2010-03-08,"Spring","Dry","March",36.45,2677.02550967879,3091.35743555061,2437.98318214086,2121.04851252533,"2010-03","5.5 _ 2010-03-08",-80.33416667,25.07966667,"Mid channel","UK",3
"WS10067_6","FLK",2010,"WaltonSmith","UK",25.0616,-80.3143,"6","3/8/2010","3/8/2010","1:22:00 PM","18:22",0,2067.41,2420.28,8.144,314.8,3.87,36.33,NA,36.507,21.71,"",NA,"Permanent","Single","Lauren’s_DB","","",NA,NA,NA,NA,"",2010-03-08,"Spring","Dry","March",36.33,2677.02550967879,3091.35743555061,2429.67916124065,2104.89555159048,"2010-03","6 _ 2010-03-08",-80.315,25.065,"Offshore","UK",3
"WS10067_7","FLK",2010,"WaltonSmith","UK",25.0484,-80.2868,"6.5","3/8/2010","3/8/2010","1:50:00 PM","18:50",0,2062.71,2418.08,8.143,315.3,3.9,36.41,NA,36.512,22.01,"",NA,"Permanent","Single","Lauren’s_DB","","",NA,NA,NA,NA,"",2010-03-08,"Spring","Dry","March",36.41,2677.02550967879,3091.35743555061,2428.10782665881,2102.54501466977,"2010-03","6.5 _ 2010-03-08",-80.28766667,25.04833333,"Oceanic","UK",3
"WS10067_8","FLK",2010,"WaltonSmith","MK",24.8192,-80.7545,"7","3/8/2010","3/8/2010","5:11:00 PM","22:11",0,2264.78,2625.78,8.172,321.6,4.08,35.27,NA,35.357,19.5,"",NA,"Permanent","Single","Lauren’s_DB","","",NA,NA,NA,NA,"",2010-03-08,"Spring","Dry","March",35.27,2677.02550967879,3091.35743555061,2626.17229621813,2271.10764127016,"2010-03","7 _ 2010-03-08",-80.75666667,24.82083333,"Inshore","MK",6
"WS10067_9","FLK",2010,"WaltonSmith","MK",24.792,-80.742,"8","3/8/2010","3/8/2010","5:32:00 PM","22:32",0,2065.2,2386.83,8.117,335.9,3.52,36.24,NA,35.915,20.64,"",NA,"Permanent","Single","Lauren’s_DB","","",NA,NA,NA,NA,"",2010-03-08,"Spring","Dry","March",36.24,2677.02550967879,3091.35743555061,2396.75942693161,2100.31134713253,"2010-03","8 _ 2010-03-08",-80.74166667,24.7925,"Mid channel","MK",6
"WS10180_1","FLK",2010,"WaltonSmith","Biscayne",25.645,-80.1267,"1","6/29/2010","6/29/2010","7:16:00 AM","11:16 AM",0,1786.83,2142.38,8.064,337.9,3.89,36.5,NA,36.773,30.35,"",NA,"Permanent","Single","Lauren’s_DB","","",NA,NA,NA,NA,"",2010-06-29,"Summer","Wet","June",36.5,2677.02550967879,3091.35743555061,2164.35173327447,1840.44071652948,"2010-06","1 _ 2010-06-29",-80.12666667,25.645,"Inshore","Biscayne",1
"WS10180_11","FLK",2010,"WaltonSmith","MK",24.7001,-81.0251,"13","6/30/2010","6/30/2010","1:53:00 AM","5:53 AM",0,1981.05,2324.68,8.018,422.2,3.89,36.68,NA,37.013,29.99,"",NA,"Permanent","Single","Lauren’s_DB","","",NA,NA,NA,NA,"",2010-06-30,"Summer","Wet","June",36.68,2677.02550967879,3091.35743555061,2340.81796227536,2031.90377567407,"2010-06","13 _ 2010-06-30",-81.03,24.70166667,"Inshore","MK",8
"WS10180_12","FLK",2010,"WaltonSmith","MK",24.675,-81.024,"14","6/30/2010","6/30/2010","2:12:00 AM","6:12 AM",0,1914.02,2310.18,8.095,333.7,4.41,36.81,NA,36.699,30.13,"",NA,"Permanent","Single","Lauren’s_DB","","",NA,NA,NA,NA,"",2010-06-30,"Summer","Wet","June",36.81,2677.02550967879,3091.35743555061,2328.21831492851,1971.91135447831,"2010-06","14 _ 2010-06-30",-81.02333333,24.675,"Mid channel","MK",8
"WS10180_13","FLK",2010,"WaltonSmith","LK",24.6735,-81.2022,"16","6/30/2010","6/30/2010","3:51:00 AM","7:51 AM",0,1847.78,2208.48,8.056,355.4,3.95,37.17,NA,37.374,30.07,"",NA,"Permanent","Single","Lauren’s_DB","","",NA,NA,NA,NA,"",2010-06-30,"Summer","Wet","June",37.17,2677.02550967879,3091.35743555061,2235.83388097936,1920.38056591727,"2010-06","16 _ 2010-06-30",-81.205,24.675,"Inshore","LK",9
"WS10180_14","FLK",2010,"WaltonSmith","LK",24.6352,-81.1941,"17","6/30/2010","6/30/2010","4:24:00 AM","8:24 AM",0,2010.31,2338.43,7.996,453.8,3.74,36.5,NA,36.697,29.85,"",NA,"Permanent","Single","Lauren’s_DB","","",NA,NA,NA,NA,"",2010-06-30,"Summer","Wet","June",36.5,2677.02550967879,3091.35743555061,2352.3448839594,2054.73660694044,"2010-06","17 _ 2010-06-30",-81.19333333,24.635,"Mid channel","LK",9
"WS10180_15","FLK",2010,"WaltonSmith","LK",24.5968,-81.1822,"18","6/30/2010","6/30/2010","4:48:00 AM","8:48 AM",0,2030.15,2359.08,7.999,454.6,3.77,36.22,NA,36.406,29.7,"",NA,"Permanent","Single","Lauren’s_DB","","",NA,NA,NA,NA,"",2010-06-30,"Summer","Wet","June",36.22,2677.02550967879,3091.35743555061,2369.78937387654,2065.8947010318,"2010-06","18 _ 2010-06-30",-81.18333333,24.59833333,"Offshore","LK",9
"WS10180_16","FLK",2010,"WaltonSmith","LK",24.6083,-81.4176,"19","6/30/2010","6/30/2010","6:28:00 AM","10:28 AM",0,1844.15,2192.83,8.042,368.1,3.83,37.05,NA,37.274,30.05,"",NA,"Permanent","Single","Lauren’s_DB","","",NA,NA,NA,NA,"",2010-06-30,"Summer","Wet","June",37.05,2677.02550967879,3091.35743555061,2219.62084466509,1913.15877848526,"2010-06","19 _ 2010-06-30",-81.42166667,24.61,"Inshore","LK",10
"WS10180_17","FLK",2010,"WaltonSmith","LK",24.5747,-81.4185,"20","6/30/2010","6/30/2010","6:51:00 AM","10:51 AM",0,2051.91,2403.28,8.028,427.1,4.03,36.24,NA,36.437,29.63,"",NA,"Permanent","Single","Lauren’s_DB","","",NA,NA,NA,NA,"",2010-06-30,"Summer","Wet","June",36.24,2677.02550967879,3091.35743555061,2412.64656821197,2087.47608223186,"2010-06","20 _ 2010-06-30",-81.41833333,24.575,"Mid channel","LK",10
"WS10180_18","FLK",2010,"WaltonSmith","LK",24.4844,-81.3909,"21.5","6/30/2010","6/30/2010","7:53:00 AM","11:53 AM",0,2032.43,2388.68,8.039,411,4.08,36.11,NA,36.27,29.62,"",NA,"Permanent","Single","Lauren’s_DB","","",NA,NA,NA,NA,"",2010-06-30,"Summer","Wet","June",36.11,2677.02550967879,3091.35743555061,2397.54357008428,2064.98080181283,"2010-06","21.5 _ 2010-06-30",-81.39166667,24.48333333,"Oceanic","LK",10
"WS10180_19","FLK",2010,"WaltonSmith","LK",24.4592,-81.8269,"22","6/30/2010","6/30/2010","11:36:00 AM","3:36 PM",0,2042.41,2405.03,8.043,409.1,4.16,36.19,NA,36.292,29.78,"",NA,"Permanent","Single","Lauren’s_DB","","",NA,NA,NA,NA,"",2010-06-30,"Summer","Wet","June",36.19,2677.02550967879,3091.35743555061,2413.97375950588,2076.90150174925,"2010-06","22 _ 2010-06-30",-81.82833333,24.455,"Offshore","LK",11
"WS10180_2","FLK",2010,"WaltonSmith","Biscayne",25.6475,-80.0833,"3","6/29/2010","6/29/2010","7:54:00 AM","11:54 AM",0,2054.34,2364.58,7.968,498,3.58,36.3,NA,36.492,29.67,"",NA,"Permanent","Single","Lauren’s_DB","","",NA,NA,NA,NA,"",2010-06-29,"Summer","Wet","June",36.3,2677.02550967879,3091.35743555061,2375.76950861109,2091.47836546049,"2010-06","3 _ 2010-06-29",-80.08333333,25.645,"Offshore","Biscayne",1
"WS10180_20","FLK",2010,"WaltonSmith","LK",24.5361,-81.8293,"24","6/30/2010","6/30/2010","12:42:00 PM","4:42 PM",0,1941.42,2281.88,8.019,412.8,3.83,36.67,NA,36.91,30.08,"",NA,"Permanent","Single","Lauren’s_DB","","",NA,NA,NA,NA,"",2010-06-30,"Summer","Wet","June",36.67,2677.02550967879,3091.35743555061,2299.87544590029,1993.78966232259,"2010-06","24 _ 2010-06-30",-81.82833333,24.53666667,"Inshore","LK",11
"WS10180_3","FLK",2010,"WaltonSmith","UK",25.0785,-80.3324,"5.5","6/29/2010","6/29/2010","1:55:00 PM","5:55 PM",0,2016.71,2395.18,8.061,385.1,4.32,36.32,NA,36.497,30.12,"",NA,"Permanent","Single","Lauren’s_DB","","",NA,NA,NA,NA,"",2010-06-29,"Summer","Wet","June",36.32,2677.02550967879,3091.35743555061,2405.42328394207,2055.76656979424,"2010-06","5.5 _ 2010-06-29",-80.33416667,25.07966667,"Mid channel","UK",3
"WS10180_4","FLK",2010,"WaltonSmith","UK",25.0678,-80.3156,"6","6/29/2010","6/29/2010","2:23:00 PM","6:23 PM",0,2038.14,2372.23,8.004,450.5,3.83,36.27,NA,36.435,29.73,"",NA,"Permanent","Single","Lauren’s_DB","","",NA,NA,NA,NA,"",2010-06-29,"Summer","Wet","June",36.27,2677.02550967879,3091.35743555061,2382.90246477232,2075.01858128341,"2010-06","6 _ 2010-06-29",-80.315,25.065,"Offshore","UK",3
"WS10180_5","FLK",2010,"WaltonSmith","MK",24.8157,-80.7525,"7","6/29/2010","6/29/2010","7:06:00 PM","11:06 PM",0,1767.63,2188.08,8.144,270,4.55,37.13,NA,37.274,30.4,"",NA,"Permanent","Single","Lauren’s_DB","","",NA,NA,NA,NA,"",2010-06-29,"Summer","Wet","June",37.13,2677.02550967879,3091.35743555061,2216.12885363899,1843.56696304128,"2010-06","7 _ 2010-06-29",-80.75666667,24.82083333,"Inshore","MK",6
"WS10180_6","FLK",2010,"WaltonSmith","MK",24.793,-80.7415,"8","6/29/2010","6/29/2010","7:19:00 PM","11:19 PM",0,2030.22,2389.78,8.04,409,4.11,36.31,NA,36.545,29.71,"",NA,"Permanent","Single","Lauren’s_DB","","",NA,NA,NA,NA,"",2010-06-29,"Summer","Wet","June",36.31,2677.02550967879,3091.35743555061,2400.14330536159,2068.50394493449,"2010-06","8 _ 2010-06-29",-80.74166667,24.7925,"Mid channel","MK",6
"WS10180_7","FLK",2010,"WaltonSmith","MK",24.7633,-80.7235,"9","6/29/2010","6/29/2010","7:50:00 PM","11:50 PM",0,2045.02,2391.28,8.023,431.2,3.97,36.23,NA,36.414,29.59,"",NA,"Permanent","Single","Lauren’s_DB","","",NA,NA,NA,NA,"",2010-06-29,"Summer","Wet","June",36.23,2677.02550967879,3091.35743555061,2400.98099301421,2080.54291045342,"2010-06","9 _ 2010-06-29",-80.72333333,24.76333333,"Offshore","MK",6
"WS11052_11","FLK",2011,"WaltonSmith","LK",24.6105,-81.422,"19","2/22/2011","2/22/2011","8:45:00 AM","1:45 PM",0,2072.11,2449.46,8.153,309.7,4.2,35.92,NA,35.968,23.54,"",NA,"Permanent","Single","Lauren’s_DB","","",NA,NA,NA,NA,"",2011-02-22,"Winter","Dry","February",35.92,2677.02550967879,3091.35743555061,2455.28851528131,2098.21544656755,"2011-02","19 _ 2011-02-22",-81.42166667,24.61,"Inshore","LK",10
"WS11052_13","FLK",2011,"WaltonSmith","LK",24.4831,-81.3928,"21.5","2/22/2011","2/22/2011","6:52:00 AM","11:52 AM",0,2071.43,2398.31,8.105,348.5,3.6,36.28,NA,36.42,21.86,"",NA,"Permanent","Single","Lauren’s_DB","","",NA,NA,NA,NA,"",2011-02-22,"Winter","Dry","February",36.28,2677.02550967879,3091.35743555061,2408.14340276706,2107.41420941303,"2011-02","21.5 _ 2011-02-22",-81.39166667,24.48333333,"Oceanic","LK",10
"WS11052_3","FLK",2011,"WaltonSmith","UK",25.0524,-80.2865,"6.5","2/21/2011","2/21/2011","6:16:00 PM","11:16 PM",0,2046.15,2380.21,8.113,337.4,3.67,36.27,NA,36.292,22.27,"",NA,"Permanent","Single","Lauren’s_DB","","",NA,NA,NA,NA,"",2011-02-21,"Winter","Dry","February",36.27,2677.02550967879,3091.35743555061,2390.60304376322,2082.74810981939,"2011-02","6.5 _ 2011-02-21",-80.28766667,25.04833333,"Oceanic","UK",3
"WS11094_10","FLK",2011,"WaltonSmith","MK",24.7636,-80.7249,"9","4/4/2011","4/5/2011","10:41:00 PM","2:41 AM",0,2024.36,2377,8.101,347.2,3.93,36.09,NA,36.103,25.23,"",NA,"Permanent","Single","Lauren’s_DB","","",NA,NA,NA,NA,"",2011-04-04,"Spring","Dry","April",36.09,2677.02550967879,3091.35743555061,2386.06145207952,2056.58574687587,"2011-04","9 _ 2011-04-04",-80.72333333,24.76333333,"Offshore","MK",6
"WS11094_21","FLK",2011,"WaltonSmith","LK",24.6087,-81.4202,"19","4/7/2011","4/8/2011","9:48:00 PM","1:48 AM",0,1884.31,2269.4,8.121,307.8,4.26,36.17,NA,36.235,28.33,"",NA,"Permanent","Single","Lauren’s_DB","","",NA,NA,NA,NA,"",2011-04-07,"Spring","Dry","April",36.17,2677.02550967879,3091.35743555061,2282.58556390169,1923.35466407504,"2011-04","19 _ 2011-04-07",-81.42166667,24.61,"Inshore","LK",10
"WS11094_23","FLK",2011,"WaltonSmith","LK",24.5363,-81.4212,"21LK","4/7/2011","4/8/2011","10:35:00 PM","2:35 AM",0,2013.08,2359.55,8.075,370,3.9,35.86,NA,36.044,26.7,"",NA,"Permanent","Single","Lauren’s_DB","","",NA,NA,NA,NA,"",2011-04-07,"Spring","Dry","April",35.86,2677.02550967879,3091.35743555061,2367.16374618862,2038.93941423797,"2011-04","21LK _ 2011-04-07",-81.42,24.54,"Offshore","LK",10
"WS11094_4","FLK",2011,"WaltonSmith","UK",25.108,-80.378,"4","4/4/2011","4/4/2011","10:46:00 AM","2:46 PM",0,1852.65,2299.9,8.245,217.1,4.82,36.43,NA,36.276,25.31,"",NA,"Permanent","Single","Lauren’s_DB","","",NA,NA,NA,NA,"",2011-04-04,"Spring","Dry","April",36.43,2677.02550967879,3091.35743555061,2314.70344438212,1901.27343213937,"2011-04","4 _ 2011-04-04",-80.38,25.10833333,"Inshore","UK",3
"WS11094_6","FLK",2011,"WaltonSmith","UK",25.0652,-80.3196,"6","4/4/2011","4/4/2011","5:30:00 PM","9:30 PM",0,2033.39,2380.6,8.091,357.2,3.87,36.15,NA,36.146,25.21,"",NA,"Permanent","Single","Lauren’s_DB","","",NA,NA,NA,NA,"",2011-04-04,"Spring","Dry","April",36.15,2677.02550967879,3091.35743555061,2390.02985715437,2067.04594884877,"2011-04","6 _ 2011-04-04",-80.315,25.065,"Offshore","UK",3
"WS11094_8","FLK",2011,"WaltonSmith","MK",24.8187,-80.755,"7","4/4/2011","4/5/2011","9:58:00 PM","1:58 AM",0,1978.95,2382.3,8.13,313.9,4.47,36.86,NA,36.864,27.55,"",NA,"Permanent","Single","Lauren’s_DB","","",NA,NA,NA,NA,"",2011-04-04,"Spring","Dry","April",36.86,2677.02550967879,3091.35743555061,2397.1722042323,2035.08341915692,"2011-04","7 _ 2011-04-04",-80.75666667,24.82083333,"Inshore","MK",6
"WS11158_18","FLK",2011,"WaltonSmith","LK",24.6087,-81.4207,"19","6/8/2011","6/8/2011","8:40:00 AM","12:40 PM",0,1948.71,2305.21,8.073,359,3.93,36.93,NA,37.072,27.61,"",NA,"Permanent","Single","Lauren’s_DB","","",NA,NA,NA,NA,"",2011-06-08,"Summer","Wet","June",36.93,2677.02550967879,3091.35743555061,2324.64146313783,2008.42593692425,"2011-06","19 _ 2011-06-08",-81.42166667,24.61,"Inshore","LK",10
"WS11158_20","FLK",2011,"WaltonSmith","LK",24.5352,-81.4121,"21LK","6/8/2011","6/8/2011","9:30:00 AM","1:30 PM",0,2027.3,2375.01,8.058,389.6,3.93,36.15,NA,36.353,27.59,"",NA,"Permanent","Single","Lauren’s_DB","","",NA,NA,NA,NA,"",2011-06-08,"Summer","Wet","June",36.15,2677.02550967879,3091.35743555061,2384.61768564677,2061.14968328861,"2011-06","21LK _ 2011-06-08",-81.42,24.54,"Offshore","LK",10
"WS11158_7","FLK",2011,"WaltonSmith","MK",24.8184,-80.755,"7","6/7/2011","6/8/2011","8:34:00 PM","12:34 AM",0,1928.2,2339.86,8.139,299.2,4.55,36.8,NA,36.922,28.31,"",NA,"Permanent","Single","Lauren’s_DB","","",NA,NA,NA,NA,"",2011-06-07,"Summer","Wet","June",36.8,2677.02550967879,3091.35743555061,2356.35179123429,1985.09357021715,"2011-06","7 _ 2011-06-07",-80.75666667,24.82083333,"Inshore","MK",6
"WS11158_9","FLK",2011,"WaltonSmith","MK",24.761,-80.7276,"9","6/7/2011","6/8/2011","9:28:00 PM","1:28 AM",0,2025.51,2381.56,8.067,380.3,4.02,36.23,NA,36.335,27.7,"",NA,"Permanent","Single","Lauren’s_DB","","",NA,NA,NA,NA,"",2011-06-07,"Summer","Wet","June",36.23,2677.02550967879,3091.35743555061,2391.59098473378,2061.69527037613,"2011-06","9 _ 2011-06-07",-80.72333333,24.76333333,"Offshore","MK",6
"WS11214_20","FLK",2011,"WaltonSmith","LK",24.6109,-81.4225,"19","8/3/2011","8/3/2011","11:05:00 AM","3:05 PM",0,1825.65,2202.61,8.067,343,4.17,36.82,NA,36.255,31.43,"",NA,"Permanent","Single","Lauren’s_DB","","",NA,NA,NA,NA,"",2011-08-03,"Summer","Wet","August",36.82,2677.02550967879,3091.35743555061,2226.06019629591,1888.21348540744,"2011-08","19 _ 2011-08-03",-81.42166667,24.61,"Inshore","LK",10
"WS11214_21","FLK",2011,"WaltonSmith","LK",24.5364,-81.4112,"21LK","8/3/2011","8/3/2011","12:32:00 PM","4:32 PM",0,1988.71,2399.56,8.074,363.4,4.55,38.34,NA,35.695,30.64,"",NA,"Permanent","Single","Lauren’s_DB","","",NA,NA,NA,NA,"",2011-08-03,"Summer","Wet","August",38.34,2677.02550967879,3091.35743555061,2423.73148675866,2084.76744482887,"2011-08","21LK _ 2011-08-03",-81.42,24.54,"Offshore","LK",10
"WS11214_4","FLK",2011,"WaltonSmith","UK",25.1059,-80.3803,"4","8/2/2011","8/2/2011","6:14:00 PM","10:14 PM",0,1900.86,2315.56,8.104,324.7,4.69,36.17,NA,32.055,31.76,"",NA,"Permanent","Single","Lauren’s_DB","","",NA,NA,NA,NA,"",2011-08-02,"Summer","Wet","August",36.17,2677.02550967879,3091.35743555061,2327.25241488317,1939.36931710241,"2011-08","4 _ 2011-08-02",-80.38,25.10833333,"Inshore","UK",3
"WS11214_6","FLK",2011,"WaltonSmith","MK",24.8214,-80.7566,"7","8/2/2011","8/3/2011","10:11:00 PM","2:11 AM",0,1872.73,2284.86,8.086,333.3,4.58,37.28,NA,37.275,32.17,"",NA,"Permanent","Single","Lauren’s_DB","","",NA,NA,NA,NA,"",2011-08-02,"Summer","Wet","August",37.28,2677.02550967879,3091.35743555061,2308.8443713001,1947.25978951329,"2011-08","7 _ 2011-08-02",-80.75666667,24.82083333,"Inshore","MK",6
"WS11214_70","FLK",2011,"WaltonSmith","UK",25.0636,-80.3108,"6","8/7/2011","8/7/2011","7:38:00 AM","11:38 AM",0,1986.24,2389.11,8.097,346.5,4.63,35.66,NA,35.657,30.66,"",NA,"Permanent","Single","Lauren’s_DB","","",NA,NA,NA,NA,"",2011-08-07,"Summer","Wet","August",35.66,2677.02550967879,3091.35743555061,2394.43877836197,2006.69365977183,"2011-08","6 _ 2011-08-07",-80.315,25.065,"Offshore","UK",3
"WS11214_8","FLK",2011,"WaltonSmith","MK",24.7657,-80.7243,"9","8/2/2011","8/3/2011","11:10:00 PM","3:10 AM",0,1987.59,2408.71,8.124,323.8,4.85,35.43,NA,35.411,30.55,"",NA,"Permanent","Single","Lauren’s_DB","","",NA,NA,NA,NA,"",2011-08-02,"Summer","Wet","August",35.43,2677.02550967879,3091.35743555061,2411.96643999892,2000.98599202051,"2011-08","9 _ 2011-08-02",-80.72333333,24.76333333,"Offshore","MK",6
"WS11293_21","FLK",2011,"WaltonSmith","LK",24.6085,-81.4225,"19","10/21/2011","10/21/2011","7:36:00 AM","11:36 AM",0,1946.62,2178.61,7.959,488.1,2.72,32.66,NA,32.669,25.68,"",NA,"Permanent","Single","Lauren’s_DB","","",NA,NA,NA,NA,"",2011-10-21,"Fall","Wet","October",32.66,2677.02550967879,3091.35743555061,2142.89988693667,1864.60268220489,"2011-10","19 _ 2011-10-21",-81.42166667,24.61,"Inshore","LK",10
"WS11293_23","FLK",2011,"WaltonSmith","LK",24.534,-81.4208,"21LK","10/21/2011","10/21/2011","8:20:00 AM","12:20 PM",0,1981.92,2282.11,8.039,403.8,3.45,34.04,NA,34.054,26.48,"",NA,"Permanent","Single","Lauren’s_DB","","",NA,NA,NA,NA,"",2011-10-21,"Fall","Wet","October",34.04,2677.02550967879,3091.35743555061,2270.97254731811,1950.6315176813,"2011-10","21LK _ 2011-10-21",-81.42,24.54,"Offshore","LK",10
"WS11293_7","FLK",2011,"WaltonSmith","MK",24.8198,-80.7546,"7","10/20/2011","10/21/2011","8:24:00 PM","12:24 AM",0,1982.2,2215.7,7.962,495.8,2.78,32.04,NA,32.083,25.87,"",NA,"Permanent","Single","Lauren’s_DB","","",NA,NA,NA,NA,"",2011-10-20,"Fall","Wet","October",32.04,2677.02550967879,3091.35743555061,2173.08066452406,1879.73102343228,"2011-10","7 _ 2011-10-20",-80.75666667,24.82083333,"Inshore","MK",6
"WS11345_18","FLK",2011,"WaltonSmith","LK",24.6047,-81.422,"19","12/12/2011","12/12/2011","5:37:00 AM","10:37 AM",0,2085.47,2376.81,8.038,418.2,3.28,35.77,NA,35.726,23.07,"",NA,"Permanent","Single","Lauren’s_DB","","",NA,NA,NA,NA,"",2011-12-12,"Winter","Dry","December",35.77,2677.02550967879,3091.35743555061,2383.27256478761,2107.12315418994,"2011-12","19 _ 2011-12-12",-81.42166667,24.61,"Inshore","LK",10
"WS11345_20","FLK",2011,"WaltonSmith","LK",24.539,-81.414,"21LK","12/12/2011","12/12/2011","6:22:00 AM","11:22 AM",0,2018.72,2379.01,8.102,346.1,4.04,35.95,NA,35.957,26.04,"",NA,"Permanent","Single","Lauren’s_DB","","",NA,NA,NA,NA,"",2011-12-12,"Winter","Dry","December",35.95,2677.02550967879,3091.35743555061,2386.88523599986,2047.06507826907,"2011-12","21LK _ 2011-12-12",-81.42,24.54,"Offshore","LK",10
"WS11345_3","FLK",2011,"WaltonSmith","UK",25.1032,-80.3763,"4","12/11/2011","12/11/2011","2:21:00 PM","7:21 PM",0,2163.5,2444.56,8.008,468.2,3.22,35.6,NA,35.611,23.36,"",NA,"Permanent","Single","Lauren’s_DB","","",NA,NA,NA,NA,"",2011-12-11,"Winter","Dry","December",35.6,2677.02550967879,3091.35743555061,2448.47795802829,2179.13804666658,"2011-12","4 _ 2011-12-11",-80.38,25.10833333,"Inshore","UK",3
"WS11345_6","FLK",2011,"WaltonSmith","MK",24.7629,-80.7249,"9","12/11/2011","12/12/2011","7:02:00 PM","12:02 AM",0,2015.58,2358.21,8.079,366.4,3.84,35.96,NA,35.966,25.98,"",NA,"Permanent","Single","Lauren’s_DB","","",NA,NA,NA,NA,"",2011-12-11,"Winter","Dry","December",35.96,2677.02550967879,3091.35743555061,2366.7212038179,2044.29930862427,"2011-12","9 _ 2011-12-11",-80.72333333,24.76333333,"Offshore","MK",6
"","FLK",2010,"WaltonSmith","Biscayne",25.6463,-80.1243,"1","3/8/2010","3/8/2010","7:26:00 AM","12:26:00 PM",0,2088.902,2424.2,8.127,323,3.67,36.359,NA,36.477,20.34,"",NA,"Permanent","Single","Derek’s_DB","","1",NA,NA,NA,NA,"",2010-03-08,"Spring","Dry","March",36.359,2677.02550967879,3091.35743555061,2433.64992622606,2126.37104306811,"2010-03","1 _ 2010-03-08",-80.12666667,25.645,"Inshore","Biscayne",1
"","FLK",2010,"WaltonSmith","Biscayne",25.6456,-80.0825,"3","3/8/2010","3/8/2010","8:05:00 AM","1:05:00 PM",0,2084.55,2418.4,8.1,346,3.67,36.547,NA,36.51,21.85,"",NA,"Permanent","Single","Derek’s_DB","","2",NA,NA,NA,NA,"",2010-03-08,"Spring","Dry","March",36.547,2677.02550967879,3091.35743555061,2429.34737361406,2127.16720805529,"2010-03","3 _ 2010-03-08",-80.08333333,25.645,"Offshore","Biscayne",1
"","FLK",2010,"WaltonSmith","UK",25.1068,-80.3812,"4","3/8/2010","3/8/2010","12:17:00 PM","5:17:00 PM",0,2203.514,2558.45,8.183,295,3.93,35.718,NA,36.662,17.9,"",NA,"Permanent","Single","Derek’s_DB","","3",25,395.2,8.084,4.08,"",2010-03-08,"Spring","Dry","March",35.718,2677.02550967879,3091.35743555061,2560.83359415279,2221.36134830409,"2010-03","4 _ 2010-03-08",-80.38,25.10833333,"Inshore","UK",3
"","FLK",2010,"WaltonSmith","UK",25.0933,-80.3545,"5","3/8/2010","3/8/2010","12:42:00 PM","5:42:00 PM",0,2128.626,2446.2,8.113,340,3.46,36.84,NA,36.701,18.86,"",NA,"Permanent","Single","Derek’s_DB","","4",NA,NA,NA,NA,"",2010-03-08,"Spring","Dry","March",36.84,2677.02550967879,3091.35743555061,2457.7287442402,2176.71030622728,"2010-03","5 _ 2010-03-08",-80.355,25.09333333,"Inshore","UK",3
"","FLK",2010,"WaltonSmith","UK",25.079,-80.333,"5.5","3/8/2010","3/8/2010","12:45:00 PM","5:45:00 PM",0,2097.235,2428.05,8.112,337,3.63,36.442,NA,36.518,20.77,"",NA,"Permanent","Single","Derek’s_DB","","5",NA,NA,NA,NA,"",2010-03-08,"Spring","Dry","March",36.442,2677.02550967879,3091.35743555061,2437.90189300688,2136.57215361572,"2010-03","5.5 _ 2010-03-08",-80.33416667,25.07966667,"Mid channel","UK",3
"","FLK",2010,"WaltonSmith","UK",25.0616,-80.3143,"6","3/8/2010","3/8/2010","1:22:00 PM","6:22:00 PM",0,2083.79,2420.25,8.124,326,3.69,36.322,NA,36.505,21.71,"",NA,"Permanent","Single","Derek’s_DB","","6",25,386.6,8.069,3.78,"",2010-03-08,"Spring","Dry","March",36.322,2677.02550967879,3091.35743555061,2429.59577456625,2120.46210367815,"2010-03","6 _ 2010-03-08",-80.315,25.065,"Offshore","UK",3
"","FLK",2010,"WaltonSmith","UK",25.0484,-80.2868,"6.5","3/8/2010","3/8/2010","1:50:00 PM","6:50:00 PM",0,2079.088,2418.05,8.108,339,3.73,36.403,NA,36.505,22.014,"",NA,"Permanent","Single","Derek’s_DB","","7",NA,NA,NA,NA,"",2010-03-08,"Spring","Dry","March",36.403,2677.02550967879,3091.35743555061,2428.0311180419,2118.10165321752,"2010-03","6.5 _ 2010-03-08",-80.28766667,25.04833333,"Oceanic","UK",3
"","FLK",2010,"WaltonSmith","MK",24.8192,-80.7545,"7","3/8/2010","3/8/2010","5:11:00 PM","10:11:00 PM",0,2281.233,2642.1,8.16,326,4.09,35.258,NA,35.39,19.5,"",NA,"Permanent","Single","Derek’s_DB","","8",25,408,8.086,4.22,"",2010-03-08,"Spring","Dry","March",35.258,2677.02550967879,3091.35743555061,2642.35556700599,2287.16107602167,"2010-03","7 _ 2010-03-08",-80.75666667,24.82083333,"Inshore","MK",6
"","FLK",2010,"WaltonSmith","MK",24.792,-80.742,"8","3/8/2010","3/8/2010","5:32:00 PM","10:32:00 PM",0,2081.579,2386.8,8.081,362,3.34,36.235,NA,35.915,20.64,"",NA,"Permanent","Single","Derek’s_DB","","9",NA,NA,NA,NA,"",2010-03-08,"Spring","Dry","March",36.235,2677.02550967879,3091.35743555061,2396.69177603017,2115.99534794825,"2010-03","8 _ 2010-03-08",-80.74166667,24.7925,"Mid channel","MK",6
"","FLK",2010,"WaltonSmith","MK",24.7629,-80.725,"9","3/8/2010","3/8/2010","5:52:00 PM","10:52:00 PM",0,2095.294,2390.35,8.063,382,3.25,36.438,NA,36.49,20.54,"",NA,"Permanent","Single","Derek’s_DB","","10",25,456.8,8.006,3.33,"",2010-03-08,"Spring","Dry","March",36.438,2677.02550967879,3091.35743555061,2401.66344703107,2134.60294177292,"2010-03","9 _ 2010-03-08",-80.72333333,24.76333333,"Offshore","MK",6
"","FLK",2010,"WaltonSmith","MK",24.7183,-80.6877,"9.5","3/8/2010","3/8/2010","6:33:00 PM","11:33:00 PM",0,2083.67,2408.05,8.099,347,3.57,36.368,NA,36.5,21.24,"",NA,"Permanent","Single","Derek’s_DB","","11",NA,NA,NA,NA,"",2010-03-08,"Spring","Dry","March",36.368,2677.02550967879,3091.35743555061,2418.16764455677,2121.57465276708,"2010-03","9.5 _ 2010-03-08",-80.69,24.71666667,"Oceanic","MK",6
"","FLK",2010,"WaltonSmith","MK",24.7865,-80.8613,"10","3/8/2010","3/9/2010","8:42:00 PM","1:42:00 AM",0,2335.194,2724.3,8.217,288,4.41,34.979,NA,35,17.9,"",NA,"Permanent","Single","Derek’s_DB","","14",NA,NA,NA,NA,"",2010-03-08,"Spring","Dry","March",34.979,2677.02550967879,3091.35743555061,2724.32838172323,2334.7400295564,"2010-03","10 _ 2010-03-08",-80.86,24.78833333,"Inshore","MK",7
"","FLK",2010,"WaltonSmith","MK",24.753,-80.8467,"11","3/8/2010","3/9/2010","8:16:00 PM","1:16:00 AM",0,2072.757,2408.6,8.136,313,3.66,36.387,NA,36.476,19.94,"",NA,"Permanent","Single","Derek’s_DB","","13",NA,NA,NA,NA,"",2010-03-08,"Spring","Dry","March",36.387,2677.02550967879,3091.35743555061,2418.83184604184,2111.58402075216,"2010-03","11 _ 2010-03-08",-80.84666667,24.75333333,"Mid channel","MK",7
"","FLK",2010,"WaltonSmith","MK",24.7126,-80.8341,"12","3/8/2010","3/9/2010","7:42:00 PM","12:42:00 AM",0,2089.872,2413.7,8.113,335,3.55,36.281,NA,36.48,20.24,"",NA,"Permanent","Single","Derek’s_DB","","12",NA,NA,NA,NA,"",2010-03-08,"Spring","Dry","March",36.281,2677.02550967879,3091.35743555061,2422.99742779688,2125.23218419945,"2010-03","12 _ 2010-03-08",-80.83166667,24.71333333,"Offshore","MK",7
"WS10067_16","FLK",2010,"WaltonSmith","LK",24.6352,-81.1859,"17","3/9/2010","3/9/2010","1:05:00 AM","6:05:00 AM",0,2311.605,2678.65,8.189,306,4.14,35.234,NA,35.52,17.91,"",NA,"Permanent","Single","Derek’s_DB","","16",NA,NA,NA,NA,"",2010-03-09,"Spring","Dry","March",35.234,2677.02550967879,3091.35743555061,2678.63921125234,2316.78357949477,"2010-03","17 _ 2010-03-09",-81.19333333,24.635,"Mid channel","LK",9
"WS10067_17","FLK",2010,"WaltonSmith","LK",24.5974,-81.1865,"18","3/9/2010","3/9/2010","12:38:00 AM","5:38",0,2340.746,2722.75,8.186,313,4.36,35.032,NA,36.189,19.19,"",NA,"Permanent","Single","Derek’s_DB","","17",NA,NA,NA,NA,"",2010-03-09,"Spring","Dry","March",35.032,2677.02550967879,3091.35743555061,2722.70823293873,2341.43164643576,"2010-03","18 _ 2010-03-09",-81.18333333,24.59833333,"Offshore","LK",9
"","FLK",2010,"WaltonSmith","LK",24.396,-81.8227,"22.5","3/9/2010","3/9/2010","7:48:00 AM","12:48:00 PM",0,2085.171,2420.95,8.096,350,3.7,36.524,NA,36.553,22.33,"",NA,"Permanent","Single","Derek’s_DB","","22",NA,NA,NA,NA,"",2010-03-09,"Spring","Dry","March",36.524,2677.02550967879,3091.35743555061,2431.63500374413,2127.15512352916,"2010-03","22.5 _ 2010-03-09",-81.82833333,24.39666667,"Oceanic","LK",11
"","FLK",2010,"WaltonSmith","LK",24.4862,-81.8279,"23","3/9/2010","3/9/2010","8:56:00 AM","1:56:00 PM",0,2121.715,2430.3,8.109,342,3.37,36.446,NA,36.504,18.579,"",NA,"Permanent","Single","Derek’s_DB","","23",NA,NA,NA,NA,"",2010-03-09,"Spring","Dry","March",36.446,2677.02550967879,3091.35743555061,2440.08886810612,2160.18569532476,"2010-03","23 _ 2010-03-09",-81.82833333,24.48666667,"Mid channel","LK",11
"","FLK",2010,"WaltonSmith","LK",24.5357,-81.8295,"24","3/9/2010","3/9/2010","9:30:00 AM","2:30:00 PM",0,2179.236,2459,8.07,388,3.1,36.212,NA,36.35902,17.92,"",NA,"Permanent","Single","Derek’s_DB","","24",NA,NA,NA,NA,"",2010-03-09,"Spring","Dry","March",36.212,2677.02550967879,3091.35743555061,2466.29721964351,2209.76431050169,"2010-03","24 _ 2010-03-09",-81.82833333,24.53666667,"Inshore","LK",11
"5346","FLK",2010,"WaltonSmith","Biscayne",25.645,-80.1267,"1","6/29/2010","6/29/2010","9:59:00 AM","2:59:00 PM",NA,1787.482,2127.65,8.032,358,3.73,36.497,NA,36.69,30.35,"",NA,"Permanent","Single","Derek’s_DB","CTD","173",NA,NA,NA,NA,"",2010-06-29,"Summer","Wet","June",36.497,2677.02550967879,3091.35743555061,2150.18377367973,1840.96314987586,"2010-06","1 _ 2010-06-29",-80.12666667,25.645,"Inshore","Biscayne",1
"5348","FLK",2010,"WaltonSmith","Biscayne",25.6475,-80.0833,"3","6/29/2010","6/29/2010","10:31:00 AM","3:31:00 PM",NA,2055.091,2349.85,7.934,529,3.41,36.302,NA,36.497,29.67,"",NA,"Permanent","Single","Derek’s_DB","CTD","174",NA,NA,NA,NA,"",2010-06-29,"Summer","Wet","June",36.302,2677.02550967879,3091.35743555061,2361.58440894721,2092.25751697116,"2010-06","3 _ 2010-06-29",-80.08333333,25.645,"Offshore","Biscayne",1
"5349","FLK",2010,"WaltonSmith","UK",25.0785,-80.3324,"5.5","6/29/2010","6/29/2010","4:51:00 PM","9:51:00 PM",NA,2017.447,2380.45,8.03,406,4.15,36.315,NA,36.491,30.12,"UO",NA,"Permanent","Single","Derek’s_DB","FT","175",NA,NA,NA,NA,"",2010-06-29,"Summer","Wet","June",36.315,2677.02550967879,3091.35743555061,2391.18927564994,2056.33429788652,"2010-06","5.5 _ 2010-06-29",-80.33416667,25.07966667,"Mid channel","UK",3
"5350","FLK",2010,"WaltonSmith","UK",25.0678,-80.3156,"6","6/29/2010","6/29/2010","5:10:00 PM","10:10:00 PM",0,2038.885,2357.5,7.972,477,3.66,36.274,NA,36.401,29.73,"",NA,"Permanent","Single","Derek’s_DB","CTD","176",25,396.2,8.051,3.56,"",2010-06-29,"Summer","Wet","June",36.274,2677.02550967879,3091.35743555061,2368.72223905086,2075.84948924551,"2010-06","6 _ 2010-06-29",-80.315,25.065,"Offshore","UK",3
"5352","FLK",2010,"WaltonSmith","MK",24.8157,-80.7525,"7","6/29/2010","6/30/2010","10:03:00 PM","3:03:00 AM",0,1768.275,2173.35,8.114,284,4.38,37.125,NA,37.268,30.4,"MI",NA,"Permanent","Single","Derek’s_DB","CTD","177",25,229.4,8.205,4.25,"",2010-06-29,"Summer","Wet","June",37.125,2677.02550967879,3091.35743555061,2202.17991132842,1844.00699126047,"2010-06","7 _ 2010-06-29",-80.75666667,24.82083333,"Inshore","MK",6
"5353","FLK",2010,"WaltonSmith","MK",24.793,-80.7415,"8","6/29/2010","6/30/2010","10:20:00 PM","3:20:00 AM",NA,2030.962,2375.05,8.009,432,3.94,36.306,NA,36.539,29.71,"",NA,"Permanent","Single","Derek’s_DB","FT","178",NA,NA,NA,NA,"",2010-06-29,"Summer","Wet","June",36.306,2677.02550967879,3091.35743555061,2385.91266775851,2069.1065611973,"2010-06","8 _ 2010-06-29",-80.74166667,24.7925,"Mid channel","MK",6
"5354","FLK",2010,"WaltonSmith","MK",24.7633,-80.7235,"9","6/29/2010","6/30/2010","10:48:00 PM","3:48:00 AM",0,2045.767,2376.55,7.991,456,3.8,36.225,NA,36.413,29.59,"MO",NA,"Permanent","Single","Derek’s_DB","CTD","179",25,380.6,8.068,3.7,"",2010-06-29,"Summer","Wet","June",36.225,2677.02550967879,3091.35743555061,2386.71100757368,2081.12513067079,"2010-06","9 _ 2010-06-29",-80.72333333,24.76333333,"Offshore","MK",6
"5354","FLK",2010,"WaltonSmith","MK",24.7633,-80.7235,"9","06/29/2010","06/30/2010","10:50:00 PM","03:50:00 AM",0,2045.767,2376.55,8.001,456,3.8,36.225,NA,36.413,29.59,"MO",NA,"Permanent","Single","Derek’s_DB","CTD","179",25,380.6,8.068,3.7,"",2010-06-29,"Summer","Wet","June",36.225,2677.02550967879,3091.35743555061,2386.71100757368,2081.12513067079,"2010-06","9 _ 2010-06-29",-80.72333333,24.76333333,"Offshore","MK",6
"5362","FLK",2010,"WaltonSmith","MK",24.7001,-81.0251,"13","6/30/2010","6/30/2010","5:15:00 AM","10:15:00 AM",NA,1914.719,2309.95,8.083,335,4.4,36.807,NA,37.007,30.13,"MI",NA,"Permanent","Single","Derek’s_DB","FT","184",NA,NA,NA,NA,"",2010-06-30,"Summer","Wet","June",36.807,2677.02550967879,3091.35743555061,2327.97117656939,1972.48479599098,"2010-06","13 _ 2010-06-30",-81.03,24.70166667,"Inshore","MK",8
"5361","FLK",2010,"WaltonSmith","MK",24.675,-81.024,"14","6/30/2010","6/30/2010","4:53:00 AM","9:53:00 AM",NA,1981.774,2295.45,7.965,471,3.56,36.683,NA,36.693,29.99,"MO",NA,"Permanent","Single","Derek’s_DB","FT","183",NA,NA,NA,NA,"",2010-06-30,"Summer","Wet","June",36.683,2677.02550967879,3091.35743555061,2312.95651753644,2032.68120284687,"2010-06","14 _ 2010-06-30",-81.02333333,24.675,"Mid channel","MK",8
"5363","FLK",2010,"WaltonSmith","LK",24.6735,-81.2022,"16","6/30/2010","6/30/2010","6:51:00 AM","11:51:00 AM",NA,1848.454,2193.75,8.025,376,3.79,37.173,NA,37.383,30.07,"LI",NA,"Permanent","Single","Derek’s_DB","CTD","185",NA,NA,NA,NA,"",2010-06-30,"Summer","Wet","June",37.173,2677.02550967879,3091.35743555061,2222.00054966056,1921.1096685081,"2010-06","16 _ 2010-06-30",-81.205,24.675,"Inshore","LK",9
"5364","FLK",2010,"WaltonSmith","LK",24.6352,-81.1941,"17","6/30/2010","6/30/2010","7:13:00 AM","12:13:00 PM",NA,2011.045,2323.65,7.963,481,3.57,36.499,NA,36.693,29.85,"",NA,"Permanent","Single","Derek’s_DB","CTD","186",NA,NA,NA,NA,"",2010-06-30,"Summer","Wet","June",36.499,2677.02550967879,3091.35743555061,2338.16299731523,2055.41301942219,"2010-06","17 _ 2010-06-30",-81.19333333,24.635,"Mid channel","LK",9
"5365","FLK",2010,"WaltonSmith","LK",24.5968,-81.1822,"18","6/30/2010","6/30/2010","7:39:00 AM","12:39:00 PM",NA,2030.892,2344.3,7.966,482,3.6,36.223,NA,36.404,29.7,"LO",NA,"Permanent","Single","Derek’s_DB","CTD","187",NA,NA,NA,NA,"",2010-06-30,"Summer","Wet","June",36.223,2677.02550967879,3091.35743555061,2355.53383757108,2066.69657796644,"2010-06","18 _ 2010-06-30",-81.18333333,24.59833333,"Offshore","LK",9
"5366","FLK",2010,"WaltonSmith","LK",24.6083,-81.4176,"19","6/30/2010","6/30/2010","9:19:00 AM","2:19:00 PM",0,1844.823,2178.05,8.01,390,3.66,37.046,NA,37.309,30.05,"LI",NA,"Permanent","Single","Derek’s_DB","CTD","188",NA,NA,NA,NA,"",2010-06-30,"Summer","Wet","June",37.046,2677.02550967879,3091.35743555061,2205.60773613353,1913.66739494511,"2010-06","19 _ 2010-06-30",-81.42166667,24.61,"Inshore","LK",10
"","FLK",2010,"WaltonSmith","LK",24.6083,-81.4176,"19","06/30/2010","06/30/2010","9:28:00 AM","02:28:00 PM",0,1844.823,2178.05,8.02,390,3.66,37.046,NA,37.309,30.05,"",NA,"Permanent","Single","Derek’s_DB","Looe Reef","188",25,319.559490773222,8.095,3.55173738613969,"",2010-06-30,"Summer","Wet","June",37.046,2677.02550967879,3091.35743555061,2205.60773613353,1913.66739494511,"2010-06","19 _ 2010-06-30",-81.42166667,24.61,"Inshore","LK",10
"5367","FLK",2010,"WaltonSmith","LK",24.5747,-81.4185,"20","6/30/2010","6/30/2010","9:42:00 AM","2:42:00 PM",NA,2052.66,2388.5,7.996,452,3.86,36.244,NA,36.434,29.63,"",NA,"Permanent","Single","Derek’s_DB","CTD","189",NA,NA,NA,NA,"",2010-06-30,"Summer","Wet","June",36.244,2677.02550967879,3091.35743555061,2398.40303868338,2088.3111314928,"2010-06","20 _ 2010-06-30",-81.41833333,24.575,"Mid channel","LK",10
"5369","FLK",2010,"WaltonSmith","LK",24.4844,-81.3909,"21.5","6/30/2010","6/30/2010","10:31:00 AM","3:31:00 PM",NA,2033.173,2373.9,8.007,434,3.91,36.114,NA,36.268,29.62,"",NA,"Permanent","Single","Derek’s_DB","CTD","190",NA,NA,NA,NA,"",2010-06-30,"Summer","Wet","June",36.114,2677.02550967879,3091.35743555061,2383.25044076486,2065.81456452355,"2010-06","21.5 _ 2010-06-30",-81.39166667,24.48333333,"Oceanic","LK",10
"","FLK",2010,"WaltonSmith","LK",24.4844,-81.3909,"21.5","06/30/2010","06/30/2010","10:53:00 AM","03:53:00 PM",0,2033.173,2373.9,8.017,434,3.91,36.114,NA,36.268,29.62,"",NA,"Permanent","Single","Derek’s_DB","Looe Reef","190",25,362.004672142522,8.086,3.80030106008898,"",2010-06-30,"Summer","Wet","June",36.114,2677.02550967879,3091.35743555061,2383.25044076486,2065.81456452355,"2010-06","21.5 _ 2010-06-30",-81.39166667,24.48333333,"Oceanic","LK",10
"5371","FLK",2010,"WaltonSmith","LK",24.4592,-81.8269,"22","6/30/2010","6/30/2010","2:30:00 PM","7:30:00 PM",NA,2043.157,2390.25,8.011,432,3.99,36.194,NA,36.286,29.78,"",NA,"Permanent","Single","Derek’s_DB","FT","191",NA,NA,NA,NA,"",2010-06-30,"Summer","Wet","June",36.194,2677.02550967879,3091.35743555061,2399.71040665736,2077.73597220665,"2010-06","22 _ 2010-06-30",-81.82833333,24.455,"Offshore","LK",11
"5373","FLK",2010,"WaltonSmith","LK",24.5361,-81.8293,"24","6/30/2010","6/30/2010","3:32:00 PM","8:32:00 PM",NA,1942.13,2267.1,7.986,437,3.66,36.666,NA,36.909,30.08,"",NA,"Permanent","Single","Derek’s_DB","CTD","192",NA,NA,NA,NA,"",2010-06-30,"Summer","Wet","June",36.666,2677.02550967879,3091.35743555061,2285.72586317364,1994.34766507466,"2010-06","24 _ 2010-06-30",-81.82833333,24.53666667,"Inshore","LK",11
"WS11052_3","FLK",2011,"WaltonSmith","UK",25.0524,-80.2865,"6.5","02/21/2011","02/21/2011","6:16:00 PM","23:16",1,2046.898,2379.4,8.096,354,3.68,36.273,NA,36.292,23.262,"",NA,"Permanent","Single","Derek’s_DB","AP-WD data says 6.5 point","7",25,379.1,8.07,3.71,"",2011-02-21,"Winter","Dry","February",36.273,2677.02550967879,3091.35743555061,2389.84515959036,2083.55327696788,"2011-02","6.5 _ 2011-02-21",-80.28766667,25.04833333,"Oceanic","UK",3
"","FLK",2011,"WaltonSmith","LK",24.6105,-81.422,"19","02/22/2011","02/22/2011","8:45:00 AM","01:45:00 PM",1,2112.923,2448.7,8.091,371,3.77,35.922,NA,35.999,23.537,"",NA,"Permanent","Single","Derek’s_DB","","18",25,393.299621402245,8.069,3.80505596269653,"",2011-02-22,"Winter","Dry","February",35.922,2677.02550967879,3091.35743555061,2454.56036746072,2138.03620498796,"2011-02","19 _ 2011-02-22",-81.42166667,24.61,"Inshore","LK",10
"","FLK",2011,"WaltonSmith","LK",24.4831,-81.3928,"21.5","02/22/2011","02/22/2011","6:52:00 AM","11:52:00 AM",1,2072.178,2397.5,8.103,351,3.58,36.282,NA,36.312,21.862,"",NA,"Permanent","Single","Derek’s_DB","","21",25,398.013302656077,8.056,3.65015216415998,"",2011-02-22,"Winter","Dry","February",36.282,2677.02550967879,3091.35743555061,2407.37684536156,2108.1900179807,"2011-02","21.5 _ 2011-02-22",-81.39166667,24.48333333,"Oceanic","LK",10
"","FLK",2011,"WaltonSmith","UK",25.108,-80.378,"4","04/04/2011","04/04/2011","9:46:00 AM","14:46",NA,1853.319,2300,8.244,218,4.82,36.433,NA,36.276,25.31,"",NA,"Permanent","Single","Derek’s_DB","","4",25,214.9,8.249,4.81,"",2011-04-04,"Spring","Dry","April",36.433,2677.02550967879,3091.35743555061,2314.82934579556,1902.01411371954,"2011-04","4 _ 2011-04-04",-80.38,25.10833333,"Inshore","UK",3
"","FLK",2011,"WaltonSmith","UK",25.0652,-80.3196,"6","04/04/2011","04/04/2011","4:26:00 PM","21:26",NA,2034.126,2380.7,8.09,358,3.87,36.152,NA,NA,25.214,"",NA,"Permanent","Single","Derek’s_DB","","6",25,355.2,8.093,3.86,"",2011-04-04,"Spring","Dry","April",36.152,2677.02550967879,3091.35743555061,2390.14254777467,2067.81516280577,"2011-04","6 _ 2011-04-04",-80.315,25.065,"Offshore","UK",3
"","FLK",2011,"WaltonSmith","MK",24.8187,-80.755,"7","04/04/2011","04/05/2011","8:56:00 PM","1:56",NA,1979.666,2372.7,8.117,325,4.36,36.861,NA,NA,27.551,"",NA,"Permanent","Single","Derek’s_DB","","8",25,293.5,8.155,4.29,"",2011-04-04,"Spring","Dry","April",36.861,2677.02550967879,3091.35743555061,2388.06447121652,2035.79192608881,"2011-04","7 _ 2011-04-04",-80.75666667,24.82083333,"Inshore","MK",6
"","FLK",2011,"WaltonSmith","MK",24.7636,-80.7249,"9","4/4/2011","04/05/2011","9:37:00 PM","2:37",NA,2024.402,2377.1,8.101,347,3.93,36.085,NA,NA,25.2345,"",NA,"Permanent","Single","Derek’s_DB","","10",25,343.9,8.104,3.93,"",2011-04-04,"Spring","Dry","April",36.085,2677.02550967879,3091.35743555061,2386.11812880702,2056.48310426971,"2011-04","9 _ 2011-04-04",-80.72333333,24.76333333,"Offshore","MK",6
"WS11094_21","FLK",2011,"WaltonSmith","LK",24.6087,-81.4202,"19","04/07/2011","04/08/2011","8:48:00 PM","1:48 AM",NA,1885,2269.6,8.12,309,4.25,36.166,NA,NA,28.3283,"",NA,"Permanent","Single","Derek’s_DB","","21",25,270.192222058936,8.169,4.17259823632801,"",2011-04-07,"Spring","Dry","April",36.166,2677.02550967879,3091.35743555061,2282.73549035795,1923.89323590809,"2011-04","19 _ 2011-04-07",-81.42166667,24.61,"Inshore","LK",10
"WS11094_23","FLK",2011,"WaltonSmith","LK",24.5363,-81.4212,"21LK","04/07/2011","04/08/2011","9:35:00 PM","2:35 AM",NA,2013.818,2359.7,8.074,371,3.89,35.855,NA,NA,26.698,"",NA,"Permanent","Single","Derek’s_DB","","23",25,346.809415022471,8.099,3.85627548332323,"",2011-04-07,"Spring","Dry","April",35.855,2677.02550967879,3091.35743555061,2367.26695888371,2039.51305556814,"2011-04","21LK _ 2011-04-07",-81.42,24.54,"Offshore","LK",10
"","FLK",2011,"WaltonSmith","MK",24.8184,-80.755,"7","06/07/2011","06/08/2011","7:34:00 PM","12:34:00 AM",0,1928.2,2339.1,8.139,299,4.54,36.711,NA,36.9191,28.309,"",NA,"Permanent","Single","Derek’s_DB","","5",25,262.2,8.188,4.46,"",2011-06-07,"Summer","Wet","June",36.711,2677.02550967879,3091.35743555061,2354.84979017353,1982.41160884277,"2011-06","7 _ 2011-06-07",-80.75666667,24.82083333,"Inshore","MK",6
"","FLK",2011,"WaltonSmith","MK",24.761,-80.7276,"9","06/07/2011","06/08/2011","8:28:00 PM","01:28:00 AM",0,2025.51,2380.7,8.066,381,4.01,36.15,NA,36.3211,27.7028,"",NA,"Permanent","Single","Derek’s_DB","","9",25,341.9,8.107,3.95,"",2011-06-07,"Summer","Wet","June",36.15,2677.02550967879,3091.35743555061,2390.12667596489,2059.41662658045,"2011-06","9 _ 2011-06-07",-80.72333333,24.76333333,"Offshore","MK",6
"","FLK",2011,"WaltonSmith","LK",24.6087,-81.4207,"19","06/08/2011","06/08/2011","7:41:00 AM","12:41",0,1948.71,2304.4,8.072,359,3.93,36.85,NA,37.067,27.61,"",NA,"Permanent","Single","Derek’s_DB","","14",25,323.817155812958,8.111,3.87009270000028,"",2011-06-08,"Summer","Wet","June",36.85,2677.02550967879,3091.35743555061,2323.10711513991,2006.07493231394,"2011-06","19 _ 2011-06-08",-81.42166667,24.61,"Inshore","LK",10
"","FLK",2011,"WaltonSmith","LK",24.5352,-81.4121,"21LK","06/08/2011","06/08/2011","8:30:00 AM","01:30:00 PM",0,2027.3,2374.2,8.058,390,3.93,36.065,NA,36.202,27.589,"",NA,"Permanent","Single","Derek’s_DB","","16",25,351.783792563359,8.096,3.86593178967852,"",2011-06-08,"Summer","Wet","June",36.065,2677.02550967879,3091.35743555061,2383.14244191898,2058.72163229894,"2011-06","21LK _ 2011-06-08",-81.42,24.54,"Offshore","LK",10
"","FLK",2011,"WaltonSmith","UK",25.1059,-80.3803,"4","08/02/2011","08/02/2011","5:14:00 PM","22:14",0,1951.905,2314.7,8.029,405.9,4.15,36.166,NA,32.055,31.76,"",NA,"Permanent","Single","Derek’s_DB","","K",NA,311,8.129,3.98,"",2011-08-02,"Summer","Wet","August",36.166,2677.02550967879,3091.35743555061,2326.3814561822,1988.64120361256,"2011-08","4 _ 2011-08-02",-80.38,25.10833333,"Inshore","UK",3
"","FLK",2011,"WaltonSmith","MK",24.8214,-80.7566,"7","08/02/2011","8/3/2011","9:11:00 PM","02:11:00 AM",1,1917.236,2284,8.021,405.218,4.116,37.277,NA,37.275,32.17,"",NA,"Permanent","Single","Derek’s_DB","","",25.07,305.7,8.126,3.94,"",2011-08-02,"Summer","Wet","August",37.277,2677.02550967879,3091.35743555061,2308.007272193,1988.95514340609,"2011-08","7 _ 2011-08-02",-80.75666667,24.82083333,"Inshore","MK",6
"","FLK",2011,"WaltonSmith","MK",24.7657,-80.7243,"9","08/02/2011","8/3/2011","10:10:00 PM","03:10:00 AM",1,2033.387,2407.9,8.058,393.644,4.349,35.426,NA,35.411,30.553,"",NA,"Permanent","Single","Derek’s_DB","","",25.1,315.9,8.14,4.21,"",2011-08-02,"Summer","Wet","August",35.426,2677.02550967879,3091.35743555061,2411.13625210645,2046.10916466845,"2011-08","9 _ 2011-08-02",-80.72333333,24.76333333,"Offshore","MK",6
"","FLK",2011,"WaltonSmith","LK",24.6109,-81.4225,"19","08/03/2011","8/3/2011","10:03:00 AM","03:03:00 PM",1,1869.975,2201.8,7.996,421.02,3.707,36.818,NA,36.255,31.429,"",NA,"Permanent","Single","Derek’s_DB","","",26.2,327.208884912781,8.091,3.56491323454254,"",2011-08-03,"Summer","Wet","August",36.818,2677.02550967879,3091.35743555061,2225.26569549123,1930.28444830874,"2011-08","19 _ 2011-08-03",-81.42166667,24.61,"Inshore","LK",10
"","FLK",2011,"WaltonSmith","LK",24.5364,-81.4112,"21LK","08/03/2011","8/3/2011","11:32:00 AM","04:32:00 PM",1,2031.704,2398.8,8.011,436.458,4.101,38.34,NA,35.695,30.64,"",NA,"Permanent","Single","Derek’s_DB","","",26,349.725002056462,8.095,3.96999227791235,"",2011-08-03,"Summer","Wet","August",38.34,2677.02550967879,3091.35743555061,2423.03769437473,2124.01601029575,"2011-08","21LK _ 2011-08-03",-81.42,24.54,"Offshore","LK",10
"","FLK",2011,"WaltonSmith","UK",25.0636,-80.3108,"6","08/07/2011","08/07/2011","8:00:00 AM","01:00:00 PM",NA,2034.321,2390.4,8.029,423.85,4.131,35.659,NA,35.657,30.656,"",NA,"Permanent","Single","Derek’s_DB","","J",NA,339.1,8.112,3.99,"",2011-08-07,"Summer","Wet","August",35.659,2677.02550967879,3091.35743555061,2395.69701368177,2053.85567598721,"2011-08","6 _ 2011-08-07",-80.315,25.065,"Offshore","UK",3
"","FLK",2011,"WaltonSmith","MK",24.8198,-80.7546,"7","10/20/2011","10/21/2011","7:24:00 PM","12:24:00 AM",1,2022.007,2215.7,7.879,620.754,2.373,32.041,NA,32.083,25.873,"",NA,"Permanent","Single","Derek’s_DB","","",24.99,600,7.891,2.36,"",2011-10-20,"Fall","Wet","October",32.041,2677.02550967879,3091.35743555061,2173.09639264881,1923.25203171579,"2011-10","7 _ 2011-10-20",-80.75666667,24.82083333,"Inshore","MK",6
"","FLK",2011,"WaltonSmith","LK",24.6085,-81.4225,"19","10/21/2011","10/21/2011","6:36:00 AM","11:36:00 AM",1,1946.71,2178.1,7.958,489.897,2.714,32.685,NA,32.669,25.681,"",NA,"Permanent","Single","Derek’s_DB","","",24.92,476.926760485362,7.967,2.7011699723506,"",2011-10-21,"Fall","Wet","October",32.685,2677.02550967879,3091.35743555061,2142.76230518873,1865.63737300598,"2011-10","19 _ 2011-10-21",-81.42166667,24.61,"Inshore","LK",10
"","FLK",2011,"WaltonSmith","LK",24.534,-81.4208,"21LK","10/21/2011","10/21/2011","7:20:00 PM","12:20:00 AM",1,1982.01,2281.6,8.038,404.759,3.443,34.035,NA,34.054,26.482,"",NA,"Permanent","Single","Derek’s_DB","","",24.68,381.608772310081,8.06,3.41143633642518,"",2011-10-21,"Fall","Wet","October",34.035,2677.02550967879,3091.35743555061,2270.38843493933,1950.55648816494,"2011-10","21LK _ 2011-10-21",-81.42,24.54,"Offshore","LK",10
"","FLK",2011,"WaltonSmith","UK",25.1032,-80.3763,"4","12/11/2011","12/11/2011","2:21:00 PM","07:21:00 PM",NA,2165.2,2443.8,8.004,474,3.2,35.604,NA,35.611,23.363,"",NA,"Permanent","Single","Derek’s_DB","","",NA,505.3,7.98,3.23,"",2011-12-11,"Winter","Dry","December",35.604,2677.02550967879,3091.35743555061,2447.75652757685,2180.91169225572,"2011-12","4 _ 2011-12-11",-80.38,25.10833333,"Inshore","UK",3
"","FLK",2011,"WaltonSmith","MK",24.7629,-80.7249,"9","12/11/2011","12/12/2011","7:02:00 PM","12:02:00 AM",NA,2015.3,2357.4,8.096,367,3.83,35.95,NA,35.966,24.77,"",NA,"Permanent","Single","Derek’s_DB","","",NA,352.9,8.093,3.81,"",2011-12-11,"Winter","Dry","December",35.95,2677.02550967879,3091.35743555061,2365.8462930235,2043.73545379063,"2011-12","9 _ 2011-12-11",-80.72333333,24.76333333,"Offshore","MK",6
"","FLK",2011,"WaltonSmith","LK",24.6047,-81.422,"19","12/12/2011","12/12/2011","5:37:00 AM","10:37:00 AM",NA,2085.57,2375.2,8.035,421,3.26,35.771,NA,35.726,23.065,"",NA,"Permanent","Single","Derek’s_DB","","",NA,454.831602780952,8.007,3.29589416920388,"",2011-12-12,"Winter","Dry","December",35.771,2677.02550967879,3091.35743555061,2381.70547840324,2107.24851367894,"2011-12","19 _ 2011-12-12",-81.42166667,24.61,"Inshore","LK",10
"","FLK",2011,"WaltonSmith","LK",24.539,-81.414,"21LK","12/12/2011","12/12/2011","6:22:00 AM","11:22:00 AM",NA,2018.82,2377.4,8.099,348,4.02,35.95,NA,35.957,26.041,"",NA,"Permanent","Single","Derek’s_DB","","",NA,334,8.115,3.99,"",2011-12-12,"Winter","Dry","December",35.95,2677.02550967879,3091.35743555061,2385.31778120153,2047.16243570996,"2011-12","21LK _ 2011-12-12",-81.42,24.54,"Offshore","LK",10
"","FLK",2012,"WaltonSmith","LK",24.5364,-81.4112,"21LK","10/11/2012","10/11/2012","6:22:00 AM","11:22",4.6,2025.102,2390.7,8.073,375.71,4.184,35.551,NA,NA,28.7,"",NA,"Permanent","Single","Derek’s_DB","","",27.59,324.339284153729,8.128,4.09463556447448,"Looe Key",2012-10-11,"Fall","Wet","October",35.551,2677.02550967879,3091.35743555061,2395.13771921558,2041.62774456382,"2012-10","21LK _ 2012-10-11",-81.42,24.54,"Offshore","LK",10
"","FLK",2012,"WaltonSmith","LK",24.5364,-81.4112,"21LK","10/11/2012","10/11/2012","6:22:00 AM","11:22",1,2026.288,2398.5,8.079,370.387,4.257,35.672,NA,NA,28.8,"",NA,"Permanent","Single","Derek’s_DB","","",27.4,318.447385196149,8.135,4.16215008082302,"Looe Key",2012-10-11,"Fall","Wet","October",35.672,2677.02550967879,3091.35743555061,2403.74694837699,2046.35210239656,"2012-10","21LK _ 2012-10-11",-81.42,24.54,"Offshore","LK",10
