"CTDID","Region","Year","Mission","Location","Latitude","Longitude","SiteID","ESTDate","UTCDate","EST.Time","UTCTime","Sample_Depth_m","DIC","TA","pH","pCO2","Aragonite_Sat_W","Salinity_Bottle","Conductivity_Sm","Salinity_CTD","Temperature_C","Pressure_db","Density_Sigmat","Survey_design","Sample_frequency","File_Origin","Notes","Bottle.No.","Temp..o.C..input","Locale","pH..total.","Date","DoM","Season","Precipitation","Month","BestSalinity","TA_0","DIC_0","nTA","nDIC","MY","ID","datetime","MoY","ToD","dec.lon","dec.lat","Zone","Sub_region","Reference","Extreme"
"SAV1803_1","FLK",2018,"WaltonSmith","Biscayne",25.6449,-80.0831,"3","03/08/2018","03/08/2018","11:00:00 AM","4:00:00 PM",2,2050.32,2379.23,8.069,380.42,3.667,36.309,NA,36.267,24.66,0,NA,"Permanent","Single","Nikki’s_DB","","",NA,"",NA,2018-03-08,"08","Winter","Dry","March",36.309,2437.85181719917,2893.16216030698,2381.34341426957,2080.70586542846,"2018-03","3 _ 2018-03-08",2018-03-08 11:00:00,3,11,-80.08333333,25.645,"Offshore","Biscayne",1,"Normal"
"SAV1803_11","FLK",2018,"WaltonSmith","MK",24.7928,-80.7425,"8","03/09/2018","03/09/2018","3:07:00 AM","8:07:00 AM",2,2029.17,2385.84,8.126,324.338,3.919,36.509,NA,36.46,23.5,0,NA,"Permanent","Single","Nikki’s_DB","","",NA,"",NA,2018-03-09,"09","Winter","Dry","March",36.509,2437.85181719917,2893.16216030698,2387.98976669187,2064.88076090562,"2018-03","8 _ 2018-03-09",2018-03-09 03:07:00,3,3.11666666666667,-80.74166667,24.7925,"Mid channel","MK",6,"Normal"
"SAV1803_12","FLK",2018,"WaltonSmith","MK",24.8112,-80.7553,"7","03/09/2018","03/09/2018","3:25:00 AM","8:25:00 AM",2,1990.18,2376.13,8.181,274.708,4.154,37.093,NA,37.15,22.38,0,NA,"Permanent","Single","Nikki’s_DB","","",NA,"",NA,2018-03-09,"09","Winter","Dry","March",37.093,2437.85181719917,2893.16216030698,2379.61269925317,2041.13143723944,"2018-03","7 _ 2018-03-09",2018-03-09 03:25:00,3,3.41666666666667,-80.75666667,24.82083333,"Inshore","MK",6,"Normal"
"SAV1803_13","FLK",2018,"WaltonSmith","UK",24.8982,-80.5296,"UK_OFF","03/07/2018","03/08/2018","11:00:00 PM","4:00:00 AM",2,2047.26,2387.185,8.078,371.141,3.789,36.381,NA,36.289,25.06,0,NA,"Permanent","Single","Nikki’s_DB","","",NA,"",NA,2018-03-07,"07","Winter","Dry","March",36.381,2437.85181719917,2893.16216030698,2389.10828068366,2079.36991680778,"2018-03","UK_OFF _ 2018-03-07",2018-03-07 23:00:00,3,23,-80.529497,24.898193,"Offshore","UK",4,"Normal"
"SAV1803_14","FLK",2018,"WaltonSmith","UK",24.921,-80.5473,"UK_MID","03/07/2018","03/08/2018","11:18:00 PM","4:18:00 AM",2,2045.444,2383.749,8.092,357.225,3.745,36.428,NA,36.37,23.97,0,NA,"Permanent","Single","Nikki’s_DB","","",NA,"",NA,2018-03-07,"07","Winter","Dry","March",36.428,2437.85181719917,2893.16216030698,2385.86986370266,2078.67507315577,"2018-03","UK_MID _ 2018-03-07",2018-03-07 23:18:00,3,23.3,-80.546176,24.920702,"Mid channel","UK",4,"Normal"
"SAV1803_15","FLK",2018,"WaltonSmith","MK",24.7611,-80.7228,"9","03/09/2018","03/09/2018","2:40:00 AM","7:40:00 AM",2,2050.2,2380.06,8.071,378.108,3.672,36.381,NA,36.32,24.55,0,NA,"Permanent","Single","Nikki’s_DB","","",NA,"",NA,2018-03-09,"09","Winter","Dry","March",36.381,2437.85181719917,2893.16216030698,2382.25374122625,2082.19831624705,"2018-03","9 _ 2018-03-09",2018-03-09 02:40:00,3,2.66666666666667,-80.72333333,24.76333333,"Offshore","MK",6,"Normal"
"SAV1803_16","FLK",2018,"WaltonSmith","MK",24.7113,-80.8324,"12","03/09/2018","03/09/2018","4:45:00 AM","9:45:00 AM",2,2057.81,2387.05,8.076,374.98,3.658,36.423,NA,36.366,24.09,0,NA,"Permanent","Single","Nikki’s_DB","","",NA,"",NA,2018-03-09,"09","Winter","Dry","March",36.423,2437.85181719917,2893.16216030698,2389.0347619876,2090.4461399148,"2018-03","12 _ 2018-03-09",2018-03-09 04:45:00,3,4.75,-80.83166667,24.71333333,"Offshore","MK",7,"Normal"
"SAV1803_17","FLK",2018,"WaltonSmith","UK",24.9361,-80.5675,"UK_IN","03/07/2018","03/08/2018","11:35:00 PM","4:35:00 AM",2,1982.671,2387.356,8.2,260.679,4.382,36.768,NA,36.697,23.01,0,NA,"Permanent","Single","Nikki’s_DB","","",NA,"",NA,2018-03-07,"07","Winter","Dry","March",36.768,2437.85181719917,2893.16216030698,2389.78410609248,2026.45223290423,"2018-03","UK_IN _ 2018-03-07",2018-03-07 23:35:00,3,23.5833333333333,-80.569852,24.939806,"Inshore","UK",4,"Normal"
"SAV1803_18","FLK",2018,"WaltonSmith","MK",24.7169,-80.6916,"9.5","03/09/2018","03/09/2018","1:45:00 AM","6:45:00 AM",2,2051.3,2380.54,8.067,382.476,3.673,36.33,NA,36.28,24.79,0,NA,"Permanent","Single","Nikki’s_DB","","",NA,"",NA,2018-03-09,"09","Winter","Dry","March",36.33,2437.85181719917,2893.16216030698,2382.6381204755,2082.11961665864,"2018-03","9.5 _ 2018-03-09",2018-03-09 01:45:00,3,1.75,-80.69,24.71666667,"Oceanic","MK",6,"Normal"
"SAV1803_19","FLK",2018,"WaltonSmith","MK",24.7538,-80.8481,"11","03/09/2018","03/09/2018","5:29:00 AM","10:29:00 AM",2,2011.47,2436.8,8.229,246.105,4.652,36.3,NA,36.253,22.87,0,NA,"Permanent","Single","Nikki’s_DB","","",NA,"",NA,2018-03-09,"09","Winter","Dry","March",36.3,2437.85181719917,2893.16216030698,2436.83766838454,2043.0457522975,"2018-03","11 _ 2018-03-09",2018-03-09 05:29:00,3,5.48333333333333,-80.84666667,24.75333333,"Mid channel","MK",7,"Normal"
"SAV1803_2","FLK",2018,"WaltonSmith","Biscayne",25.6424,-80.104,"2","03/08/2018","03/08/2018","12:20:00 PM","5:20:00 PM",2,2047.75,2377.01,8.071,377.7,3.665,36.34,NA,36.284,24.55,0,NA,"Permanent","Single","Nikki’s_DB","","",NA,"",NA,2018-03-08,"08","Winter","Dry","March",36.34,2437.85181719917,2893.16216030698,2379.25347922529,2078.92370101297,"2018-03","2 _ 2018-03-08",2018-03-08 12:20:00,3,12.3333333333333,-80.105,25.64166667,"Mid channel","Biscayne",1,"Normal"
"SAV1803_20","FLK",2018,"WaltonSmith","MK",24.6752,-81.0232,"14","03/09/2018","03/09/2018","7:40:00 AM","12:40:00 PM",2,2042.07,2385.36,8.101,348.16,3.798,36.367,NA,36.385,23.89,0,NA,"Permanent","Single","Nikki’s_DB","","",NA,"",NA,2018-03-09,"09","Winter","Dry","March",36.367,2437.85181719917,2893.16216030698,2387.33311612482,2074.06172280198,"2018-03","14 _ 2018-03-09",2018-03-09 07:40:00,3,7.66666666666667,-81.02333333,24.675,"Mid channel","MK",8,"Normal"
"SAV1803_21","FLK",2018,"WaltonSmith","MK",24.644,-81.0152,"15","03/09/2018","03/09/2018","8:00:00 AM","1:00:00 PM",2,2053.64,2397.71,8.098,353.254,3.811,36.464,NA,36.313,24,0,NA,"Permanent","Single","Nikki’s_DB","","",NA,"",NA,2018-03-09,"09","Winter","Dry","March",36.464,2437.85181719917,2893.16216030698,2399.32166137504,2087.3461332462,"2018-03","15 _ 2018-03-09",2018-03-09 08:00:00,3,8,-81.01666667,24.64333333,"Offshore","MK",8,"Normal"
"SAV1803_22","FLK",2018,"WaltonSmith","MK",24.5918,-80.9915,"15.5","03/09/2018","03/09/2018","8:25:00 AM","1:25:00 PM",2,2050.31,2378.67,8.067,382.481,3.66,36.363,NA,36.308,24.71,0,NA,"Permanent","Single","Nikki’s_DB","","",NA,"",NA,2018-03-09,"09","Winter","Dry","March",36.363,2437.85181719917,2893.16216030698,2380.88832128379,2081.90275897199,"2018-03","15.5 _ 2018-03-09",2018-03-09 08:25:00,3,8.41666666666667,-80.99166667,24.59166667,"Oceanic","MK",8,"Normal"
"SAV1803_23","FLK",2018,"WaltonSmith","LK",24.5978,-81.1872,"18","03/09/2018","03/09/2018","9:59:00 AM","2:59:00 PM",2,2043.84,2378.82,8.083,365.975,3.72,36.353,NA,36.275,24.36,0,NA,"Permanent","Single","Nikki’s_DB","","",NA,"",NA,2018-03-09,"09","Winter","Dry","March",36.353,2437.85181719917,2893.16216030698,2381.01706898112,2075.45040032172,"2018-03","18 _ 2018-03-09",2018-03-09 09:59:00,3,9.98333333333333,-81.18333333,24.59833333,"Offshore","LK",9,"Normal"
"SAV1803_24","FLK",2018,"WaltonSmith","LK",24.6353,-81.1931,"17","03/09/2018","03/09/2018","10:24:00 AM","3:24:00 PM",2,2010.27,2329.1,8.099,345.132,3.521,35.655,NA,35.902,22.63,0,NA,"Permanent","Single","Nikki’s_DB","","",NA,"",NA,2018-03-09,"09","Winter","Dry","March",35.655,2437.85181719917,2893.16216030698,2331.09782471646,2026.48916603565,"2018-03","17 _ 2018-03-09",2018-03-09 10:24:00,3,10.4,-81.19333333,24.635,"Mid channel","LK",9,"Normal"
"SAV1803_25","FLK",2018,"WaltonSmith","LK",24.6623,-81.1998,"16","03/09/2018","03/09/2018","10:51:00 AM","3:51:00 PM",2,2016.34,2333.56,8.101,343.943,3.482,35.992,NA,35.944,22.04,0,NA,"Permanent","Single","Nikki’s_DB","","",NA,"",NA,2018-03-09,"09","Winter","Dry","March",35.992,2437.85181719917,2893.16216030698,2336.43445773121,2040.50669212671,"2018-03","16 _ 2018-03-09",2018-03-09 10:51:00,3,10.85,-81.205,24.675,"Inshore","LK",9,"Normal"
"SAV1803_26","FLK",2018,"WaltonSmith","LK",24.4857,-81.3857,"21.5","03/09/2018","03/09/2018","12:56:00 PM","5:56:00 PM",2,2053.81,2384.21,8.07,379.882,3.683,36.36,NA,36.288,24.65,0,NA,"Permanent","Single","Nikki’s_DB","","",NA,"",NA,2018-03-09,"09","Winter","Dry","March",36.36,2437.85181719917,2893.16216030698,2386.21640460371,2085.20491028651,"2018-03","21.5 _ 2018-03-09",2018-03-09 12:56:00,3,12.9333333333333,-81.39166667,24.48333333,"Oceanic","LK",10,"Normal"
"SAV1803_27","FLK",2018,"WaltonSmith","LK",24.5368,-81.413,"21LK","03/09/2018","03/09/2018","2:05:00 PM","7:05:00 PM",2,2050.1,2383.52,8.074,376.02,3.716,36.347,NA,36.28,24.76,0,NA,"Permanent","Single","Nikki’s_DB","","",NA,"",NA,2018-03-09,"09","Winter","Dry","March",36.347,2437.85181719917,2893.16216030698,2385.53350751829,2081.34342393962,"2018-03","21LK _ 2018-03-09",2018-03-09 14:05:00,3,14.0833333333333,-81.42,24.54,"Offshore","LK",10,"Normal"
"SAV1803_28","FLK",2018,"WaltonSmith","LK",24.5719,-81.418,"20","03/09/2018","03/09/2018","2:50:00 PM","7:50:00 PM",2,2054.52,2387.4,8.089,361.149,3.691,36.298,NA,36.285,23.64,0,NA,"Permanent","Single","Nikki’s_DB","","",NA,"",NA,2018-03-09,"09","Winter","Dry","March",36.298,2437.85181719917,2893.16216030698,2389.20413407693,2084.50946289268,"2018-03","20 _ 2018-03-09",2018-03-09 14:50:00,3,14.8333333333333,-81.41833333,24.575,"Mid channel","LK",10,"Normal"
"SAV1803_29","FLK",2018,"WaltonSmith","LK",24.6078,-81.4209,"19","03/09/2018","03/09/2018","3:08:00 PM","8:08:00 PM",2,2048.58,2393.93,8.114,338.628,3.827,36.093,NA,36.025,23.42,0,NA,"Permanent","Single","Nikki’s_DB","","",NA,"",NA,2018-03-09,"09","Winter","Dry","March",36.093,2437.85181719917,2893.16216030698,2395.26007913442,2074.15638049526,"2018-03","19 _ 2018-03-09",2018-03-09 15:08:00,3,15.1333333333333,-81.42166667,24.61,"Inshore","LK",10,"Normal"
"SAV1803_3","FLK",2018,"WaltonSmith","Biscayne",25.6452,-80.1269,"1","03/08/2018","03/08/2018","12:49:00 PM","5:49:00 PM",2,2044.45,2373.28,8.072,376.126,3.656,36.354,NA,36.271,24.47,0,NA,"Permanent","Single","Nikki’s_DB","","",NA,"",NA,2018-03-08,"08","Winter","Dry","March",36.354,2437.85181719917,2893.16216030698,2375.68496893018,2076.06017398514,"2018-03","1 _ 2018-03-08",2018-03-08 12:49:00,3,12.8166666666667,-80.12666667,25.645,"Inshore","Biscayne",1,"Normal"
"SAV1803_31","FLK",2018,"WaltonSmith","LK",24.3974,-81.8272,"22.5","03/08/2018","03/09/2018","7:01:00 PM","12:01:00 AM",2,2040.18,2378.58,8.081,367.55,3.764,36.377,NA,36.297,24.84,0,NA,"Permanent","Single","Nikki’s_DB","","",NA,"",NA,2018-03-08,"08","Winter","Dry","March",36.377,2437.85181719917,2893.16216030698,2380.82365099605,2072.46843595521,"2018-03","22.5 _ 2018-03-08",2018-03-08 19:01:00,3,19.0166666666667,-81.82833333,24.39666667,"Oceanic","LK",11,"Normal"
"SAV1803_32","FLK",2018,"WaltonSmith","LK",24.536,-81.8282,"24","03/08/2018","03/09/2018","8:08:00 PM","1:08:00 AM",2,2055.72,2392.57,8.107,344.384,3.713,36.376,NA,36.28,22.74,0,NA,"Permanent","Single","Nikki’s_DB","","",NA,"",NA,2018-03-08,"08","Winter","Dry","March",36.376,2437.85181719917,2893.16216030698,2394.28288158308,2087.39804081214,"2018-03","24 _ 2018-03-08",2018-03-08 20:08:00,3,20.1333333333333,-81.82833333,24.53666667,"Inshore","LK",11,"Normal"
"SAV1803_33","FLK",2018,"WaltonSmith","LK",24.4868,-81.8267,"23","03/08/2018","03/09/2018","7:45:00 PM","12:45:00 AM",2,2055.98,2394.82,8.092,359.398,3.76,36.376,NA,36.27,23.97,0,NA,"Permanent","Single","Nikki’s_DB","","",NA,"",NA,2018-03-08,"08","Winter","Dry","March",36.376,2437.85181719917,2893.16216030698,2396.44777052084,2087.64820575606,"2018-03","23 _ 2018-03-08",2018-03-08 19:45:00,3,19.75,-81.82833333,24.48666667,"Mid channel","LK",11,"Normal"
"SAV1803_34","FLK",2018,"WaltonSmith","LK",24.4567,-81.8286,"22","03/08/2018","03/09/2018","7:26:00 PM","12:26:00 AM",2,2052.75,2392.33,8.084,366.572,3.779,36.376,NA,36.27,24.6,0,NA,"Permanent","Single","Nikki’s_DB","","",NA,"",NA,2018-03-08,"08","Winter","Dry","March",36.376,2437.85181719917,2893.16216030698,2394.05196009638,2084.5403874143,"2018-03","22 _ 2018-03-08",2018-03-08 19:26:00,3,19.4333333333333,-81.82833333,24.455,"Offshore","LK",11,"Normal"
"SAV1803_4","FLK",2018,"WaltonSmith","Biscayne",25.2956,-80.1607,"EK_OFF","03/08/2018","03/08/2018","3:42:00 PM","8:42:00 PM",2,2046.65,2374.92,8.063,385.576,3.663,36.355,NA,36.291,24.99,0,NA,"Permanent","Single","Nikki’s_DB","","",NA,"",NA,2018-03-08,"08","Winter","Dry","March",36.355,2437.85181719917,2893.16216030698,2377.26555390744,2078.20065265344,"2018-03","EK_OFF _ 2018-03-08",2018-03-08 15:42:00,3,15.7,-80.162604,25.294251,"Offshore","Biscayne",2,"Normal"
"SAV1803_5","FLK",2018,"WaltonSmith","Biscayne",25.3147,-80.1959,"EK_MID","03/08/2018","03/08/2018","4:03:00 PM","9:03:00 PM",2,2037.66,2374.62,8.085,362.398,3.739,36.354,NA,36.301,24.43,0,NA,"Permanent","Single","Nikki’s_DB","","",NA,"",NA,2018-03-08,"08","Winter","Dry","March",36.354,2437.85181719917,2893.16216030698,2376.97506080452,2069.52306665169,"2018-03","EK_MID _ 2018-03-08",2018-03-08 16:03:00,3,16.05,-80.1946,25.314483,"Mid channel","Biscayne",2,"Normal"
"SAV1803_6","FLK",2018,"WaltonSmith","Biscayne",25.3246,-80.2174,"EK_IN","03/08/2018","03/08/2018","4:22:00 PM","9:22:00 PM",2,1991.54,2378.71,8.169,285.042,4.226,36.552,NA,36.488,23.72,0,NA,"Permanent","Single","Nikki’s_DB","","",NA,"",NA,2018-03-08,"08","Winter","Dry","March",36.552,2437.85181719917,2893.16216030698,2381.22116492376,2029.82292823365,"2018-03","EK_IN _ 2018-03-08",2018-03-08 16:22:00,3,16.3666666666667,-80.227501,25.336306,"Inshore","Biscayne",2,"Normal"
"SAV1803_7","FLK",2018,"WaltonSmith","UK",25.048,-80.2873,"6.5","03/07/2018","03/08/2018","7:00:00 PM","12:00:00 AM",2,2044.34,2373.19,8.06,388.969,3.679,36.287,NA,36.23,25.36,0,NA,"Permanent","Single","Nikki’s_DB","","",NA,"",NA,2018-03-07,"07","Winter","Dry","March",36.287,2437.85181719917,2893.16216030698,2375.48337665653,2074.44538540841,"2018-03","6.5 _ 2018-03-07",2018-03-07 19:00:00,3,19,-80.28766667,25.04833333,"Oceanic","UK",3,"Normal"
"SAV1803_8","FLK",2018,"WaltonSmith","UK",25.0649,-80.315,"6","03/07/2018","03/08/2018","7:12:00 PM","12:12:00 AM",2,2044.77,2385.66,8.088,361.074,3.788,36.358,NA,36.32,24.53,0,NA,"Permanent","Single","Nikki’s_DB","","",NA,"",NA,2018-03-07,"07","Winter","Dry","March",36.358,2437.85181719917,2893.16216030698,2387.60940557117,2076.45811688478,"2018-03","6 _ 2018-03-07",2018-03-07 19:12:00,3,19.2,-80.315,25.065,"Offshore","UK",3,"Normal"
"SAV1803_9","FLK",2018,"WaltonSmith","UK",25.0768,-80.3298,"5.5","03/07/2018","03/08/2018","7:22:00 PM","12:22:00 AM",2,1991.46,2384.62,8.178,278.111,4.288,36.562,NA,36.51,23.6,0,NA,"Permanent","Single","Nikki’s_DB","","",NA,"",NA,2018-03-07,"07","Winter","Dry","March",36.562,2437.85181719917,2893.16216030698,2386.89416712612,2029.98247618838,"2018-03","5.5 _ 2018-03-07",2018-03-07 19:22:00,3,19.3666666666667,-80.33416667,25.07966667,"Mid channel","UK",3,"Normal"
"SAV18173_1","FLK",2018,"WaltonSmith","Biscayne",25.6463,-80.083,"1","06/22/2018","06/22/2018","9:58:00 AM","1:58:00 PM",2,2055.64,2388.62,8.008,451.09,3.866,35.601,NA,35.501,29.71,0,NA,"Permanent","Single","Nikki’s_DB","","",NA,"",NA,2018-06-22,"22","Spring","Wet","June",35.601,2437.85181719917,2893.16216030698,2389.45110929852,2069.77867077735,"2018-06","1 _ 2018-06-22",2018-06-22 09:58:00,6,9.96666666666667,-80.12666667,25.645,"Inshore","Biscayne",1,"Normal"
"SAV18173_10","FLK",2018,"WaltonSmith","UK",24.8992,-80.5257833333333,"UK_OFF","06/22/2018","06/23/2018","8:53:00 PM","12:53:00 AM",2,2016.063,2373.128,8.038,408.724,4.071,36.337,NA,36.289,29.78,0,NA,"Permanent","Single","Nikki’s_DB","","",NA,"",NA,2018-06-22,"22","Spring","Wet","June",36.337,2437.85181719917,2893.16216030698,2375.50947738105,2048.33538289706,"2018-06","UK_OFF _ 2018-06-22",2018-06-22 20:53:00,6,20.8833333333333,-80.529497,24.898193,"Offshore","UK",4,"Normal"
"SAV18173_11","FLK",2018,"WaltonSmith","UK",24.9179,-80.5456,"UK_MID","06/22/2018","06/23/2018","9:15:00 PM","1:15:00 AM",2,2004.856,2376.466,8.046,397.753,4.243,36.389,NA,36.265,30.59,0,NA,"Permanent","Single","Nikki’s_DB","","",NA,"",NA,2018-06-22,"22","Spring","Wet","June",36.389,2437.85181719917,2893.16216030698,2378.80915040506,2038.76342413,"2018-06","UK_MID _ 2018-06-22",2018-06-22 21:15:00,6,21.25,-80.546176,24.920702,"Mid channel","UK",4,"Normal"
"SAV18173_12","FLK",2018,"WaltonSmith","UK",24.9342,-80.5637833333333,"UK_IN","06/22/2018","06/23/2018","9:34:00 PM","1:34:00 AM",2,1943.498,2339.722,8.075,358.011,4.5,36.359,NA,36.266,31.51,0,NA,"Permanent","Single","Nikki’s_DB","","",NA,"",NA,2018-06-22,"22","Spring","Wet","June",36.359,2437.85181719917,2893.16216030698,2343.38982424087,1978.99384955189,"2018-06","UK_IN _ 2018-06-22",2018-06-22 21:34:00,6,21.5666666666667,-80.569852,24.939806,"Inshore","UK",4,"Normal"
"SAV18173_13","FLK",2018,"WaltonSmith","MK",24.7166,-80.6861833333333,"9.5","06/22/2018","06/23/2018","11:54:00 PM","3:54:00 AM",2,2003.84,2351.5,8.024,420.995,3.972,36.222,NA,36.055,30.06,0,NA,"Permanent","Single","Nikki’s_DB","","",NA,"",NA,2018-06-22,"22","Spring","Wet","June",36.222,2437.85181719917,2893.16216030698,2354.41319972993,2033.84253105558,"2018-06","9.5 _ 2018-06-22",2018-06-22 23:54:00,6,23.9,-80.69,24.71666667,"Oceanic","MK",6,"Normal"
"SAV18173_14","FLK",2018,"WaltonSmith","MK",24.7629,-80.72455,"9","06/23/2018","06/23/2018","12:56:00 AM","4:56:00 AM",2,1936.95,2302.49,8.056,375.59,4.147,35.985,NA,35.95,30.5,0,NA,"Permanent","Single","Nikki’s_DB","","",NA,"",NA,2018-06-23,"23","Spring","Wet","June",35.985,2437.85181719917,2893.16216030698,2306.19519355123,1963.12393296936,"2018-06","9 _ 2018-06-23",2018-06-23 00:56:00,6,0.933333333333333,-80.72333333,24.76333333,"Offshore","MK",6,"Normal"
"SAV18173_15","FLK",2018,"WaltonSmith","MK",24.7917,-80.7412,"8","06/23/2018","06/23/2018","1:24:00 AM","5:24:00 AM",2,1943.84,2308.27,8.048,384.522,4.151,35.952,NA,35.777,30.86,0,NA,"Permanent","Single","Nikki’s_DB","","",NA,"",NA,2018-06-23,"23","Spring","Wet","June",35.952,2437.85181719917,2893.16216030698,2311.7012942249,1968.97781421374,"2018-06","8 _ 2018-06-23",2018-06-23 01:24:00,6,1.4,-80.74166667,24.7925,"Mid channel","MK",6,"Normal"
"SAV18173_16","FLK",2018,"WaltonSmith","MK",24.8146,-80.7573,"7","06/23/2018","06/23/2018","1:46:00 AM","5:46:00 AM",2,1825.81,2203.53,8.082,332.367,4.267,35.353,NA,35.316,31.71,0,NA,"Permanent","Single","Nikki’s_DB","","",NA,"",NA,2018-06-23,"23","Spring","Wet","June",35.353,2437.85181719917,2893.16216030698,2205.86970530001,1836.46752022709,"2018-06","7 _ 2018-06-23",2018-06-23 01:46:00,6,1.76666666666667,-80.75666667,24.82083333,"Inshore","MK",6,"Normal"
"SAV18173_17","FLK",2018,"WaltonSmith","MK",24.7117,-80.8313,"12","06/23/2018","06/23/2018","3:15:00 AM","7:15:00 AM",2,1918.38,2262.59,8.027,400.811,3.901,36.002,NA,35.879,30.68,0,NA,"Permanent","Single","Nikki’s_DB","","",NA,"",NA,2018-06-23,"23","Spring","Wet","June",36.002,2437.85181719917,2893.16216030698,2267.46784958707,1945.5099295769,"2018-06","12 _ 2018-06-23",2018-06-23 03:15:00,6,3.25,-80.83166667,24.71333333,"Offshore","MK",7,"Normal"
"SAV18173_18","FLK",2018,"WaltonSmith","MK",24.7552,-80.8474333333333,"11","06/23/2018","06/23/2018","3:37:00 AM","7:37:00 AM",2,1793.12,2114.16,8.009,393.341,3.581,35.834,NA,35.778,31.26,0,NA,"Permanent","Single","Nikki’s_DB","","",NA,"",NA,2018-06-23,"23","Spring","Wet","June",35.834,2437.85181719917,2893.16216030698,2121.69359869242,1818.72236539867,"2018-06","11 _ 2018-06-23",2018-06-23 03:37:00,6,3.61666666666667,-80.84666667,24.75333333,"Mid channel","MK",7,"Normal"
"SAV18173_19","FLK",2018,"WaltonSmith","MK",24.7831,-80.8626333333333,"10","06/23/2018","06/23/2018","4:06:00 AM","8:06:00 AM",2,1724.37,2099.63,8.089,307.143,4.142,35.718,NA,35.691,31.95,0,NA,"Permanent","Single","Nikki’s_DB","","",NA,"",NA,2018-06-23,"23","Spring","Wet","June",35.718,2437.85181719917,2893.16216030698,2106.42890432692,1747.86495411558,"2018-06","10 _ 2018-06-23",2018-06-23 04:06:00,6,4.1,-80.86,24.78833333,"Inshore","MK",7,"Normal"
"SAV18173_2","FLK",2018,"WaltonSmith","Biscayne",25.6421,-80.10445,"2","06/22/2018","06/22/2018","10:26:00 AM","2:26:00 PM",2,2032.52,2366.59,8.009,446.238,3.882,35.452,NA,35.213,30.16,0,NA,"Permanent","Single","Nikki’s_DB","","",NA,"",NA,2018-06-22,"22","Spring","Wet","June",35.452,2437.85181719917,2893.16216030698,2367.49856203808,2043.49287195246,"2018-06","2 _ 2018-06-22",2018-06-22 10:26:00,6,10.4333333333333,-80.105,25.64166667,"Mid channel","Biscayne",1,"Normal"
"SAV18173_20","FLK",2018,"WaltonSmith","MK",24.5917,-80.9914,"15.5","06/23/2018","06/23/2018","6:34:00 AM","10:34:00 AM",2,2045.08,2380.93,8.007,448.932,3.853,36.323,NA,36.26,29.61,0,NA,"Permanent","Single","Nikki’s_DB","","",NA,"",NA,2018-06-23,"23","Spring","Wet","June",36.323,2437.85181719917,2893.16216030698,2383.00327489895,2075.96986862556,"2018-06","15.5 _ 2018-06-23",2018-06-23 06:34:00,6,6.56666666666667,-80.99166667,24.59166667,"Oceanic","MK",8,"Normal"
"SAV18173_21","FLK",2018,"WaltonSmith","MK",24.643,-81.0169166666667,"15","06/23/2018","06/23/2018","7:00:00 AM","11:00:00 AM",2,1956.34,2275.38,7.994,444.506,3.641,35.916,NA,35.741,30.11,0,NA,"Permanent","Single","Nikki’s_DB","","",NA,"",NA,2018-06-23,"23","Spring","Wet","June",35.916,2437.85181719917,2893.16216030698,2279.52367369848,1980.23266897319,"2018-06","15 _ 2018-06-23",2018-06-23 07:00:00,6,7,-81.01666667,24.64333333,"Offshore","MK",8,"Normal"
"SAV18173_22","FLK",2018,"WaltonSmith","MK",24.6748,-81.0234,"14","06/23/2018","06/23/2018","7:18:00 AM","11:18:00 AM",2,1876.42,2210.04,8.018,402,3.767,35.876,NA,35.741,30.89,0,NA,"Permanent","Single","Nikki’s_DB","","",NA,"",NA,2018-06-23,"23","Spring","Wet","June",35.876,2437.85181719917,2893.16216030698,2215.60258088601,1901.24623850008,"2018-06","14 _ 2018-06-23",2018-06-23 07:18:00,6,7.3,-81.02333333,24.675,"Mid channel","MK",8,"Normal"
"SAV18173_23","FLK",2018,"WaltonSmith","MK",24.7014,-81.03,"13","06/23/2018","06/23/2018","7:37:00 AM","11:37:00 AM",2,1908.03,2218.39,7.981,448.737,3.529,35.895,NA,35.82,30.68,0,NA,"Permanent","Single","Nikki’s_DB","","",NA,"",NA,2018-06-23,"23","Spring","Wet","June",35.895,2437.85181719917,2893.16216030698,2223.86202469406,1932.59312253725,"2018-06","13 _ 2018-06-23",2018-06-23 07:37:00,6,7.61666666666667,-81.03,24.70166667,"Inshore","MK",8,"Normal"
"SAV18173_24","FLK",2018,"WaltonSmith","LK",24.5983,-81.1816333333333,"18","06/23/2018","06/23/2018","9:16:00 AM","1:16:00 PM",2,1983.57,2306.1,8,444.238,3.691,35.894,NA,35.98,29.8,0,NA,"Permanent","Single","Nikki’s_DB","","",NA,"",NA,2018-06-23,"23","Spring","Wet","June",35.894,2437.85181719917,2893.16216030698,2309.38149898524,2006.22491144243,"2018-06","18 _ 2018-06-23",2018-06-23 09:16:00,6,9.26666666666667,-81.18333333,24.59833333,"Offshore","LK",9,"Normal"
"SAV18173_25","FLK",2018,"WaltonSmith","LK",24.634,-81.1928333333333,"17","06/23/2018","06/23/2018","9:45:00 AM","1:45:00 PM",2,1923.27,2238.18,7.985,447.999,3.585,35.965,NA,35.889,30.67,0,NA,"Permanent","Single","Nikki’s_DB","","",NA,"",NA,2018-06-23,"23","Spring","Wet","June",35.965,2437.85181719917,2893.16216030698,2243.53752269143,1949.2937991018,"2018-06","17 _ 2018-06-23",2018-06-23 09:45:00,6,9.75,-81.19333333,24.635,"Mid channel","LK",9,"Normal"
"SAV18173_26","FLK",2018,"WaltonSmith","LK",24.6729,-81.2044166666667,"16","06/23/2018","06/23/2018","9:45:00 AM","1:45:00 PM",2,1897.25,2221.37,8.002,423.289,3.679,35.825,NA,35.813,30.83,0,NA,"Permanent","Single","Nikki’s_DB","","",NA,"",NA,2018-06-23,"23","Spring","Wet","June",35.825,2437.85181719917,2893.16216030698,2226.35527562287,1920.18447403359,"2018-06","16 _ 2018-06-23",2018-06-23 09:45:00,6,9.75,-81.205,24.675,"Inshore","LK",9,"Normal"
"SAV18173_27","FLK",2018,"WaltonSmith","LK",24.483,-81.391,"21.5","06/23/2018","06/23/2018","12:48:00 PM","4:48:00 PM",2,2053.73,2383.11,7.985,476.868,3.802,36.381,NA,36.256,30.33,0,NA,"Permanent","Single","Nikki’s_DB","","",NA,"",NA,2018-06-23,"23","Spring","Wet","June",36.381,2437.85181719917,2893.16216030698,2385.18796513433,2085.59431965542,"2018-06","21.5 _ 2018-06-23",2018-06-23 12:48:00,6,12.8,-81.39166667,24.48333333,"Oceanic","LK",10,"Normal"
"SAV18173_28","FLK",2018,"WaltonSmith","LK",24.5378,-81.4133,"21LK","06/23/2018","06/23/2018","1:15:00 PM","5:15:00 PM",2,1996.16,2324.72,7.984,465.863,3.785,36.167,NA,36.256,31.12,0,NA,"Permanent","Single","Nikki’s_DB","","",NA,"",NA,2018-06-23,"23","Spring","Wet","June",36.167,2437.85181719917,2893.16216030698,2328.37042250315,2025.10355409844,"2018-06","21LK _ 2018-06-23",2018-06-23 13:15:00,6,13.25,-81.42,24.54,"Offshore","LK",10,"Normal"
"SAV18173_29","FLK",2018,"WaltonSmith","LK",24.5765,-81.4188,"20","06/23/2018","06/23/2018","2:16:00 PM","6:16:00 PM",2,1927.33,2245.82,7.984,450.295,3.645,35.825,NA,35.749,31.15,0,NA,"Permanent","Single","Nikki’s_DB","","",NA,"",NA,2018-06-23,"23","Spring","Wet","June",35.825,2437.85181719917,2893.16216030698,2250.24222607646,1949.57177340553,"2018-06","20 _ 2018-06-23",2018-06-23 14:16:00,6,14.2666666666667,-81.41833333,24.575,"Mid channel","LK",10,"Normal"
"SAV18173_3","FLK",2018,"WaltonSmith","Biscayne",25.5816,-80.0842833333333,"3","06/22/2018","06/22/2018","11:10:00 AM","3:10:00 PM",2,2081.31,2394,7.982,490.774,3.697,34.823,NA,36.255,29.91,0,NA,"Permanent","Single","Nikki’s_DB","Coordinates wrong?","",NA,"",NA,2018-06-22,"22","Spring","Wet","June",34.823,2437.85181719917,2893.16216030698,2393.77710789868,2077.18347924147,"2018-06","3 _ 2018-06-22",2018-06-22 11:10:00,6,11.1666666666667,-80.08333333,25.645,"Offshore","Biscayne",1,"Normal"
"SAV18173_30","FLK",2018,"WaltonSmith","LK",24.609,-81.421,"19","06/23/2018","06/23/2018","2:34:00 PM","6:34:00 PM",2,1886.32,2150.71,7.877,578.235,3.052,36.235,NA,36.16,32.79,0,NA,"Permanent","Single","Nikki’s_DB","","",NA,"",NA,2018-06-23,"23","Spring","Wet","June",36.235,2437.85181719917,2893.16216030698,2160.49667432706,1920.63627067695,"2018-06","19 _ 2018-06-23",2018-06-23 14:34:00,6,14.5666666666667,-81.42166667,24.61,"Inshore","LK",10,"Normal"
"SAV18173_32","FLK",2018,"WaltonSmith","LK",24.3965,-81.8287166666667,"22.5","06/23/2018","06/23/2018","6:47:00 PM","10:47:00 PM",2,2019.95,2354.07,7.992,460.753,3.844,36.321,NA,36.201,30.7,0,NA,"Permanent","Single","Nikki’s_DB","","",NA,"",NA,2018-06-23,"23","Spring","Wet","June",36.321,2437.85181719917,2893.16216030698,2357.1171567556,2051.70885200753,"2018-06","22.5 _ 2018-06-23",2018-06-23 18:47:00,6,18.7833333333333,-81.82833333,24.39666667,"Oceanic","LK",11,"Normal"
"SAV18173_34","FLK",2018,"WaltonSmith","LK",24.4522,-81.8288666666667,"22","06/23/2018","06/23/2018","7:15:00 PM","11:15:00 PM",2,2005.23,2343.42,7.998,451.157,3.887,36.271,NA,36.125,30.91,0,NA,"Permanent","Single","Nikki’s_DB","","",NA,"",NA,2018-06-23,"23","Spring","Wet","June",36.271,2437.85181719917,2893.16216030698,2346.72905791569,2036.34471356594,"2018-06","22 _ 2018-06-23",2018-06-23 19:15:00,6,19.25,-81.82833333,24.455,"Offshore","LK",11,"Normal"
"SAV18173_35","FLK",2018,"WaltonSmith","LK",24.5368,-81.8280666666667,"24","06/23/2018","06/24/2018","8:41:00 PM","12:41:00 AM",2,1989.24,2318.51,7.991,454.981,3.773,36.257,NA,36.142,30.68,0,NA,"Permanent","Single","Nikki’s_DB","","",NA,"",NA,2018-06-23,"23","Spring","Wet","June",36.257,2437.85181719917,2893.16216030698,2322.64748143033,2020.57822863187,"2018-06","24 _ 2018-06-23",2018-06-23 20:41:00,6,20.6833333333333,-81.82833333,24.53666667,"Inshore","LK",11,"Normal"
"SAV18173_36","FLK",2018,"WaltonSmith","LK",24.4806,-81.8279,"23","06/24/2018","06/24/2018","7:44:00 PM","11:44:00 PM",2,1986.42,2315.77,7.991,455.283,3.779,36.185,NA,36.089,30.82,0,NA,"Permanent","Single","Nikki’s_DB","","",NA,"",NA,2018-06-24,"24","Spring","Wet","June",36.185,2437.85181719917,2893.16216030698,2319.76798130112,2016.11433356263,"2018-06","23 _ 2018-06-24",2018-06-24 19:44:00,6,19.7333333333333,-81.82833333,24.48666667,"Mid channel","LK",11,"Normal"
"SAV18173_4","FLK",2018,"WaltonSmith","Biscayne",25.2958,-80.1643333333333,"EK_OFF","06/22/2018","06/22/2018","1:55:00 PM","5:55:00 PM",2,2037.49,2377.11,8.019,433.603,3.883,36.271,NA,36.147,29.27,0,NA,"Permanent","Single","Nikki’s_DB","","",NA,"",NA,2018-06-22,"22","Spring","Wet","June",36.271,2437.85181719917,2893.16216030698,2379.23850072124,2067.47426610102,"2018-06","EK_OFF _ 2018-06-22",2018-06-22 13:55:00,6,13.9166666666667,-80.162604,25.294251,"Offshore","Biscayne",2,"Normal"
"SAV18173_5","FLK",2018,"WaltonSmith","Biscayne",25.3144,-80.1955833333333,"EK_MID","06/22/2018","06/22/2018","2:10:00 PM","6:10:00 PM",2,2023,2369.83,8.029,419.311,3.965,36.139,NA,36.283,29.49,0,NA,"Permanent","Single","Nikki’s_DB","","",NA,"",NA,2018-06-22,"22","Spring","Wet","June",36.139,2437.85181719917,2893.16216030698,2371.97385704612,2050.42507265253,"2018-06","EK_MID _ 2018-06-22",2018-06-22 14:10:00,6,14.1666666666667,-80.1946,25.314483,"Mid channel","Biscayne",2,"Normal"
"SAV18173_6","FLK",2018,"WaltonSmith","Biscayne",25.3325,-80.2193,"EK_IN","06/22/2018","06/22/2018","2:24:00 PM","6:24:00 PM",2,1975.35,2326.76,8.026,412.4,3.993,36.404,NA,36.297,30.42,0,NA,"Permanent","Single","Nikki’s_DB","","",NA,"",NA,2018-06-22,"22","Spring","Wet","June",36.404,2437.85181719917,2893.16216030698,2331.04449926787,2010.7474363551,"2018-06","EK_IN _ 2018-06-22",2018-06-22 14:24:00,6,14.4,-80.227501,25.336306,"Inshore","Biscayne",2,"Normal"
"SAV18173_7","FLK",2018,"WaltonSmith","UK",25.0489,-80.2871,"6.5","06/22/2018","06/22/2018","5:20:00 PM","9:20:00 PM",2,2027.21,2380.56,8.032,416.967,4.038,36.295,NA,36.207,29.73,0,NA,"Permanent","Single","Nikki’s_DB","","",NA,"",NA,2018-06-22,"22","Spring","Wet","June",36.295,2437.85181719917,2893.16216030698,2382.60416319804,2058.10703947093,"2018-06","6.5 _ 2018-06-22",2018-06-22 17:20:00,6,17.3333333333333,-80.28766667,25.04833333,"Oceanic","UK",3,"Normal"
"SAV18173_8","FLK",2018,"WaltonSmith","UK",25.0639,-80.3135166666667,"6","06/22/2018","06/22/2018","5:34:00 PM","9:34:00 PM",2,2030.38,2373.77,8.023,426.978,3.924,36.26,NA,36.153,29.39,0,NA,"Permanent","Single","Nikki’s_DB","","",NA,"",NA,2018-06-22,"22","Spring","Wet","June",36.26,2437.85181719917,2893.16216030698,2375.99678129264,2060.36084726935,"2018-06","6 _ 2018-06-22",2018-06-22 17:34:00,6,17.5666666666667,-80.315,25.065,"Offshore","UK",3,"Normal"
"SAV18173_9","FLK",2018,"WaltonSmith","UK",25.0765,-80.3304166666667,"5.5","06/22/2018","06/22/2018","5:44:00 PM","9:44:00 PM",2,2014.69,2378.12,8.049,396.954,4.134,36.376,NA,36.273,29.6,0,NA,"Permanent","Single","Nikki’s_DB","","",NA,"",NA,2018-06-22,"22","Spring","Wet","June",36.376,2437.85181719917,2893.16216030698,2380.37948373835,2047.92008831599,"2018-06","5.5 _ 2018-06-22",2018-06-22 17:44:00,6,17.7333333333333,-80.33416667,25.07966667,"Mid channel","UK",3,"Normal"
"WS10067_15","FLK",2010,"WaltonSmith","LK",24.6736,-81.2036,"16","03/08/2010","03/09/2010","1:36:00 AM","6:36:00 AM",2,2176.96,2481.23,8.121,347.8,3.35,36.19,NA,35.976,17.64,NA,NA,"Permanent","Single","Lauren’s_DB","","",NA,"",NA,2010-03-08,"08","Winter","Dry","March",36.19,2437.85181719917,2893.16216030698,2479.80363808972,2200.51016774704,"2010-03","16 _ 2010-03-08",2010-03-08 01:36:00,3,1.6,-81.205,24.675,"Inshore","LK",9,"ColdMortality"
"WS10067_18","FLK",2010,"WaltonSmith","LK",24.6092,-81.4201,"19","03/08/2010","03/09/2010","3:12:00 AM","8:12:00 AM",2,2162.61,2510.08,8.175,302,3.8,36.43,NA,36.408,18.17,NA,NA,"Permanent","Single","Lauren’s_DB","","",NA,"",NA,2010-03-08,"08","Winter","Dry","March",36.43,2437.85181719917,2893.16216030698,2507.24480094962,2191.28662885641,"2010-03","19 _ 2010-03-08",2010-03-08 03:12:00,3,3.2,-81.42166667,24.61,"Inshore","LK",10,"ColdMortality"
"WS10067_19","FLK",2010,"WaltonSmith","LK",24.5766,-81.418,"20","03/08/2010","03/09/2010","3:34:00 AM","8:34:00 AM",2,2184.4,2479.03,8.077,392.3,3.27,36.39,NA,36.31,19.39,NA,NA,"Permanent","Single","Lauren’s_DB","","",NA,"",NA,2010-03-08,"08","Winter","Dry","March",36.39,2437.85181719917,2893.16216030698,2477.45710431181,2211.47280579353,"2010-03","20 _ 2010-03-08",2010-03-08 03:34:00,3,3.56666666666667,-81.41833333,24.575,"Mid channel","LK",10,"ColdMortality"
"WS10067_20","FLK",2010,"WaltonSmith","LK",24.5383,-81.4124,"21LK","03/08/2010","03/09/2010","3:54:00 AM","8:54:00 AM",2,2137.08,2454.28,8.108,354.6,3.49,36.51,NA,36.396,19.88,NA,NA,"Permanent","Single","Lauren’s_DB","","",NA,"",NA,2010-03-08,"08","Winter","Dry","March",36.51,2437.85181719917,2893.16216030698,2453.60055447742,2168.35044815293,"2010-03","21LK _ 2010-03-08",2010-03-08 03:54:00,3,3.9,-81.42,24.54,"Offshore","LK",10,"ColdMortality"
"WS10067_21","FLK",2010,"WaltonSmith","LK",24.4841,-81.3929,"21.5","03/08/2010","03/09/2010","4:26:00 AM","9:26:00 AM",2,2064.18,2417.63,8.127,328.8,3.89,36.5,NA,36.54,22.79,NA,NA,"Permanent","Single","Lauren’s_DB","","",NA,"",NA,2010-03-08,"08","Winter","Dry","March",36.5,2437.85181719917,2893.16216030698,2418.46103358353,2098.24776001262,"2010-03","21.5 _ 2010-03-08",2010-03-08 04:26:00,3,4.43333333333333,-81.39166667,24.48333333,"Oceanic","LK",10,"ColdMortality"
"WS10180_10","FLK",2010,"WaltonSmith","MK",24.7566,-80.8474,"11","06/29/2010","06/30/2010","11:05:00 PM","3:05:00 AM",2,2050.28,2372.78,7.98,481.6,3.71,36.51,NA,36.775,29.93,NA,NA,"Permanent","Single","Lauren’s_DB","","",NA,"",NA,2010-06-29,"29","Spring","Wet","June",36.51,2437.85181719917,2893.16216030698,2375.47127482801,2085.14036872264,"2010-06","11 _ 2010-06-29",2010-06-29 23:05:00,6,23.0833333333333,-80.84666667,24.75333333,"Mid channel","MK",7,"Normal"
"WS10180_8","FLK",2010,"WaltonSmith","MK",24.7177,-80.6879,"9.5","06/29/2010","06/30/2010","8:49:00 PM","12:49:00 AM",2,2054.48,2388.48,8.003,455.4,3.85,36.13,NA,36.29,29.72,NA,NA,"Permanent","Single","Lauren’s_DB","","",NA,"",NA,2010-06-29,"29","Spring","Wet","June",36.13,2437.85181719917,2893.16216030698,2390.02415038569,2080.7105796055,"2010-06","9.5 _ 2010-06-29",2010-06-29 20:49:00,6,20.8166666666667,-80.69,24.71666667,"Oceanic","MK",6,"Normal"
"WS10180_9","FLK",2010,"WaltonSmith","MK",24.7802,-80.8583,"10","06/29/2010","06/30/2010","10:46:00 PM","2:46:00 AM",2,2003.44,2375.03,8.052,390.9,4.21,36.65,NA,36.857,30,NA,NA,"Permanent","Single","Lauren’s_DB","","",NA,"",NA,2010-06-29,"29","Spring","Wet","June",36.65,2437.85181719917,2893.16216030698,2377.85826735003,2043.49570435216,"2010-06","10 _ 2010-06-29",2010-06-29 22:46:00,6,22.7666666666667,-80.86,24.78833333,"Inshore","MK",7,"Normal"
"WS11052_6","FLK",2011,"WaltonSmith","MK",24.7637,-80.7233,"9","02/21/2011","02/22/2011","11:06:00 PM","4:06:00 AM",2,2059.34,2389.51,8.104,347.8,3.64,36.3,NA,36.344,22.36,NA,NA,"Permanent","Single","Lauren’s_DB","","",NA,"",NA,2011-02-21,"21","Winter","Dry","February",36.3,2437.85181719917,2893.16216030698,2391.24124965176,2089.20139968042,"2011-02","9 _ 2011-02-21",2011-02-21 23:06:00,2,23.1,-80.72333333,24.76333333,"Offshore","MK",6,"Normal"
"WS11052_7","FLK",2011,"WaltonSmith","MK",24.7169,-80.6894,"9.5","02/21/2011","02/22/2011","11:57:00 PM","4:57:00 AM",2,2073.6,2393.31,8.098,355.4,3.52,36.25,NA,36.258,21.66,NA,NA,"Permanent","Single","Lauren’s_DB","","",NA,"",NA,2011-02-21,"21","Winter","Dry","February",36.25,2437.85181719917,2893.16216030698,2394.84592473101,2101.86076414852,"2011-02","9.5 _ 2011-02-21",2011-02-21 23:57:00,2,23.95,-80.69,24.71666667,"Oceanic","MK",6,"Normal"
"WS11094_10","FLK",2011,"WaltonSmith","MK",24.7636,-80.7249,"9","04/04/2011","04/05/2011","10:41:00 PM","2:41:00 AM",2,2024.36,2377,8.101,347.2,3.93,36.09,NA,36.103,25.23,NA,NA,"Permanent","Single","Lauren’s_DB","","",NA,"",NA,2011-04-04,"04","Spring","Dry","April",36.09,2437.85181719917,2893.16216030698,2378.83786314068,2050.59979924452,"2011-04","9 _ 2011-04-04",2011-04-04 22:41:00,4,22.6833333333333,-80.72333333,24.76333333,"Offshore","MK",6,"Normal"
"WS11094_18","FLK",2011,"WaltonSmith","LK",24.4855,-81.829,"23","04/07/2011","04/07/2011","6:09:00 PM","10:09:00 PM",2,2043.91,2383.65,8.076,373.6,3.8,36.25,NA,36.31,25.38,NA,NA,"Permanent","Single","Lauren’s_DB","","",NA,"",NA,2011-04-07,"07","Spring","Dry","April",36.25,2437.85181719917,2893.16216030698,2385.51902817928,2073.19455725196,"2011-04","23 _ 2011-04-07",2011-04-07 18:09:00,4,18.15,-81.82833333,24.48666667,"Mid channel","LK",11,"Normal"
"WS11094_19","FLK",2011,"WaltonSmith","LK",24.536,-81.829,"24","04/07/2011","04/07/2011","6:46:00 PM","10:46:00 PM",2,2078.21,2391.85,8.037,420.5,3.57,35.6,NA,35.682,25.61,NA,NA,"Permanent","Single","Lauren’s_DB","","",NA,"",NA,2011-04-07,"07","Spring","Dry","April",35.6,2437.85181719917,2893.16216030698,2392.62531152583,2091.94514876922,"2011-04","24 _ 2011-04-07",2011-04-07 18:46:00,4,18.7666666666667,-81.82833333,24.53666667,"Inshore","LK",11,"Normal"
"WS11094_22","FLK",2011,"WaltonSmith","LK",24.5748,-81.4212,"20","04/08/2011","04/08/2011","10:11:00 PM","2:11:00 AM",2,2109.22,2343.05,7.878,638.4,2.77,35.68,NA,35.71,27.31,NA,NA,"Permanent","Single","Lauren’s_DB","","",NA,"",NA,2011-04-08,"08","Spring","Dry","April",35.68,2437.85181719917,2893.16216030698,2344.85676109012,2124.16060170989,"2011-04","20 _ 2011-04-08",2011-04-08 22:11:00,4,22.1833333333333,-81.41833333,24.575,"Mid channel","LK",10,"Normal"
"WS11094_8","FLK",2011,"WaltonSmith","MK",24.8187,-80.755,"7","04/04/2011","04/05/2011","9:58:00 PM","1:58:00 AM",2,1978.95,2382.3,8.13,313.9,4.47,36.86,NA,36.864,27.55,NA,NA,"Permanent","Single","Lauren’s_DB","","",NA,"",NA,2011-04-04,"04","Spring","Dry","April",36.86,2437.85181719917,2893.16216030698,2385.10321161124,2025.08224683047,"2011-04","7 _ 2011-04-04",2011-04-04 21:58:00,4,21.9666666666667,-80.75666667,24.82083333,"Inshore","MK",6,"Normal"
"WS11094_9","FLK",2011,"WaltonSmith","MK",24.7933,-80.7416,"8","04/04/2011","04/05/2011","10:15:00 PM","2:15:00 AM",2,2011.32,2384,8.116,331.9,4.15,36.25,NA,36.154,26.03,NA,NA,"Permanent","Single","Lauren’s_DB","","",NA,"",NA,2011-04-04,"04","Spring","Dry","April",36.25,2437.85181719917,2893.16216030698,2385.85695921376,2041.72835035541,"2011-04","8 _ 2011-04-04",2011-04-04 22:15:00,4,22.25,-80.74166667,24.7925,"Mid channel","MK",6,"Normal"
"WS11214_1","FLK",2011,"WaltonSmith","Biscayne",25.6451,-80.1241,"1","08/02/2011","08/02/2011","10:54:00 AM","2:54:00 PM",2,1952.96,2381.61,8.129,312.1,4.89,36.19,NA,36.192,30.79,NA,NA,"Permanent","Single","Lauren’s_DB","","",NA,"",NA,2011-08-02,"02","Summer","Wet","August",36.19,2437.85181719917,2893.16216030698,2383.45934408585,1983.87573834665,"2011-08","1 _ 2011-08-02",2011-08-02 10:54:00,8,10.9,-80.12666667,25.645,"Inshore","Biscayne",1,"Normal"
"WS11214_10","FLK",2011,"WaltonSmith","MK",24.7891,-80.8607,"10","08/03/2011","08/03/2011","2:00:00 AM","6:00:00 AM",2,1845.94,2270.21,8.132,292.9,4.73,36.31,NA,36.331,31.24,NA,NA,"Permanent","Single","Lauren’s_DB","","",NA,"",NA,2011-08-03,"03","Summer","Wet","August",36.31,2437.85181719917,2893.16216030698,2276.25821758554,1883.72190663735,"2011-08","10 _ 2011-08-03",2011-08-03 02:00:00,8,2,-80.86,24.78833333,"Inshore","MK",7,"Normal"
"WS11214_11","FLK",2011,"WaltonSmith","MK",24.7539,-80.847,"11","08/03/2011","08/03/2011","2:30:00 AM","6:30:00 AM",2,1964.27,2394.51,8.127,316.6,4.91,35.94,NA,35.946,30.94,NA,NA,"Permanent","Single","Lauren’s_DB","","",NA,"",NA,2011-08-03,"03","Summer","Wet","August",35.94,2437.85181719917,2893.16216030698,2395.64359232519,1988.56489790452,"2011-08","11 _ 2011-08-03",2011-08-03 02:30:00,8,2.5,-80.84666667,24.75333333,"Mid channel","MK",7,"Normal"
"WS11214_12","FLK",2011,"WaltonSmith","MK",24.7145,-80.8314,"12","08/03/2011","08/03/2011","2:58:00 AM","6:58:00 AM",2,1989.3,2410.11,8.117,328.8,4.81,36.01,NA,35.475,30.47,NA,NA,"Permanent","Single","Lauren’s_DB","","",NA,"",NA,2011-08-03,"03","Summer","Wet","August",36.01,2437.85181719917,2893.16216030698,2410.88809595588,2014.65131302166,"2011-08","12 _ 2011-08-03",2011-08-03 02:58:00,8,2.96666666666667,-80.83166667,24.71333333,"Offshore","MK",7,"Normal"
"WS11214_13","FLK",2011,"WaltonSmith","MK",24.7014,-81.0291,"13","08/03/2011","08/03/2011","4:25:00 AM","8:25:00 AM",2,1896.46,2306.71,8.093,332.3,4.6,36.79,NA,36.8,31.66,NA,NA,"Permanent","Single","Lauren’s_DB","","",NA,"",NA,2011-08-03,"03","Summer","Wet","August",36.79,2437.85181719917,2893.16216030698,2313.09064291347,1944.95407086027,"2011-08","13 _ 2011-08-03",2011-08-03 04:25:00,8,4.41666666666667,-81.03,24.70166667,"Inshore","MK",8,"Normal"
"WS11214_14","FLK",2011,"WaltonSmith","MK",24.6759,-81.0236,"14","08/03/2011","08/03/2011","4:41:00 AM","8:41:00 AM",2,1950.7,2373.61,8.114,324.4,4.8,36.22,NA,36.227,31.11,NA,NA,"Permanent","Single","Lauren’s_DB","","",NA,"",NA,2011-08-03,"03","Summer","Wet","August",36.22,2437.85181719917,2893.16216030698,2375.77386021488,1982.44499822127,"2011-08","14 _ 2011-08-03",2011-08-03 04:41:00,8,4.68333333333333,-81.02333333,24.675,"Mid channel","MK",8,"Normal"
"WS11214_15","FLK",2011,"WaltonSmith","MK",24.6447,-81.0171,"15","08/03/2011","08/03/2011","4:55:00 AM","8:55:00 AM",2,1991.35,2407.01,8.119,328.3,4.77,35.61,NA,35.621,30.24,NA,NA,"Permanent","Single","Lauren’s_DB","","",NA,"",NA,2011-08-03,"03","Summer","Wet","August",35.61,2437.85181719917,2893.16216030698,2407.53832093489,2006.79806003334,"2011-08","15 _ 2011-08-03",2011-08-03 04:55:00,8,4.91666666666667,-81.01666667,24.64333333,"Offshore","MK",8,"Normal"
"WS11214_16","FLK",2011,"WaltonSmith","MK",24.5927,-80.9922,"15.5","08/03/2011","08/03/2011","5:20:00 AM","9:20:00 AM",2,1994.89,2405.81,8.105,339.6,4.66,36.37,NA,35.771,30.11,NA,NA,"Permanent","Single","Lauren’s_DB","","",NA,"",NA,2011-08-03,"03","Summer","Wet","August",36.37,2437.85181719917,2893.16216030698,2407.01696424424,2028.72648225517,"2011-08","15.5 _ 2011-08-03",2011-08-03 05:20:00,8,5.33333333333333,-80.99166667,24.59166667,"Oceanic","MK",8,"Normal"
"WS11214_17","FLK",2011,"WaltonSmith","LK",24.5993,-81.1815,"18","08/03/2011","08/03/2011","7:18:00 AM","11:18:00 AM",2,1962.25,2358.26,8.086,350.8,4.46,36.62,NA,35.586,30.33,NA,NA,"Permanent","Single","Lauren’s_DB","","",NA,"",NA,2011-08-03,"03","Summer","Wet","August",36.62,2437.85181719917,2893.16216030698,2361.78099245938,2003.43180501631,"2011-08","18 _ 2011-08-03",2011-08-03 07:18:00,8,7.3,-81.18333333,24.59833333,"Offshore","LK",9,"Normal"
"WS11214_18","FLK",2011,"WaltonSmith","LK",24.6361,-81.1937,"17","08/03/2011","08/03/2011","7:53:00 AM","11:53:00 AM",2,1962.3,2377.26,8.122,321.1,4.75,35.46,NA,35.559,30.44,NA,NA,"Permanent","Single","Lauren’s_DB","","",NA,"",NA,2011-08-03,"03","Summer","Wet","August",35.46,2437.85181719917,2893.16216030698,2378.04601906124,1974.375482057,"2011-08","17 _ 2011-08-03",2011-08-03 07:53:00,8,7.88333333333333,-81.19333333,24.635,"Mid channel","LK",9,"Normal"
"WS11214_19","FLK",2011,"WaltonSmith","LK",24.6714,-81.2036,"16","08/03/2011","08/03/2011","8:24:00 AM","12:24:00 PM",2,1779.28,2163.01,8.089,315.9,4.23,36.33,NA,37.353,31.5,NA,NA,"Permanent","Single","Lauren’s_DB","","",NA,"",NA,2011-08-03,"03","Summer","Wet","August",36.33,2437.85181719917,2893.16216030698,2173.07164648706,1820.05795962588,"2011-08","16 _ 2011-08-03",2011-08-03 08:24:00,8,8.4,-81.205,24.675,"Inshore","LK",9,"Normal"
"WS11214_2","FLK",2011,"WaltonSmith","Biscayne",25.642,-80.1038,"2","08/02/2011","08/02/2011","11:05:00 AM","3:05:00 PM",2,1985.61,2391.86,8.104,338.7,4.66,36.03,NA,36.034,30.36,NA,NA,"Permanent","Single","Lauren’s_DB","","",NA,"",NA,2011-08-02,"02","Summer","Wet","August",36.03,2437.85181719917,2893.16216030698,2393.17478134097,2011.55445531824,"2011-08","2 _ 2011-08-02",2011-08-02 11:05:00,8,11.0833333333333,-80.105,25.64166667,"Mid channel","Biscayne",1,"Normal"
"WS11214_20","FLK",2011,"WaltonSmith","LK",24.6109,-81.4225,"19","08/03/2011","08/03/2011","11:05:00 AM","3:05:00 PM",2,1825.65,2202.61,8.067,343,4.17,36.82,NA,36.255,31.43,NA,NA,"Permanent","Single","Lauren’s_DB","","",NA,"",NA,2011-08-03,"03","Summer","Wet","August",36.82,2437.85181719917,2893.16216030698,2214.23792252315,1878.41676077563,"2011-08","19 _ 2011-08-03",2011-08-03 11:05:00,8,11.0833333333333,-81.42166667,24.61,"Inshore","LK",10,"Normal"
"WS11214_22","FLK",2011,"WaltonSmith","LK",24.4843,-81.3894,"21.5","08/03/2011","08/03/2011","1:14:00 PM","5:14:00 PM",2,1979.48,2392.46,8.083,353.8,4.59,37.92,NA,35.745,30.64,NA,NA,"Permanent","Single","Lauren’s_DB","","",NA,"",NA,2011-08-03,"03","Summer","Wet","August",37.92,2437.85181719917,2893.16216030698,2395.95536145099,2049.83738154263,"2011-08","21.5 _ 2011-08-03",2011-08-03 13:14:00,8,13.2333333333333,-81.39166667,24.48333333,"Oceanic","LK",10,"Normal"
"WS11214_23","FLK",2011,"WaltonSmith","LK",24.5352,-81.8291,"24","08/03/2011","08/03/2011","6:40:00 PM","10:40:00 PM",2,1901.45,2295.61,8.072,352.5,4.43,36.71,NA,36.72,31.75,NA,NA,"Permanent","Single","Lauren’s_DB","","",NA,"",NA,2011-08-03,"03","Summer","Wet","August",36.71,2437.85181719917,2893.16216030698,2302.23581060775,1947.64525453895,"2011-08","24 _ 2011-08-03",2011-08-03 18:40:00,8,18.6666666666667,-81.82833333,24.53666667,"Inshore","LK",11,"Normal"
"WS11214_25","FLK",2011,"WaltonSmith","LK",24.3964,-81.8238,"22.5","08/03/2011","08/04/2011","9:32:00 PM","1:32:00 AM",2,1998.77,2424.11,8.12,329,4.94,35.22,NA,35.223,31.17,NA,NA,"Permanent","Single","Lauren’s_DB","","",NA,"",NA,2011-08-03,"03","Summer","Wet","August",35.22,2437.85181719917,2893.16216030698,2424.19583758614,2004.35677669698,"2011-08","22.5 _ 2011-08-03",2011-08-03 21:32:00,8,21.5333333333333,-81.82833333,24.39666667,"Oceanic","LK",11,"Normal"
"WS11214_26","FLK",2011,"WaltonSmith","LK",24.4857,-81.8275,"23","08/03/2011","08/04/2011","8:36:00 PM","12:36:00 AM",2,1964.26,2382.36,8.113,328.5,4.78,35.79,NA,35.794,30.99,NA,NA,"Permanent","Single","Lauren’s_DB","","",NA,"",NA,2011-08-03,"03","Summer","Wet","August",35.79,2437.85181719917,2893.16216030698,2383.58488224608,1984.76384762902,"2011-08","23 _ 2011-08-03",2011-08-03 20:36:00,8,20.6,-81.82833333,24.48666667,"Mid channel","LK",11,"Normal"
"WS11214_3","FLK",2011,"WaltonSmith","Biscayne",25.6527,-80.0808,"3","08/02/2011","08/02/2011","11:36:00 AM","3:36:00 PM",2,1978.26,2396.21,8.122,322.4,4.78,35.97,NA,36.072,30.28,NA,NA,"Permanent","Single","Lauren’s_DB","","",NA,"",NA,2011-08-02,"02","Summer","Wet","August",35.97,2437.85181719917,2893.16216030698,2397.33295142294,2002.93209050592,"2011-08","3 _ 2011-08-02",2011-08-02 11:36:00,8,11.6,-80.08333333,25.645,"Offshore","Biscayne",1,"Normal"
"WS11214_32","FLK",2011,"WaltonSmith","LK",24.455,-81.8283,"22","08/03/2011","08/04/2011","9:00:00 PM","1:00:00 AM",2,1948.77,2396.51,8.144,299.6,5.11,35.97,NA,35.704,31.28,NA,NA,"Permanent","Single","Lauren’s_DB","","",NA,"",NA,2011-08-03,"03","Summer","Wet","August",35.97,2437.85181719917,2893.16216030698,2397.62486134788,1974.23734488456,"2011-08","22 _ 2011-08-03",2011-08-03 21:00:00,8,21,-81.82833333,24.455,"Offshore","LK",11,"Normal"
"WS11214_4","FLK",2011,"WaltonSmith","UK",25.1059,-80.3803,"4","08/02/2011","08/02/2011","6:14:00 PM","10:14:00 PM",2,1900.86,2315.56,8.104,324.7,4.69,36.17,NA,32.055,31.76,NA,NA,"Permanent","Single","Lauren’s_DB","","",NA,"",NA,2011-08-02,"02","Summer","Wet","August",36.17,2437.85181719917,2893.16216030698,2319.51580387401,1932.95824516337,"2011-08","4 _ 2011-08-02",2011-08-02 18:14:00,8,18.2333333333333,-80.38,25.10833333,"Inshore","UK",3,"Normal"
"WS11214_5","FLK",2011,"WaltonSmith","UK",25.0955,-80.3513,"5","08/02/2011","08/02/2011","6:40:00 PM","10:40:00 PM",2,1949.33,2377.21,8.12,319.3,4.87,36.16,NA,36.162,31.19,NA,NA,"Permanent","Single","Lauren’s_DB","","",NA,"",NA,2011-08-02,"02","Summer","Wet","August",36.16,2437.85181719917,2893.16216030698,2379.15536802962,1979.60780160277,"2011-08","5 _ 2011-08-02",2011-08-02 18:40:00,8,18.6666666666667,-80.355,25.09333333,"Inshore","UK",3,"Normal"
"WS11214_6","FLK",2011,"WaltonSmith","MK",24.8214,-80.7566,"7","08/02/2011","08/03/2011","10:11:00 PM","2:11:00 AM",2,1872.73,2284.86,8.086,333.3,4.58,37.28,NA,37.275,32.17,NA,NA,"Permanent","Single","Lauren’s_DB","","",NA,"",NA,2011-08-02,"02","Summer","Wet","August",37.28,2437.85181719917,2893.16216030698,2294.21679568707,1935.13840465397,"2011-08","7 _ 2011-08-02",2011-08-02 22:11:00,8,22.1833333333333,-80.75666667,24.82083333,"Inshore","MK",6,"Normal"
"WS11214_69","FLK",2011,"WaltonSmith","UK",25.0503,-80.2825,"6.5","08/07/2011","08/07/2011","8:04:00 AM","12:04:00 PM",2,1983.49,2399.76,8.107,335.6,4.73,36.38,NA,35.564,30.52,NA,NA,"Permanent","Single","Lauren’s_DB","","",NA,"",NA,2011-08-07,"07","Summer","Wet","August",36.38,2437.85181719917,2893.16216030698,2401.2049342423,2017.9965305449,"2011-08","6.5 _ 2011-08-07",2011-08-07 08:04:00,8,8.06666666666667,-80.28766667,25.04833333,"Oceanic","UK",3,"Normal"
"WS11214_7","FLK",2011,"WaltonSmith","MK",24.7933,-80.742,"8","08/02/2011","08/03/2011","10:31:00 PM","2:31:00 AM",2,1961.02,2389.36,8.121,320.8,4.88,36.13,NA,36.135,31.07,NA,NA,"Permanent","Single","Lauren’s_DB","","",NA,"",NA,2011-08-02,"02","Summer","Wet","August",36.13,2437.85181719917,2893.16216030698,2390.87662755148,1990.17362970238,"2011-08","8 _ 2011-08-02",2011-08-02 22:31:00,8,22.5166666666667,-80.74166667,24.7925,"Mid channel","MK",6,"Normal"
"WS11214_70","FLK",2011,"WaltonSmith","UK",25.0636,-80.3108,"6","08/07/2011","08/07/2011","7:38:00 AM","11:38:00 AM",2,1986.24,2389.11,8.097,346.5,4.63,35.66,NA,35.657,30.66,NA,NA,"Permanent","Single","Lauren’s_DB","","",NA,"",NA,2011-08-07,"07","Summer","Wet","August",35.66,2437.85181719917,2893.16216030698,2390.01212000425,2003.02543538426,"2011-08","6 _ 2011-08-07",2011-08-07 07:38:00,8,7.63333333333333,-80.315,25.065,"Offshore","UK",3,"Normal"
"WS11214_8","FLK",2011,"WaltonSmith","MK",24.7657,-80.7243,"9","08/02/2011","08/03/2011","11:10:00 PM","3:10:00 AM",2,1987.59,2408.71,8.124,323.8,4.85,35.43,NA,35.411,30.55,NA,NA,"Permanent","Single","Lauren’s_DB","","",NA,"",NA,2011-08-02,"02","Summer","Wet","August",35.43,2437.85181719917,2893.16216030698,2409.06368279412,1998.58057377736,"2011-08","9 _ 2011-08-02",2011-08-02 23:10:00,8,23.1666666666667,-80.72333333,24.76333333,"Offshore","MK",6,"Normal"
"WS11214_9","FLK",2011,"WaltonSmith","MK",24.7191,-80.6891,"9.5","08/02/2011","08/03/2011","11:59:00 PM","3:59:00 AM",2,1983.27,2398.66,8.119,326.1,4.75,35.76,NA,35.729,30.14,NA,NA,"Permanent","Single","Lauren’s_DB","","",NA,"",NA,2011-08-02,"02","Summer","Wet","August",35.76,2437.85181719917,2893.16216030698,2399.49293571229,2002.60775284769,"2011-08","9.5 _ 2011-08-02",2011-08-02 23:59:00,8,23.9833333333333,-80.69,24.71666667,"Oceanic","MK",6,"Normal"
"WS11293_10","FLK",2011,"WaltonSmith","MK",24.7173,-80.6864,"9.5","10/20/2011","10/21/2011","9:52:00 PM","1:52:00 AM",2,2118.33,2376.6,7.925,573.9,3.07,34.71,NA,34.717,27.7,NA,NA,"Permanent","Single","Lauren’s_DB","","",NA,"",NA,2011-10-20,"20","Fall","Wet","October",34.71,2437.85181719917,2893.16216030698,2376.08824468488,2111.85632306283,"2011-10","9.5 _ 2011-10-20",2011-10-20 21:52:00,10,21.8666666666667,-80.69,24.71666667,"Oceanic","MK",6,"LowSalinty"
"WS11293_12","FLK",2011,"WaltonSmith","MK",24.7554,-80.8468,"11","10/20/2011","10/21/2011","12:20:00 AM","4:20:00 AM",2,1953.14,2225.21,8.111,353,3.39,NA,NA,32.294,26.12,NA,NA,"Permanent","Single","Lauren’s_DB","Duplicated with Dereks salinity issues","",NA,"",NA,2011-10-20,"20","Fall","Wet","October",32.294,2437.85181719917,2893.16216030698,2207.39217757661,1874.37304744563,"2011-10","11 _ 2011-10-20",2011-10-20 00:20:00,10,0.333333333333333,-80.84666667,24.75333333,"Mid channel","MK",7,"LowSalinty"
"WS11293_13","FLK",2011,"WaltonSmith","MK",24.712,-80.8328,"12","10/20/2011","10/21/2011","12:47:00 AM","4:47:00 AM",2,1969.71,2361.01,8.157,295.8,4.47,34.17,NA,34.184,27.12,NA,NA,"Permanent","Single","Lauren’s_DB","","",NA,"",NA,2011-10-20,"20","Fall","Wet","October",34.17,2437.85181719917,2893.16216030698,2359.14348819797,1947.27905785617,"2011-10","12 _ 2011-10-20",2011-10-20 00:47:00,10,0.783333333333333,-80.83166667,24.71333333,"Offshore","MK",7,"LowSalinty"
"WS12027_1","FLK",2012,"WaltonSmith","Biscayne",25.6468,-80.0782,"3","02/27/2012","02/27/2012","10:16:00 AM","3:16:00 PM",2,2032.02,2362.81,8.116,332.2,3.62,36.34,NA,36.104,21.85,NA,NA,"Permanent","Single","Lauren’s_DB","","",NA,"",NA,2012-02-27,"27","Winter","Dry","February",36.34,2437.85181719917,2893.16216030698,2365.57708957201,2063.77372853086,"2012-02","3 _ 2012-02-27",2012-02-27 10:16:00,2,10.2666666666667,-80.08333333,25.645,"Offshore","Biscayne",1,"Normal"
"WS12027_10","FLK",2012,"WaltonSmith","MK",24.7015,-81.0288,"13","02/28/2012","02/28/2012","4:47:00 AM","9:47:00 AM",2,1981.85,2337.26,8.111,331.4,3.94,36.03,NA,36.016,25.33,NA,NA,"Permanent","Single","Lauren’s_DB","","",NA,"",NA,2012-02-28,"28","Winter","Dry","February",36.03,2437.85181719917,2893.16216030698,2340.13564728602,2007.90194352251,"2012-02","13 _ 2012-02-28",2012-02-28 04:47:00,2,4.78333333333333,-81.03,24.70166667,"Inshore","MK",8,"Normal"
"WS12027_11","FLK",2012,"WaltonSmith","MK",24.6761,-81.0243,"14","02/28/2012","02/28/2012","5:01:00 AM","10:01:00 AM",2,2017.75,2356.46,8.082,363.1,3.78,36.09,NA,36.075,25.26,NA,NA,"Permanent","Single","Lauren’s_DB","","",NA,"",NA,2012-02-28,"28","Winter","Dry","February",36.09,2437.85181719917,2893.16216030698,2358.91821780956,2044.18943626308,"2012-02","14 _ 2012-02-28",2012-02-28 05:01:00,2,5.01666666666667,-81.02333333,24.675,"Mid channel","MK",8,"Normal"
"WS12027_12","FLK",2012,"WaltonSmith","MK",24.6422,-81.016,"15","02/28/2012","02/28/2012","5:13:00 AM","10:13:00 AM",2,2025.64,2375.46,8.095,352.9,3.91,36.02,NA,36.009,25.41,NA,NA,"Permanent","Single","Lauren’s_DB","","",NA,"",NA,2012-02-28,"28","Winter","Dry","February",36.02,2437.85181719917,2893.16216030698,2377.22678660586,2050.20614668276,"2012-02","15 _ 2012-02-28",2012-02-28 05:13:00,2,5.21666666666667,-81.01666667,24.64333333,"Offshore","MK",8,"Normal"
"WS12027_13","FLK",2012,"WaltonSmith","MK",24.5922,-80.9918,"15.5","02/28/2012","02/28/2012","5:37:00 AM","10:37:00 AM",2,2021.65,2379.06,8.104,344,3.99,36.02,NA,36.009,25.53,NA,NA,"Permanent","Single","Lauren’s_DB","","",NA,"",NA,2012-02-28,"28","Winter","Dry","February",36.02,2437.85181719917,2893.16216030698,2380.72484324106,2046.32913391208,"2012-02","15.5 _ 2012-02-28",2012-02-28 05:37:00,2,5.61666666666667,-80.99166667,24.59166667,"Oceanic","MK",8,"Normal"
"WS12027_14","FLK",2012,"WaltonSmith","LK",24.6733,-81.201,"16","02/28/2012","02/28/2012","7:56:00 AM","12:56:00 PM",2,2039.3,2402.16,8.114,337.9,4.05,36.13,NA,36.128,25.08,NA,NA,"Permanent","Single","Lauren’s_DB","","",NA,"",NA,2012-02-28,"28","Winter","Dry","February",36.13,2437.85181719917,2893.16216030698,2403.27629541752,2066.00534849562,"2012-02","16 _ 2012-02-28",2012-02-28 07:56:00,2,7.93333333333333,-81.205,24.675,"Inshore","LK",9,"Normal"
"WS12027_15","FLK",2012,"WaltonSmith","LK",24.6338,-81.1972,"17","02/28/2012","02/28/2012","8:40:00 AM","1:40:00 PM",2,2040.11,2405.96,8.119,333.7,4.08,36.13,NA,36.133,25,NA,NA,"Permanent","Single","Lauren’s_DB","","",NA,"",NA,2012-02-28,"28","Winter","Dry","February",36.13,2437.85181719917,2893.16216030698,2406.95744681525,2066.79001497777,"2012-02","17 _ 2012-02-28",2012-02-28 08:40:00,2,8.66666666666667,-81.19333333,24.635,"Mid channel","LK",9,"Normal"
"WS12027_16","FLK",2012,"WaltonSmith","LK",24.5984,-81.185,"18","02/28/2012","02/28/2012","9:47:00 AM","2:47:00 PM",2,2040.35,2397.26,8.113,339,3.98,36.05,NA,36.05,24.67,NA,NA,"Permanent","Single","Lauren’s_DB","","",NA,"",NA,2012-02-28,"28","Winter","Dry","February",36.05,2437.85181719917,2893.16216030698,2398.44228593784,2065.18918913515,"2012-02","18 _ 2012-02-28",2012-02-28 09:47:00,2,9.78333333333333,-81.18333333,24.59833333,"Offshore","LK",9,"Normal"
"WS12027_17","FLK",2012,"WaltonSmith","LK",24.5759,-81.4187,"20","02/28/2012","02/28/2012","12:54:00 PM","5:54:00 PM",2,2021.43,2385.56,8.117,332.4,4.06,36.03,NA,36.026,25.25,NA,NA,"Permanent","Single","Lauren’s_DB","","",NA,"",NA,2012-02-28,"28","Winter","Dry","February",36.03,2437.85181719917,2893.16216030698,2387.05488125771,2046.3504586488,"2012-02","20 _ 2012-02-28",2012-02-28 12:54:00,2,12.9,-81.41833333,24.575,"Mid channel","LK",10,"Normal"
"WS12027_18","FLK",2012,"WaltonSmith","LK",24.4833,-81.3929,"21.5","02/28/2012","02/28/2012","2:17:00 PM","7:17:00 PM",2,2032.63,2390.51,8.106,343.7,4,36.06,NA,36.063,25.26,NA,NA,"Permanent","Single","Lauren’s_DB","","",NA,"",NA,2012-02-28,"28","Winter","Dry","February",36.06,2437.85181719917,2893.16216030698,2391.90163411623,2057.92573183376,"2012-02","21.5 _ 2012-02-28",2012-02-28 14:17:00,2,14.2833333333333,-81.39166667,24.48333333,"Oceanic","LK",10,"Normal"
"WS12027_19","FLK",2012,"WaltonSmith","LK",24.3977,-81.8284,"22.5","02/28/2012","02/28/2012","6:43:00 PM","11:43:00 PM",2,2041.7,2401.06,8.115,337.2,4,36.17,NA,36.169,24.64,NA,NA,"Permanent","Single","Lauren’s_DB","","",NA,"",NA,2012-02-28,"28","Winter","Dry","February",36.17,2437.85181719917,2893.16216030698,2402.25011407584,2069.24245859992,"2012-02","22.5 _ 2012-02-28",2012-02-28 18:43:00,2,18.7166666666667,-81.82833333,24.39666667,"Oceanic","LK",11,"Normal"
"WS12027_2","FLK",2012,"WaltonSmith","Biscayne",25.6425,-80.1043,"2","02/27/2012","02/27/2012","1:42:00 PM","6:42:00 PM",2,2050.06,2370.21,8.063,387.2,3.59,35.84,NA,35.828,24.61,NA,NA,"Permanent","Single","Lauren’s_DB","","",NA,"",NA,2012-02-27,"27","Winter","Dry","February",35.84,2437.85181719917,2893.16216030698,2371.79535509061,2069.82020688219,"2012-02","2 _ 2012-02-27",2012-02-27 13:42:00,2,13.7,-80.105,25.64166667,"Mid channel","Biscayne",1,"Normal"
"WS12027_20","FLK",2012,"WaltonSmith","LK",24.4555,-81.828,"22","02/28/2012","02/29/2012","7:56:00 PM","12:56:00 AM",2,2030.19,2369.01,8.08,367.5,3.78,36.1,NA,36.087,25.28,NA,NA,"Permanent","Single","Lauren’s_DB","","",NA,"",NA,2012-02-28,"28","Winter","Dry","February",36.1,2437.85181719917,2893.16216030698,2371.10767310025,2056.48555059107,"2012-02","22 _ 2012-02-28",2012-02-28 19:56:00,2,19.9333333333333,-81.82833333,24.455,"Offshore","LK",11,"Normal"
"WS12027_21","FLK",2012,"WaltonSmith","LK",24.4865,-81.8297,"23","02/28/2012","02/29/2012","8:16:00 PM","1:16:00 AM",2,2038.14,2377.86,8.084,364.4,3.8,36,NA,35.997,25.04,NA,NA,"Permanent","Single","Lauren’s_DB","","",NA,"",NA,2012-02-28,"28","Winter","Dry","February",36,2437.85181719917,2893.16216030698,2379.52643936664,2061.89061556408,"2012-02","23 _ 2012-02-28",2012-02-28 20:16:00,2,20.2666666666667,-81.82833333,24.48666667,"Mid channel","LK",11,"Normal"
"WS12027_22","FLK",2012,"WaltonSmith","LK",24.5359,-81.8296,"24","02/28/2012","02/29/2012","8:47:00 PM","1:47:00 AM",2,2055.8,2387.01,8.055,396.7,3.73,36.13,NA,36.133,25.92,NA,NA,"Permanent","Single","Lauren’s_DB","","",NA,"",NA,2012-02-28,"28","Winter","Dry","February",36.13,2437.85181719917,2893.16216030698,2388.6001260292,2081.98929535419,"2012-02","24 _ 2012-02-28",2012-02-28 20:47:00,2,20.7833333333333,-81.82833333,24.53666667,"Inshore","LK",11,"Normal"
"WS12027_3","FLK",2012,"WaltonSmith","Biscayne",25.6444,-80.1207,"1","02/27/2012","02/27/2012","1:59:00 PM","6:59:00 PM",2,2055.56,2380.56,8.07,381.2,3.65,35.72,NA,35.727,24.63,NA,NA,"Permanent","Single","Lauren’s_DB","","",NA,"",NA,2012-02-27,"27","Winter","Dry","February",35.72,2437.85181719917,2893.16216030698,2381.71481826381,2072.44335821447,"2012-02","1 _ 2012-02-27",2012-02-27 13:59:00,2,13.9833333333333,-80.12666667,25.645,"Inshore","Biscayne",1,"Normal"
"WS12027_4","FLK",2012,"WaltonSmith","UK",25.092,-80.356,"5","02/27/2012","02/27/2012","6:48:00 PM","11:48:00 PM",2,1950.99,2338.41,8.168,281.5,4.27,35.75,NA,35.756,24.93,NA,NA,"Permanent","Single","Lauren’s_DB","","",NA,"",NA,2012-02-27,"27","Winter","Dry","February",35.75,2437.85181719917,2893.16216030698,2340.49619196921,1970.75584951693,"2012-02","5 _ 2012-02-27",2012-02-27 18:48:00,2,18.8,-80.355,25.09333333,"Inshore","UK",3,"Normal"
"WS12027_45","FLK",2012,"WaltonSmith","UK",25.0805,-80.3311,"5.5","03/01/2012","03/01/2012","3:09:36 AM","8:09:36 AM",2,1997.33,2345.11,8.088,354.3,3.88,36.04,NA,36.03,25.96,NA,NA,"Permanent","Single","Lauren’s_DB","","",NA,"",NA,2012-03-01,"01","Winter","Dry","March",36.04,2437.85181719917,2893.16216030698,2347.78623445858,2023.18087255048,"2012-03","5.5 _ 2012-03-01",2012-03-01 03:09:36,3,3.15,-80.33416667,25.07966667,"Mid channel","UK",3,"Normal"
"WS12027_5","FLK",2012,"WaltonSmith","MK",24.793,-80.7403,"8","02/27/2012","02/28/2012","10:38:00 PM","3:38:00 AM",2,2021.14,2357.21,8.08,365.5,3.75,36.06,NA,36.048,25.13,NA,NA,"Permanent","Single","Lauren’s_DB","","",NA,"",NA,2012-02-27,"27","Winter","Dry","February",36.06,2437.85181719917,2893.16216030698,2359.58050266864,2046.77348557752,"2012-02","8 _ 2012-02-27",2012-02-27 22:38:00,2,22.6333333333333,-80.74166667,24.7925,"Mid channel","MK",6,"Normal"
"WS12027_53","FLK",2012,"WaltonSmith","UK",25.0505,-80.2884,"6.5","03/02/2012","03/02/2012","2:39:00 PM","7:39:00 PM",2,2017.03,2358.81,8.08,365.4,3.83,35.95,NA,35.941,25.81,NA,NA,"Permanent","Single","Lauren’s_DB","","",NA,"",NA,2012-03-02,"02","Winter","Dry","March",35.95,2437.85181719917,2893.16216030698,2360.89872674101,2040.18231021674,"2012-03","6.5 _ 2012-03-02",2012-03-02 14:39:00,3,14.65,-80.28766667,25.04833333,"Oceanic","UK",3,"Normal"
"WS12027_6","FLK",2012,"WaltonSmith","MK",24.7175,-80.6907,"9.5","02/27/2012","02/28/2012","11:48:00 PM","4:48:00 AM",2,2016.51,2354.31,8.233,241.5,3.59,35.89,NA,35.909,25.43,NA,NA,"Permanent","Single","Lauren’s_DB","Temperature edited from 15.43","",NA,"",NA,2012-02-27,"27","Winter","Dry","February",35.89,2437.85181719917,2893.16216030698,2356.38166947081,2038.24921489755,"2012-02","9.5 _ 2012-02-27",2012-02-27 23:48:00,2,23.8,-80.69,24.71666667,"Oceanic","MK",6,"Normal"
"WS12027_7","FLK",2012,"WaltonSmith","MK",24.7882,-80.8627,"10","02/28/2012","02/28/2012","2:30:00 AM","7:30:00 AM",2,1969.58,2346.56,8.149,298.1,4.17,35.83,NA,35.822,24.98,NA,NA,"Permanent","Single","Lauren’s_DB","","",NA,"",NA,2012-02-28,"28","Winter","Dry","February",35.83,2437.85181719917,2893.16216030698,2348.67476997698,1990.97473047878,"2012-02","10 _ 2012-02-28",2012-02-28 02:30:00,2,2.5,-80.86,24.78833333,"Inshore","MK",7,"Normal"
"WS12027_8","FLK",2012,"WaltonSmith","MK",24.7523,-80.8463,"11","02/28/2012","02/28/2012","2:55:00 AM","7:55:00 AM",2,2027.86,2358.86,8.071,375.7,3.7,36.07,NA,36.058,25.2,NA,NA,"Permanent","Single","Lauren’s_DB","","",NA,"",NA,2012-02-28,"28","Winter","Dry","February",36.07,2437.85181719917,2893.16216030698,2361.20325601339,2053.52879155887,"2012-02","11 _ 2012-02-28",2012-02-28 02:55:00,2,2.91666666666667,-80.84666667,24.75333333,"Mid channel","MK",7,"Normal"
"WS12027_9","FLK",2012,"WaltonSmith","MK",24.7125,-80.8334,"12","02/28/2012","02/28/2012","3:22:00 AM","8:22:00 AM",2,2024.66,2356.21,8.07,376.2,3.71,35.96,NA,35.962,25.42,NA,NA,"Permanent","Single","Lauren’s_DB","","",NA,"",NA,2012-02-28,"28","Winter","Dry","February",35.96,2437.85181719917,2893.16216030698,2358.3895368329,2047.84581963,"2012-02","12 _ 2012-02-28",2012-02-28 03:22:00,2,3.36666666666667,-80.83166667,24.71333333,"Offshore","MK",7,"Normal"
"WS14335_1","FLK",2014,"WaltonSmith","Biscayne",25.645,-80.1252,"1","12/01/2014","12/01/2014","8:23:00 AM","1:23:00 PM",2,2066.79,2379.53,8.062,390.14,3.49,36.16,NA,36.241,23.5,NA,NA,"Permanent","Single","Lauren’s_DB","","",NA,"",NA,2014-12-01,"01","Fall","Dry","December",36.16,2437.85181719917,2893.16216030698,2381.40094325086,2093.29972638153,"2014-12","1 _ 2014-12-01",2014-12-01 08:23:00,12,8.38333333333333,-80.12666667,25.645,"Inshore","Biscayne",1,"Normal"
"WS14335_10","FLK",2014,"WaltonSmith","UK",24.8991,-80.5298,"UK_OFF","12/01/2014","12/01/2014","4:52:00 PM","9:52:00 PM",2,2073.166,2383.652,8.039,416.429,3.502,35.975,NA,35.957,24.9,NA,NA,"Permanent","Single","Lauren’s_DB","","",NA,"",NA,2014-12-01,"01","Fall","Dry","December",35.975,2437.85181719917,2893.16216030698,2385.12093180734,2095.38966244056,"2014-12","UK_OFF _ 2014-12-01",2014-12-01 16:52:00,12,16.8666666666667,-80.529497,24.898193,"Offshore","UK",4,"Normal"
"WS14335_11","FLK",2014,"WaltonSmith","MK",24.8129,-80.7488,"7","12/01/2014","12/01/2014","6:30:00 PM","11:30:00 PM",2,2100.27,2408.71,8.059,399.45,3.46,36.03,NA,36.012,23.1,NA,NA,"Permanent","Single","Lauren’s_DB","","",NA,"",NA,2014-12-01,"01","Fall","Dry","December",36.03,2437.85181719917,2893.16216030698,2409.54308553192,2122.93663683364,"2014-12","7 _ 2014-12-01",2014-12-01 18:30:00,12,18.5,-80.75666667,24.82083333,"Inshore","MK",6,"Normal"
"WS14335_12","FLK",2014,"WaltonSmith","MK",24.7742,-80.7323,"8","11/30/2014","12/01/2014","10:20:00 PM","3:20:00 AM",2,2037.13,2378.4,8.092,357.56,3.82,35.86,NA,35.822,24.8,NA,NA,"Permanent","Single","Lauren’s_DB","","",NA,"",NA,2014-11-30,"30","Fall","Dry","November",35.86,2437.85181719917,2893.16216030698,2379.82578256529,2057.65949408433,"2014-11","8 _ 2014-11-30",2014-11-30 22:20:00,11,22.3333333333333,-80.74166667,24.7925,"Mid channel","MK",6,"Normal"
"WS14335_13","FLK",2014,"WaltonSmith","MK",24.7621,-80.7223,"9","12/01/2014","12/02/2014","7:12:00 PM","12:12:00 AM",2,2044.15,2377.88,8.08,369.74,3.75,35.72,NA,35.707,24.9,NA,NA,"Permanent","Single","Lauren’s_DB","","",NA,"",NA,2014-12-01,"01","Fall","Dry","December",35.72,2437.85181719917,2893.16216030698,2379.08883842059,2061.26334701627,"2014-12","9 _ 2014-12-01",2014-12-01 19:12:00,12,19.2,-80.72333333,24.76333333,"Offshore","MK",6,"Normal"
"WS14335_14","FLK",2014,"WaltonSmith","MK",24.7167,-80.6899,"9.5","12/01/2014","12/02/2014","7:47:00 PM","12:47:00 AM",2,2050.83,2370.99,8.051,400.21,3.6,35.95,NA,35.958,25.3,NA,NA,"Permanent","Single","Lauren’s_DB","","",NA,"",NA,2014-12-01,"01","Fall","Dry","December",35.95,2437.85181719917,2893.16216030698,2372.75686304142,2073.0891252376,"2014-12","9.5 _ 2014-12-01",2014-12-01 19:47:00,12,19.7833333333333,-80.69,24.71666667,"Oceanic","MK",6,"Normal"
"WS14335_15","FLK",2014,"WaltonSmith","MK",24.7922,-80.7419,"8","12/01/2014","12/02/2014","8:46:00 PM","1:46:00 AM",2,2051.18,2374.14,8.061,388.93,3.62,36.05,NA,35.822,24.8,NA,NA,"Permanent","Single","Lauren’s_DB","","",NA,"",NA,2014-12-01,"01","Fall","Dry","December",36.05,2437.85181719917,2893.16216030698,2375.99568399609,2075.70375224195,"2014-12","8 _ 2014-12-01",2014-12-01 20:46:00,12,20.7666666666667,-80.74166667,24.7925,"Mid channel","MK",6,"Normal"
"WS14335_16","FLK",2014,"WaltonSmith","MK",24.7754,-80.8613,"10","12/01/2014","12/02/2014","9:42:00 PM","2:42:00 AM",2,2099.52,2406.07,8.059,398.38,3.43,36.06,NA,36.04,22.8,NA,NA,"Permanent","Single","Lauren’s_DB","","",NA,"",NA,2014-12-01,"01","Fall","Dry","December",36.06,2437.85181719917,2893.16216030698,2407.00424088273,2122.84947004785,"2014-12","10 _ 2014-12-01",2014-12-01 21:42:00,12,21.7,-80.86,24.78833333,"Inshore","MK",7,"Normal"
"WS14335_17","FLK",2014,"WaltonSmith","MK",24.7539,-80.8477,"11","12/01/2014","12/02/2014","10:00:00 PM","3:00:00 AM",2,2047.69,2375.73,8.078,371.74,3.66,36.01,NA,36.043,24.3,NA,NA,"Permanent","Single","Lauren’s_DB","","",NA,"",NA,2014-12-01,"01","Fall","Dry","December",36.01,2437.85181719917,2893.16216030698,2377.47237809973,2071.40360405193,"2014-12","11 _ 2014-12-01",2014-12-01 22:00:00,12,22,-80.84666667,24.75333333,"Mid channel","MK",7,"Normal"
"WS14335_18","FLK",2014,"WaltonSmith","MK",24.7132,-80.8357,"12","12/01/2014","12/02/2014","10:31:00 PM","3:31:00 AM",2,2038.46,2379.34,8.092,357.98,3.82,35.72,NA,35.711,24.9,NA,NA,"Permanent","Single","Lauren’s_DB","","",NA,"",NA,2014-12-01,"01","Fall","Dry","December",35.72,2437.85181719917,2893.16216030698,2380.51940952921,2055.68803906554,"2014-12","12 _ 2014-12-01",2014-12-01 22:31:00,12,22.5166666666667,-80.83166667,24.71333333,"Offshore","MK",7,"Normal"
"WS14335_19","FLK",2014,"WaltonSmith","MK",24.5925,-80.9105,"15.5","12/01/2014","12/02/2014","11:58:00 PM","4:58:00 AM",2,2038.17,2376.65,8.079,369.49,3.79,35.96,NA,35.986,25.3,NA,NA,"Permanent","Single","Lauren’s_DB","","",NA,"",NA,2014-12-01,"01","Fall","Dry","December",35.96,2437.85181719917,2893.16216030698,2378.28386386294,2060.99515222177,"2014-12","15.5 _ 2014-12-01",2014-12-01 23:58:00,12,23.9666666666667,-80.99166667,24.59166667,"Oceanic","MK",8,"Normal"
"WS14335_2","FLK",2014,"WaltonSmith","Biscayne",25.6415,-80.1042,"2","12/01/2014","12/01/2014","8:32:00 AM","1:32:00 PM",2,2055.36,2377.04,8.058,392.59,3.6,36.15,NA,36.169,24.8,NA,NA,"Permanent","Single","Lauren’s_DB","","",NA,"",NA,2014-12-01,"01","Fall","Dry","December",36.15,2437.85181719917,2893.16216030698,2378.97453913635,2082.01207425596,"2014-12","2 _ 2014-12-01",2014-12-01 08:32:00,12,8.53333333333333,-80.105,25.64166667,"Mid channel","Biscayne",1,"Normal"
"WS14335_20","FLK",2014,"WaltonSmith","MK",24.6435,-81.0183,"15","12/02/2014","12/02/2014","12:22:00 AM","5:22:00 AM",2,2042.73,2378.86,8.082,367.8,3.77,35.76,NA,35.753,25,NA,NA,"Permanent","Single","Lauren’s_DB","","",NA,"",NA,2014-12-02,"02","Fall","Dry","December",35.76,2437.85181719917,2893.16216030698,2380.11374108141,2060.80406157252,"2014-12","15 _ 2014-12-02",2014-12-02 00:22:00,12,0.366666666666667,-81.01666667,24.64333333,"Offshore","MK",8,"Normal"
"WS14335_21","FLK",2014,"WaltonSmith","MK",24.6753,-81.0244,"14","12/02/2014","12/02/2014","12:36:00 AM","5:36:00 AM",2,2047.27,2379.77,8.087,363.02,3.7,36.13,NA,36.112,24,NA,NA,"Permanent","Single","Lauren’s_DB","","",NA,"",NA,2014-12-02,"02","Fall","Dry","December",36.13,2437.85181719917,2893.16216030698,2381.58656389247,2073.72607919034,"2014-12","14 _ 2014-12-02",2014-12-02 00:36:00,12,0.6,-81.02333333,24.675,"Mid channel","MK",8,"Normal"
"WS14335_22","FLK",2014,"WaltonSmith","MK",24.7008,-81.03,"13","12/02/2014","12/02/2014","12:47:00 AM","5:47:00 AM",2,2165.78,2443.5,8.019,453.59,3.15,35.89,NA,35.839,22,NA,NA,"Permanent","Single","Lauren’s_DB","","",NA,"",NA,2014-12-02,"02","Fall","Dry","December",35.89,2437.85181719917,2893.16216030698,2443.35993639753,2183.81761835256,"2014-12","13 _ 2014-12-02",2014-12-02 00:47:00,12,0.783333333333333,-81.03,24.70166667,"Inshore","MK",8,"Normal"
"WS14335_23","FLK",2014,"WaltonSmith","LK",24.6719,-81.2029,"16","12/02/2014","12/02/2014","2:06:00 AM","7:06:00 AM",2,2122.66,2402.14,8.02,443.63,3.13,36.33,NA,36.337,22.2,NA,NA,"Permanent","Single","Lauren’s_DB","","",NA,"",NA,2014-12-02,"02","Fall","Dry","December",36.33,2437.85181719917,2893.16216030698,2403.44736903041,2150.86720818079,"2014-12","16 _ 2014-12-02",2014-12-02 02:06:00,12,2.1,-81.205,24.675,"Inshore","LK",9,"Normal"
"WS14335_24","FLK",2014,"WaltonSmith","LK",24.634,-81.1935,"17","12/02/2014","12/02/2014","2:34:00 AM","7:34:00 AM",2,2063.89,2391.22,8.081,371.47,3.65,35.99,NA,36.008,23.8,NA,NA,"Permanent","Single","Lauren’s_DB","","",NA,"",NA,2014-12-02,"02","Fall","Dry","December",35.99,2437.85181719917,2893.16216030698,2392.50273128722,2086.70132088647,"2014-12","17 _ 2014-12-02",2014-12-02 02:34:00,12,2.56666666666667,-81.19333333,24.635,"Mid channel","LK",9,"Normal"
"WS14335_25","FLK",2014,"WaltonSmith","LK",24.5986,-81.1832,"18","12/02/2014","12/02/2014","2:54:00 AM","7:54:00 AM",2,2035.8,2385.01,8.102,348.38,3.91,35.74,NA,35.74,25,NA,NA,"Permanent","Single","Lauren’s_DB","","",NA,"",NA,2014-12-02,"02","Fall","Dry","December",35.74,2437.85181719917,2893.16216030698,2386.10409470418,2053.55176269242,"2014-12","18 _ 2014-12-02",2014-12-02 02:54:00,12,2.9,-81.18333333,24.59833333,"Offshore","LK",9,"Normal"
"WS14335_26","FLK",2014,"WaltonSmith","LK",24.6105,-81.4196,"19","12/02/2014","12/02/2014","4:23:00 AM","9:23:00 AM",2,2116.77,2418.94,8.05,410.42,3.38,36.21,NA,36.205,22.7,NA,NA,"Permanent","Single","Lauren’s_DB","","",NA,"",NA,2014-12-02,"02","Fall","Dry","December",36.21,2437.85181719917,2893.16216030698,2419.57196075148,2142.71406279954,"2014-12","19 _ 2014-12-02",2014-12-02 04:23:00,12,4.38333333333333,-81.42166667,24.61,"Inshore","LK",10,"Normal"
"WS14335_27","FLK",2014,"WaltonSmith","LK",24.5743,-81.4185,"20","12/02/2014","12/02/2014","4:39:00 AM","9:39:00 AM",2,2068.46,2396.26,8.084,369.54,3.66,36.01,NA,35.995,23.6,NA,NA,"Permanent","Single","Lauren’s_DB","","",NA,"",NA,2014-12-02,"02","Fall","Dry","December",36.01,2437.85181719917,2893.16216030698,2397.42655749434,2091.59105198306,"2014-12","20 _ 2014-12-02",2014-12-02 04:39:00,12,4.65,-81.41833333,24.575,"Mid channel","LK",10,"Normal"
"WS14335_28","FLK",2014,"WaltonSmith","LK",24.5374,-81.4132,"21LK","12/02/2014","12/02/2014","4:56:00 AM","9:56:00 AM",2,2036.22,2386.67,8.104,346.39,3.93,35.7,NA,35.696,25,NA,NA,"Permanent","Single","Lauren’s_DB","","",NA,"",NA,2014-12-02,"02","Fall","Dry","December",35.7,2437.85181719917,2893.16216030698,2387.67356504312,2053.022787457,"2014-12","21LK _ 2014-12-02",2014-12-02 04:56:00,12,4.93333333333333,-81.42,24.54,"Offshore","LK",10,"Normal"
"WS14335_29","FLK",2014,"WaltonSmith","LK",24.484,-81.3922,"21.5","12/02/2014","12/02/2014","5:21:00 AM","10:21:00 AM",2,2035.85,2382.52,8.099,351.06,3.88,35.81,NA,35.83,24.9,NA,NA,"Permanent","Single","Lauren’s_DB","","",NA,"",NA,2014-12-02,"02","Fall","Dry","December",35.81,2437.85181719917,2893.16216030698,2383.77157140272,2055.24186958527,"2014-12","21.5 _ 2014-12-02",2014-12-02 05:21:00,12,5.35,-81.39166667,24.48333333,"Oceanic","LK",10,"Normal"
"WS14335_3","FLK",2014,"WaltonSmith","Biscayne",25.6459,-80.0818,"3","12/01/2014","12/01/2014","8:53:00 AM","1:53:00 PM",2,2048.12,2379.15,8.065,384.98,3.71,36.12,NA,36.144,25.3,NA,NA,"Permanent","Single","Lauren’s_DB","","",NA,"",NA,2014-12-01,"01","Fall","Dry","December",36.12,2437.85181719917,2893.16216030698,2380.97021138602,2074.32285768394,"2014-12","3 _ 2014-12-01",2014-12-01 08:53:00,12,8.88333333333333,-80.08333333,25.645,"Offshore","Biscayne",1,"Normal"
"WS14335_30","FLK",2014,"WaltonSmith","LK",24.3961,-81.8339,"22.5","12/02/2014","12/02/2014","8:05:00 AM","1:05:00 PM",2,2041.78,2384.75,8.094,357.19,3.85,35.7,NA,35.732,25,NA,NA,"Permanent","Single","Lauren’s_DB","","",NA,"",NA,2014-12-02,"02","Fall","Dry","December",35.7,2437.85181719917,2893.16216030698,2385.79121210194,2058.47376784916,"2014-12","22.5 _ 2014-12-02",2014-12-02 08:05:00,12,8.08333333333333,-81.82833333,24.39666667,"Oceanic","LK",11,"Normal"
"WS14335_31","FLK",2014,"WaltonSmith","LK",24.4558,-81.8285,"22","12/02/2014","12/02/2014","8:35:00 AM","1:35:00 PM",2,2035.97,2385.5,8.104,346.99,3.92,35.67,NA,35.68,25,NA,NA,"Permanent","Single","Lauren’s_DB","","",NA,"",NA,2014-12-02,"02","Fall","Dry","December",35.67,2437.85181719917,2893.16216030698,2386.48333943155,2052.070890031,"2014-12","22 _ 2014-12-02",2014-12-02 08:35:00,12,8.58333333333333,-81.82833333,24.455,"Offshore","LK",11,"Normal"
"WS14335_32","FLK",2014,"WaltonSmith","LK",24.4848,-81.8293,"23","12/02/2014","12/02/2014","8:49:00 AM","1:49:00 PM",2,2048.34,2381.6,8.081,369.67,3.74,35.69,NA,35.679,24.8,NA,NA,"Permanent","Single","Lauren’s_DB","","",NA,"",NA,2014-12-02,"02","Fall","Dry","December",35.69,2437.85181719917,2893.16216030698,2382.68752462503,2064.67307062516,"2014-12","23 _ 2014-12-02",2014-12-02 08:49:00,12,8.81666666666667,-81.82833333,24.48666667,"Mid channel","LK",11,"Normal"
"WS14335_33","FLK",2014,"WaltonSmith","LK",24.538,-81.829,"24","12/02/2014","12/02/2014","9:08:00 AM","2:08:00 PM",2,2109.44,2408,8.046,413.78,3.34,36.21,NA,36.201,22.7,NA,NA,"Permanent","Single","Lauren’s_DB","","",NA,"",NA,2014-12-02,"02","Fall","Dry","December",36.21,2437.85181719917,2893.16216030698,2408.9975337976,2135.62900342368,"2014-12","24 _ 2014-12-02",2014-12-02 09:08:00,12,9.13333333333333,-81.82833333,24.53666667,"Inshore","LK",11,"Normal"
"WS14335_4","FLK",2014,"WaltonSmith","Biscayne",25.3336,-80.2231,"EK_IN","12/01/2014","12/01/2014","12:10:00 PM","5:10:00 PM",2,2190.35,2457.78,8.013,465.96,3.05,35.63,NA,35.599,21.3,NA,NA,"Permanent","Single","Lauren’s_DB","","",NA,"",NA,2014-12-01,"01","Fall","Dry","December",35.63,2437.85181719917,2893.16216030698,2457.42763527464,2202.77693407223,"2014-12","EK_IN _ 2014-12-01",2014-12-01 12:10:00,12,12.1666666666667,-80.227501,25.336306,"Inshore","Biscayne",2,"Normal"
"WS14335_45","FLK",2014,"WaltonSmith","UK",25.0487,-80.2882,"6.5","12/04/2014","12/05/2014","8:13:00 PM","1:13:00 AM",2,2031.21,2381.66,8.088,359.65,3.92,36.14,NA,36.142,25.7,NA,NA,"Permanent","Single","Lauren’s_DB","","",NA,"",NA,2014-12-04,"04","Fall","Dry","December",36.14,2437.85181719917,2893.16216030698,2383.43251443296,2058.39941512867,"2014-12","6.5 _ 2014-12-04",2014-12-04 20:13:00,12,20.2166666666667,-80.28766667,25.04833333,"Oceanic","UK",3,"Normal"
"WS14335_46","FLK",2014,"WaltonSmith","UK",25.0657,-80.3148,"6","12/04/2014","12/05/2014","8:28:00 PM","1:28:00 AM",2,2044.42,2391.43,8.096,354.98,3.89,35.86,NA,35.872,25,NA,NA,"Permanent","Single","Lauren’s_DB","","",NA,"",NA,2014-12-04,"04","Fall","Dry","December",35.86,2437.85181719917,2893.16216030698,2392.54329511409,2064.7746641903,"2014-12","6 _ 2014-12-04",2014-12-04 20:28:00,12,20.4666666666667,-80.315,25.065,"Offshore","UK",3,"Normal"
"WS14335_47","FLK",2014,"WaltonSmith","UK",25.0784,-80.3336,"5.5","12/04/2014","12/05/2014","8:38:00 PM","1:38:00 AM",2,2070.96,2399.71,8.07,383.29,3.68,36.12,NA,36.096,24.5,NA,NA,"Permanent","Single","Lauren’s_DB","","",NA,"",NA,2014-12-04,"04","Fall","Dry","December",36.12,2437.85181719917,2893.16216030698,2400.89269200618,2096.45464062967,"2014-12","5.5 _ 2014-12-04",2014-12-04 20:38:00,12,20.6333333333333,-80.33416667,25.07966667,"Mid channel","UK",3,"Normal"
"WS14335_48","FLK",2014,"WaltonSmith","Biscayne",25.2934,-80.1625,"EK_OFF","12/04/2014","12/05/2014","11:03:00 PM","4:03:00 AM",2,2044.19,2383.3,8.083,367.31,3.8,35.94,NA,35.939,25.1,NA,NA,"Permanent","Single","Lauren’s_DB","","",NA,"",NA,2014-12-04,"04","Fall","Dry","December",35.94,2437.85181719917,2893.16216030698,2384.72678653776,2066.39461409818,"2014-12","EK_OFF _ 2014-12-04",2014-12-04 23:03:00,12,23.05,-80.162604,25.294251,"Offshore","Biscayne",2,"Normal"
"WS14335_5","FLK",2014,"WaltonSmith","Biscayne",25.3164,-80.1949,"EK_MID","12/01/2014","12/01/2014","12:21:00 PM","5:21:00 PM",2,2051.12,2380.8,8.071,379.02,3.68,36.17,NA,36.192,24.7,NA,NA,"Permanent","Single","Lauren’s_DB","","",NA,"",NA,2014-12-01,"01","Fall","Dry","December",36.17,2437.85181719917,2893.16216030698,2382.64546934263,2078.35774751339,"2014-12","EK_MID _ 2014-12-01",2014-12-01 12:21:00,12,12.35,-80.1946,25.314483,"Mid channel","Biscayne",2,"Normal"
"WS14335_6","FLK",2014,"WaltonSmith","UK",25.1087,-80.3826,"4","12/01/2014","12/01/2014","2:18:00 PM","7:18:00 PM",2,2347.65,2609.4,7.981,539.09,3.05,36.19,NA,35.094,21,NA,NA,"Permanent","Single","Lauren’s_DB","","",NA,"",NA,2014-12-01,"01","Fall","Dry","December",36.19,2437.85181719917,2893.16216030698,2603.75915066226,2365.58753718611,"2014-12","4 _ 2014-12-01",2014-12-01 14:18:00,12,14.3,-80.38,25.10833333,"Inshore","UK",3,"Normal"
"WS14335_7","FLK",2014,"WaltonSmith","UK",25.0906,-80.3591,"5","12/01/2014","12/01/2014","2:36:00 PM","7:36:00 PM",2,2107.09,2412.33,8.063,395.06,3.41,36.13,NA,36.1,22.3,NA,NA,"Permanent","Single","Lauren’s_DB","","",NA,"",NA,2014-12-01,"01","Fall","Dry","December",36.13,2437.85181719917,2893.16216030698,2413.12821902671,2131.67515198303,"2014-12","5 _ 2014-12-01",2014-12-01 14:36:00,12,14.6,-80.355,25.09333333,"Inshore","UK",3,"Normal"
"WS14335_8","FLK",2014,"WaltonSmith","UK",24.9356,-80.5717,"UK_IN","12/01/2014","12/01/2014","4:26:00 PM","9:26:00 PM",2,2325.966,2566.106,7.954,575.279,2.859,34.931,NA,34.85,21.6,NA,NA,"Permanent","Single","Lauren’s_DB","","",NA,"",NA,2014-12-01,"01","Fall","Dry","December",34.931,2437.85181719917,2893.16216030698,2566.35934340881,2324.84560450427,"2014-12","UK_IN _ 2014-12-01",2014-12-01 16:26:00,12,16.4333333333333,-80.569852,24.939806,"Inshore","UK",4,"Normal"
"WS14335_9","FLK",2014,"WaltonSmith","UK",24.9205,-80.5454,"UK_MID","12/01/2014","12/01/2014","4:40:00 PM","9:40:00 PM",2,2141.743,2422.679,8.025,441.819,3.161,36.177,NA,36.176,22,NA,NA,"Permanent","Single","Lauren’s_DB","","",NA,"",NA,2014-12-01,"01","Fall","Dry","December",36.177,2437.85181719917,2893.16216030698,2423.1726397668,2166.19003407362,"2014-12","UK_MID _ 2014-12-01",2014-12-01 16:40:00,12,16.6666666666667,-80.546176,24.920702,"Mid channel","UK",4,"Normal"
"WS15103_1","FLK",2015,"WaltonSmith","Biscayne",25.6398,-80.122,"1","04/13/2015","04/13/2015","8:45:00 AM","12:45:00 PM",2,1997.03,2361.44,8.092,350.24,4.04,36.69,NA,36.718,26.7,NA,NA,"Permanent","Single","Lauren’s_DB","","",NA,"",NA,2015-04-13,"13","Spring","Dry","April",36.69,2437.85181719917,2893.16216030698,2364.95965034251,2038.30727857506,"2015-04","1 _ 2015-04-13",2015-04-13 08:45:00,4,8.75,-80.12666667,25.645,"Inshore","Biscayne",1,"Normal"
"WS15103_10","FLK",2015,"WaltonSmith","UK",25.0481,-80.2862,"6.5","04/13/2015","04/13/2015","2:51:00 PM","6:51:00 PM",2,2048.01,2383.09,8.054,395.38,3.76,36.45,NA,36.357,26.2,NA,NA,"Permanent","Single","Lauren’s_DB","","",NA,"",NA,2015-04-13,"13","Spring","Dry","April",36.45,2437.85181719917,2893.16216030698,2385.26845363344,2081.63059348272,"2015-04","6.5 _ 2015-04-13",2015-04-13 14:51:00,4,14.85,-80.28766667,25.04833333,"Oceanic","UK",3,"Normal"
"WS15103_11","FLK",2015,"WaltonSmith","UK",25.005,-80.3789,"MR","04/13/2015","04/13/2015","3:40:00 PM","7:40:00 PM",2,2059.23,2384.23,8.039,413.55,3.65,36.45,NA,36.34,26.1,NA,NA,"Permanent","Single","Lauren’s_DB","","",NA,"",NA,2015-04-13,"13","Spring","Dry","April",36.45,2437.85181719917,2893.16216030698,2386.3631038392,2092.40425603416,"2015-04","MR _ 2015-04-13",2015-04-13 15:40:00,4,15.6666666666667,-80.38,25.01,"Offshore","UK",3,"Normal"
"WS15103_12","FLK",2015,"WaltonSmith","UK",24.9206,-80.5473,"UK_MID","04/13/2015","04/13/2015","6:12:00 PM","10:12:00 PM",2,2038.384,2382.756,8.063,384.804,3.864,36.406,NA,36.383,26.6,NA,NA,"Permanent","Single","Lauren’s_DB","","",NA,"",NA,2015-04-13,"13","Spring","Dry","April",36.406,2437.85181719917,2893.16216030698,2384.88380088398,2071.39553912519,"2015-04","UK_MID _ 2015-04-13",2015-04-13 18:12:00,4,18.2,-80.546176,24.920702,"Mid channel","UK",4,"Normal"
"WS15103_13","FLK",2015,"WaltonSmith","MK",24.7914,-80.7414,"8","04/13/2015","04/13/2015","8:07:00 PM","12:07:00 AM",2,2009.74,2393.64,8.109,337.64,4.28,36.59,NA,36.559,27.2,NA,NA,"Permanent","Single","Lauren’s_DB","","",NA,"",NA,2015-04-13,"13","Spring","Dry","April",36.59,2437.85181719917,2893.16216030698,2395.56120222319,2048.12866452277,"2015-04","8 _ 2015-04-13",2015-04-13 20:07:00,4,20.1166666666667,-80.74166667,24.7925,"Mid channel","MK",6,"Normal"
"WS15103_14","FLK",2015,"WaltonSmith","MK",24.8206,-80.7538,"7","04/13/2015","04/13/2015","7:44:00 PM","11:44:00 PM",2,2002.7,2384.57,8.104,340.6,4.26,36.64,NA,36.629,27.4,NA,NA,"Permanent","Single","Lauren’s_DB","","",NA,"",NA,2015-04-13,"13","Spring","Dry","April",36.64,2437.85181719917,2893.16216030698,2386.95488483097,2042.5569307561,"2015-04","7 _ 2015-04-13",2015-04-13 19:44:00,4,19.7333333333333,-80.75666667,24.82083333,"Inshore","MK",6,"Normal"
"WS15103_15","FLK",2015,"WaltonSmith","UK",24.94,-80.5703,"UK_IN","04/13/2015","04/13/2015","6:23:00 PM","10:23:00 PM",2,1874.887,2318.047,8.188,255.348,4.83,37.006,NA,36.967,28.1,NA,NA,"Permanent","Single","Lauren’s_DB","","",NA,"",NA,2015-04-13,"13","Spring","Dry","April",37.006,2437.85181719917,2893.16216030698,2324.54131074154,1930.08507521958,"2015-04","UK_IN _ 2015-04-13",2015-04-13 18:23:00,4,18.3833333333333,-80.569852,24.939806,"Inshore","UK",4,"Normal"
"WS15103_16","FLK",2015,"WaltonSmith","UK",24.8982,-80.5303,"UK_OFF","04/13/2015","04/13/2015","6:03:00 PM","10:03:00 PM",2,2051.918,2383.958,8.05,400.685,3.723,36.51,NA,36.421,26.1,NA,NA,"Permanent","Single","Lauren’s_DB","","",NA,"",NA,2015-04-13,"13","Spring","Dry","April",36.51,2437.85181719917,2893.16216030698,2386.18696915833,2086.71062344737,"2015-04","UK_OFF _ 2015-04-13",2015-04-13 18:03:00,4,18.05,-80.529497,24.898193,"Offshore","UK",4,"Normal"
"WS15103_17","FLK",2015,"WaltonSmith","MK",24.7624,-80.7242,"9","04/13/2015","04/13/2015","8:39:00 PM","12:39:00 AM",2,2025.36,2394.99,8.091,356.11,4.13,36.57,NA,36.463,27,NA,NA,"Permanent","Single","Lauren’s_DB","","",NA,"",NA,2015-04-13,"13","Spring","Dry","April",36.57,2437.85181719917,2893.16216030698,2396.83011629759,2062.6159308636,"2015-04","9 _ 2015-04-13",2015-04-13 20:39:00,4,20.65,-80.72333333,24.76333333,"Offshore","MK",6,"Normal"
"WS15103_18","FLK",2015,"WaltonSmith","MK",24.7171,-80.6887,"9.5","04/13/2015","04/14/2015","9:12:00 PM","1:12:00 AM",2,2053.31,2380.14,8.042,409.2,3.68,36.38,NA,36.298,26.2,NA,NA,"Permanent","Single","Lauren’s_DB","","",NA,"",NA,2015-04-13,"13","Spring","Dry","April",36.38,2437.85181719917,2893.16216030698,2382.32917833246,2085.16805335964,"2015-04","9.5 _ 2015-04-13",2015-04-13 21:12:00,4,21.2,-80.69,24.71666667,"Oceanic","MK",6,"Normal"
"WS15103_19","FLK",2015,"WaltonSmith","MK",24.783,-80.8633,"10","04/13/2015","04/14/2015","11:10:00 PM","3:10:00 AM",2,1979.67,2373.72,8.122,320.7,4.36,36.81,NA,36.723,27.3,NA,NA,"Permanent","Single","Lauren’s_DB","","",NA,"",NA,2015-04-13,"13","Spring","Dry","April",36.81,2437.85181719917,2893.16216030698,2376.87345257078,2024.58770742069,"2015-04","10 _ 2015-04-13",2015-04-13 23:10:00,4,23.1666666666667,-80.86,24.78833333,"Inshore","MK",7,"Normal"
"WS15103_2","FLK",2015,"WaltonSmith","Biscayne",25.6434,-80.0997,"2","04/13/2015","04/13/2015","8:58:00 AM","12:58:00 PM",2,2059.17,2384.2,8.031,422.78,3.67,36.42,NA,36.388,26.7,NA,NA,"Permanent","Single","Lauren’s_DB","","",NA,"",NA,2015-04-13,"13","Spring","Dry","April",36.42,2437.85181719917,2893.16216030698,2386.29186107696,2091.68699252158,"2015-04","2 _ 2015-04-13",2015-04-13 08:58:00,4,8.96666666666667,-80.105,25.64166667,"Mid channel","Biscayne",1,"Normal"
"WS15103_20","FLK",2015,"WaltonSmith","MK",24.7533,-80.8459,"11","04/13/2015","04/14/2015","11:36:00 PM","3:36:00 AM",2,1986.92,2367.72,8.108,333.86,4.22,36.8,NA,36.761,27.1,NA,NA,"Permanent","Single","Lauren’s_DB","","",NA,"",NA,2015-04-13,"13","Spring","Dry","April",36.8,2437.85181719917,2893.16216030698,2371.15036062387,2031.24706218893,"2015-04","11 _ 2015-04-13",2015-04-13 23:36:00,4,23.6,-80.84666667,24.75333333,"Mid channel","MK",7,"Normal"
"WS15103_21","FLK",2015,"WaltonSmith","MK",24.7115,-80.8301,"12","04/14/2015","04/14/2015","12:06:00 AM","4:06:00 AM",2,2051.86,2380.29,8.049,401.26,3.69,36.38,NA,36.331,25.9,NA,NA,"Permanent","Single","Lauren’s_DB","","",NA,"",NA,2015-04-14,"14","Spring","Dry","April",36.38,2437.85181719917,2893.16216030698,2382.47348839293,2083.7730561084,"2015-04","12 _ 2015-04-14",2015-04-14 00:06:00,4,0.1,-80.83166667,24.71333333,"Offshore","MK",7,"Normal"
"WS15103_22","FLK",2015,"WaltonSmith","MK",24.7016,-81.0304,"13","04/14/2015","04/14/2015","1:54:00 AM","5:54:00 AM",2,1918.49,2315.39,8.131,303.62,4.34,37.01,NA,37.028,27.5,NA,NA,"Permanent","Single","Lauren’s_DB","","",NA,"",NA,2015-04-14,"14","Spring","Dry","April",37.01,2437.85181719917,2893.16216030698,2322.0408579457,1971.42410003288,"2015-04","13 _ 2015-04-14",2015-04-14 01:54:00,4,1.9,-81.03,24.70166667,"Inshore","MK",8,"Normal"
"WS15103_23","FLK",2015,"WaltonSmith","MK",24.6753,-81.0235,"14","04/14/2015","04/14/2015","2:09:00 AM","6:09:00 AM",2,2049.93,2382.65,8.052,398.73,3.74,36.4,NA,36.376,26.1,NA,NA,"Permanent","Single","Lauren’s_DB","","",NA,"",NA,2015-04-14,"14","Spring","Dry","April",36.4,2437.85181719917,2893.16216030698,2384.77314681535,2082.36200616565,"2015-04","14 _ 2015-04-14",2015-04-14 02:09:00,4,2.15,-81.02333333,24.675,"Mid channel","MK",8,"Normal"
"WS15103_24","FLK",2015,"WaltonSmith","MK",24.6436,-81.016,"15","04/14/2015","04/14/2015","2:27:00 AM","6:27:00 AM",2,2059.05,2390.16,8.051,400.81,3.72,36.46,NA,36.411,25.9,NA,NA,"Permanent","Single","Lauren’s_DB","","",NA,"",NA,2015-04-14,"14","Spring","Dry","April",36.46,2437.85181719917,2893.16216030698,2392.06976558175,2092.45109034691,"2015-04","15 _ 2015-04-14",2015-04-14 02:27:00,4,2.45,-81.01666667,24.64333333,"Offshore","MK",8,"Normal"
"WS15103_25","FLK",2015,"WaltonSmith","MK",24.5918,-80.9919,"15.5","04/14/2015","04/14/2015","2:59:00 AM","6:59:00 AM",2,2064.44,2386.78,8.035,418.6,3.62,36.51,NA,36.373,26,NA,NA,"Permanent","Single","Lauren’s_DB","","",NA,"",NA,2015-04-14,"14","Spring","Dry","April",36.51,2437.85181719917,2893.16216030698,2388.89225538129,2098.71473191081,"2015-04","15.5 _ 2015-04-14",2015-04-14 02:59:00,4,2.98333333333333,-80.99166667,24.59166667,"Oceanic","MK",8,"Normal"
"WS15103_26","FLK",2015,"WaltonSmith","LK",24.6763,-81.2064,"16","04/14/2015","04/14/2015","5:15:00 AM","9:15:00 AM",2,1899.49,2276.48,8.109,317.77,4.1,37.14,NA,37.001,27.4,NA,NA,"Permanent","Single","Lauren’s_DB","","",NA,"",NA,2015-04-14,"14","Spring","Dry","April",37.14,2437.85181719917,2893.16216030698,2285.77821456129,1956.74520794445,"2015-04","16 _ 2015-04-14",2015-04-14 05:15:00,4,5.25,-81.205,24.675,"Inshore","LK",9,"Normal"
"WS15103_27","FLK",2015,"WaltonSmith","LK",24.6386,-81.1943,"17","04/14/2015","04/14/2015","5:51:00 AM","9:51:00 AM",2,2048.37,2377.31,8.043,406.85,3.69,36.48,NA,36.483,26.3,NA,NA,"Permanent","Single","Lauren’s_DB","","",NA,"",NA,2015-04-14,"14","Spring","Dry","April",36.48,2437.85181719917,2893.16216030698,2379.76619214514,2082.64336615281,"2015-04","17 _ 2015-04-14",2015-04-14 05:51:00,4,5.85,-81.19333333,24.635,"Mid channel","LK",9,"Normal"
"WS15103_28","FLK",2015,"WaltonSmith","LK",24.6005,-81.185,"18","04/14/2015","04/14/2015","6:18:00 AM","10:18:00 AM",2,2067.12,2383.65,8.03,424.29,3.56,36.44,NA,36.388,25.8,NA,NA,"Permanent","Single","Lauren’s_DB","","",NA,"",NA,2015-04-14,"14","Spring","Dry","April",36.44,2437.85181719917,2893.16216030698,2385.79189398372,2099.7627198365,"2015-04","18 _ 2015-04-14",2015-04-14 06:18:00,4,6.3,-81.18333333,24.59833333,"Offshore","LK",9,"Normal"
"WS15103_29","FLK",2015,"WaltonSmith","LK",24.5928,-81.421,"19","04/14/2015","04/14/2015","8:58:00 AM","12:58:00 PM",2,1932.06,2294.44,8.097,333.72,3.97,36.91,NA,36.602,26.7,NA,NA,"Permanent","Single","Lauren’s_DB","","",NA,"",NA,2015-04-14,"14","Spring","Dry","April",36.91,2437.85181719917,2893.16216030698,2301.86120213629,1981.79462818169,"2015-04","19 _ 2015-04-14",2015-04-14 08:58:00,4,8.96666666666667,-81.42166667,24.61,"Inshore","LK",10,"Normal"
"WS15103_3","FLK",2015,"WaltonSmith","Biscayne",25.6453,-80.0853,"3","04/13/2015","04/13/2015","9:16:00 AM","1:16:00 PM",2,2052.14,2381.27,8.047,403.27,3.69,36.51,NA,36.306,26,NA,NA,"Permanent","Single","Lauren’s_DB","","",NA,"",NA,2015-04-13,"13","Spring","Dry","April",36.51,2437.85181719917,2893.16216030698,2383.6101408921,2086.92344185329,"2015-04","3 _ 2015-04-13",2015-04-13 09:16:00,4,9.26666666666667,-80.08333333,25.645,"Offshore","Biscayne",1,"Normal"
"WS15103_30","FLK",2015,"WaltonSmith","LK",24.5731,-81.4187,"20","04/14/2015","04/14/2015","9:01:00 AM","1:01:00 PM",2,2021.88,2365.21,8.059,385.33,3.83,36.63,NA,36.592,26.7,NA,NA,"Permanent","Single","Lauren’s_DB","","",NA,"",NA,2015-04-14,"14","Spring","Dry","April",36.63,2437.85181719917,2893.16216030698,2368.44249145604,2060.65122362272,"2015-04","20 _ 2015-04-14",2015-04-14 09:01:00,4,9.01666666666667,-81.41833333,24.575,"Mid channel","LK",10,"Normal"
"WS15103_31","FLK",2015,"WaltonSmith","LK",24.5372,-81.4183,"21LK","04/14/2015","04/14/2015","9:20:00 AM","1:20:00 PM",2,2066.95,2384.67,8.031,423.13,3.57,36.5,NA,36.383,25.8,NA,NA,"Permanent","Single","Lauren’s_DB","","",NA,"",NA,2015-04-14,"14","Spring","Dry","April",36.5,2437.85181719917,2893.16216030698,2386.85555413147,2100.90392439618,"2015-04","21LK _ 2015-04-14",2015-04-14 09:20:00,4,9.33333333333333,-81.42,24.54,"Offshore","LK",10,"Normal"
"WS15103_32","FLK",2015,"WaltonSmith","LK",24.4832,-81.3903,"21.5","04/14/2015","04/14/2015","11:38:00 AM","3:38:00 PM",2,2067.21,2383.34,8.031,422.73,3.55,36.48,NA,36.402,25.6,NA,NA,"Permanent","Single","Lauren’s_DB","","",NA,"",NA,2015-04-14,"14","Spring","Dry","April",36.48,2437.85181719917,2893.16216030698,2385.55155398725,2100.71902404754,"2015-04","21.5 _ 2015-04-14",2015-04-14 11:38:00,4,11.6333333333333,-81.39166667,24.48333333,"Oceanic","LK",10,"Normal"
"WS15103_33","FLK",2015,"WaltonSmith","LK",24.4759,-81.7167,"WS","04/14/2015","04/14/2015","1:50:00 PM","5:50:00 PM",2,2060.56,2381.94,8.034,419.13,3.61,36.5,NA,36.376,26.1,NA,NA,"Permanent","Single","Lauren’s_DB","","",NA,"",NA,2015-04-14,"14","Spring","Dry","April",36.5,2437.85181719917,2893.16216030698,2384.23774591229,2094.7765271359,"2015-04","WS _ 2015-04-14",2015-04-14 13:50:00,4,13.8333333333333,-81.717,24.478,"Offshore","LK",11,"Normal"
"WS15103_34","FLK",2015,"WaltonSmith","LK",24.3966,-81.8301,"22.5","04/14/2015","04/14/2015","3:05:00 PM","7:05:00 PM",2,2075.58,2389.2,8.017,439.8,3.53,36.62,NA,36.48,26.1,NA,NA,"Permanent","Single","Lauren’s_DB","","",NA,"",NA,2015-04-14,"14","Spring","Dry","April",36.62,2437.85181719917,2893.16216030698,2391.35226498806,2111.74829873559,"2015-04","22.5 _ 2015-04-14",2015-04-14 15:05:00,4,15.0833333333333,-81.82833333,24.39666667,"Oceanic","LK",11,"Normal"
"WS15103_35","FLK",2015,"WaltonSmith","LK",24.4551,-81.8284,"22","04/14/2015","04/14/2015","3:26:00 PM","7:26:00 PM",2,2065.71,2385.49,8.028,426.57,3.6,36.5,NA,36.736,26.2,NA,NA,"Permanent","Single","Lauren’s_DB","","",NA,"",NA,2015-04-14,"14","Spring","Dry","April",36.5,2437.85181719917,2893.16216030698,2387.64185550134,2099.71488330029,"2015-04","22 _ 2015-04-14",2015-04-14 15:26:00,4,15.4333333333333,-81.82833333,24.455,"Offshore","LK",11,"Normal"
"WS15103_36","FLK",2015,"WaltonSmith","LK",24.4888,-81.8286,"23","04/14/2015","04/14/2015","3:38:00 PM","7:38:00 PM",2,2060.24,2382.28,8.025,429.48,3.63,36.51,NA,36.465,26.7,NA,NA,"Permanent","Single","Lauren’s_DB","","",NA,"",NA,2015-04-14,"14","Spring","Dry","April",36.51,2437.85181719917,2893.16216030698,2384.57836877488,2094.68843774482,"2015-04","23 _ 2015-04-14",2015-04-14 15:38:00,4,15.6333333333333,-81.82833333,24.48666667,"Mid channel","LK",11,"Normal"
"WS15103_37","FLK",2015,"WaltonSmith","LK",24.5325,-81.8119,"24","04/14/2015","04/14/2015","3:54:00 PM","7:54:00 PM",2,1889.52,2242.17,8.069,351.23,3.85,37.08,NA,36.982,28,NA,NA,"Permanent","Single","Lauren’s_DB","","",NA,"",NA,2015-04-14,"14","Spring","Dry","April",37.08,2437.85181719917,2893.16216030698,2253.14675781484,1945.81923660837,"2015-04","24 _ 2015-04-14",2015-04-14 15:54:00,4,15.9,-81.82833333,24.53666667,"Inshore","LK",11,"Normal"
"WS15103_4","FLK",2015,"WaltonSmith","Biscayne",25.3335,-80.2242,"EK_IN","04/13/2015","04/13/2015","12:19:00 PM","4:19:00 PM",2,1868.6,2286.92,8.163,270.81,4.52,37.33,NA,37.29,27.5,NA,NA,"Permanent","Single","Lauren’s_DB","","",NA,"",NA,2015-04-13,"13","Spring","Dry","April",37.33,2437.85181719917,2893.16216030698,2296.34060364517,1932.5493660197,"2015-04","EK_IN _ 2015-04-13",2015-04-13 12:19:00,4,12.3166666666667,-80.227501,25.336306,"Inshore","Biscayne",2,"Normal"
"WS15103_45","FLK",2015,"WaltonSmith","Biscayne",25.2941,-80.1633,"EK_OFF","04/17/2015","04/17/2015","3:46:00 AM","7:46:00 AM",2,2060.61,2380.68,8.029,424.7,3.6,36.53,NA,36.368,26.2,NA,NA,"Permanent","Single","Lauren’s_DB","","",NA,"",NA,2015-04-17,"17","Spring","Dry","April",36.53,2437.85181719917,2893.16216030698,2383.07454914631,2095.48010143087,"2015-04","EK_OFF _ 2015-04-17",2015-04-17 03:46:00,4,3.76666666666667,-80.162604,25.294251,"Offshore","Biscayne",2,"Normal"
"WS15103_5","FLK",2015,"WaltonSmith","Biscayne",25.3129,-80.1943,"EK_MID","04/13/2015","04/13/2015","12:27:00 PM","4:27:00 PM",2,1992.03,2361.58,8.096,345.8,4.1,36.67,NA,36.58,27,NA,NA,"Permanent","Single","Lauren’s_DB","","",NA,"",NA,2015-04-13,"13","Spring","Dry","April",36.67,2437.85181719917,2893.16216030698,2365.05351880891,2033.06874305189,"2015-04","EK_MID _ 2015-04-13",2015-04-13 12:27:00,4,12.45,-80.1946,25.314483,"Mid channel","Biscayne",2,"Normal"
"WS15103_6","FLK",2015,"WaltonSmith","UK",25.1096,-80.3783,"4","04/13/2015","04/13/2015","1:02:00 PM","5:02:00 PM",2,1811.82,2258.03,8.204,235.38,4.78,37.36,NA,37.315,27.7,NA,NA,"Permanent","Single","Lauren’s_DB","","",NA,"",NA,2015-04-13,"13","Spring","Dry","April",37.36,2437.85181719917,2893.16216030698,2269.38919402008,1880.12748121854,"2015-04","4 _ 2015-04-13",2015-04-13 13:02:00,4,13.0333333333333,-80.38,25.10833333,"Inshore","UK",3,"Normal"
"WS15103_7","FLK",2015,"WaltonSmith","UK",25.0957,-80.3599,"5","04/13/2015","04/13/2015","2:12:00 PM","6:12:00 PM",2,1942.31,2355.42,8.152,290.81,4.56,36.69,NA,36.712,27.4,NA,NA,"Permanent","Single","Lauren’s_DB","","",NA,"",NA,2015-04-13,"13","Spring","Dry","April",36.69,2437.85181719917,2893.16216030698,2359.21694115744,1986.10776917195,"2015-04","5 _ 2015-04-13",2015-04-13 14:12:00,4,14.2,-80.355,25.09333333,"Inshore","UK",3,"Normal"
"WS15103_8","FLK",2015,"WaltonSmith","UK",25.0796,-80.3338,"5.5","04/13/2015","04/13/2015","2:21:00 PM","6:21:00 PM",2,1998.66,2383.03,8.111,333.64,4.28,36.54,NA,36.506,27.3,NA,NA,"Permanent","Single","Lauren’s_DB","","",NA,"",NA,2015-04-13,"13","Spring","Dry","April",36.54,2437.85181719917,2893.16216030698,2385.34049804288,2036.3593247639,"2015-04","5.5 _ 2015-04-13",2015-04-13 14:21:00,4,14.35,-80.33416667,25.07966667,"Mid channel","UK",3,"Normal"
"WS15103_9","FLK",2015,"WaltonSmith","UK",25.0656,-80.3146,"6","04/13/2015","04/13/2015","2:36:00 PM","6:36:00 PM",2,2053.65,2383.22,8.046,405.45,3.7,36.43,NA,36.377,26.2,NA,NA,"Permanent","Single","Lauren’s_DB","","",NA,"",NA,2015-04-13,"13","Spring","Dry","April",36.43,2437.85181719917,2893.16216030698,2385.36448253074,2086.60367524675,"2015-04","6 _ 2015-04-13",2015-04-13 14:36:00,4,14.6,-80.315,25.065,"Offshore","UK",3,"Normal"
"WS15148_1","FLK",2015,"WaltonSmith","Biscayne",25.6447,-80.1244,"1","06/01/2015","06/01/2015","8:09:00 AM","12:09:00 PM",2,1996.59,2341.01,8.043,396.92,3.85,36.79,NA,36.756,28,NA,NA,"Permanent","Single","Lauren’s_DB","","",NA,"",NA,2015-06-01,"01","Spring","Wet","June",36.79,2437.85181719917,2893.16216030698,2345.72179268243,2040.2122932033,"2015-06","1 _ 2015-06-01",2015-06-01 08:09:00,6,8.15,-80.12666667,25.645,"Inshore","Biscayne",1,"Normal"
"WS15148_10","FLK",2015,"WaltonSmith","UK",25.0645,-80.3127,"6","06/01/2015","06/01/2015","2:40:00 PM","6:40:00 PM",2,2053.28,2382.45,8.019,435.95,3.74,36.35,NA,36.646,28,NA,NA,"Permanent","Single","Lauren’s_DB","","",NA,"",NA,2015-06-01,"01","Spring","Wet","June",36.35,2437.85181719917,2893.16216030698,2384.50756405004,2084.47232232227,"2015-06","6 _ 2015-06-01",2015-06-01 14:40:00,6,14.6666666666667,-80.315,25.065,"Offshore","UK",3,"Normal"
"WS15148_11","FLK",2015,"WaltonSmith","UK",25.0481,-80.2871,"6.5","06/01/2015","06/01/2015","2:47:00 PM","6:47:00 PM",2,2049.11,2383.79,8.022,431.91,3.81,36.37,NA,36.358,28.4,NA,NA,"Permanent","Single","Lauren’s_DB","","",NA,"",NA,2015-06-01,"01","Spring","Wet","June",36.37,2437.85181719917,2893.16216030698,2385.82642258903,2080.90410117186,"2015-06","6.5 _ 2015-06-01",2015-06-01 14:47:00,6,14.7833333333333,-80.28766667,25.04833333,"Oceanic","UK",3,"Normal"
"WS15148_12","FLK",2015,"WaltonSmith","UK",25.0046,-80.3782,"MR","06/01/2015","06/01/2015","3:36:00 PM","7:36:00 PM",2,2050.07,2385.05,8.028,424.35,3.8,36.42,NA,36.401,27.9,NA,NA,"Permanent","Single","Lauren’s_DB","","",NA,"",NA,2015-06-01,"01","Spring","Wet","June",36.42,2437.85181719917,2893.16216030698,2387.10871994571,2082.94179757375,"2015-06","MR _ 2015-06-01",2015-06-01 15:36:00,6,15.6,-80.38,25.01,"Offshore","UK",3,"Normal"
"WS15148_13","FLK",2015,"WaltonSmith","UK",24.8981,-80.5311,"UK_OFF","06/01/2015","06/01/2015","5:43:00 PM","9:43:00 PM",2,2055.505,2385.37,8.02,434.42,3.749,36.396,NA,36.388,27.9,NA,NA,"Permanent","Single","Lauren’s_DB","","",NA,"",NA,2015-06-01,"01","Spring","Wet","June",36.396,2437.85181719917,2893.16216030698,2387.38298540527,2087.63406351765,"2015-06","UK_OFF _ 2015-06-01",2015-06-01 17:43:00,6,17.7166666666667,-80.529497,24.898193,"Offshore","UK",4,"Normal"
